Book	Smell_Word	Smell_Source	Quality	Full_Sentence
abc57	smrde	gnoj		„ Kaj , nič da nisi storil , kanalja ? Ven iz cerkve , ven iz božjega hrama ! Plaziš se po križevem potu , razpelo ližeš , tvoje misli pa so kakor mlaka in gnoj in smrde do neba ! Delat , kanalja , delat ! Pomedli bomo cerkev in umili razpelo tudi brez tvojega jezika ! To je tvoje zasluženje , to tvoje plačilo ! """" Debelo gorjačo je držal v pesti sodnik in je zamahnil in zabobnelo je zamolklo po Aleševem hrbtu .
abc58	vonj		prijeten	Ko se prebudi , mu vdsri na nos prijeten vonj ; to ga spravi na nege .
abc58	vonj|duh	smola|joličin|rožmarin		Vraga — si je mislil gospod Miau — ravno zdaj s < m moral zaspati , kaj me j « neki motilo — in ravno zdaj , oh , to je smola — Če bi jo bil vsaj videl — ta vonj — kaj je pravzaprav to — vi - joličin duh ni — rožmarin tudi ne , E ^ u a ' Odogne tudi ne , to je kuka moderna francoska dšava , ki jo rabijo samo dame iz boljših hiš .
abc58	vonj		fini	pet mu je udaril fini vonj v nos .
abc58	vonj|vonj		fini	Kakšen vonj je vendar to — vsaj precej poznam take reči — te pa ne morem razločili — na vsak način je to fini vonj .
abc58	duh|dišav		zadušljiv|mogočih	Vrata se odpro in venkaj se privali debela masa v črnih hlačah , sivem suknjiču , zeleni kravati in rjavem klobuku s kovčegom v roki in po hodniku se razlije zadušljiv duh vseh mogočih dišav tega sveta .
abc58	diši	ba|harija		Zdi se nam , da diši ta ba - harija preveč po reklami .
abc59	dehti	vijola	opojno	Kakor vijola na skrivnem in tihem v gaju zelenem opojno dehti , cvela globoko je v srčnem zavetju , niso dosegle je zlobne oči .
abc59	dehti	vijola	opojno	Kakor vijola na skrivnem in tihem v gaju zelenem opojno dehti , cvela globoko je v srčnem zavetju , niso dosegle je zlobne oči .
abc59	vonja	cvetočih grmov	pomirljivega	„ Izven hiš v prosto naravo ! """" zakoprni vsak tujec , ki je kdaj čutil preblagodejni vpliv pomirljivega vonja cvetočih grmov , šepetanja visokih dreves in vabljivosti zelene trate .
abc59	vonja	cvetočih grmov	pomirljivega	„ Izven hiš v prosto naravo ! """" zakoprni vsak tujec , ki je kdaj čutil preblagodejni vpliv pomirljivega vonja cvetočih grmov , šepetanja visokih dreves in vabljivosti zelene trate .
abc59	vonj	cvetočih gred	mlačni	Obe okni ob straneh balkona sta bili odprti in mlačni vonj cvetočih gred je plaval obenem s pojemajočimi glasovi delavnika med navzočne na krilih jedva čutne sapice , ki je malodane v rednih premorih napenjala zagritijalo pri vratih .
abc59	vonj	cvetočih gred	mlačni	Obe okni ob straneh balkona sta bili odprti in mlačni vonj cvetočih gred je plaval obenem s pojemajočimi glasovi delavnika med navzočne na krilih jedva čutne sapice , ki je malodane v rednih premorih napenjala zagritijalo pri vratih .
abc59	diščeči	dim	prijetno	Vsi trije gospodje so kadili ; prijetno diščeči dim se je v vijoličastih progah zapletal in razvozlaval nad glavami in zavijal družbo v fino , lahno meglo , kakor je plavalo nad vsemi tisto ljubeznivo razpoloženje ur , ko se sklenejo duše brez stremljenja in nepotrebnega poleta in zanosa v verigo soglasja , navdane edinole z željo , ugajati drugemu za lastno udobnost .
abc59	diščeči	dim	prijetno	Vsi trije gospodje so kadili ; prijetno diščeči dim se je v vijoličastih progah zapletal in razvozlaval nad glavami in zavijal družbo v fino , lahno meglo , kakor je plavalo nad vsemi tisto ljubeznivo razpoloženje ur , ko se sklenejo duše brez stremljenja in nepotrebnega poleta in zanosa v verigo soglasja , navdane edinole z željo , ugajati drugemu za lastno udobnost .
abc59	vzduh|vonjem	kostanji|hrasti|hijacinte|tulipani	polnijo|mamečim	Vse že zeleni , kostanji , hrasti , breze ; in hijacinte cveto in polnijo vzduh s svojim mamečim vonjem in tulipani se dvigajo ob njih strani ponosno v vseh baryah , pijani same pomladne radosti .
abc59	vzduh|vonjem	kostanji|hrasti|hijacinte|tulipani	polnijo|mamečim	Vse že zeleni , kostanji , hrasti , breze ; in hijacinte cveto in polnijo vzduh s svojim mamečim vonjem in tulipani se dvigajo ob njih strani ponosno v vseh baryah , pijani same pomladne radosti .
abc59	duh		mrtvaški	In skoro mrtvaški duh mi je silil v nos , in ko sem hotela okreniti svoje misli na drugo stran , se mi to ni posrečilo .
abc59	dehtel	močni Magdin parfum		Iz prvega je dehtel močni Magdin parfum .
abc59	brez duha			Drugo je bilo večje , navadno pismo iz zamolklega papirja brez duha .
abc59	vzduh		neokuženi	Dokler me je obsevalo nebeško solnce s svojimi čistimi in očiščujočimi žarki , dokler sem srkal vase še neokuženi vzduh iz sinjih nebeških višav , moje misli niso mogle oskruniti tvojega spomina .
abc60	duh		hudobni	Missia je bil pozneje za svoje uspehe sijajno poplačan s kardi - nalskim klobukom , ali pravim narodnjakom je bil ta fanatični ultramontanec tisti hudobni duh , ki je zakrivil mnogo , mnogo zla .
abc60	dišalo	zdravilih		Kette je ležal v posteli , ko sva vstopila v preprosto dijaško sobo , v kateri je dišalo po raznih zdravilih .
abc60	duhteči	Šopek		Ti me ne trgaj , s sabo ne jemlji , pusti me , deček , v materi zemlji ! Šopek duhteči kmalu ovene , a korenina več ne požene .
abc60	diši	slanina		Hitro steče k njej in se ji prijazno pridruži , rekoč : „ Boterca , tudi meni diši slanina , saj mi pustiš , da jo tudi jaz nekoliko pokusim ? """" „ „ Ti tatica tatinska , ti ! """" """" zarezi mačka nanjo , „ „ jaz ti pokažem krasti , čakaj me ! """" """" In v hipu jo zagrabi in zadavi .
abc60	dišeči	cvetki		Na dišeči cvetki sta se sešla čmrlj in čebela .
abc60	dišeči		sladki	Nad travnikom cvetnim ob reki šumeči metuljček mlad leta od cveta do cveta in srka med sladki , dišeči .
abc60	duhteče	cvetke	lepo	A sedaj je to še skrito , ker pomlad še ni v aprilu , in lepo duhteče cvetke vzbuja šele gorki maj .
abc60	duhteče	cvetke	lepo	A sedaj je to še skrito , ker pomlad še ni v aprilu , in lepo duhteče cvetke vzbuja šele gorki maj .
abc60	duh	vijolic|trnjolic		Sum vira in zefira pa gaja zelenega , žar kamna in cvklamna in solnca rumenega , duh vijolic in trnjolic , ki sapica žene ga , miru mi ne morete dati , miru izgubljenega .
abc60	duhtečih	vijolic|rož|lilij		Imam pa vijolic duhtečih in rož in lilij visokih tudi ; in ž njimi bom ljubici svoji krasil prelepe bele grudi .
abc60	duhtela	Vitka smreka		Vitka smreka , zelenela nisi , pa duhtela si , zeleneča ovenela nisi .
abc60	dišečim	kostanjem		Aj , tam pod dišečim kostanjem lagala se ona , tam vetrček vel nasproti z lahkotnim šušljanjem .
abc60	dehteči	rožica		Jaz vidim le življenje , ljubezen večno vidim krog in krog : Saj če te , duh , neskončno hrepenenje , ah , če te je v nebo poklical Bog : Glej , vzklilo je telo v lepo zelenje , ko rožica krasi dehteči log .
abc60	vonjivi	cveti		A naj li rastejo vonjivi cveti brez solnca sredi jasnega neba ? Zato prešini me , o Bog , zaneti mi večni žarki ogenj v dnu srca ! IV .
abc60	duhtečega	cvetke	cvetočega|sladko	Jaz zrl le tvoja očka bi odprta in trgal cvetke ust iz prsij vrta cvetočega , duhtečega sladko .
abc60	duhtečega	cvetke	cvetočega|sladko	Jaz zrl le tvoja očka bi odprta in trgal cvetke ust iz prsij vrta cvetočega , duhtečega sladko .
abc60	duh		blag	Kako tvoj duh je blag , kako iskren je , pokazale so mehke mi oči .
abc60	duh		lažnivi	In strastna je in polna takih muh , da joj """" , šepetal je lažnivi duh .
abc60	duh		temni	"""" O demon , demon , kaj mi je resnica , pač boljša bi mi bila krasna laž ! Rešitve ni ? „ Nikdar ! """" In pozabljenja , o temni duh , nesrečni plod stvarjenja , ga ni ? „ Nikdar ! """" Nikdar ? „ Jaz vem — Kaj naj storim ? .
abc62	Diši	žganje		» In vi pijete žganje ? — Diši vam iz ust , gospod učitelj ! Kaj naj mislijo učenci ? « » Kuham si šele na večer , ker podnevi ne utegnem , zato pa pojem včasih malo kruha in nekoliko prilijem .
abc62	duh	krompirjev		Ni bila to nevošljivost , ne , le krompirjev duh ga je nekako čudno ščegetal v nosu in od tu je šlo proti srcu , od srca pa proti želodcu : organist danes ni še ničesar jedel .
abc62	dišal	krompir .		« » Seveda , človek se mora še na stara leta učiti ! Tudi pri meni je tako : nove skladbe , nove pesmi , in jaz naj vse to proizvajam ! « Gospod učitelj ni ničesar na to odgovoril , tudi organist je molčal ; bolj kot kedaj mu je dišal sedaj krompir .
abc62	diši	krompir	izvanredno	» Prav pravite : jako slasten je ! « » Kako čudno je to ! — Včasih človeku krompir izvanredno diši , včasih zopet kaj druzega ; ali to , drugo si mora izbiti iz glave .
abc62	diši	krompir	izvanredno	» Prav pravite : jako slasten je ! « » Kako čudno je to ! — Včasih človeku krompir izvanredno diši , včasih zopet kaj druzega ; ali to , drugo si mora izbiti iz glave .
abc62	duh	po kislem zelju	prijeten	Sobo je napolnjeval prijeten duh po kislem zelju inorganist je dobil moč .
abc62	duh	po kislem zelju	prijeten	Sobo je napolnjeval prijeten duh po kislem zelju inorganist je dobil moč .
abc63	voha|smrdi|smrdljive	gnojšnice		Pri drugih vedno nekaj voha in mu zmiraj nekaj smrdi — svoje smrdljive gnojšnice pa , katera od njega kar curkoma teče in s katero zemljo okužuje in ljudi .
abc63	smrdi|vohaš		grdo	Seveda , ti ljubi „ Stajerc """" ' , ker si sam poln gnusobe , zato tebi vse kar je pošteno smrdi in povsod le grdo vohaš in sumničiš .
abc63	smrdi	družba		"""" Bila je tedaj dejansko čisto liberalnega mišljenja , ker tudi liberalcem Marijina družba smrdi .
abc64	zelišča	trave|cvetice|alpska		Pokrivajo ga razne trave , cvetice in alpska zelišča , ki poleti preživi premnogo Čred domaČih živali .
abc64	zelišče	travico	gorsko	Sivo prodovje pokriva prepadna tla ; le malokje zagledaš kako osamelo travico ali kako gorsko zelišče .
abc64	zelišče	travico	gorsko	Sivo prodovje pokriva prepadna tla ; le malokje zagledaš kako osamelo travico ali kako gorsko zelišče .
abc64	vzduh	Zrak		Zrak ali vzduh je prozorna , plinava telesnina brez barve in obdaje našo zemljo od vseh strani .
abc64	vzduh		gosteji	Med telesom , katero vzbuja zvok , in našim sluhom se nahaja navadno zrak ; na visokih hribih , koder je zrak tanjši , ne slišimo tako dobro , kakor v dolini , kjer je vzduh gosteji .
abc64	duh		poseben|zadušljiv|žveplenast	Pri tem se razširja neki poseben , zadušljiv , žveplenast duh .
abc64	duha		slabega	Mladi ježi se kmalu privadijo hiše in bili bi človeku všeč , ko bi ponoči ne bili tako nemirni , in ko bi ne imeli slabega duha .
abc64	diši		zoprno	Njegovega mesa niti druge živali nočejo jesti , menda zato , ker diši zoprno .
abc64	smrad	Domača kuna ali kuna belica|Ijivega dehorja		Domača kuna ali kuna belica je večja od smrad - Ijivega dehorja ; dlake je črno - rjavkaste , grlo in prsi so bele , rep pa dolg .
abc64	zeliščem	osatom|oves|seno	bodečim	Zraven tega je zadovoljen sb suhim listjem , osatom in drugim bodečim zeliščem , dasi tudi dobro v6 , da je oves in seno boljše .
abc64	zeliščem	osatom|oves|seno	bodečim	Zraven tega je zadovoljen sb suhim listjem , osatom in drugim bodečim zeliščem , dasi tudi dobro v6 , da je oves in seno boljše .
abc64	diši	raznih rastlin|vodnih živalc|mrhovine	najbolje	Šele ponoči ali v nevihti gre ali plava okoli ritensko veslaje ter išče hrane , to je : raznih rastlin , vodnih živalc in mrhovine , ki mu najbolje diši .
abc64	diši	raznih rastlin|vodnih živalc|mrhovine	najbolje	Šele ponoči ali v nevihti gre ali plava okoli ritensko veslaje ter išče hrane , to je : raznih rastlin , vodnih živalc in mrhovine , ki mu najbolje diši .
abc64	dišeče	grmiče		Po vrtčh imamo dišeče grmiče za lepoto , pa tudi sadne za dobiček in zdravilne za pomoč v bolezni .
abc64	duh	Lipovka ( španski bezeg )	daje prijeten	Lipovka ( španski bezeg ) cvete aprila in maja ter daje prijeten duh .
abc64	duh	Lipovka ( španski bezeg )	daje prijeten	Lipovka ( španski bezeg ) cvete aprila in maja ter daje prijeten duh .
abc64	dišaven	Malinjak		Malinjak rodi vrlo dišaven plod zajed , za ocet in malinovec .
abc64	diši	mošt	kalen|sladek	Kadar sok teče iz kadi , je še kalen in sladek ter diši po jagodah : pilijo mu mošt .
abc64	diši	mošt	kalen|sladek	Kadar sok teče iz kadi , je še kalen in sladek ter diši po jagodah : pilijo mu mošt .
abc64	puhti	čeva kislina		To vrenje vzrokuje ogljen - čeva kislina , ki puhti iz ga oš t a in zrak tako pridi , da ni varno hoditi v zaprto klet , v katerej vino vrfe .
abc64	opojna	Jabolčnik in hruševec|vino|sadni mošt		Jabolčnik in hruševec sicer nista tako opojna , kakor vino ; a vendar je tudi sadni mošt zdrava in dobra pijača .
abc64	dišečega	cvetja	belega	Iz belega , dišečega cvetja se razvijajo podolgaste , rdečim črešnjam podobne jagode , ki pa ne dozorevajo vse ob istem času .
abc64	dišečega	cvetja	belega	Iz belega , dišečega cvetja se razvijajo podolgaste , rdečim črešnjam podobne jagode , ki pa ne dozorevajo vse ob istem času .
abc64	smrdeča		zoprno	Vsa rastlina je zoprno smrdeča .
abc64	duh	cvetje	ostuden	Ako zmanemo liste , cvetje ali mehka stebelca , dobimo j ako ostuden duh , od katerega posebno v gorkih sobah človeka glava boli ter mu dela težave in omedlevice .
abc64	duh	cvetje	ostuden	Ako zmanemo liste , cvetje ali mehka stebelca , dobimo j ako ostuden duh , od katerega posebno v gorkih sobah človeka glava boli ter mu dela težave in omedlevice .
abc64	smrdeči|smrdljiva	Omotne strupenice|volčja črešnja|navadni zobnik|razhudnik ( črlenka )|omotna ljuljka	zoprno	Omotne strupenice so tudi : volčja črešnja , zoprno smrdeči navadni zobnik , smrdljiva s al a t a , razhudnik ( črlenka ) in omotna ljuljka .
abc64	smrdeči|smrdljiva	Omotne strupenice|volčja črešnja|navadni zobnik|razhudnik ( črlenka )|omotna ljuljka	zoprno	Omotne strupenice so tudi : volčja črešnja , zoprno smrdeči navadni zobnik , smrdljiva s al a t a , razhudnik ( črlenka ) in omotna ljuljka .
abc64	gnila		Slab|umazane	Slab zrak dela v hiši mokro perilo , gnila , mokra tla , umazane reči , smeti , posebno pa , če je več ljudi v enej sobi .
abc65	dišale		mamljivo	Tudi belih je bilo med njimi in dišale so mamljivo .
abc65	dehteče		čarobne	V letnih nočeh , ki so tako dehteče in čarobne , rada slišim njihovo glasno , jednakomerno pesem .
abc65	vonja	cigarete|dima		Tako grozni so zame taki dnevi , ko sedim v svojem kabinetu bliže nebu nego zemlji in premetavam razne časopise , pregledujem stara pisma in razglednice , brez odmora kadim cigarete , da me je že skoraj zakril gost oblak dima ! Ne vem , kolikokrat sem že pregledal vsa ta pisma ob takih dnevih , a vseeno se mi vzbujajo vedno novi spomini , ko gledam te fotografije , ki sem si jih razstrl pred sabo na mizi , ko opazujem posušene cvetke brez boje in vonja , ki so mi bile včasi , kdove kako drage ! In ne vem , kako to , največkrat mi zastane oko na sliki mladega lepega dekleta v plavi mornarski bluzi , z golim vratom in okoli njega črn baržunast trak ! Moja roka se največkrat dotakne malega , suhega šopka vijolic , ki so povite z rdečo svileno pentljo ! Izmed vseh je ta slika že najbolj obledela .
abc65	duh		zopern	„ Pristavi stol sem , Lipe , in sedi ! Prej pa še privij svetilko , kadi se in zopern duh se razširja po sobi ! """" Lipe je storil , kar mu je naročil in je sedel k očetovem zglavju .
abc65	ni|dišalo			Sedaj ni več iskal dela , ni mu dišalo , le tupatam je pomagal kmetu , da je dobil za žganje .
abc65	duh		bistrejši	Čustvo slabosti in utrujenosti izginjuje , duh je živejši , bistrejši , volja jasna , — neugodnosti dnevnih skrbi in mute postanejo laglje .
abc65	dišava	Vydrov „ Buhtin """"		Vydrov „ Buhtin """" je dišava za pecivo .
abc65	diši		imenitno	kajti moji vnukinji imenitno diši .
abc65	diši		jako	Novi Bydžov : Vaša otroška moka je znamenita , naši Boženki jako diši vsled česar prosimo , da nam zopet pošljete 1 .
abc66	smrdečih|smradu	bomb	neznosnega	Da povzroči konec seje , je vrgel poslanec Turk v dvorano par smrdečih bomb , da so poslanci vsled neznosnega smradu morali bežati iz dvorane .
abc66	smrdečih|smradu	bomb	neznosnega	Da povzroči konec seje , je vrgel poslanec Turk v dvorano par smrdečih bomb , da so poslanci vsled neznosnega smradu morali bežati iz dvorane .
abc66	gnije	grozdje		Dan za dnevom dežuje , ljudstvo sc ne upa po takem vremenu v vinograde , a trgati pa mora , ker grozdje letos zelo gnije .
abc66	dišeče		rožnato	Ni usahnila , marsikatero leto je še cvetela rožnato , dišeče in dajala nam otrokom svojo sladke sadove .
abc66	dišala	slovanske lipe	Mogočne|prijetno	Mogočne , slovanske lipe , ta krasna stoletna , tiha drevesa , ki so tako prijetno dišala , so krasila in stražila njih skromne koče , čuvala so nad njimi , nad njih sivo starostjo in so jim šepetala pravljice o davno minulih dneh .
abc66	dišala	slovanske lipe	Mogočne|prijetno	Mogočne , slovanske lipe , ta krasna stoletna , tiha drevesa , ki so tako prijetno dišala , so krasila in stražila njih skromne koče , čuvala so nad njimi , nad njih sivo starostjo in so jim šepetala pravljice o davno minulih dneh .
abc66	diši|diši	materina dušica		Ta priroda , ta nizek kraj , na katerem diši materina dušica , diši za vse , tisti tihi gozd razteza prijazno nad vsemi svoje veje .
abc67	vonja	cvetka	prijetnega	Tako je ostal Konrad človek brez energije in odločne volje , cvetka , ki je skrivala v svoji časi mnogo prijetnega vonja , a manjkalo je skrbne roke , ki bi ji prilivala .
abc67	vonja	cvetka	prijetnega	Tako je ostal Konrad človek brez energije in odločne volje , cvetka , ki je skrivala v svoji časi mnogo prijetnega vonja , a manjkalo je skrbne roke , ki bi ji prilivala .
abc67	duha		krepkega	Srečko Rakar je bil človek dinamične sile in krepkega duha .
abc67	dišečim	kadilom		V mestu nima tiste poezije kot na kmetih , kjer kleči vsa družina pred jaslicami , mati škropi vse shrambe z blagoslovljeno vodo , oče pa kadi z dišečim kadilom .
abc67	dehtela		prijetna	V kotu je tiktakala velika ura , od peči je dehtela prijetna toplota in v stekleni omari so stale v lepem redu razne knjige .
abc67	duh		nemiren	V meni je bil vedno nemiren duh , ki ni bil nikoli zadovoljen in tudi ne bo .
abc68	duh	po gnilih jajcih|žvepleno sokislino .		Kakor hitro hoče mlado vino na zraku rjaveti , zamori se v njem oksidar a če hoče cikati , zavreti , zamore se v njem glive , če ima duh po gnilih jajcih , se izloči ta z žvepleno sokislino .
abc68	zelišči	žveplenih trščic		Največja in duhu vinske postave nasprotujoča neumnost je poraba z raznimi zelišči in semenjem potrošenih žveplenih trščic .
abc68	vonj	vinu|zelišči	prijeten	Namen , podeliti vinu s takimi zelišči prijeten vonj , pa je po § 6 .
abc68	vonj	vinu|zelišči	prijeten	Namen , podeliti vinu s takimi zelišči prijeten vonj , pa je po § 6 .
abc68	smrdi	dim		Pameten kletar bo tudi to zavrgel ker ve , da dim gorečega platna smrdi da se pri lomljenji in nabadanji teh teržic na žico mnogo žvepla odlušči , da prizažiganju velik del neizgoretega žvepla odkaplje ali sublimira , se lazhlapi in na stene posode vsede .
abc68	smrdečih|smrdi	proizvodov|žveplene sokisline|novo vino		Njemu ni za take trske , ker ne mara smrdečih proizvodov goreče cunje , ker ne more vsled luščenja , odkapljanja in sublimacije žvepla množine žveplene sokisline , nastale vsled gorenja , primerno odmeriti in ker je premnogokrat nesežgano dokapano , posebno pa sublimirano žveplo povod , da smrdi novo vino po ogljenčevem žvepljencu ali gnilih jajcih .
abc71	smrdljive	safalade		Staculove smrdljive safalade .
abc71	smrdela	safalado	neznosno	Včeraj zjutraj je kupil nekdo pri Staculu safalado , ki je pa tako neznosno smrdela , da se ji je celo pes umaknil .
abc71	smrdela	safalado	neznosno	Včeraj zjutraj je kupil nekdo pri Staculu safalado , ki je pa tako neznosno smrdela , da se ji je celo pes umaknil .
abc72	smrdljive	safalade		Staculove smrdljive safalade .
abc72	smrdela	safalado	neznosno	Včeraj zjutraj je kupil nekdo pri Staculu safalado , ki je pa tako neznosno smrdela , da se ji je celo pes umaknil .
abc72	smrdela	safalado	neznosno	Včeraj zjutraj je kupil nekdo pri Staculu safalado , ki je pa tako neznosno smrdela , da se ji je celo pes umaknil .
abc74	dišala	jed		V naših vrstah se najde mnogo eksemplarjev z dobrim tekom , ki so povsod dobrodošli gostje ; ali vsaj vsaka gospodinja rajše vidi , če dela gost kuhinji čast , da mu gre jed v slast , kakor onega , ki se obira , kot bi mu ne dišala .
abc74	dišeče	pecivo	prijetno	Da je pa pecivo prijetno dišeče , brez katere lastnosti bi se nam ne mogli priljubiti , dosežemo zopet le z Buhtinom .
abc74	dišeče	pecivo	prijetno	Da je pa pecivo prijetno dišeče , brez katere lastnosti bi se nam ne mogli priljubiti , dosežemo zopet le z Buhtinom .
abc74	dišav	zrak		In zrak je bil mehek , dišav poln , kakor tenka svila je božal obraz .
abc74	zadišalo	Seno		Seno je zadišalo skozi veje in kmalu sva bila zunaj na planem polju , na vaških senožetih .
abc74	dišalo	seno		Zopet so švigale zlate kresnice v temnem grmi - čevlju , po senožetih je dišalo seno , murni so peli na polju .
abc74	dišeče	livade|lipe	cvetoče	Kako krasno je bilo v letovišču ! Mala vasica v ozki dolinici , obdana vse na okoli z nebotičnimi gorami ; cvetoče , dišeče livade , žuboreče vode , prijazne lipe in črne jelke ! Po livadah so cveteli rožnatobojni , narezljani klinčki — vsa trata je bila rožnata ž njimi .
abc74	dišeče	livade|lipe	cvetoče	Kako krasno je bilo v letovišču ! Mala vasica v ozki dolinici , obdana vse na okoli z nebotičnimi gorami ; cvetoče , dišeče livade , žuboreče vode , prijazne lipe in črne jelke ! Po livadah so cveteli rožnatobojni , narezljani klinčki — vsa trata je bila rožnata ž njimi .
abc74	dišečinu	tobakom .	lepo	Star , na pol gluh mož je sedel na klopici pred durmi ter si basal vivček z ne - lepo dišečinu tobakom .
abc74	dišečinu	tobakom .	lepo	Star , na pol gluh mož je sedel na klopici pred durmi ter si basal vivček z ne - lepo dišečinu tobakom .
abc74	ni dišalo			Pošiljam Vam sliko naše majhne Vvdrovčanke , ki uživa od šestega tedna samo stroško moko ; poskusili ; smo jo hraniti z raznimi sličnimi izdelki , pa nič ji ni dišalo tako , kakor Vvdrova otroška moka , ki jo zahteva še danes .
abc75	smrdi	Krofičev mleče|lemenatar		Zapomnite si to za volitev ! — Krofičev mleče - zobi lemenatar , za katerim smrdi celo uro po Begunjah , kadar prifrfota iz svojega zmedenega gnezda na Zgoši , je pa menda sedel in zjecljal na podlagi te .
abc76	dehti	ajdov cvetek	bel|sladko	ko gre deca brat rožic pisanih , da ozaljša kip božje Matere sredi cvetnih trat ? Kdo nam bo zdaj pel , kak se ziblje klas , ajdov cvetek bel kak sladko dehti , da se kar gubi v njem čebelica , kakor v bajnem snu klone , pade nanj in kot v snu drhti ? Kdo nam bo zapel pesem zdaj jesensko , ko si ti odšel ? Klas je zdaj bogat , ves rumen , ves zlat - toda tebe ni ! .
abc76	dehti	ajdov cvetek	bel|sladko	ko gre deca brat rožic pisanih , da ozaljša kip božje Matere sredi cvetnih trat ? Kdo nam bo zdaj pel , kak se ziblje klas , ajdov cvetek bel kak sladko dehti , da se kar gubi v njem čebelica , kakor v bajnem snu klone , pade nanj in kot v snu drhti ? Kdo nam bo zapel pesem zdaj jesensko , ko si ti odšel ? Klas je zdaj bogat , ves rumen , ves zlat - toda tebe ni ! .
abc77	dišeče	malinovega|vino	desertno	Mešanica iz 1 litra malinovega soka , 1 ’ / 2 l vode in 80 do 90 dkg sladkorja da dišeče desertno vino .
abc77	dišeče	malinovega|vino	desertno	Mešanica iz 1 litra malinovega soka , 1 ’ / 2 l vode in 80 do 90 dkg sladkorja da dišeče desertno vino .
abc77	aromatično	sadje	okusnejša	Sadje vseh vrst se lahko uporabi tudi pri napravi raznih likerov in so ti sadni likeri precej udomačena in priljubljena pijača , ki je tem okusnejša , čim bolj je sadje aromatično .
abc77	aromatično	sadje	okusnejša	Sadje vseh vrst se lahko uporabi tudi pri napravi raznih likerov in so ti sadni likeri precej udomačena in priljubljena pijača , ki je tem okusnejša , čim bolj je sadje aromatično .
abc77	vonjavo	likeri|voda|sladkor|sadje|alkohol|čistem špiritu|konjaku|slivovki		Glavne snovi , iz katerih ti likeri obstoje , so : voda , sladkor , sadje , ki naj da vonjavo in alkohol , katerega dodamo bodisi v finem , čistem špiritu ali v konjaku , slivovki itd .
abc77	dišavnimi	sadnih likerov		iejši način prirejanja sadnih likerov je ta , da napolnimo primerno velike bele steklenice z dobro osnaženim sadjem in potrebnim sladkorjem , oziroma še z drugimi dišavnimi dodatki in da zalijemo vse skupaj z alkoholom .
abc77	Dišeča	jabolka		Dišeča jabolka , kakor so : zimska parmena , ananasov kosmač itd .
abc78	parfumov	mlačni zrak		Soba je urejena za dolge ljubezenske objeme ; mlačni zrak je v njej težak od slastibud - nih parfumov .
abc78	dišale	razne okrožnice	po duhu	Slovenci srno po njegovi milosti prejeli par sodnih predsednikov in tudi razne okrožnice so dišale po duhu » od pgoraj « .
abc78	dišale	razne okrožnice	po duhu	Slovenci srno po njegovi milosti prejeli par sodnih predsednikov in tudi razne okrožnice so dišale po duhu » od pgoraj « .
abc78	duhala	rožice		__ » Tukaj boš rožice duhala .
abc78	duhala	rožice		Vsa iz sebe zgrabi - nato naskakovalka svojo nasprotnico z golimi rokami in jo potisne v odprto stranišče z besedami : » I ukaj boš rožice duhala « in zaklene ( vrata prijetne sobice .
