id	year	author	title	tags	link
003039265	1856	RANK	Rank and Beauty; or, the Young Baroness
003039265	1856	RANK	Rank and Beauty; or, the Young Baroness
003039265	1856	RANK	Rank and Beauty; or, the Young Baroness
003039455	1852	Ranke, Leopold von	Civil Wars and Monarchy in France in the sixteenth and seventeenth centuries: a History of France principally during that period. Translated by M. A. Garvey
003041637	1852	RAPP, Joseph.	[Tirol im Jahre 1809.]
003044177	1852	RATHLEF, Carl.	Skizze der orographischen und hydrographischen Verhältnisse von Liv-, Esth- und Kurland, ein geographischer Versuch, etc
003046539	1850	RAVEAUX, Franz.	Mittheilungen über die Badische Revolution
003046798	1853	RAVEN, Ralph.	Golden Dreams and Leaden Realities
003047062	1856	RAVENSTEIN, August.	Die Bundes-Plankammer. Ein Versuch zur Begründung ihrer Nothwendigkeit und Ausführbarkeit, mit einem Hinblick auf ihren Wirkungskreis
003047071	1856	RAVENSTEIN, Ernst Georg.	Illustrations of the principal varieties of the Human Race, arranged according to the system of Dr. Latham, with descriptive notes
003047118	1854	RAVERGIE, Auguste Léonce.	Histoire de la Russie et de ses projets d'envahissements depuis le règne de Pierre le Grand jusqu'à nos jours. ... Ouvrage illustré de gravures
003047119	1856	RAVERGIE, Auguste Léonce.	[Histoire de la Russie et de ses projets d'envahissements depuis le règne de Pierre le Grand jusqu'à nos jours. ... Ouvrage illustré de gravures.]
003050148	1851	RAYNBIRD, William.	Miscellaneous Essays, etc
003051016	1852	Reach, Angus B. (Angus Bethune)	Claret and Olives, from the Garonne to the Rhone; or Notes social, picturesque and legendary, by the way
003051017	1852	Reach, Angus B. (Angus Bethune)	[Claret and Olives, from the Garonne to the Rhone; or Notes social, picturesque and legendary, by the way.]
003051193	1858	READ	Read's history of the Isle of Axholme: its manors and parishes, with biographical notices of eminent men. Edited by T. C. Fletcher
003051567	1852	READ, James	Kat River Settlement in 1851, described in a series of letters published in “The South African Commercial Advertiser.”
003051818	1857	Reade, Charles	[Christie Johnstone. A novel.]
003051910	1856	Reade, Charles	“It is Never Too Late to Mend.” A matter of fact romance
003051910	1856	Reade, Charles	“It is Never Too Late to Mend.” A matter of fact romance
003051910	1856	Reade, Charles	“It is Never Too Late to Mend.” A matter of fact romance
003051911	1856	Reade, Charles	[“It is Never Too Late to Mend.” A matter of fact romance.]
003051911	1856	Reade, Charles	[“It is Never Too Late to Mend.” A matter of fact romance.]
003051911	1856	Reade, Charles	[“It is Never Too Late to Mend.” A matter of fact romance.]
003051952	1851	Reade, Charles	Peregrine Pickle: a biographical play, etc. [By C. Reade.]
003051970	1857	Reade, Charles	White Lies. A story
003051970	1857	Reade, Charles	White Lies. A story
003051970	1857	Reade, Charles	White Lies. A story
003052669	1858	READWIN, Thomas Allison.	Reynold's Outlines of Science and Art. Outlines of Geology. [By] T. A. Readwin
003054759	1852	RECKE, Johan Detlev Zepelin von der.	Insurgenternes Angreb paa den Kongelige Danske Armees Fløistillinger i September og October. 1850
003055102	1858	RECOLLECTIONS	Recollections of a Maiden Aunt
003056148	1854	REDEN, Friedrich Wilhelm Otto Ludwig von	Ost-Europa. Kampf-Gebiet und Sieges-Preis in geschichtlich-statistischer Darstellung
003056149	1852	REDEN, Friedrich Wilhelm Otto Ludwig von	Die Staaten im Stromgebiet des La Plata, in ihrer Bedeutung für Europa. Grundlage von Vorträgen im geografischen Verein zu Frankfurt a. M., etc
003057276	1855	REDSLOB, Gustav Moritz.	Thule, die phönicischen Handelswege nach dem Norden insbesondere nach dem Bernsteinlande sowie die Reise des Pytheas von Massilien, etc
003059677	1858	REES, Willem Adriaan van.	Montrado. Geschied- en krijgskundige bijdrage betreffende de onderwerping der Chinezen op Borneo. Naar het dagboek van een Indisch Officier over 1854-1856 ... Met eene voorrede van P. J. Vith
003061298	1853	REFUTATION	A brief and complete Refutation of the Anti-Scriptural Theory of Geologists. By a Clergyman of the Church of England
003062256	1856	REGLEY, Léon.	Guide du voyageur au Mont-Saint-Michel et au Mont-Tombelaine. Nouvelle édition, entièrement refondue, et enrichie des vues les plus remarquables
003062508	1857	REGNAULT, Amable.	Esquisses historiques sur Moscou et Saint Pétersbourg à l'époque du couronnement de l'Empereur Alexandre II
003062512	1855	REGNAULT, Amable.	Voyage en Orient, Grèce, Turquie, Égypte
003062526	1850	REGNAULT, Élias Georges Soulange Oliva.	Histoire du Gouvernement provisoire
003063975	1854	REICHARDT, C. F.	Nicaragua. Nach eigener Anschauung im Jahre 1852 und mit besonderer Beziehung auf die Auswanderung nach den heissen Zonen Amerika's beschrieben, etc
003065890	1855	Reid, Mayne	White Chief. A legend of Northern Mexico
003067283	1856	REINA, G.	Descrizione dell'arco della Pace in Milano, ... con tavole in rame. Quinta edizione, con correzioni ed aggiunte del prof. D. Moglia
003068686	1852	REININGER, Nikolaus.	Münnerstadt und seine nächste Umgebung, nach den ältesten archivalischen Nachrichten dargestellt, besonders in seinen kirchlichen, Religions- und Schulverhältnissen. Mit 40 Urkunden und einem lithographirten Grundrisse der Pfarrkirche nebst den 3 ältesten Stadtwappen
003071144	1849	REMAK, Gustav.	Die Vereinigten Staaten und die andern Länder Amerika's ... Nach dem englischen Werke von S. A. Mitchell und mehreren geschichtlichen ... Werken bearbeitet
003072383	1856	RÉMUSAT, Charles François Marie de	L'Angleterre au dix-huitième siècle. Études et portraits pour servir à l'histoire du gouvernement anglais depuis la fin du règne de Guillaume III
003072383	1856	RÉMUSAT, Charles François Marie de	L'Angleterre au dix-huitième siècle. Études et portraits pour servir à l'histoire du gouvernement anglais depuis la fin du règne de Guillaume III
003078700	1858	REUSCHLE, Carl Gustav.	Handbuch der Geographie, oder neueste Erdbeschreibung, mit besondere Rücksicht auf Statistik, Topographie und Geschichte
003078700	1858	REUSCHLE, Carl Gustav.	Handbuch der Geographie, oder neueste Erdbeschreibung, mit besondere Rücksicht auf Statistik, Topographie und Geschichte
003079908	1849	REVERE, Joseph Warren.	Tour of duty in California; including a description of the Gold Region; and an account of the Voyage around Cape Horn; with notices of Lower California, the Gulf and Pacific Coasts and the principal events attending the conquest of the Californias ... Edited by J. N. Balestier
003080361	1856	REVILLOUT, Victor.	Alaise, Alise, ni l'un ni l'autre ne peut être Alesia. Études critiques d'histoire et de topographie
003081277	1850	REY, William.	Les Grisons et la haute Engadine
003082946	1855	REYNOLDS, Beatrice	My First Season. ... Edited by the author of “Counterparts” [Miss E. S. Sheppard]
003083361	1857	Reynolds, George W. M. (George William MacArthur)	Agnes; or Beauty and Pleasure
003083361	1857	Reynolds, George W. M. (George William MacArthur)	Agnes; or Beauty and Pleasure
003083365	1855	Reynolds, George W. M. (George William MacArthur)	Ciprina; or, The Secrets of the Picture Gallery
003083370	1856	Reynolds, George W. M. (George William MacArthur)	Ellen Percy: or, the Memoirs of an Actress
003083370	1856	Reynolds, George W. M. (George William MacArthur)	Ellen Percy: or, the Memoirs of an Actress
003083371	1857	Reynolds, George W. M. (George William MacArthur)	Empress Eugenie's Boudoir
003083380	1855	Reynolds, George W. M. (George William MacArthur)	Loves of the Harem: a tale of Constantinople
003083383	1852	Reynolds, George W. M. (George William MacArthur)	Mary Price; or, the Memoirs of a servant-maid ... Illustrated with fifty-two engravings by F. Gilbert
003083383	1852	Reynolds, George W. M. (George William MacArthur)	Mary Price; or, the Memoirs of a servant-maid ... Illustrated with fifty-two engravings by F. Gilbert
003083395	1849	Reynolds, George W. M. (George William MacArthur)	Mysteries of the Court of London ... With ... illustrations
003083395	1849	Reynolds, George W. M. (George William MacArthur)	Mysteries of the Court of London ... With ... illustrations
003083395	1849	Reynolds, George W. M. (George William MacArthur)	Mysteries of the Court of London ... With ... illustrations
003083395	1849	Reynolds, George W. M. (George William MacArthur)	Mysteries of the Court of London ... With ... illustrations
003083395	1849	Reynolds, George W. M. (George William MacArthur)	Mysteries of the Court of London ... With ... illustrations
003083395	1849	Reynolds, George W. M. (George William MacArthur)	Mysteries of the Court of London ... With ... illustrations
003083395	1849	Reynolds, George W. M. (George William MacArthur)	Mysteries of the Court of London ... With ... illustrations
003083395	1849	Reynolds, George W. M. (George William MacArthur)	Mysteries of the Court of London ... With ... illustrations
003083396	1850	Reynolds, George W. M. (George William MacArthur)	Mysteries of the Court of London
003083396	1850	Reynolds, George W. M. (George William MacArthur)	Mysteries of the Court of London
003083396	1850	Reynolds, George W. M. (George William MacArthur)	Mysteries of the Court of London
003083396	1850	Reynolds, George W. M. (George William MacArthur)	Mysteries of the Court of London
003083413	1854	Reynolds, George W. M. (George William MacArthur)	Rosa Lambert
003083418	1853	Reynolds, George W. M. (George William MacArthur)	Soldier's Wife
003085226	1858	RHIND, William	Class-book of Elementary Geography
003085236	1850	RHIND, William	Scottish Tourist's Picturesque Guide to Edinburgh and environs ... illustrated with ... plan of the city, maps, ... and ... views
003085963	1854	RHODES, Godfrey.	A Personal Narrative of a Tour of Military Inspection in ... European Turkey, etc
003087479	1856	RHYME	[The Rhyme and Reason of Country Life: or, selections from fields old and new. By the author of “Rural Hours,” etc.]
003087993	1856	RIBADIEU, Henri.	Les Châteaux de la Gironde ... Deuxième édition
003087996	1853	RIBADIEU, Henri.	Histoire de Bordeaux pendant le règne de Louis XVI. Précédé d'une notice sur la statue de Louis XVI. à Bordeaux, par J. Dupuy, etc
003088132	1854	RIBBANS, Frederick Bolingbroke.	Tintern Abbey: a poem
003088911	1855	RIBEYROLLES, Charles.	History of the transportation of December. The African Gaols
003091878	1858	GRAINGER, H. J.	Wanderings through the ruins of Heidelberg Castle and its environs. With views ... Edited by Richard-Janillon. (From the German by H. J. Grainger.)
003093024	1853	RICHARDS, William	Heimburg, a tale: and other poems
003093518	1849	RICHARDSON, David Lester.	[The Anglo-Indian Passage, homeward and outward; or a Card for the Overland Traveller from Southampton, to Bombay, Madras and Calcutta. With letters descriptive of the homeward passage, and notices of Gibraltar, Malta, etc.]
003093523	1852	RICHARDSON, David Lester.	Literary Recreations: or Essays, Criticisms and Poems, chiefly written in India
003094162	1853	RICHARDSON, James	Narrative of a mission to Central Africa, performed in the years 1850-51. [Edited by B. St. John.]
003094348	1850	RICHARDSON, John	Monk Knight of St. John. A tale of the Crusaders
003094387	1851	RICHARDSON, John	Arctic Searching Expedition: a journal of a boat-voyage through Rupert's Land and the Arctic Sea, in search of the discovery ships under the command of Sir John Franklin
003094387	1851	RICHARDSON, John	Arctic Searching Expedition: a journal of a boat-voyage through Rupert's Land and the Arctic Sea, in search of the discovery ships under the command of Sir John Franklin
003096146	1850	RICHMOND, Surrey	Richmond &amp; Hampton-Court Guide: containing a description of every object of note between London Bridge and the Town of Hampton, etc
003096795	1850	RICHOMME, Fanny.	Paris monumental et historique depuis son origine jusqu'à 1789, etc
003097307	1853	RICHTER, Friedrich Theodor.	Geschlechts-Tafeln zur Erläuterung der allgemeinen Geschichte. Nebst einer synchronistischen Übersichtstafel. Heft 1, 2
003097722	1851	RICHTER, Johann Daniel Wilhelm.	Die an dem 8teⁿ Novembertage des 1620steⁿ Jahres bei Prag geschlagene Schlacht, aus Urkunden und andern Quellenschriften beschrieben
003097725	1855	RICHTER, Johann Daniel Wilhelm.	Letzte Unterhandlungen des Königs Jacob von England mit dem Könige Philipp dem Dritten von Spanien über die Zurückgabe des Pfälzer Kurthumes an den Kurfürsten Friedrich
003100904	1851	RIEDEL, Adolph Friedrich.	Zehn Jahre aus der Geschichte der Ahnherren des Preussischen Königshauses. Das Aufsteigen des Burggrafen Friedrich VI. von Nürnberg zur kurfürstlichen Würde und zur Reichsstatthalterschaft in Deutschland
003101679	1858	RIEHL, Wilhelm Heinrich von.	Die Pfälzer. Ein rheinisches Volksbild ... Zweiter unveränderter Abdruck
003104036	1852	RIGLER, Lorenz.	Die Türkei und deren Bewohner in ihren naturhistorischen, physiologischen und pathologischen Verhältnissen vom Standpunkte Constantinopels
003104654	1852	RIKER, James.	Annals of Newtown in Queen's County, New York, containing its history from its first settlement, together with many interesting facts concerning the adjacent towns; also a particular account of numerous Long Island Families, etc
003104897	1851	RILEY, James	Sequel to Riley's Narrative: being a sketch of interesting incidents in the life, voyages and travels of Capt. J. Riley, from the period of his return to his native land ... until his death. Compiled chiefly from the original journal and manuscripts left at his death in possession of his son
003105337	1849	RILLIET, Albert.	Histoire de la restauration de la République de Genève
003106151	1851	PREST, Thomas Peckett.	Bridal Ring; or, the Maiden's sacrifice. A domestic romance ... By the author of “Love and Mystery,” [i.e. T. P. Prest.] etc
003106208	1850	RING, Bernard Jacques Joseph Maximilien de.	Histoire des Germains depuis les temps les plus reculés jusqu'à Charlemagne. Pour servir d'introduction à l'histoire de l'Empire Germanique
003108199	1855	RIPLEY, J. J.	Five Poems. [With notes.]
003108224	1849	RIPLEY, R. S.	War with Mexico
003108224	1849	RIPLEY, R. S.	War with Mexico
003109761	1858	RITA	Rita; an autobiography. [By Hamilton Aïdé.]
003109761	1858	RITA	Rita; an autobiography. [By Hamilton Aïdé.]
003109926	1850	Ritchie, Archibald Tucker.	Dynamical Theory of the Formation of the Earth
003109926	1850	Ritchie, Archibald Tucker.	Dynamical Theory of the Formation of the Earth
003109927	1854	Ritchie, Archibald Tucker.	[The Dynamical Theory of the Formation of the Earth.]
003110247	1853	RITCHIE, Leitch.	Liber Fluviorum; or, River Scenery of France depicted in sixty-one line engravings from drawings by J. M. W. Turner. With descriptive letter-press by Leitch Ritchie; and a biographical sketch by A. A. Watts
003110248	1857	RITCHIE, Leitch.	Liber Fluviorum; or, River Scenery of France. Depicted in sixty-one line engravings from drawings by J. M. W. Turner ... With descriptive letter-press by Leitch Ritchie; and a biographical sketch by Alaric A. Watts
003110849	1852	RITTER, Carl	Einleitung zur allgemeinen vergleichenden Geographie, und Abhandlungen zur Begründung einer mehr wissenschaftlichen Behandlung der Erdkunde
003110863	1858	RITTER, Carl	Geografiskt-statistiskt Lexikon ... efter Ritters geografisk-statistiska verk, i der af W. Hoffman, C. Winderlich och C. Cramer tillökade upplaga, bearbetadt på Svenska, etc
003110863	1858	RITTER, Carl	Geografiskt-statistiskt Lexikon ... efter Ritters geografisk-statistiska verk, i der af W. Hoffman, C. Winderlich och C. Cramer tillökade upplaga, bearbetadt på Svenska, etc
003110863	1858	RITTER, Carl	Geografiskt-statistiskt Lexikon ... efter Ritters geografisk-statistiska verk, i der af W. Hoffman, C. Winderlich och C. Cramer tillökade upplaga, bearbetadt på Svenska, etc
003110871	1850	RITTER, Carl	Über räumliche Anordnungen auf der Aussenseite des Erdballs, und ihre Functionen im Entwicklungsgange der Geschichten
003110950	1853	RITTER, Franz von	Beiträge zur Regierungs-Geschichte König Ludwig I. von Bayern. Bde. 1 &amp; 2
003111401	1853	RITTIEZ, F.	Histoire de la Restauration, ou précis des règnes de Louis XVIII. et Charles X
003111404	1855	RITTIEZ, F.	Histoire du règne de Louis-Philippe Ier 1830 à 1848, précis par F. Rittiez ... faisant suite à l'Histoire de la Restauration, même auteur
003111404	1855	RITTIEZ, F.	Histoire du règne de Louis-Philippe Ier 1830 à 1848, précis par F. Rittiez ... faisant suite à l'Histoire de la Restauration, même auteur
003111404	1855	RITTIEZ, F.	Histoire du règne de Louis-Philippe Ier 1830 à 1848, précis par F. Rittiez ... faisant suite à l'Histoire de la Restauration, même auteur
003112353	1852	RIVERS, Alice.	Alice Rivers, or, passages in the life of a young lady. Written by herself. [By M. A. Kelty.]
003112566	1856	RIVERS, William James.	sketch of the history of South Carolina to the close of the proprietary gevernment by the revolution of 1719. With an appendix containing many valuable records hitherto unpublished
003114326	1852	PREST, Thomas Peckett.	Robber's Wife. A domestic romance. By the author of “Kathleen, or The Secret Marriage. [i.e. T. P. Prest.]
003114516	1852	ROBBINS, Eliza.	Class-book of Poetry, for the use of schools, etc
003115406	1852	ROBERT, Cyprien.	Les Slaves de Turquie, édition de 1844, précédée d'une introduction nouvelle sur leur situation pendant et depuis leurs insurrections de 1849 à 1851
003116955	1850	ROBERTS, Emma.	Hindostan; its landscapes, palaces, temples, tombs; the shores of the Red Sea; and the ... scenery of the Himalaya Mountains, illustrated in a series of views. With descriptions by E. Roberts
003117165	1856	ROBERTS, George	Social History of the people of the Southern Counties of England in past centuries
003118470	1855	ROBERTS, Richard Earnshaw.	Mysterious Providence improved. A sermon [on 1 Sam. xx. 3] preached ... on the occasion of the death of the Rev. S. Sunderland
003119611	1851	ROBERTSON, David Henderson.	Sculptured Stones of Leith; with historical and antiquarian notices
003119972	1858	ROBERTSON, Frederick William	Lectures and Addresses on literary and social topics
003119992	1853	ROBERTSON, Frederick William	On the anniversary of the death of the Rev. F. W. Robertson, etc
003120290	1851	ROBERTSON, Janet	Light and Shades of a Traveller's Path; or, Scenes in foreign lands
003123421	1856	ROBINSON, Edward	[Biblical Researches in Palestine, Mount Sinai, and Arabia Petræa. A journal of travels in the year 1838, by E. Robinson and E. Smith ... Drawn up from the original diaries, with historical illustrations, by E. Robinson.]
003123421	1856	ROBINSON, Edward	[Biblical Researches in Palestine, Mount Sinai, and Arabia Petræa. A journal of travels in the year 1838, by E. Robinson and E. Smith ... Drawn up from the original diaries, with historical illustrations, by E. Robinson.]
003123421	1856	ROBINSON, Edward	[Biblical Researches in Palestine, Mount Sinai, and Arabia Petræa. A journal of travels in the year 1838, by E. Robinson and E. Smith ... Drawn up from the original diaries, with historical illustrations, by E. Robinson.]
003124311	1853	ROBINSON, James	Edith: a tale of Belle Isle, Windermere. In verse
003125005	1852	ROBINSON, Mary Gordon.	life and adventures of James Kelly O'Dwyer. [By M. G. Robinson.]
003125409	1857	ROBINSON, Sara Tappan Doolittle.	Kansas; its interior and exterior life. Including a full view of its settlement ... Seventh edition
003126869	1854	ROBSON, William James.	Love and Loyalty. A play in five acts [and in verse.]
003127595	1853	ROCHAU, August Ludwig von.	Wanderings through the cities of Italy in 1850 and 1851. ... Translated by Mrs. P. Sinnett
003127834	1850	ROCHE, James	Critical and Miscellaneous Essays. By an Octogenarian (J. Roche)
003127834	1850	ROCHE, James	Critical and Miscellaneous Essays. By an Octogenarian (J. Roche)
003129051	1857	Jarnac, Philippe-Ferdinand-Auguste de Rohan-Chabot	Dark and Fair. By Sir Charles Rockingham
003129051	1857	Jarnac, Philippe-Ferdinand-Auguste de Rohan-Chabot	Dark and Fair. By Sir Charles Rockingham
003129051	1857	Jarnac, Philippe-Ferdinand-Auguste de Rohan-Chabot	Dark and Fair. By Sir Charles Rockingham
003132465	1856	RODWELL, James.	Queen Cora: or, Slavery and its Downfall. [A drama, in five acts and in prose.]
003133912	1849	ROEMER, Ferdinand.	Texas. Mit besonderer Rücksicht auf deutsche Auswanderung, etc
003134003	1857	ROEMER-BUECHNER, Benedict Jacob.	Die Wahl- und Krönungs-Kirche der deutschen Kaiser zu St. Bartholomäi in Frankfurt am Main
003135226	1856	ROGER, Charles	Rise of Canada, from barbarism to wealth, etc
003135276	1857	ROGER, James Cruikshank.	Notes of Ancient Monuments in the ruined Church of St. Mary, Rothesay. Being the substance of a paper read at a meeting of the Society of Antiquaries of Scotland, etc. [With plates.]
003135692	1849	ROGERS, Charles	History of St. Andrews, with a full account of the recent improvements in the City
003136218	1850	ROGERS, Henry	Essays, selected from contributions to the Edinburgh Review
003136218	1850	ROGERS, Henry	Essays, selected from contributions to the Edinburgh Review
003136929	1852	ROGERS, Samuel	Poetical Works of Samuel Rogers. Illustrated with engravings ... from designs by Lawrence, Stothard, Turner, etc
003136968	1852	ROGERS, Samuel	Italy, a poem ... A new edition
003137265	1850	ROGERSON, John Bolton.	Poetical Works of J. B. Rogerson
003137371	1858	ROGET DE BELLOGUET, Dominique François Louis	Ethnogénie Gauloise, ou mémoires critiques sur l'origine et la parenté des Cimmériens, des Cimbres, des Ombres, etc. (Les Cimmériens, des Cimbres, des Ombres, etc. (Les Cimmériens ... Ouvrage posthume publié par les soins de M. A. Maury, M. H. Gaidoz.)
003137371	1858	ROGET DE BELLOGUET, Dominique François Louis	Ethnogénie Gauloise, ou mémoires critiques sur l'origine et la parenté des Cimmériens, des Cimbres, des Ombres, etc. (Les Cimmériens, des Cimbres, des Ombres, etc. (Les Cimmériens ... Ouvrage posthume publié par les soins de M. A. Maury, M. H. Gaidoz.)
003137373	1851	ROGET DE BELLOGUET, Dominique François Louis	Origines Dijonnaises dégagées des fables et des erreurs qui les ont enveloppées jusqu'à ce jour, suivies d'une dissertation particulière sur les actes et la mission de S. Bénigne, l'Apôtre de Dijon, etc
003140326	1854	ROLLAND, Charles	La Turquie contemporaine. Hommes et choses. Études sur l'orient
003147270	1857	Rome (Italy)	History of Modern Rome from the taking of Constantinople (1453) to the restoration (1850) of Pope Pius the ninth
003147474		Rome (Italy)	Lays of Modern Rome
003147547	1851	Rome (Italy)	Rome in 1848-49
003152932	1855	ROMEY, Louis Charles Reparat Geneviève Octave	La Russie ancienne et moderne, d'après les chroniques nationales, etc
003153304	1851	ROMNEY, John	Chester and its Environs illustrated. Drawn and engraved by J. Romney. With historical descriptions by a citizen. pt. 1
003154853	1858	ROOKE, Octavius.	Life of the Moselle, from its source in the Vosges Mountains to its junction with the Rhine at Coblence
003154854		ROOKE, Octavius.	An Ode on the Marriage of H.R.H. the Princess Royal
003156127	1855	ROPER, William	An Ode addressed to ... [Victor Emanuel II.] the King of Sardinia, on the occasion of His Majesty's ... visit to this country
003156853	1858	ROSA, Gabriele.	Notizie statistiche della provincia di Bergamo in ordine storico. Raccolte da G. Rosa
003157116	1850	ROSALES, Diego de.	Historia de America. Noticia de un manuscrito muy interesante. (Su titulo es: Historia general del Reyno de Chile ... por el P. Diego de Rosales.)
003157460	1857	ROSCHER, Albrecht.	Ptolemaeus und die Handelsstrassen in Central-Africa. Ein Beitrag zur Erklärung der ältesten und erhaltenen Weltkarte. Mit zwei Karten
003157821	1849	Roscoe, Thomas.	Continental Tourist. Views of Cities and Scenery in Italy, France, and Switzerland. From original drawings by S. Prout, ... and J. D. Harding, with descriptions in English by T. Roscoe, and in French by A. Sosson
003157844	1853	Roscoe, Thomas.	[Wanderings and Excursions in North Wales, with 51 engravings, by Radclyffe, from drawings by Cattermole, Cox, etc.]
003157865	1855	Roscoe, William	[The butterfly's ball, and the grasshopper's feast.]
003158432	1857	ROSE, George	Boston Municipal Charities. Scheme for the administration of the charities, and the application of the income thereof, approved by the report of Sir George Rose ... dated the 27th of July, 1850. Confirmed by an order of Vice-Chancellor Knight Bruce, dated the 3rd of August, 1850
003158978	1858	ROSE, Thomas	[Westmorland, Cumberland, Durham, and Northumberland, illustrated from original drawings by T. Allom, G. Pickering, &amp;c. With descriptions by T. Rose.]
003159532		ROSEN, Georg	Отъѣзжія поля. [An historical essay.]
003160061	1851	ROSENBERG, Charles G.	Jenny Lind in America
003160934	1850	ROSENKRANZ, Johann Carl Friedrich.	Die Topographie des heutigen Paris und Berlin. Zwei Vorträge
003161612	1855	ROSES	Rival Roses: a romance of English History. By the author of “Royalists and Roundheads,” etc
003161614	1853	CAMPBELL, afterwards BURY, Charlotte Susan Maria	Roses. By the author of “The History of a Flirt” [i.e. Lady Charlotte S. M. Campbell, afterwards Bury]
003161630	1856	ROSET, Hipponax.	Jewelry and the Precious Stones: with a history, and description from models, of the largest individual diamonds known; including particularly a consideration of the Koh-i-Noor's claim to notoriety
003162473	1851	ROSMAN, P.	Geschichte der Stadt Breisach ... Mit einem Vorwort von Dr. Weiss
