id	year	author	title	tags	link
000000472	1851	A., E. S.	Welsh Sketches, chiefly ecclesiastical, to the close of the twelfth century. By the author of “Proposals for Christian Union” (E. S. A. [i.e. Ernest Appleyard])
000000478	1854	A., E. S.	[Third series.]
000000480	1857	A., E. S.	World in which I live, and my place in it. By E. S. A. [i.e. Letitia Willgoss Stone.] Edited by ... J. H. Broome.]
000001494	1855	AA, Abraham Jacob van der.	Ons Vaderland en zijne Bewoners ... Met ... platen, etc
000004337	1856	ABBOTT, James	[Narrative of a journey from Heraut to Khiva, Moscow and St. Petersburgh, during the late Russian invasion of Khiva. With some account of the court of Khiva and the kingdom of Khaurism.]
000004337	1856	ABBOTT, James	[Narrative of a journey from Heraut to Khiva, Moscow and St. Petersburgh, during the late Russian invasion of Khiva. With some account of the court of Khiva and the kingdom of Khaurism.]
000005165	1854	ABDERAHMAN, Effendi, pseud.	Boatman of the Bosphorus: a tale of Turkey
000014678	1856	ADAMS, C. Warren.	Randal Vaughan: or, Self in self-sacrifice. A novel
000014678	1856	ADAMS, C. Warren.	Randal Vaughan: or, Self in self-sacrifice. A novel
000015002	1857	ADAMS, Edwin G.	Historical Discourse in commemoration of the one hundredth Anniversary of the formation of the first Congregational Church in Templeton, Massachusetts. With an appendix, embracing a survey of the municipal affairs of the town
000015576	1856	ADAMS, Henry Gardiner.	An Historical and Descriptive Account of Rochester Bridge, in three epochs, being a memorial of the opening of the new bridge, and the taking down of the old, with illustrations
000018504	1855	ADDISON, Julia.	Evelyn Lascelles. An autobiography. Edited [or rather written] by J. Addison
000019922	1857	ADINOLFI, Pasquale.	Laterano e Via Maggiore. Saggio della topografia di Roma nell' età di mezzo dato sopra pubblici e privati documenti
000020441	1856	ADLER, Hermann	Zur ältesten Geschichte Schlesiens, etc
000020960	1853	PEPYS, Charlotte Maria	Diary and Houres of the Ladye Adolie, a faythfulle childe. 1552. [Edited, or rather written, by Lady C. M. Pepys.]
000021104	1858	ADOLPHUS, John Leycester.	Letters from Spain in 1856 and 1857
000021394	1857	ADRIANI, Giovanni Battista	Indice analitico e cronologico di alcuni documenti per servire alla storia della città di Cherasco e delle antiche castella di sua dipendenza dal secolo X. al XVII., etc
000022376	1853	AEGYPTUS, pseud.	Compass and Lyre. [Verses. The preface signed: Ægyptus.]
000024344	1853	WUTTKE, Heinrich.	Cosmographiam Æthici Istrici ab Hieronymo ex Graeco in Latinum breviarium redactam ... separato libello expressam primum edidit Henricus Wuttke. Accedunt duae tabulae, etc
000024407	1857	AFANAS'EV, Dmitry Lavrent'evich.	Путеводитель по Севастополю, его бастіонамъ и окрестностямъ, etc. [With two plans.]
000024685	1850	AFFRE, Henri.	Simples Récits historiques sur Espalion
000028615	1852	Agardh, C. A. (Carl Adolf)	Försök till en statsekonomisk statistik öfver Sverige. (Den statsekonomiska afdelningen af C. A. Agardh, den statistiska af C. E. Ljungberg.)
000028615	1852	Agardh, C. A. (Carl Adolf)	Försök till en statsekonomisk statistik öfver Sverige. (Den statsekonomiska afdelningen af C. A. Agardh, den statistiska af C. E. Ljungberg.)
000028615	1852	Agardh, C. A. (Carl Adolf)	Försök till en statsekonomisk statistik öfver Sverige. (Den statsekonomiska afdelningen af C. A. Agardh, den statistiska af C. E. Ljungberg.)
000028615	1852	Agardh, C. A. (Carl Adolf)	Försök till en statsekonomisk statistik öfver Sverige. (Den statsekonomiska afdelningen af C. A. Agardh, den statistiska af C. E. Ljungberg.)
000028630	1857	Agardh, C. A. (Carl Adolf)	Inledning till Sveriges fysiska geografi. Jemte upplysningar rörande ankologisk och fysisk karta öfver Sverige
000028762	1850	Agassiz, Louis	Lake Superior: its physical character, vegetation, and animals, compared with those of other and similar regions ... With a narrative of the tour by J. E. Cabot, etc
000028873	1853	Craik, Dinah Maria Mulock	Agatha's Husband. A novel. By the author of “Olive,” etc. [i.e. D. M. Mulock, afterwards Craik.]
000031922	1852	AHIER, John Patriarche.	Tableaux historiques de la civilisation à Jersey: résumé philosophique des moeurs, lois et coutumes de l'île, etc. [With plates.]
000033822	1857	AIKIN, Berkeley	Anne Shrewood (Anne Sherwood): or, the Social Institutions of England. [A novel.]
000033822	1857	AIKIN, Berkeley	Anne Shrewood (Anne Sherwood): or, the Social Institutions of England. [A novel.]
000033822	1857	AIKIN, Berkeley	Anne Shrewood (Anne Sherwood): or, the Social Institutions of England. [A novel.]
000033833	1850	Goldsmith, Oliver	Vicar of Wakefield ... Illustrated with numerous engravings. With an account of the author's life and writings by J. Aikin
000034865	1857	Ainsworth, William Harrison	[Guy Fawkes; or the Gunpowder treason, etc.]
000034876	1854	Ainsworth, William Harrison	[Jack Sheppard ... With illustrations by George Cruikshank. A new edition.]
000034900	1854	Ainsworth, William Harrison	[The Lancashire Witches. A novel.]
000034914	1858	Ainsworth, William Harrison	Mervyn Clitheroe ... Illustrated by Hablot K. Browne
000034921	1855	Ainsworth, William Harrison	[The miser's daughter, etc.]
000034937	1855	Ainsworth, William Harrison	[Old Saint Paul's, etc.]
000034967	1857	Ainsworth, William Harrison	[Rookwood ... The fourth edition ... with illustrations by George Cruikshank. [With a portrait.]]
000034987	1857	Ainsworth, William Harrison	Spendthrift: a tale ... With illustrations by Hablot K. Browne
000034996	1854	Ainsworth, William Harrison	Star-Chamber: an historical romance
000035008	1854	Ainsworth, William Harrison	[The Tower of London ... Illustrated by George Cruikshank. Fifth edition.]
000035218	1856	AIREY, Richard	Opening address of Major-General Sir Richard Airey, K.C.B. ... before the Board of General Officers assembled at the Royal Hospital, Chelsea. Together with his summing-up address, etc. [With maps.]
000035847	1852	AITON, John.	Lands of the Messiah, Mahomet, and the Pope; as visited in 1851. [With plates and a map.]
000036521	1857	Akenside, Mark	Poetical Works of Mark Akenside ... With a biographical sketch of the author (by Dr. Johnson).]
000037770	1849	ALAMÁN, Lúcas.	Historia de Méjico, etc
000037770	1849	ALAMÁN, Lúcas.	Historia de Méjico, etc
000037770	1849	ALAMÁN, Lúcas.	Historia de Méjico, etc
000037770	1849	ALAMÁN, Lúcas.	Historia de Méjico, etc
000037770	1849	ALAMÁN, Lúcas.	Historia de Méjico, etc
000038340	1858	ALASTOR, pseud. [i.e. James Orton.]	Caleb Redivivus. By Alastor
000041096	1849	ALBERTRANDY, Jan Chrzciciel	Panowanie Henryka Walezyusza i Stefana Batorego krolów Polskich. Z rękopismów Albertrandego podług wydania Ż. Onacewicza. Z dołączeniem Pamiętników historyi Stefana Batorego dotyczących. [With the preface of Onacewicz.]
000042095	1857	ALBRECHT, Karl	Englische Literaturgeschichte in Musterstücken aus den besten Schriftstellern von Shakespeare an bis auf unsere Zeit. Ein Lehr- und Lesebuch, etc
000042911	1851	SANDBACH, Margaret	Spiritual Alchemy; or, Trials turned to Gold. By the Author of “Hearts in Mortmain,” and “Cornelia” [i.e. Margaret Sandbach]
000043836	1855	ALDAMA AYALA, José de.	Compendio geográficoestadístico de Portugal y sus posesiones ultramarinas. [With a map and tables.]
000044398	1856	ALDERSHOTTANA	Aldershottana: or, Chinks in my Hut: and Touch-and-go Sketches from Court to Camp
000044428	1855	ALDERSON, Edward Hall	On the Reform of Youthful Criminals by means of Reformatory Schools, under 17 &amp; 18 Vict. c. 86., being part of the charge of Mr. Baron Alderson to the Grand Jury of Yorkshire at the Winter Assize, 1854
000048214	1854	ALEXANDER, Gabriel.	Lilias, the Milliner's Apprentice ... With ... wood-engravings drawn by W. H. Thwaits
000048215	1852	ALEXANDER, Gabriel.	Robert Bruce, the Hero-King of Scotland ... With ... wood-engravings drawn by W. H. Thwaits. [A novel.]
000048379	1857	Alexander, James Edward	Passages in the Life of a Soldier; or, Military Service in the East and West
000048379	1857	Alexander, James Edward	Passages in the Life of a Soldier; or, Military Service in the East and West
000052357	1850	ALISON, Archibald	Essays, political, historical and miscellaneous
000052357	1850	ALISON, Archibald	Essays, political, historical and miscellaneous
000052357	1850	ALISON, Archibald	Essays, political, historical and miscellaneous
000052367	1849	ALISON, Archibald	[History of Europe from the commencement of the French Revolution, etc.]
000052367	1849	ALISON, Archibald	[History of Europe from the commencement of the French Revolution, etc.]
000052367	1849	ALISON, Archibald	[History of Europe from the commencement of the French Revolution, etc.]
000052367	1849	ALISON, Archibald	[History of Europe from the commencement of the French Revolution, etc.]
000052367	1849	ALISON, Archibald	[History of Europe from the commencement of the French Revolution, etc.]
000052367	1849	ALISON, Archibald	[History of Europe from the commencement of the French Revolution, etc.]
000052367	1849	ALISON, Archibald	[History of Europe from the commencement of the French Revolution, etc.]
000052367	1849	ALISON, Archibald	[History of Europe from the commencement of the French Revolution, etc.]
000052367	1849	ALISON, Archibald	[History of Europe from the commencement of the French Revolution, etc.]
000052367	1849	ALISON, Archibald	[History of Europe from the commencement of the French Revolution, etc.]
000052367	1849	ALISON, Archibald	[History of Europe from the commencement of the French Revolution, etc.]
000052367	1849	ALISON, Archibald	[History of Europe from the commencement of the French Revolution, etc.]
000052367	1849	ALISON, Archibald	[History of Europe from the commencement of the French Revolution, etc.]
000052367	1849	ALISON, Archibald	[History of Europe from the commencement of the French Revolution, etc.]
000052374	1849	ALISON, Archibald	Atlas
000052378	1853	ALISON, Archibald	History of Europe from the Fall of Napoleon in 1815 to the Accession of Louis Napoleon in 1852
000052378	1853	ALISON, Archibald	History of Europe from the Fall of Napoleon in 1815 to the Accession of Louis Napoleon in 1852
000052378	1853	ALISON, Archibald	History of Europe from the Fall of Napoleon in 1815 to the Accession of Louis Napoleon in 1852
000052378	1853	ALISON, Archibald	History of Europe from the Fall of Napoleon in 1815 to the Accession of Louis Napoleon in 1852
000052378	1853	ALISON, Archibald	History of Europe from the Fall of Napoleon in 1815 to the Accession of Louis Napoleon in 1852
000052378	1853	ALISON, Archibald	History of Europe from the Fall of Napoleon in 1815 to the Accession of Louis Napoleon in 1852
000052378	1853	ALISON, Archibald	History of Europe from the Fall of Napoleon in 1815 to the Accession of Louis Napoleon in 1852
000052378	1853	ALISON, Archibald	History of Europe from the Fall of Napoleon in 1815 to the Accession of Louis Napoleon in 1852
000053224	1857	ALLAN, Francis	Het eiland Ameland en zijne bewoners, etc. [With a map.]
000053234	1856	ALLAN, Francis	De stad Enkhuizen en hare geschiedenis
000053235	1857	ALLAN, Francis	De stad 's Gravenhage en hare geschiedenis, etc. afl. 1-5
000053236	1856	ALLAN, Francis	De stad Utrecht en hare geschiedenis, voorafgegaan door eene algemeene geschied- en aardrijkskundige beschouwing over de provincie Utrecht
000053313	1857	ALLAN, James MacGrigor.	Ernest Basil, a novel
000053313	1857	ALLAN, James MacGrigor.	Ernest Basil, a novel
000053313	1857	ALLAN, James MacGrigor.	Ernest Basil, a novel
000053321	1856	ALLAN, James MacGrigor.	Woman-Hater; or, True and false love. A drama, in five acts
000054554	1850	ALLEN, A. J.	Ten Years in Oregon. Travels and adventures of Dr. E. White and lady, west of the Rocky Mountains ... Compiled by ... A. J. Allen
000054812	1854	ALLEN, Carl Ferdinand.	Breve og Aktstykker til Oplysning af Christiern den Andens og Frederik den Førstes Historie. Bd. 1
000057223	1849	ALLEN, William	History of Norridgewock: comprising memorials of the aboriginal inhabitants, and Jesuit Missionaries, hardships of the pioneers, biographical notices of the early settlers and ecclesiastical sketches
000057999	1852	ALLIES, Jabez.	[On the Ancient British, Roman and Saxon Antiquities of Worcestershire.]
000058024	1849	ALLIES, Thomas William.	Journal in France in 1845 and 1848, with letters from Italy in 1847, of things and persons concerning the Church and education
000058791	1858	ALLMERS, Hermann.	Marschenbuch. Land- und Volksbilder aus den Marschen der Weser und Elbe
000058889	1850	ALLOM, Thomas.	Polyorama of Constantinople ... Third edition
000059048	1856	ALLOUVILLE-BELLEFOSSE	Notice sur le gros chêne d'Allouville, ou Chêne-chapelle
000059435	1854	ALMA, River	Battle of the Alma. From the official despatches. By an Enemy to despotism. [A poem.]
000062461	1851	ALSINA, Valentín.	Compilacion de documentos relativos á sucesos del Rio de La Plata desde 1806. [Edited by V. Alsina.]
000063103	1853	ALTEN, Friedrich von.	Graf Christoff von Oldenburg und die Grafenfehde, 1534-1536. Ein Beitrag zur Geschichte des Dänischen Interregnums
000064159	1852	Alton Towers (England)	[The Stranger's Guide; or, Description of Alton Towers, Staffordshire.]
000064634	1853	ALVARADO TEZOZOMOC, Fernando de.	Histoire du Mexique ... Traduite sur un manuscrit inédit par H. Ternaux-Compans
000064829	1856	ÁLVAREZ, José Justo	Itinerarios y derroteros de la República Mexicana, etc
000065026	1850	ÁLVAREZ DE TOLEDO, Fernando	Correspondance du Duc d'Albe sur l'invasion du Comte Louis de Nassau en Frise, en 1568, et les batailles de Heyligerlée et de Gemmingen; publiée par M. Gachard. (Extrait des Bulletins de la Commission Royale d'Histoire.)
000065130	1849	ÁLVAREZ MIRANDA, Vicente.	Glorias de Sevilla en armas, letra, ciencias, artes, tradiciones, monumentos, edificios, etc. [With plates.]
000065475	1854	ALVENSLEBEN, Ludwig von.	Die deutsche Colonie Dona Francisca in Brasilien. Der vortheilhafteste Punkt für deutsche Auswanderer. Ein Rathgeber und Wegweiser, etc
000066585	1852	AMALFI	Beauty of Amalfi. An Italian tale
000067034	1850	AMARI, Michele.	History of the War of the Sicilian Vespers ... [Translated by Anne B. I. Percy.] Edited, with an introduction and notes, by the Earl of Ellesmere
000067034	1850	AMARI, Michele.	History of the War of the Sicilian Vespers ... [Translated by Anne B. I. Percy.] Edited, with an introduction and notes, by the Earl of Ellesmere
000067034	1850	AMARI, Michele.	History of the War of the Sicilian Vespers ... [Translated by Anne B. I. Percy.] Edited, with an introduction and notes, by the Earl of Ellesmere
000067036	1849	AMARI, Michele.	Anglo-French Mediation in Sicily; or, Post-Scriptum to “Sicily and the Bourbons.” Translated from the French
000067216	1855	Sullivan, Edward Robert	Trip to the Trenches in February and March, 1855. By an Amateur. Second edition
000069157	1855	AMERICA, North	Handbüchlein für Auswanderer nach Nordamerika ... Zweite vermehrte Auflage
000069175	1855	AMERICA, North	Letters from North America, written during the summer of 1853. (Letters ... addressed to the Warden of St. Augustine's [Canterbury], by one of the members of the College.)
000069348	1856	AMERICAN	Golden Dagon; or, Up and down the Irrawaddi. Being passages of adventure in the Burman Empire. By an American [i.e. John W. Palmer]
000069360	1851	AMERICAN	Journal of a Voyage up the Nile, made between the months of November, 1848, and April, 1849. By an American
000069415	1849	AMERICAN ADVERTISER	American Advertiser, designed for the cards and advertisements of the leading business establishments of the United States
000069639	1853	AMERICAN INDIAN LIFE	Traits of American-Indian Life and Character. By a Fur Trader
000069769	1852	AMERICAN SCENERY	Home-Book of the Picturesque: or American Scenery, Art, and Literature. Comprising a series of Essays ... With thirteen engravings, etc
000071005	1855	AMICO E STATELLA, Vito Maria.	Dizionario topografico della Sicilia ... Tradotto ... ed annotato da Gioacchino Dimarzo. [With “Vita dell' autore,” by Francesco Ferrara.]
000071005	1855	AMICO E STATELLA, Vito Maria.	Dizionario topografico della Sicilia ... Tradotto ... ed annotato da Gioacchino Dimarzo. [With “Vita dell' autore,” by Francesco Ferrara.]
000071406	1851	AMIOT, Benjamin.	Traité élémentaire de cosmographie ... Deuxième édition
000074411	1853	AMUNÁTEGUI REYES, Miguel Luis	La Dictadura de O'Higgins
000076128	1853	ANCHORIZ, José Marie.	Ensayo de geografia historica antigua
000077495	1851	Andersen, H. C. (Hans Christian)	Pictures of Sweden. [Translated by Charles Beckwith Lohmeyer.]
000079169	1856	ANDERSON, John	A History of Edinburgh from the Earliest Period to the Completion of the Half Century, 1850, with brief notices of eminent or remarkable individuals. [With a map.]
000079174	1850	ANDERSON, John	Course of Creation
000079175	1851	ANDERSON, John	[The Course of Creation.]
000079229	1858	ANDERSON, John	Descriptive Account of Mauritius, its scenery, statistics, &amp;c. ... Preceded by elements of geography, etc
000080440	1856	ANDERSON, Thomas Carnegy.	Poems
000080663	1853	ANDERSON, William	Blanche the Huguenot. A tale
000080908	1856	ANDERSSON, Carl Johan.	Lake Ngami; or, Explorations and discoveries during four years wandering in the wilds of South Western Africa ... With a map, and numerous illustrations, etc
000081300	1850	ANDLAW, Heinrich von	Der Aufruhr und Umsturz in Baden, als eine natürliche Folge der Landesgesetzgebung, mit Rücksicht auf die “Bewegung in Baden” von J. B. Bekk, etc
000082469	1856	ANDREAE, Johannes Henricks Beucker.	Herinneringen aan Italie
000084491	1856	ANDREWS, Alexander.	Eighteenth Century; or, Illustrations of the manners and customs of our grandfathers
000084632	1857	ANDREWS, Christopher Columbus.	Minnesota and Dacotah: in letters descriptive of a tour through the North-West, in ... 1856, etc
000085013	1852	ANDREWS, John Richard	A Four Months' Tour in the East
000087164	1854	ANGELIS, Pedro de.	De la navigation de l'Amazone, réponse à un mémoire de M. Maury [“The Amazon and the Atlantic Slopes of South America”], etc
000091396	1853	ANNOVAZZI, Vincenzo Giovanni Niccola	Storia di Civitavecchia dalla sua origine fino all' anno 1848. [Edited, with a life of the author, by D. and B. Annovazzi. With plates.]
000091651	1849	ANNUS	Annus infamis, 1848. A satire of the day, or thoughts on the events of the past year. In verse
000092982	1850	ANSTED, David Thomas.	An Elementary Course of Geology, Mineralogy, and Physical Geography
000092983	1856	ANSTED, David Thomas.	[An Elementary Course of Geology, Mineralogy, and Physical Geography.]
000092992	1849	ANSTED, David Thomas.	[The Gold-Seeker's Manual.]
000093006	1854	ANSTED, David Thomas.	Scenery, Science, and Art; being extracts from the note book of a geologist and mining engineer. [With plates.]
000093809	1850	ANTHON, Charles	A System of Ancient and Mediæval Geography, for the use of Schools and Colleges
000094077	1852	ANTHONY, Louisa.	Footsteps to History: being an epitome of the histories of England and France, embracing the cotemporaneous periods from the fifth to the nineteenth century, etc
000094904	1850	ANTIQUARY	Topographical Memoranda of the Ward of Farringdon Without. By an Antiquary [i.e.-Underhill]
000094905	1852	ANTIQUARY	A Tradition of the King's Head Tavern, in the Poultry. [Signed: An Antiquary.]
000096025	1855	Ruffini, Giovanni	Doctor Antonio: a tale. By the author of Lorenzo Benoni [i.e. Giovanni D. Ruffini]
000096329	1851	ANTONY	Antony, the deaf and dumb boy
000097248	1855	ANTWERP	Jaerboek der vermaerde en kunstryke Gilde van Sint Lucas binnen de Stad Antwerpen, behelzende de gedenkweerdigste geschiedenissen in dit Genootschap voorgevallen sedert het jaer 1434 tot het jaer 1795. In orde gesteld ... door J. B. van der Straelen en uytgegeven door P. Th. Moons-van der Straelen
000099991	1851	APPERT, Benjamin Nicolas Marie.	Die Gefängnisse, Spitäler, Schulen, Civil- und Militär-Anstalten in Oesterreich, Baiern, Preussen, Sachsen, Belgien. Nebst einer Widerlegung des Zellensystems
000102311	1855	ARAGO, Jacques Étienne Victor.	Histoire de Paris, ses révolutions ... et ses événements de 1841 à 1852 ... 2e édition
000104780	1856	ARCHAEOLOGIST	Stories by an Archaeologist and his Friends. [By Henry Noel Humphreys.]
000104780	1856	ARCHAEOLOGIST	Stories by an Archaeologist and his Friends. [By Henry Noel Humphreys.]
000105300	1854	ARCHER, James Henry Lawrence.	Shadow-Haunted. A tale. [An offprint from Saunders's Monthly Magazine, with a special titlepage prefixed.]
000106286	1852	ARCTIC MISCELLANIES	Arctic Miscellanies. A souvenir of the late Polar search. By the Officers and Seamen of the expedition
000106294	1851	MANGLES, James.	Papers and Despatches relating to the Arctic Searching Expeditions of 1850-51. Together with a few remarks as to the probable course pursued by Sir John Franklin, etc. [Compiled by James Mangles. With maps.]
000106645	1852	ARDENNAN	Heir of Ardennan: a story of domestic life in Scotland. By the author of “Anne Dysart” [i.e. Christiana Jane Douglas]
000106905	1853	ARDOUIN, Beaubrun.	Études sur l'histoire d'Haïti, suivies de la vie du général J. M. Borgella
000106905	1853	ARDOUIN, Beaubrun.	Études sur l'histoire d'Haïti, suivies de la vie du général J. M. Borgella
000106905	1853	ARDOUIN, Beaubrun.	Études sur l'histoire d'Haïti, suivies de la vie du général J. M. Borgella
000106905	1853	ARDOUIN, Beaubrun.	Études sur l'histoire d'Haïti, suivies de la vie du général J. M. Borgella
000106905	1853	ARDOUIN, Beaubrun.	Études sur l'histoire d'Haïti, suivies de la vie du général J. M. Borgella
000106905	1853	ARDOUIN, Beaubrun.	Études sur l'histoire d'Haïti, suivies de la vie du général J. M. Borgella
000107225	1849	ARENALES, José Ildefonso.	[Noticias históricas y descriptivas sobre el gran pais del Chaco y Rio Bermejo, etc.]
000107880	1857	ARÉVALO, Rafael de.	Coleccion de documentos antigüos del Archivo del ayuntamiento de la ciudad de Guatemala, formada por ... D. Rafael Arévalo, etc
000113378	1858	ARKANSAS	First Report of a Geological Reconnoissance of the Northern Counties of Arkansas, made during the years 1857 and 1858, by David Dale Owen ... assisted by William Elderhorst ... Edward T. Cox. [With plates.]
000113801	1856	ARLE, Mr.	Mr. Arle. A novel. [By Emily Jolly.]
000113801	1856	ARLE, Mr.	Mr. Arle. A novel. [By Emily Jolly.]
000114914	1853	ARMES, William.	Port of King's Lynn: its position and prospects
000115604	1857	ARMSTRONG, Alexander	Personal Narrative of the Discovery of the North-West Passage. [With a map.]
000115903	1853	ARMSTRONG, Edward	History and Location of Fort Nassau upon the Delaware. A paper, etc
000115940	1855	ARMSTRONG, F. Claudius.	Battle on the Bosphorus
000115959	1858	ARMSTRONG, F. Claudius.	Two Buccaneers. A tale of the sea
000115959	1858	ARMSTRONG, F. Claudius.	Two Buccaneers. A tale of the sea
000115959	1858	ARMSTRONG, F. Claudius.	Two Buccaneers. A tale of the sea
000115960	1854	ARMSTRONG, F. Claudius.	Two Midshipmen. A tale of the sea
000116525	1853	ARMSTRONG, Nelly.	Nelly Armstrong: a story of the day. By the author of “Rose Douglas” [i.e. S. R. Whitehead]
000116525	1853	ARMSTRONG, Nelly.	Nelly Armstrong: a story of the day. By the author of “Rose Douglas” [i.e. S. R. Whitehead]
000117858	1858	ARND, Carl	Geschichte der Provinz Hanau und der unteren Maingegend, etc
000119498	1852	ARNOLD, Jessie.	Jessie Arnold; or, the Murder at the Old Well. A romance. By the author of “The Black Mantle,” [i.e. J. M. Rymer] etc
000119589	1850	ARNOLD, Lettice.	Lettice Arnold. A tale. By the author of “Emilia Wyndham,” etc. [i.e. Anne Marsh.]
000120399	1854	ARNOLD, William Delafield.	Oakfield; or, Fellowship in the East ... Second edition
000120399	1854	ARNOLD, William Delafield.	Oakfield; or, Fellowship in the East ... Second edition
000122645	1856	ARROWSMITH, Aron	[A Compendium of Ancient and Modern Geography ... New and improved edition.]
000124912	1857	ARTIST	Artist's Family. A novel. By the author of “Savile House” [i.e. Mary Anne, Lady Hardy]
000124912	1857	ARTIST	Artist's Family. A novel. By the author of “Savile House” [i.e. Mary Anne, Lady Hardy]
000124912	1857	ARTIST	Artist's Family. A novel. By the author of “Savile House” [i.e. Mary Anne, Lady Hardy]
000125541	1856	ARUNDELL, William Arundell Harris.	Contested Election. A comedy in three acts
000126091	1856	WARREN, Elizabeth	Asaph; or, Faith's conflict with infidelity. [A poem. By Elizabeth Warren.]
000128056	1854	Asher, G. M. (Georg Michael)	Bibliographical and Historical Essay on the Dutch Books and pamphlets relating to New-Netherland, and to the Dutch West-India Company and to its possessions in Brazil, Angola, etc. As also on the maps, charts, etc. of New-Netherland, with fac-similes of the Map of New Netherland by N. I. Visscher and of the three existing views of New-Amsterdam, etc
000129127	1853	ASHTON, Thomas	Bannerford; or, The valley of gold. A tale of our own times. [By T. Ashton.]
000130618	1849	ASPERN, F. A. von.	Beiträge zur ältern Geschichte Holsteins
000131530	1853	ASSELIN, Alfred Félix.	Journal de voyage d'un touriste dans le midi de la France et en Italie. [With a map.]
000131798	1853	ASSIER, Alexandre	Les Archives curieuses de la Champagne et de la Brie
000135936	1849	ATKINSON, James George.	Mind and Soul. A lecture on the intellectual differences between man and the lower animals, etc
000136223	1858	ATKINSON, Thomas Witlam.	Oriental and Western Siberia; a narrative of seven years' explorations and adventures in Siberia, Mongolia, the Kirghis Steppes, Chinese Tartary, and part of Central Asia ... With a map and numerous illustrations
