id	year	author	title	tags	link
000928806	1854	DÍAZ DE GUZMÁN, Ruy.	[Historia argentina del descubrimiento, poblacion y conquista de las provincias del Rio de la Plata. Escrita ... en el año de 1612 ... Ilustrada con disertaciones, y un índice histórico y geográfico para la más fácil inteligencia del texto. [With a separate titlepage bearing the imprint “Buenos-Aires, 1835.”]]
000928834	1854	DÍAZ DEL CASTILLO, Bernal.	Historia verdadera de la conquista de la Nueva España
000928834	1854	DÍAZ DEL CASTILLO, Bernal.	Historia verdadera de la conquista de la Nueva España
000930551	1858	Dickens, Charles	Works of Charles Dickens. Library edition
000930551	1858	Dickens, Charles	Works of Charles Dickens. Library edition
000930551	1858	Dickens, Charles	Works of Charles Dickens. Library edition
000930551	1858	Dickens, Charles	Works of Charles Dickens. Library edition
000930551	1858	Dickens, Charles	Works of Charles Dickens. Library edition
000931211	1853	Dickens, Charles	Bleak House ... With illustrations by H. K. Browne
000931556	1850	Dickens, Charles	personal history of David Copperfield ... With illustrations by H. K. Browne
000932671	1856	Dickens, Charles	Immortelles from Charles Dickens. By Ich
000933195	1851	DICKINSON, Andrew.	My First Visit to Europe: or, Sketches of society, scenery, and antiquities, in England, Wales, Ireland, Scotland, and France ... Second edition
000934403	1850	DICKSON, Walter	Antarctic Voyage of Her Majesty's Hired Barque, Pagoda
000935814	1853	DIEFFENBACH, Johann Philipp.	Ansichten von Giessen und seiner Nachbarschaft. Nach Originalzeichnungen von F. Heinzerling, in Stahl gestochen von J. J. Tanner, nebst einem beschreibenden Texte von Prof. Dr. P. Dieffenbach
000935815	1857	DIEFFENBACH, Johann Philipp.	Geschichte der Stadt und Burg Friedberg in der Weterau ... Nebst vier lithographirten Skizzen
000935835	1853	DIEGERICK, Isidore Lucien Antoine.	Correspondance des magistrats d'Ypres, députés à Gand et à Bruges, pendant les troubles de Flandre sous Maximilien, duc d'Autriche, roi des Romains ... publiée par I. L. A. Diegerick
000936617	1850	DIER, Henry.	Dustiana; or, the Evening adventures of a weaver and a chimney-sweep
000936840	1849	DIESELDORFF, J. P. D.	Wegweiser nach Südaustralien oder Südaustralien in seiner jetzigen Gestalt. Nach eigener Anschauung während eines mehrjährigen Aufenthalts besonders für Auswanderer geschildert
000937594	1858	DIETSCH, Heinrich Rudolf.	Abrisz der brandenburgisch-preuszischen Geschichte. [With maps.]
000938927	1851	DIJK, Hendrik Alexander van.	Bijdrage tot de geschiedenis der Nederlandsche diplomatie. Handelingen met Frankrijk en Spanje, in de jaren 1668-1672
000938995	1849	DIJKEMA, Hemmo.	Winterreis door Rusland, gedaan in het jaar 1841 ... Met eene kaart
000943937	1856	DIPROSE, John.	Diprose's London Guide
000947302	1857		List of the Post Offices in the United States on the thirteenth of July 1857, with a statement of the existing rates of postage domestic and foreign ... Compiled by D. D. T. Leech
000947307	1856		Post Office Directory; or, Business Man's Guide to the Post Offices in the United States ... Containing also a comprehensive codification of the existing Postal laws ... Compiled ... by D. D. T. Leech
000950704	1856	DISNEY, John	Nugae Poeticae; being a selection of miscellaneous poems. L.P
000951025	1853	Disraeli, Benjamin	Contarini Fleming ... A new edition
000951039	1853	Disraeli, Benjamin	[Henrietta Temple. A love story. By the author of “Vivian Grey”, &amp;c. [i.e. Benjamin Disraeli.]]
000951100	1853	Disraeli, Benjamin	[Venetia. By the author of “Vivian Grey” and “Henrietta Temple”. [The dedication signed: Δ., i.e. Benjamin Disraeli.]]
000951235	1857	DISSEL, Sibrand van.	Curaçao. Herinneringen en schetsen
000951888	1850	DITSON, George Leighton.	Circassia; or, a Tour to the Caucasus
000951889	1850	DITSON, George Leighton.	[Circassia; or, a Tour to the Caucasus.]
000951890	1858	DITSON, George Leighton.	Para papers on France, Egypt and Ethiopia
000953103	1850	DIXON, Charles George.	Sketch of Mairwara; giving a brief account of the origin and habits of the Mairs, their subjugation by a British force; their civilisation and conversion into an industrious peasantry: with descriptions of various works of irrigation in Mairwara and Ajmeer, etc
000953533	1858	Dixon, Richard Watson	Close of the tenth century of the Christian Era. The Arnold Prize Essay for 1858
000955687	1852	DOBROKHOTOV, Vasily Ivanovich.	Древній Боголюдовъ Городъ и Монастырь съ его окрестностями
000955688	1849	DOBROKHOTOV, Vasily Ivanovich.	Памятники древности во Владимірѣ Кляземскомъ
000958063	1855	DODEWAARD, D. van.	Gedenkschriften van een Krijgsgevangenen in Rusland, gedurende 1812, 1813 en 1814. ... In orde gebragt, en met een aanhangsel ... voorzien; door J. de Vletter, etc
000959877	1855	DOERING, Reinhold.	Lehrbuch der Geschichte mit besonderer Berücksichtigung der ... Fortbildung des Menschengeschlechts
000962893	1858	MUNFORD, George.	An analysis of the Domesday Book of the County of Norfolk. By the Rev. G. Munford
000962962	1858	Domeyko, Ignacio	[Tratado de Ensayes, tanto por la via seca como por la via humida, de toda clase de minerales y pastas de cobre, plomo, plata, oro, mercurio, etc.]
000965249	1852	DONCASTER	Bye Laws passed by the Council of the borough of Docaster ... 1852, etc
000965380	1856	DONCK, Adriaen van der.	Remonstrance of New Netherland, and the occurrences there addressed to the Highland Mighty Lords States General of the United Netherlands, on the 28th July, 1649. [Signed A. van der Donck, etc.] With Secretary van Tienhoven's answer. Translated from a copy of the original Dutch MS. by E. B. O'Callaghan
000965589	1857	DONELAN, John P.	My Trip to France
000968596	1857	DORÉ	Doré. By a Stroller in Europe. (Letters written during a year's residence in Europe.)
000969571	1856	DORMOUSE, Dunstan	Rigmarole. A poem. By D. D
000970517	1849	DORSET, Catherine Ann.	[The peacock “At home”. By a lady [i.e. Catherine A. Dorset]. And Butterfly's ball; an original poem. By Mr. Roscoe.]
000971754	1854	DOTTAIN, Ernest.	Cours Complet d'Histoire Universelle. Par MM. Dottain Chevallier et Todière
000971754	1854	DOTTAIN, Ernest.	Cours Complet d'Histoire Universelle. Par MM. Dottain Chevallier et Todière
000971754	1854	DOTTAIN, Ernest.	Cours Complet d'Histoire Universelle. Par MM. Dottain Chevallier et Todière
000972062	1857	DOUBLEDAY, Thomas.	Eve of St. Mark: a romance of Venice
000972062	1857	DOUBLEDAY, Thomas.	Eve of St. Mark: a romance of Venice
000975338	1850	DOVEDALE	Guide to Dovedale, Ilam, Alton Towers, and Scenes adjacent. Second edition
000975404	1851	DOVER CASTLE	day's ramble about Dover Castle. By - &amp; -
000976111	1857	DOWLEANS, A. M.	Selections from the miscellaneous writings of A. M. D
000977797	1852	DOYLE, Francis Hastings Charles	Duke's Funeral: a poem
000977810		DOYLE, Francis Hastings Charles	Vision of Er, the Pamphylian. [A poem.]
000979688	1858	DRAKE, Samuel Gardner.	Address delivered at the Annual Meeting of the New England Historical and Genealogical Society, ... January 20th, 1858
000979695	1851	DRAKE, Samuel Gardner.	[Biography and History of the Indians of North America ... also a history of their wars ... Likewise exhibiting an analysis of the ... authors, who have written upon ... the first peopling of America. Third edition, with ... additions ... corrections and ... engravings.]
000979698	1857	DRAKE, Samuel Gardner.	History and Antiquities of Boston, the capital of Massachusetts ... from its settlement in 1630 to the year 1770. Also an introductory history to the discovery and settlement of New England ... Second edition
000979698	1857	DRAKE, Samuel Gardner.	History and Antiquities of Boston, the capital of Massachusetts ... from its settlement in 1630 to the year 1770. Also an introductory history to the discovery and settlement of New England ... Second edition
000980639	1858	DRAYSON, Alfred Wilks.	Sporting Scenes amongst the Kaffirs of South Africa ... Illustrated by Harrison Weir
000980677	1851	DRAYTON, John	John Drayton; being a history of the early life and development of a Liverpool engineer. [By William Wilson, Minister at Etal.]
000980821	1852	DREADNOUGHT, Deborah	Beauties of Bloomerism [in verse]. Edited ... by D. D. Illustrated with twelve ... coloured likenesses ... from the designs of W. S. Reed
000980841	1849	DREAM	Dream of Human Life. By the author of “The Lollards,” etc. [T. Gaspey.]
000983539	1853	DRIENDL, Thomas.	Geschichte von Bayern und der zum Königreiche Bayern gehörigen Provinzen Rheinpfalz, Franken u. Schwaben in 120 Bildern mit erklärendem Texte
000984147	1858	DRIOU, Alfred.	Alpes et Pyrénées, voyage en Suisse et en Savoie, dans Le Béarn, La Navarre, Le Bigorre et Le Comminges ... Par M. A. D. [or C. De Chaumont?]
000985460	1858	DROYSEN, Johann Gustav.	Grundriss der Historik
000985480	1850	DROYSEN, Johann Gustav	Die Herzogthümer Schleswig-Holstein und das Königreich Dänemark Aktenmässige Geschichte der Dänischen Politik seit dem Jahre 1806
000985481	1850	DROYSEN, Johann Gustav	[Die Herzogthümer Schleswig-Holstein und das Königreich Dänemark Aktenmässige Geschichte der Dänischen Politik seit dem Jahre 1806.]
000985483	1850	DROYSEN, Johann Gustav	Regerings og Statsforandringen i Danmark og Hertugdømmerne siden Christian VIII.'s Død. Fremstilt af D Hrr. D. og S., med Forord og Anmærkninger af C. Christianson [pseud., i.e. Baron C. P. H. M. W. Dirckinck-Holmfeld]
000985484	1850	DROYSEN, Johann Gustav	La Révolution Danoise en 1848, traduit de l'Allemand, d'après l'Histoire Diplomatique de la Politique Danoise de MM. D. et S
000986143	1853	DRUMMOND, David Thomas Kerr.	Scenes and impressions in Switzerland and the North of Italy, together with some remarks on the religious state of these countries
000986167	1850	DRUMMOND, Francisco Ferreira.	Annaes da ilha Terceira
000986167	1850	DRUMMOND, Francisco Ferreira.	Annaes da ilha Terceira
000986167	1850	DRUMMOND, Francisco Ferreira.	Annaes da ilha Terceira
000986167	1850	DRUMMOND, Francisco Ferreira.	Annaes da ilha Terceira
000987506	1855	Dryden, John.	poetical works of John Dryden. With life, critical dissertation, and explanatory notes, by ... George Gilfillan
000987506	1855	Dryden, John.	poetical works of John Dryden. With life, critical dissertation, and explanatory notes, by ... George Gilfillan
000988783	1855	Duberly, Frances Isabella Locke	Journal kept during the Russian war: from the departure of the army from England in April 1854 to the fall of Sebastopol
000988784	1856	Duberly, Frances Isabella Locke	Journal kept during the Russian War. Second Edition
000991174	1854	DUBOIS, L.	Mauzé-sur-le-Mignon (Deux-Sèvres). Notice historique, etc
000993416	1858	DU CHATELLIER, Armand René.	Brest et le Finistère sous la Terreur
000994019	1854	DUCHESS	Duchess. A domestic romance. By the Author of ... “Mabel or the Child of the Battle Field,” etc
000994023	1850	BOYD, Archibald	Duchess; or Woman's Love and Woman's hate. A romance. [By A. Boyd.]
000994277	1855	DUCKETT, William A.	La Turquie pittoresque; histoire, mœurs, description ... Préface par T. Gautier. Illustrée de vingt gravures sur acier, etc
000994701	1858	DUCOR, Henri.	[Aventures d'un Marin de la Garde Impériale, prisonnier de guerre ... pour faire suite à l'Histoire de la Campagne de 1812, etc. [Edited by L. F. L. Heritier.]]
000995461	1852	DUDÍK, Beda.	Forschungen in Schweden für Mährens Geschichte. Im Auftrage des hohen mähr. Landesausschusses im Jahre 1851 unternommen und veröffentlicht von B. D
000995464	1855	DUDÍK, Beda.	Iter Romanum. Im Auftrage des Hohen Maehrischen Landesausschusses in den Jahren 1852 und 1853 unternommen und veröffentlicht
000995464	1855	DUDÍK, Beda.	Iter Romanum. Im Auftrage des Hohen Maehrischen Landesausschusses in den Jahren 1852 und 1853 unternommen und veröffentlicht
000995467	1850	DUDÍK, Beda.	Mährens Geschichts-Quellen. Im Auftrage des hohen mährischen Landes-Ausschusses bearbeitet und durch den mährischen Landes-Fond herausgegeben von Dr D. B. Bd. I
000995599	1851	DUDLEY, Dean.	Pictures of life in England and America; prose and poetry
000996364	1849	DUER, William Alexander.	New-York as it was, during the latter part of the last century. An address, etc
000996628	1857	DUERRE, Hermann.	Braunschweigs Entstehung und städtische Entwickelung bis in den Anfang des dreizehnten Jahrhunderts, etc
000998438	1855	DUFRÉNOY, Pierre Armand.	[Traité de Minéralogie.]
000998438	1855	DUFRÉNOY, Pierre Armand.	[Traité de Minéralogie.]
000998438	1855	DUFRÉNOY, Pierre Armand.	[Traité de Minéralogie.]
000998438	1855	DUFRÉNOY, Pierre Armand.	[Traité de Minéralogie.]
000998438	1855	DUFRÉNOY, Pierre Armand.	[Traité de Minéralogie.]
000998988	1850	DUGDALE, Thomas.	England and Wales Delineated, etc
000998988	1850	DUGDALE, Thomas.	England and Wales Delineated, etc
000998988	1850	DUGDALE, Thomas.	England and Wales Delineated, etc
000998988	1850	DUGDALE, Thomas.	England and Wales Delineated, etc
000998988	1850	DUGDALE, Thomas.	England and Wales Delineated, etc
000998988	1850	DUGDALE, Thomas.	England and Wales Delineated, etc
000998988	1850	DUGDALE, Thomas.	England and Wales Delineated, etc
000998988	1850	DUGDALE, Thomas.	England and Wales Delineated, etc
000998988	1850	DUGDALE, Thomas.	England and Wales Delineated, etc
001001029	1853	DULAURE, Jacques Antoine.	[Histoire physique, civile et morale de Paris ... Quatrième édition.]
001001029	1853	DULAURE, Jacques Antoine.	[Histoire physique, civile et morale de Paris ... Quatrième édition.]
001001029	1853	DULAURE, Jacques Antoine.	[Histoire physique, civile et morale de Paris ... Quatrième édition.]
001001029	1853	DULAURE, Jacques Antoine.	[Histoire physique, civile et morale de Paris ... Quatrième édition.]
001001030	1857	DULAURE, Jacques Antoine.	[Histoire physique, civile et morale de Paris ... Quatrième édition.]
001001030	1857	DULAURE, Jacques Antoine.	[Histoire physique, civile et morale de Paris ... Quatrième édition.]
001001030	1857	DULAURE, Jacques Antoine.	[Histoire physique, civile et morale de Paris ... Quatrième édition.]
001001346	1853	DULLER, Eduard.	Vaterländische Geschichte von den ältesten Zeiten bis zur Gegenwart. ([Bd. 3-5] Fortgesetzt von Prof. Dr. K. Hagen.)
001001346	1853	DULLER, Eduard.	Vaterländische Geschichte von den ältesten Zeiten bis zur Gegenwart. ([Bd. 3-5] Fortgesetzt von Prof. Dr. K. Hagen.)
001001346	1853	DULLER, Eduard.	Vaterländische Geschichte von den ältesten Zeiten bis zur Gegenwart. ([Bd. 3-5] Fortgesetzt von Prof. Dr. K. Hagen.)
001001346	1853	DULLER, Eduard.	Vaterländische Geschichte von den ältesten Zeiten bis zur Gegenwart. ([Bd. 3-5] Fortgesetzt von Prof. Dr. K. Hagen.)
001001346	1853	DULLER, Eduard.	Vaterländische Geschichte von den ältesten Zeiten bis zur Gegenwart. ([Bd. 3-5] Fortgesetzt von Prof. Dr. K. Hagen.)
001002103	1854	Dumas, Alexandre	[Le Dernier Roi (Louis-Philippe).]
001002256	1857	Dumas, Alexandre	Taïti. Marquises. Californie. Journal de Madame Giovanni, rédigé et publié par Alexandre Dumas
001002429	1855	Dumas, Alexandre	La Régence et Louis Quinze. [With illustrations.]
001004042	1856	DUMONT, Charles Emmanuel.	Histoire des Fiefs et principaux villages de la Seigneurie de Commercy, etc
001004042	1856	DUMONT, Charles Emmanuel.	Histoire des Fiefs et principaux villages de la Seigneurie de Commercy, etc
001004145	1852	DUMONT, Henrietta.	Lady's Oracle: an elegant pastime for social parties, etc
001005061	1858	DUNANT, Jean Henry.	Notice sur la Régence de Tunis
001005741	1850	DUNCAN, Handasyde.	colony of South Australia
001006104	1856	DUNCAN, Peter Martin.	history and description of the walls of Colchester. (Colonia Camalodunum.)
001006516	1855	DUNCKER, Maximilian Wolfgang.	[Geschichte des Alterthums.]
001006516	1855	DUNCKER, Maximilian Wolfgang.	[Geschichte des Alterthums.]
001006528	1849	DUNCKER, Maximilian Wolfgang.	Zur Geschichte der deutschen Reichsversammlung in Frankfurt
001006931	1849	DUNDER, Wenzeslaw Georg.	Denkschrift über die Wiener October-Revolution. Ausführliche Darstellung aller Ereignisse, aus ämtlichen Quellen geschöpft, etc
001007463	1854	DUNKIN, Alfred John.	History of the County of Kent ... Deptford. L.P
001007692	1852	DUNLOP	Emily Howard: a novel
001007866	1858	DUNLOP, Madeline Anne Wallace	Timely Retreat; or, a Year in Bengal before the Mutinies
001009453	1851	DUNTZE, Johann Hermann.	Bremen unter französischer Gewaltherrschaft. Auszug aus der Geschichte der freien Stadt Bremen
001011901	1852	DUPRAT, Pascal.	Les Tables de Proscription de Louis Buonaparte et de ses complices
001013164	1855	DURAND, Henri	Notice sur la Village de Jujurieux en Bugey, et sur l'érection de son église en 1854 et 1855
001013904	1856	DURANVILLE, Léon de.	Essai historique et archéologique sur la ville du Pontde-l'Arche et sur l'Abbaye de N.-D.-de-Bonport, etc. (Documents Supplémentaires.)
001013904	1856	DURANVILLE, Léon de.	Essai historique et archéologique sur la ville du Pontde-l'Arche et sur l'Abbaye de N.-D.-de-Bonport, etc. (Documents Supplémentaires.)
001014930	1855	DURHAM	brief Sketch of Durham. Compiled for the use of the ... deputies of the ... Order of Odd-fellows ... attending the annual ... Committee of the Order held at D., etc. [With illustrations.]
001015143	1849	DURHAM, J. D.	Reform the safety-valve of revolution. [In verse.]
001015238	1850	DURHEIM, Carl Jakob.	Sammlung trigonometrischer oder barometrisch-bestimmter absoluter Höhen der Schweiz und ihrer nähern Umgebung. Hypsométrie de la Suisse, etc
001016304	1852	DURRIEU, Xavier.	Le Coup d'État de Louis Bonaparte. Histoire de la persécution de Décembre, etc
001017047	1849	DUSEVEL, Hyacinthe.	Le Département de la Somme, ses monuments anciens et modernes, ses grands hommes, et ses sonvenirs historiques. Ouvrage illustré ... par M. L. Duthoit, texte par M. H. D
001017054	1858	DUSEVEL, Hyacinthe.	Recherches historiques sur les ouvrages exécutés dans la Ville d'Amiens ... pendant les XIVe, XVe et XVIe siècles
001017422	1855	DUSSIEUX, Louis Étienne.	Le Canada sous la domination française d'après les archives de la Marine et de la Guerre
001018289	1858	DUTHIE, William.	A Tramp's Wallet; stored by an English Goldsmith during his wanderings in Germany and France
001018289	1858	DUTHIE, William.	A Tramp's Wallet; stored by an English Goldsmith during his wanderings in Germany and France
001018296	1850	DUTHILLOEUL, Hippolyte Romain Joseph.	Douai et Lille au XIIIe siècle ... d'après des manuscrits originaux, etc
001019526	1850	DU VAL, Claude	life and adventures of C.D., the dashing highwayman. By the author of “Dick Clinton,” “Ned Scarlet,” etc
001019921	1855	DUVARD, Primogene.	[Devotional Exercises for fourteen days, etc.]
001019946	1857	DUVE, A. E. E. L. von.	Mittheilungen zur näheren Kunde des wichtigsten der Staatsgeschichte und Zustände der Bewohner des Herzogthums Lauenburg von des Vorzeit bis zum Schlusse des Jahres 1851. Nach Urkunden und authentischen Quellen bearbeitet von A. E. E. L. von D
001020689	1849	DUYSE, Prudens van.	Inventaire analytique des chartes et documents appartenant aux archives de la ville de Gand
001021206	1851	DWIGHT, Theodore	Roman Republic of 1849, with accounts of the Inquisition, etc
001023731	1856	DZIAŁYŃSKI, Adam Tytus	Zrzodlopisma do Dziejow Unii Kor. Polskiej i W. X. Litewskiego ... Drukiem oglosił A. T. Hr. ... Działyński. Czesc III. Diariusz Lubelskiego Sejmu Unii. Rok 1569
001024340	1855	E., Alethea.	Pignadar: or Three Days' Wanderings in the Landes
001026886	1854	East India Company	A Gazetteer of the Territories under the Government of the East-India Company, and of the Native States on the continent of India. Compiled ... by Edward Thornton. [With a map.]
001026886	1854	East India Company	A Gazetteer of the Territories under the Government of the East-India Company, and of the Native States on the continent of India. Compiled ... by Edward Thornton. [With a map.]
001026886	1854	East India Company	A Gazetteer of the Territories under the Government of the East-India Company, and of the Native States on the continent of India. Compiled ... by Edward Thornton. [With a map.]
001026886	1854	East India Company	A Gazetteer of the Territories under the Government of the East-India Company, and of the Native States on the continent of India. Compiled ... by Edward Thornton. [With a map.]
001026892	1857	East India Company	A Gazetteer of the Territories under the Government of the East-India Company ... Compiled ... by Edward Thornton ... Corrected to the latest period by the author
001026895	1858	East India Company	A Gazetteer of the Territories under the Government of the East-India Company ... Compiled ... by Edward Thornton, etc
001027692	1851	EASTERN COUNTIES RAILWAY	Eastern Counties Railway Illustrated Guide
001027708	1857	TAYLOR, Fanny Margaret.	[Eastern Hospitals and English Nurses; the narrative of twelve months' experience in the Hospitals of Koulali and Scutari. By a Lady Volunteer. [Miss Fanny M. Taylor].]
001027968	1854	EASTMAN, Mary H.	Chicora and other regions of the conquerors and the conquered
001028138	1858	EASTON, John	narrative of the causes which led to Philip's Indian war of 1675 and 1676 ... With other documents concerning this event ... Prepared from the originals with an introduction and notes. By F. B. Hough. F.P
001028596	1851	EATON, Cyrus.	Annals of the town of Warren; with the early history of St. George's, Broad Bay, etc
001028655	1852	EATON, F. B.	History of Canadia: once known as Charmingfare; with notices of some of the early settlers
001029185	1850	EBEL, Wilhelm	Geographische Naturkunde oder Grundzüge einer Allgemeinen Naturgeschichte der drei Reiche, mit physiognomischer Schilderung der Erdoberfläche, etc. Mit vierzehn ... Karten und Tafeln
001032177	1853	ECKERTZ, Gottfried	Die Benedictiner-Abtei M. Gladbach. Ein Beitrag zur Geschichte des Herzogthums Jülich, von G. E. und E. J. K. N. Nebst ungedruckten Urkunden, mehreren Siegeln und einer Abbildung der Münsterkirche
001036306	1858	Edinburgh Angling Club (EDINBURGH)	Songs of the Edinburgh Angling Club. With illustrations ... by members of the Club
001036683	1857	George Heriot's Hospital	Inventory of original documents in the archives of George Heriot's Hospital
001038089	1857	CUTLAR, Roger.	Edinburgh dissected: including strictures on its institutions, legal, clerical, medical, educational, &amp;c. To which are added, confessions and opinions of a Tory country gentleman: with a variety of anecdotical and other matter. In a series of letters addressed to Roger Cutlar, Esquire, by his nephew
001039584	1855	EDREHI, Moses.	An Historical Account of the Ten Tribes settled beyond the river Sambatyon in the East, etc
001039585	1855	EDREHI, Moses.	History of the Capital of Asia and the Turks: together with an account of the domestic manners of the Turks in Turkey. [Edited by I. Edrehi. Illustrated.]
001041022	1855	Edwards, Edward	Manchester Worthies, and their Foundations: or, six chapters of local history. With an epilogue, by way of moral
001041804	1857	EDWARDS, John E.	Random Sketches and Notes of European Travel
001042399	1857	EDWARDS, Matilda Barbara Betham.	White House by the Sea. A love story
001042399	1857	EDWARDS, Matilda Barbara Betham.	White House by the Sea. A love story
001043489	1851	Eekhoff, W. (Wopke)	Beknopte Geschiedenis van Friesland, in Hoofdtrekken ... uit vele vroegere en latere bronnen bewerkt ... Met eene Schetskaart
001044422	1855	EGAN, Pierce	London Apprentice and the Goldsmith's Daughter of West Chepe; or, the Evil May-Day. A story of the times of Bluff King Hal ... Author's large edition
001044427	1850	EGAN, Pierce	[Robin Hood and Little John: or, the Merry Men of Sherwood Forest.]
001044428	1849	EGAN, Pierce	Thirteenth; or, the fatal number
001044827	1852	EGERTON, Francis	Journal of a Winter's Tour in India: with a visit to the Court of Nepaul
001052245	1858	ELAGIN, Nikolai.	Бѣлевская Вивліоѳика, издаваемая Н. Е. Собраніе древнихъ памятниковъ объ исторіи Бѣлева и Бѣлевскаго уѣзда
001052245	1858	ELAGIN, Nikolai.	Бѣлевская Вивліоѳика, издаваемая Н. Е. Собраніе древнихъ памятниковъ объ исторіи Бѣлева и Бѣлевскаго уѣзда
001052483	1849	ELBERTS, Willem Antonij.	Geschiedenis des Vaterlands ... Tweede vermeerderde druk. Met Kaarten
001053265	1857	ELECTOR	late Leeds Elections. The case stated. By an Elector
001054122	1850	ELGGER, Franz von	Des Kantons Luzern und seiner Bundesgenossen Kampf gegen den Radikalismus vom 8 Dezember 1844 bis 24. November 1847, und mein Antheil an demselben
001055512	1849	ELIOT, Samuel	Liberty of Rome: a history, with an historical account of the liberty of ancient nations
001055512	1849	ELIOT, Samuel	Liberty of Rome: a history, with an historical account of the liberty of ancient nations
001055970	1855	ELISH, pseud.	Love versus Money: a novel [by Elish]
001057154	1853	ELLET, Elizabeth Fries	Summer Rambles in the West
001058102	1857	ELLIOTT, Charles Wyllys.	New England History, ... to ... A.D. 1776
001058102	1857	ELLIOTT, Charles Wyllys.	New England History, ... to ... A.D. 1776
001059021	1855	ELLIS, Alfred Burdon.	West African Islands
001059974	1850	ELLIS, James	A Genealogy of the family of Radclyffe, of Dilston, in Northumberland. [With preface by John Fenwick.]
001059975	1850	ELLIS, James	Letters between J. Ellis, esq. and Walter Scott, esq. [Edited by J. F., i.e. J. Fenwick.]
001059975	1850	ELLIS, James	Letters between J. Ellis, esq. and Walter Scott, esq. [Edited by J. F., i.e. J. Fenwick.]
