id	year	author	title	tags	link
001171918	1776	EUPHROSYNE, Saint	Euphrosyne, or, Amusements on the Road of Life [in verse]. By the author of the Spiritual Quixote [R. Graves]
001174859	1714	EUSDEN, Lawrence.	A letter [in verse] to Mr. Addison, on the King's [George I.] accession to the Throne
001174871	1714	EUSDEN, Lawrence.	Verses at the last publick Commencement at Cambridge
001180134	1715	EVENING THOUGHT	An Evening Thought. [A poem.]
001188919	1746	Brooke, Henry	[Fables for the Female Sex. [By Edward Moore and Henry Brooke. In verse. With engravings after F. Hayman.]]
001191059	1705	SHIPPEN, William	[Faction display'd. A poem. Answer'd paragraph by paragraph. [With the text.]]
001191632	1773	FAGAN, Christophe Barthélemi.	[The Guardian: a comedy of two acts [and in prose. Translated and altered from the Pupille of C. B. F. by D. Garrick] ... Fourth edition.]
001192662	1737	FAIR	Distress'd Fair, or Happy Unfortunate: being a secret history, etc
001195236	1764	FALCONER, William	Shipwreck. By a Sailor ... A new edition, corrected and enlarged. [With the “Occasional Elegy,” the chart, and an engraved “Elevation of a Merchant-Ship.”]
001195237	1769	FALCONER, William	[The Shipwreck. By a Sailor ... A new edition, corrected and enlarged. [With the “Occasional Elegy,” the chart, and an engraved “Elevation of a Merchant-Ship.”]]
001196331	1780	FALL	fall of Romish Babylon anticipated. A poem ... By a Protestant
001197054	1798	MOULTRIE, George.	[False and True, etc. [By George Moultrie.]]
001197390	1789	FAMILY PARTY	Family Party; a comic piece, in two acts [and in prose]
001197570	1749	FAN	Fan: a heroi-comical poem in three cantos
001201768	1710	Farquhar, George	Comedies of Mr G. F
001202932	1792	FARRELL, Sarah	Charlotte; or, a Sequel to the Sorrows of Werther ... and other poems
001203915	1777	FASHION	Fashion; or, a trip to a foreign C-t. A poem
001207833	1795	FAWCETT, Joseph.	Art of War: a poem
001207835	1798	FAWCETT, Joseph.	Poems ... To which are added, Civilised War, [a poem,] before published under the title of The Art of War ... and The art of Poetry ... with additions
001208011	1761	FAWKES, Francis.	Original poems and translations
001214430	1771	FELLOWS, John	Bromsgrove Elegy, in blank verse, on the death of G. Whitefield, etc
001215944	1791	FENNELL, James	Lindor and Clara; or, The British Officer: a Comedy, in five acts [and in prose]
001216409	1711	FENTON, Elijah.	An epistle to Mr Southerne [on the fate of the tragic muse in England] ... from Kent, Jan. 28. 1711/10
001216427	1717	FENTON, Elijah.	Poems on several occasions
001219246	1773	Fergusson, Robert	A Poem to the memory of John Cunningham
001228674	1730	FIDDLER	Fiddler's fling at Roguery, (canto verace odioso): divided into several cantos. To be successively continued
001230725	1765	Fielding, Henry	Fielding komischer Roman in vier Theilen, etc
001230771	1743	Fielding, Henry	Miscellanies, by Henry Fielding, Esq
001230771	1743	Fielding, Henry	Miscellanies, by Henry Fielding, Esq
001230771	1743	Fielding, Henry	Miscellanies, by Henry Fielding, Esq
001230772	1743	Fielding, Henry	[Miscellanies, by Henry Fielding, Esq.]
001230772	1743	Fielding, Henry	[Miscellanies, by Henry Fielding, Esq.]
001230772	1743	Fielding, Henry	[Miscellanies, by Henry Fielding, Esq.]
001231676	1754	FIFE	Fragments of a Prospect from a Hill in Fife. [In verse. By George Wallace.]
001232064	1770	BOTTARELLI, Giovanni Gualberto.	La Buona Figliuola; a comic opera. [By C. Goldoni.] ... Altered by G. G. Bottarelli, etc. Ital. &amp; Eng
001234932	1713	Winchilsea, Anne Kingsmill Finch	Miscellany Poems, on several occasions. Written by a lady [i.e. A. Finch, Countess of Winchilsea]
001243494	1790	FISHER, James	Poems on various subjects
001244312	1792	FISHERMAN	Putt: a mock-heroic poem, etc. [Dedication subscribed: A Fisherman.]
001245896	1787	FITZGERALD, George Robert.	Riddle [a satirical poem] by the late unhappy G. R. Fitzgerald. With notes by W. Bingley
001246310	1733	FITZGERALD, Thomas	Poems on several occasions
001247094	1743	FITZROY, Dorothy	Dorinda: or, the Grove in tears. A pastoral elegy towards the character of that excellent, and universally lamented lady, the ... Countess of Euston
001253039	1708	FLETCHER, John	Wit without Mony; a comedy, [in five acts and in prose. By J. F. and F. Beaumont?] With alterations and amendments by some persons of quality
001262361	1728	FOLKES, Martin.	A full and true Account of an horrid ... Robbery, committed on Epping-Forest, upon the body of the Cambridge Coach. In a letter to M(artin) F(olkes) Esq. [In verse.]
001265758	1757	FOOTE, Samuel.	Dramatic Works of Samuel Foote
001265784	1782	FOOTE, Samuel.	[The author. A farce, etc.]
001265788	1776	FOOTE, Samuel.	Bankrupt. A comedy in three acts [and in prose]
001265790	1782	FOOTE, Samuel.	[The Bankrupt. A comedy in three acts [and in prose].]
001265793	1765	FOOTE, Samuel.	Commissary. A comedy in three acts [and in prose]
001265798	1778	FOOTE, Samuel.	Cozeners; a comedy in three acts [and in prose]. ... Published by Mr. Colman
001265800	1778	FOOTE, Samuel.	Devil upon Two Sticks; a comedy, in three acts [and in prose] ... published by Mr. Colman
001265802	1794	FOOTE, Samuel.	[The devil upon two sticks; a comedy, etc.]
001265814	1788	FOOTE, Samuel.	[The Englishman returned from Paris, being the sequel to The Englishman in Paris ... The second edition.]
001265817	1754	FOOTE, Samuel.	Knights. A comedy, in two acts [and in prose]
001265823	1770	FOOTE, Samuel.	Lame Lover; a comedy in three acts [and in prose]
001265868	1760	FOOTE, Samuel.	[The Minor, a comedy [in three acts and in prose], etc.]
001265884	1760	FOOTE, Samuel.	Christian and critical remarks on a droll, or interlude, called The Minor, now acting ... in the Hay-Market, etc. By a Minister of the Church of Christ. Second edition
001265885	1760	FOOTE, Samuel.	A Letter from Mr. Foote to the Reverend Author of the Remarks, critical and Christian, on the Minor
001265886	1760	FOOTE, Samuel.	A Letter to Mr. Foote, occasioned by his letter to the ... Author of the Christian and Critical Remarks on the Minor, containing a refutation of Mr. Foote's pamphlet, and a full defence of the principles and practices of the Methodists. By the Author of the Christian and Critical Remarks
001265888	1778	FOOTE, Samuel.	Nabob; a comedy in three acts [and in prose]. ... Published by Mr. Colman
001265889	1795	FOOTE, Samuel.	[The Nabob; a comedy in three acts [and in prose]. ... Published by Mr. Colman.]
001265891	1762	FOOTE, Samuel.	Orators. [A comedy in three acts and in prose.]
001265899	1764	FOOTE, Samuel.	[The Patron, a comedy in three acts [and in prose].]
001265910	1778	FOOTE, Samuel.	A Trip to Calais; a comedy in three acts [and in prose] as originally written, and intended for representation ... To which is annexed, The Capuchin; altered from The Trip to Calais, and now published by Mr. Colman
001265912	1795	FOOTE, Samuel.	[A Trip to Calais, etc.]
001265913	1777	FOOTE, Samuel.	Wit for the Ton! The Convivial Jester; or Samuel Foote's last budget opened. Contaning ... anecdotes, bon mots, etc. With authentic memoirs of his life and writings
001274791	1795	FOSBROKE, Thomas Dudley.	economy of monastic life (as it existed in England) A poem, with philosophical and archæological illustrations from Lyndwood, Dugdale, Selden, etc
001281053	1705	FOX	Fox set to watch the Geese: a state-paradox, being a welcome from Newmarket, by way of fable
001281370	1780	Fox, Charles James	Epistle from the Hon. C. Fox, partridge-shooting, to the Hon. J. Townshend, cruising. [By R. Tickell.] The third edition, corrected
001306116	1781	FRANCIS, Benjamin	An elegiac poem sacred to the memory of ... Hugh Evans, etc
001308126	1754	FRANCKLIN, Thomas	Translation ... Second edition
001319079	1731	Freemasons.	Generous Freemason; or, the Constant Lady. With the humours of Squire Noodle, and his man Doodle. A tragi-comi-farcical ballad opera. In three acts [and in prose and verse]. With the music prefix'd to each song. By the author of the Lover's Opera [W. R. Chetwood]
001326913	1761	Z., X. Y.	Fribbleriad. [A satire upon X. Y. Z., an anonymous writer in The Craftsman, written in consequence of his attacks upon David Garrick.]
001337877	1760	F....TE, Mr.	A letter to Mr. F[oo]te. Occasioned by the Christian and Critical Remarks on his Interlude called The Minor. To which is added, an appendix, relative to a serious address to the Methodists themselves
001344489	1746	F--X, H---y	An Ode to the Honourable H---y F--x [i.e. Henry Fox, afterwards Lord Holland], on the Marriage of the Du---s of M-------r [i.e. Duchess of Manchester] to H---s---y, Esq. [i.e. Edward Hussey, afterwards Montagu, Earl of Beaulieu. [By Sir C. H. Williams.]
001345162	1798	G....., A. L....	Courage rewarded; or the English volunteer. A political drama. [In three acts and in prose.] By Mr. A. L.... G
001345330	1769	G., D.	An Ode upon dedicating a building, and erecting a statue to Shakespeare, at Stratford upon Avon. By D[avid] G[arrick]. (Testimonies to the genius and merits of Shakespeare.)
001345330	1769	G., D.	An Ode upon dedicating a building, and erecting a statue to Shakespeare, at Stratford upon Avon. By D[avid] G[arrick]. (Testimonies to the genius and merits of Shakespeare.)
001345334	1735	G., D.	Satyræ quatuor. Auctore D. G. [In Latin verse.]
001346555	1784	GAAUW, Hendrik van der.	Rym Journaal der ontmoetingen van alle het scheepsvolk van het visch hoekerschip de Juffrouw Johanna ... Behelzende alle de omstandigheden by het neemen van het voornoemde schip op de Noord-zee, door een Engelsche Kaper ... Beschreeven en in rym gebragt door H. van der Gaauw
001347631	1790	GABRIEL, Robert Burd.	New Facts, or the White-Washer, or, the second part of Gabriel Outcast [i.e. R. B. G.]. Being an ancient poem, revis'd and now first published by Ferdinando Fungus. Gent. [A satire on R. B. G.'s “Facts relating to Dr. White's Bampton Lectures.”]
001350692	1794	GAINSBOROUGH	Village Ramble, a topographical and sentimental excursion, descriptive of the town and vicinity of Gainsborough, etc. [In verse.]
001354422	1778	GALLANTRY	Ecclesiastical Gallantry: or the Mystery Unravelled, a tale, [in verse.] Dedicated to his Grace the Archbishop of Canterbury, without permission
001364170	1791	Darwin, Erasmus	Botanic Garden; a poem, etc. [By Erasmus Darwin, the Elder.] (Part I. The second edition.-Part II. The third edition.)
001370222	1767	Garrick, David	[Lethe ... Sixth edition.]
001370236	1749	GARRICK, David.	Lying Valet ... The fourth edition
001370238	1756	Garrick, David	[The Lyng Valet ... The fifth edition.]
001370241	1769	Garrick, David	[The Lying Valet, etc.]
001370284	1758	Garrick, David	Florizel and Perdita. A dramatic pastoral, in three acts. Altered from The Winter's Tale of Shakespear
001370298	1757	Garrick, David	Isabella: or, the Fatal Marriage; a play ... alter'd from Southern
001370299	1758	GARRICK, David.	[Isabella: or, the Fatal Marriage; a play ... alter'd from Southern.]
001370315	1778	GARRICK, David.	[MS. Catalogues and indexes of the collection of plays made by Garrick and bequeathed to the British Museum. Compiled by E. Capell.]
001370315	1778	GARRICK, David.	[MS. Catalogues and indexes of the collection of plays made by Garrick and bequeathed to the British Museum. Compiled by E. Capell.]
001370322	1779	Garrick, David	An elegy on the death of D. Garrick. By the author of the Ode to the warlike genius of Great Britain, [i.e. W. Tasker.]
001370329	1776	Garrick, David	Garrick's Looking Glass: or, the art of rising on the Stage; a poem, in three cantos, decorated with dramatic characters. By the author of *****
001370335	1766	Garrick, David	Interview; or, Jack Falstaff's Ghost ... a poem, inscribed to D. Garrick
001370337	1773	Garrick, David	[A letter to D. Garrick, esq. on his conduct as principal manager and actor at Drury Lane. [By D. Williams, according to a MS. note by J. P. Kemble.]]
001379575	1733	GAY, John	Achilles. An opera. As it is perform'd at the Theatre-Royal in Covent-Garden ... With the musick prefix'd to each song
001379579	1774	GAY, John	Achilles in petticoats. An opera ... Written by Mr. Gay, with alterations [by George Colman, the elder]
001379652	1750	GAY, John	[The distress'd wife. A comedy.]
001379653	1722	GAY, John	An epistle to Her Grace Henrietta, Dutchess of Marlborough
001379785	1714	GAY, John	fan. A poem
001379790	1714	GAY, John	[A letter to a lady, occasion'd by the arrival of Her Royal Highness the Princess of Wales. [By John Gay.]]
001379800	1721	GAY, John	A panegyrical epistle to Mr. Thomas Snow, goldsmith, near Temple-Barr: occasion'd by his buying and selling of the third subscriptions, taken in by the directors of the South-Sea Company, at a thousand per cent. [By John Gay.]
001379825	1713	GAY, John	Rural sports. A poem, etc
001379839	1742	GAY, John	[The shepherd's week ... The fourth edition.]
001379897	1733	GAY, Joseph	[The Lure of Venus; or, A Harlot's Progress: a heroi-comical poem [descriptive of Hogarth's prints].]
001379898	1719	GAY, Joseph	Miscellanies upon several subjects; occasionally written by Mr. J. G. [In prose and verse.]
001390020	1761	GENT, Thomas	contingencies, vicissitudes or changes of this transitory life. Set forth in a ... prologue, spoken for the most part on the 18th and 20th of February 1761 at the tragedy of Jane Shore. With a Benedictive Epilogue, etc
001390672	1773	GENTLEMAN	Kentish Cricketers; a poem. By a Gentleman. Being a reply to a ... parody on ... Chevy Chace; intituled Surry triumphant; or, the Kentish Men's Defeat
001391551	1726	George	Verses on the King, occasion'd by his late danger and distress, at Sea
001391700	1788	George	King's Ode, in answer to Peter Pindar, on the subject of his pension, etc. [A satire on George III. By J. Wolcot.]
001391709	1777	George	A poetical address to Almighty God, supposed to be delivered by his ... Majesty, George III. Occasioned by the present troubles in America and intended to convey a just idea of the character ... of that great monarch ... By a lover of his country
001391850	1789	George	Tears of loyalty; or portrait of a Prince. A poem. Inscribed to the Prince of Wales
001409662	1699	GETHIN, Grace	Misery's Virtues Whet-stone. Reliquiae Gethinianæ, or, Some remains of the most ingenious and excellent lady, the Lady Grace Gethin ... Being a collection of choice discourses, pleasant spothegmes, and witty sentences, etc. (A Funeral Sermon preach'd on the decease of Grace Lady Gethin ... By Dr. Birch.)
001413778	1796	GIBBON, Edward	Miscellaneous works of E. G. ... With memoirs of his life and writings; composed by himself; illustrated from his letters, with occasional notes and narrative by John [Holroyd] Lord Sheffield
001413778	1796	GIBBON, Edward	Miscellaneous works of E. G. ... With memoirs of his life and writings; composed by himself; illustrated from his letters, with occasional notes and narrative by John [Holroyd] Lord Sheffield
001413780	1796	GIBBON, Edward	[Miscellaneous works of E. G. ... With memoirs of his life and writings; composed by himself; illustrated from his letters, with occasional notes and narrative by John [Holroyd] Lord Sheffield.]
001413780	1796	GIBBON, Edward	[Miscellaneous works of E. G. ... With memoirs of his life and writings; composed by himself; illustrated from his letters, with occasional notes and narrative by John [Holroyd] Lord Sheffield.]
001413780	1796	GIBBON, Edward	[Miscellaneous works of E. G. ... With memoirs of his life and writings; composed by himself; illustrated from his letters, with occasional notes and narrative by John [Holroyd] Lord Sheffield.]
001414613	1750	GIBBONS, Thomas	Juvenalia: poems on various subjects of devotion and virtue
001415419	1797	GIBE	A Peep into the Convent of Clutha: a poetical epistle [signed Gibe, i.e. J. Headrick]
001419836	1789	GILBANK, William.	Day of Pentecost, or man restored. A poem, etc
001421942	1701	GILDON, Charles.	A new Miscellany of original poems on several occasions. Written by the E[arl] of D[orset], Sir C. Sidley, Sir F. Shepheard, Mr Wolesly, Mr Granvill, Mr Dryden, Mr Stepney, Mr Rowe, and several other eminent Hands. Never before printed. [Edited by C. G.]
001422544	1775	GILES, William	A collection of poems on divine and moral subjects, selected from various authors, by William Giles
001432033	1797	GISBORNE, John.	Vales of Wever, a loco-descriptive poem, etc
001432111	1796	GISBORNE, Thomas	Walks in a Forest: or, Poems descriptive of Scenery and Incidents characteristic of a Forest ... Second edition, corrected and enlarged
001434989	1725	GLANVIL, John.	Poems: consisting of originals and translations
001436817	1754	GLASNEVIN	Villa: or, Glasnevin, a poem. Written in imitation of Cowley's Pindariques [contained in the “Poems” of 1656]. With a copy of Verses to a young lady on seeing her at the play. Inscribed to Secretary Belchier
001440890	1787	GLOVER, Phillips	Royal and Royalty Theatres. Letter to P. G. ... in a dedication to the burletta of hero and Leander. (Hero and Leander, a burletta, in two acts [and in verse.-By J. Jackman].)
001440906	1737	GLOVER, Richard	Leonidas, a poem
001440929	1761	Glover, Richard	Medea. A tragedy [in five acts, and in verse]
001440932	1762	GLOVER, Richard	[Medea, etc.]
001440933	1762	GLOVER, Richard	[Medea, etc.]
001454047	1775	Goldsmith, Oliver	miscellaneous works of Oliver Goldsmith, M.B. Containing all his essays and poems
001454170	1770	Goldsmith, Oliver	deserted village, a poem
001454171	1770	Goldsmith, Oliver	[The deserted village, a poem.]
001454172	1770	Goldsmith, Oliver	[The deserted village, a poem.]
001454186	1775	Goldsmith, Oliver	[The deserted village, etc.]
001454325	1776	Goldsmith, Oliver	haunch of venison, a poetical epistle to Lord Clare ... With a head of the author, drawn by Henry Bunbury Esq; and etched by Bretherton
001454441	1774	Goldsmith, Oliver	Retaliation: a poem ... Including epitaphs on the most distinguished wits of this metropolis
001454493	1773	Goldsmith, Oliver	[She stoops to conquer: or, The mistakes of a night. A comedy. As it is acted at the Theatre-Royal in Covent-Garden.]
001454533	1765	Goldsmith, Oliver	[The traveller, or A prospect of society. A poem. Inscribed to the Rev. Mr. Henry Goldsmith.]
001454534	1774	Goldsmith, Oliver	[The traveller, or A prospect of society. A poem. Inscribed to the Rev. Mr. Henry Goldsmith.]
001454537	1768	Goldsmith, Oliver	[The traveller, or A prospect of society. A poem. Inscribed to the Rev. Mr. Henry Goldsmith.]
001454582	1780	Goldsmith, Oliver	[The vicar of Wakefield: a tale. Supposed to be written by himself. [The advertisement signed: Oliver Goldsmith.]]
001455202	1751	GOLDWIN, William.	A description of the ancient ... city of Bristol, a poem. ... Revised, with large additions, by I. Smart ... Second edition
001455210	1712	GOLDWIN, William.	A Poetical Description of Bristol
001477845	1785	GOVERNESS	Governess; or, the Boarding School dissected. A dramatic original in three acts [and in prose]
001489232	1712	GRANVILLE, George	Poems upon Several Occasions. (The British Enchanters; or, No magic like love.)
001494360	1786	GRAY, Thomas	poems of Mr Gray. With notes by Gilbert Wakefield
001494496	1775	GRAY, Thomas	Latin odes of Mr. Gray, in English verse, with an ode On the death of a favorite spaniel. [Signed: E. B. G., i.e. Edward Burnaby Greene.]
001494553	1787	GRAY, Thomas	An elegy written in a country church-yard. [By Thomas Gray.] A new edition: as deliver'd by Mr. Palmer, at the Royalty Theatre, Goodman's Fields
001495909	1788	GREATHEED, Bertie.	Regent: a tragedy [in five acts, prose and verse]
001496495	1772	MURPHY, Arthur.	Grecian Daughter: a tragedy [in five acts and in verse. By A. Murphy]. A new edition
001499074	1752	GREEN, George Smith.	Oliver Cromwell: an historical play [in five acts and in prose and verse]. To which is prefix'd an Extract or Journal of the rise and progress of Oliver Cromwell
001499745	1737	GREEN, Matthew.	Spleen. An epistle [in verse] inscribed to his particular friend Mr. C. J. ... By the late Mr. M. Green. [Edited by Richard Glover.]
001500654	1775	GREEN, William	sufferings of W. G. Being a sorrowful account of his seven years transportation, etc. [a chap-book.]
001502822	1796	GREENSTED, Frances.	Fugitive Pieces
001503676	1787	GREENWOOD, William	A Poem written during a shooting excursion on the moors
001510950	1752	GREY, Zachary.	Critical, Historical, and Explanatory Notes upon Hudibras, by way of supplement to the two editions published in 1744, and 1745 ... To which is prefixed, a dissertation upon burlesque poetry, by the late ... Montagu Bacon ... And an appendix added; in which is a translation of part of the first canto of the first book into Latin doggrel. MS. notes
001512681	1796	GRIEVOUS, Peter	A congratulatory epistle to ... “Peter Porcupine” [W. Cobbett] on his “Complete Triumph over the once towering, but fallen ... faction in the United States.” A poem, by P. G. Junr. To which is annexed The Vision, a dialogue [in verse] between Marat and Peter Porcupine, in the Infernal Regions
001513427	1787	GRIFFITH, Amyas.	Miscellaneous tracts, containing: I. A letter to D. Trant ... ralative to his pamphlet against the Munster Peasantry, and his unfortunate duel with ... Sir J. Colthurst, Bt.-II. Observations on the Bishop of Cloyne's pamphlet; in which the doctrine of tithes is candidly considered .... III. Extract of Theophilus's letter to the author ... A letter to D. Toler ... relative to that unfortunate victim to popular prejudice, ... N. Sheehy, etc
001513572	1772	Griffith, (Elizabeth)	A Wife in the Right: a comedy [in five acts and in prose]. L.P
001518023	1750	GRINSTEAD BALLAD	Grinsted Ballad. To the tune of Packington's Pound. [A political squib.]
001525073	1750	GROUP	Groupe. A poem. Fancied from a picture. MS. notes
001525258	1789	GROVE	Grove of Fancy. A poem
001529657	1699	GARTH, Samuel	Dispensary ... The third edition, corrected by the author
001529659	1703	GARTH, Samuel	Dispensary ... The fifth edition. MS. notes
001529659	1703	GARTH, Samuel	Dispensary ... The fifth edition. MS. notes
001551248	1744	WHITEHEAD, Paul.	gymnasiad, or boxing match; a very short but very curious epic poem: with the prolegomena of Scriblerus Tertius, and notes variorum. [By P. Whitehead.]
001551954	1720	H., A.	A new Miscellany of original poems, translations and imitations, by ... Mr Prior, Mr Pope, Mr Hughes, Mr Harcourt, Lady M[ary] W[ortley] M[ontague], Mrs Manley, etc. Now first published ... with some familiar Letters by the late Earl of Rochester, never before printed. [Edited, with contributions, by A. H., i.e. Anthony Hammond.]
001585156	1789	HANDS, Elizabeth.	death of Amnon: a poem. With an appendix containing pastorals, and other poetical pieces
001595035	1742	HAREN, Willem van.	[Lof der vrede.] The Praise of peace. A poem. In three cantos. From the Dutch ... by Mr. Boyse
001596448	1746	HARLEQUIN	Harlequin Incendiary; or Colombine Cameron. A musical pantomime
001596465	1719	AUBERT	Harlequin Hydaspes; or, The Greshamite; a mock opera [in three acts, in prose and verse. By Mrs. Aubert?]
001596469	1750	HARLEQUIN MUNGO	Harlequin Mungo; or, a Peep into the Tower: a new pantomimical entertainment in two acts [in prose and verse]
001599299	1737	HARRINGTON, James	[The Oceana of James Harrington and his other works; som whereof are now first publish'd from his own manuscripts. The whole collected, methodiz'd, and review'd, with an exact account of his life prefix'd, by J. Toland.]
001601716	1773	HARRIS, Sally.	Orange-Girl at Foote's to Sally Harris: or, the Town to the Country Pomona. An heroic epistle. [In verse.]
001602488	1794	Harrison, Anthony.	Infant Vision of Shakspeare; with an apostrophe to the immortal bard, and other poems
001602488	1794	Harrison, Anthony.	Infant Vision of Shakspeare; with an apostrophe to the immortal bard, and other poems
001603871	1788	HARRISON, Nicholas Bacon.	Travellers. A comedy, in three acts [and in prose], etc
001606791	1727	HARTE, Walter.	Poems on several occasions
001606791	1727	HARTE, Walter.	Poems on several occasions
001606791	1727	HARTE, Walter.	Poems on several occasions
001609773	1767	HARTSON, Hall.	Countess of Salisbury. A tragedy [in five acts and in verse]. ... Second edition
001609774	1767	HARTSON, Hall.	[The Countess of Salisbury. A tragedy [in five acts and in verse]. ... Second edition.]
001611003	1797	HARVEY, Jane.	Poems on various subjects
001611460	1766	HARVEY, William	Guilielmi Harveii opera omnia, etc
001621422	1747	HAWKE, Edward	Oracle, an Ode inscrib'd to ... Sir E. Hawke
001624450	1730	HAY, William	Mount Caburn. A poem, etc
001626297	1795	Hayley, William	An Elegy on the Death of ... Sir William Jones, etc
001626330	1788	Hayley, William	Occasional Stanzas, written at the request of the Revolution Society and recited on their anniversary, November 4, 1788. To which is added, Queen Mary to King William, during his Campaign in Ireland, 1690: a poetical Epistle
001627949	1729	Haywood, Eliza Fowler	Frederick, Duke of Brunswick-Lunenburgh. A tragedy [in five acts and in verse], etc
001627962	1719	Haywood, Eliza Fowler	Love in Excess; or, the Fatal Enquiry. A novel
001629471	1787	HEADLEY, Henry.	Select beauties of ancient English poetry, with remarks by H. H
001629471	1787	HEADLEY, Henry.	Select beauties of ancient English poetry, with remarks by H. H
001643125	1790	HELICON, Harry	Musical Law-Bird. On the following subjects: I. The Poet Laureate's address to the House of Lords; II. The Declaration of a Bright Luminary of the Law. The Royal Stag-Hunt on Windsor Forest. ... By Harry Helicon, Esq., Poet Laureate to the House of Lords, near Lombard Street. [In verse.]
001650799	1793	HENLEY, Samuel.	Ad Anglos. Ode gratulatoria. A S.H-, eloquentiæ professore [i.e. Samuel Henley]
001659685	1710	HERCULES	famous and renowned history of the life and glorious actions of the mighty Hercules of Greece, etc. [A chap-book.]
