id	year	author	title	tags	link
001836131	1818	JACKSON, Zachariah.	A few concise examples of seven hundred errors in Shakespeare's plays, now corrected and elucidated, etc
001837130	1814	JACOB, William	Considerations on the Protection required by British Agriculture, and on the influence of the price of corn on exportable productions
001837139	1811	JACOB, William	Travels in the South of Spain, in letter written A.D. 1809 and 1810. [With plates.]
001844204	1816	JAMAICA	Further proceedings of the ... House of Assembly of J. relative to a Bill introduced into the House of Commons, for effectually preventing the unlawful importation of Slaves, and holding free persons in Slavery, in the British Colonies. To which are ... annexed, Examinations, taken upon Oath, ... for the purpose of disproving the allegations of the said Bill
001847338	1817	JAMES, John Thomas	[Journal of a tour in Germany, Sweden, Russia, Poland, during ... 1813 and 1814.]
001847338	1817	JAMES, John Thomas	[Journal of a tour in Germany, Sweden, Russia, Poland, during ... 1813 and 1814.]
001848108	1817	James, William	full and correct account of the chief Naval Occurrences of the late War between Great Britain and the United States of America, preceded by a cursory examination of the American account of their Naval Actions fought previous to that period, etc
001848109	1818	James, William	full and correct account of the Military Occurrences of the late War between Great Britain and the United States of America, etc
001848109	1818	James, William	full and correct account of the Military Occurrences of the late War between Great Britain and the United States of America, etc
001848614	1813	JAMESON, Robert	Mineralogical travels through the Hebrides, Orkney and Shetland Islands, etc
001848614	1813	JAMESON, Robert	Mineralogical travels through the Hebrides, Orkney and Shetland Islands, etc
001848617	1816	JAMESON, Robert	[System of mineralogy, comprehending oryctognosie, geognosie, mineralogical chemistry, mineralogical geography, and œconomical mineralogy. vol. 1-3.]
001848617	1816	JAMESON, Robert	[System of mineralogy, comprehending oryctognosie, geognosie, mineralogical chemistry, mineralogical geography, and œconomical mineralogy. vol. 1-3.]
001848617	1816	JAMESON, Robert	[System of mineralogy, comprehending oryctognosie, geognosie, mineralogical chemistry, mineralogical geography, and œconomical mineralogy. vol. 1-3.]
001848620	1816	JAMESON, Robert	[A Treatise on the external characters of minerals. (Tabular view [by A. G. Werner] of the generic external characters of minerals.)]
001848625	1813	JAMESON, Robert Francis.	Students of Salamanca; a comedy, in five acts [and in prose], etc
001848626	1812	JAMESON, Robert Francis.	A Touch at the Times; a comedy, in five acts [and in prose]
001850385	1816	JANILLION, F. L.	Versailles et Quiberon, ou précis historique sur le massacre des prisonniers d'Orléans, égorgés à Versailles le ... 9 Septembre 1792 ... et sur l'expédition de Quiberon
001857699	1814	Jean	Songs, Duetts, Chorusses, etc., in the new comic Opera ... called Jean of Paris; taken from the French, etc
001865771	1818	JERMYN, James.	Phrases. Specimen of an arrangement of English phrases, faithfully collected from the works of our principal poets, from the time of Chaucer to the present period. [By J. Jermyn.]
001865839	1811	JERNINGHAM, Edward.	Old Bard's Farewell. A Poem
001867473	1816	JERVIS, Thomas.	God the Author of Peace. A Sermon [on Ps. xlvi. 9] preached in ... Leeds ... Jan. 18, 1816, being the Day appointed for a Public Thanksgiving, on the Conclusion of a General Peace
001878535	1814	JODRELL, Richard Paul.	Poetical Works of R. P. Jodrell ... Now first collected
001884125	1816	JOHNSON, B.	Particulars of the ancient and present state of the Savoy Palace
001884126	1817	JOHNSON, B.	[Particulars of the ancient and present state of the Savoy Palace.]
001885704	1816	JOHNSON, James Rawlins.	A treatise on the Medicinal Leech, including its medical and natural history, etc
001887109	1817	Johnson, Samuel	A Journey to the Western Islands of Scotland ... With remarks by the Rev. Donald McNicol, etc. [With a portrait.]
001888348	1810	JOHNSTON, Arthur.	Narrative of the operations of a detachment in an expedition to Candy, in the island of Ceylon, in ... 1804, etc
001889216	1815	JOHNSTON, Robert	Travels through part of the Russian Empire and the County of Poland, along the southern shores of the Baltic
001889987	1817	JOHNSTONE, Thomas	history of Berwick-upon-Tweed and its vicinity. To which is added a correct copy [or rather, translation] of the Charter granted to that borough
001892193	1815	JONATHAN, Son of Saul, King of Israel	Jonathan. (A summary of Jonathan's life, etc.)
001900218	1810	JONG, Cornelis de	Derde Reize naar de Middellandsche Zee, gedaan in de Jaren 1786-88, etc
001900791	1811	JONSON, Ben.	Dramatic Works of B. J., and Beaumont and Fletcher: the first printed from the text, and with the notes of, P. Whalley; the latter, from the text, and with the notes of, ... G. Coleman. [With memoirs, prefaces of former editions, etc.]
001900791	1811	JONSON, Ben.	Dramatic Works of B. J., and Beaumont and Fletcher: the first printed from the text, and with the notes of, P. Whalley; the latter, from the text, and with the notes of, ... G. Coleman. [With memoirs, prefaces of former editions, etc.]
001900791	1811	JONSON, Ben.	Dramatic Works of B. J., and Beaumont and Fletcher: the first printed from the text, and with the notes of, P. Whalley; the latter, from the text, and with the notes of, ... G. Coleman. [With memoirs, prefaces of former editions, etc.]
001900791	1811	JONSON, Ben.	Dramatic Works of B. J., and Beaumont and Fletcher: the first printed from the text, and with the notes of, P. Whalley; the latter, from the text, and with the notes of, ... G. Coleman. [With memoirs, prefaces of former editions, etc.]
001914349	1817	JÜRGENSEN, Jørgen	Travels through France and Germany in the years 1815-1817, comprising a view of the moral, political and social state of those countries. Interspersed with ... historical and political anecdotes, etc
001915255	1818	JUSTICE	[Justice triumphant; or, the Organ in the Suds. A farce of three acts [and in prose].]
001915261	1813	JUSTICE	Retributive Justice: a tragedy in five acts [and in prose], etc. [Founded on the story of Kruitzner in the Canterbury Tales.]
001916239	1818	JUVENALIS, Decimus Junius.	Juvenal's tenth and thirteenth Satires, translated by E. L. Swift
001918959	1809	KAFFKA, Johann Christoph	Statistische Schilderung vom gegenwärtigen Russland unter Alexander dem Ersten
001921697	1814	WILSON, Horace Hayman.	Mégha Dúta; or, Cloud Messenger; a poem ... Translated into English verse, with notes and illustrations, by H. H. Wilson, etc
001923687	1815	KAMCHATKA	Airs, duetts, chorusses, etc., etc. in the new musical drama [in three acts], called Kamtchatka; or the Slave's Tribute
001926207	1814	KANTER, Johan de.	De Franschen in Walcheren
001927598	1817	KARACSAY, Fedor von	Beyträge zur Europäischen Länderkunde. Die Moldau, Wallachey, Bessarabien und Bukowina. Neueste Darstellung dieser Lander, nebst Kupfern
001932910	1812	KATHLEEN	Legend of Cathleen and Kevin; a poem. By - - Esq. Barrister at Law
001938040	1809	KEATING, Geoffrey	General History of Ireland ... Collected by ... J. K. ... translated from the original Irish ... with ... amendments by D. O'Connor ... Illustrated with ... coats of arms, etc. (The Genealogy of the Posterity of H. Fionn, ... The posterity of Ir, etc.)]
001938040	1809	KEATING, Geoffrey	General History of Ireland ... Collected by ... J. K. ... translated from the original Irish ... with ... amendments by D. O'Connor ... Illustrated with ... coats of arms, etc. (The Genealogy of the Posterity of H. Fionn, ... The posterity of Ir, etc.)]
001939963	1817	KEEP, W. A.	Incog; or, Three days at a well-known Hotel. A farce, in two acts [and in prose]
001944207	1817	Kelly, Christopher.	Full and Circumstantial Account of the Memorable Battle of Waterloo: the second restoration of Louis XVIII; and the deportation of Napoleon Buonaparte to the island of St. Helena and every recent particular relative to his conduct and mode of life in his exile. Together with an interesting account of the affairs of France, and biographical sketches of the most distinguished Waterloo heroes. Embellished with engravings
001944213	1814	Kelly, Christopher.	A new and complete System of Universal Geography: or an authentic history of the whole world ... Illustrated by ... a new set of accurate maps, forming a ... complete atlas
001944213	1814	Kelly, Christopher.	A new and complete System of Universal Geography: or an authentic history of the whole world ... Illustrated by ... a new set of accurate maps, forming a ... complete atlas
001947362	1809	KENDALL, Edward Augustus.	Travels through the northern parts of the United States in ... 1807 and 1808
001947362	1809	KENDALL, Edward Augustus.	Travels through the northern parts of the United States in ... 1807 and 1808
001947362	1809	KENDALL, Edward Augustus.	Travels through the northern parts of the United States in ... 1807 and 1808
001949445	1817	KENNEDY, Rann.	A Poem on the death of Her Royal Highness, the Princess Charlotte of Wales and Saxe-Coburg
001950040	1816	KENNEY, James.	Portfolio: or, The Family of Anglade; a drama, in two acts [in prose]
001950059	1812	KENNEY, James.	Turn out! A musical farce, in two acts [in prose]
001952986	1816	KER, Henry	Travels through the western interior of the United States from ... 1808 up to ... 1816, with a particular description of a great part of Mexico or New Spain, etc
001953162	1817	KÉRATRY, Auguste Hilarion.	Inductions morales et physiologiques
001955024	1811	KERR, Robert	A General History and Collection of Voyages and Travels arranged in systematic order: forming a complete History of the origin and progress of navigation, discovery, and commerce, by sea and land, from the earliest to the present time
001955024	1811	KERR, Robert	A General History and Collection of Voyages and Travels arranged in systematic order: forming a complete History of the origin and progress of navigation, discovery, and commerce, by sea and land, from the earliest to the present time
001955024	1811	KERR, Robert	A General History and Collection of Voyages and Travels arranged in systematic order: forming a complete History of the origin and progress of navigation, discovery, and commerce, by sea and land, from the earliest to the present time
001955024	1811	KERR, Robert	A General History and Collection of Voyages and Travels arranged in systematic order: forming a complete History of the origin and progress of navigation, discovery, and commerce, by sea and land, from the earliest to the present time
001955024	1811	KERR, Robert	A General History and Collection of Voyages and Travels arranged in systematic order: forming a complete History of the origin and progress of navigation, discovery, and commerce, by sea and land, from the earliest to the present time
001955024	1811	KERR, Robert	A General History and Collection of Voyages and Travels arranged in systematic order: forming a complete History of the origin and progress of navigation, discovery, and commerce, by sea and land, from the earliest to the present time
001955024	1811	KERR, Robert	A General History and Collection of Voyages and Travels arranged in systematic order: forming a complete History of the origin and progress of navigation, discovery, and commerce, by sea and land, from the earliest to the present time
001955024	1811	KERR, Robert	A General History and Collection of Voyages and Travels arranged in systematic order: forming a complete History of the origin and progress of navigation, discovery, and commerce, by sea and land, from the earliest to the present time
001955024	1811	KERR, Robert	A General History and Collection of Voyages and Travels arranged in systematic order: forming a complete History of the origin and progress of navigation, discovery, and commerce, by sea and land, from the earliest to the present time
001955024	1811	KERR, Robert	A General History and Collection of Voyages and Travels arranged in systematic order: forming a complete History of the origin and progress of navigation, discovery, and commerce, by sea and land, from the earliest to the present time
001955024	1811	KERR, Robert	A General History and Collection of Voyages and Travels arranged in systematic order: forming a complete History of the origin and progress of navigation, discovery, and commerce, by sea and land, from the earliest to the present time
001955024	1811	KERR, Robert	A General History and Collection of Voyages and Travels arranged in systematic order: forming a complete History of the origin and progress of navigation, discovery, and commerce, by sea and land, from the earliest to the present time
001955024	1811	KERR, Robert	A General History and Collection of Voyages and Travels arranged in systematic order: forming a complete History of the origin and progress of navigation, discovery, and commerce, by sea and land, from the earliest to the present time
001955024	1811	KERR, Robert	A General History and Collection of Voyages and Travels arranged in systematic order: forming a complete History of the origin and progress of navigation, discovery, and commerce, by sea and land, from the earliest to the present time
001955024	1811	KERR, Robert	A General History and Collection of Voyages and Travels arranged in systematic order: forming a complete History of the origin and progress of navigation, discovery, and commerce, by sea and land, from the earliest to the present time
001955024	1811	KERR, Robert	A General History and Collection of Voyages and Travels arranged in systematic order: forming a complete History of the origin and progress of navigation, discovery, and commerce, by sea and land, from the earliest to the present time
001955024	1811	KERR, Robert	A General History and Collection of Voyages and Travels arranged in systematic order: forming a complete History of the origin and progress of navigation, discovery, and commerce, by sea and land, from the earliest to the present time
001955024	1811	KERR, Robert	A General History and Collection of Voyages and Travels arranged in systematic order: forming a complete History of the origin and progress of navigation, discovery, and commerce, by sea and land, from the earliest to the present time
001955026	1811	KERR, Robert	History of Scotland during the Reign of Robert I. surnamed the Bruce
001955026	1811	KERR, Robert	History of Scotland during the Reign of Robert I. surnamed the Bruce
001961696	1815	KIDD, John	A geological essay on the imperfect evidence in support of a theory of the Earth, deducible either from its general structure or from the changes produced on its surface by the operation of existing causes
001961703	1809	KIDD, John	Outlines of Mineralogy
001966727	1814	KING	King and the Duke; or, Which is Which? A Farce, in two Acts [in prose], etc
001966784	1815	ARNOLD, Samuel James.	[The King's Proxy.] Songs, duetts, chorusses, etc., in the King's Proxy; a comick opera in three acts. [By Samuel James Arnold], etc
001971727	1818	KINNEIR, John Macdonald.	Journey through Asia Minor, Armenia, and Koordistan in the years 1813 and 1814. With remarks on the Marches of Alexander, and Retreat of the Ten Thousand
001974666	1818	KIRCHNER, Anton.	Ansichten von Frankfurt Am Main und seiner Umgegend, etc
001974666	1818	KIRCHNER, Anton.	Ansichten von Frankfurt Am Main und seiner Umgegend, etc
001977253	1810	KIRWAN, Richard	[Elements of Mineralogy.]
001977253	1810	KIRWAN, Richard	[Elements of Mineralogy.]
001980409	1814	KLAPROTH, Heinrich Julius von.	Travels in the Caucasus and Georgia performed in the years 1807 and 1808 ... Translated from the German by F. Shoberl
001981746	1811	KLEIN, Georg Michael.	Versuch, die Ethik als Wissenschaft zu begründen: nebst einer kurzen Einleitung in das Studium der Philosophie überhaupt
001989242	1817	KNIGHT, Henry Gally.	Phrosyne: a Grecian tale. Alashtar: an Arabian tale. [In verse.-With notes.]
001989388	1818	KNIGHT, John	Emigrant's Best Instructor; or, the most ... important information respecting the United States of America; selected from the works of ... Bradbury, Hulme, Brown, Birkbeck, etc.]
001989389	1818	KNIGHT, John	Important extracts from original and recent letters, written by Englishmen in the United States of America. ... containing information respecting that country: ... selected by J. K
001989390	1818	KNIGHT, John	Second Series
001989869	1818	KNIGHT, William	Facts and observations towards forming a new theory of the earth
001997988	1816	KOEPPEL, Johann Gottfried.	Malerische Reise durch die beiden fränkischen Fürstenthümer Baireuth und Anspach ... Zweite unveränderte Auflage
002000928	1813	KOLB, J. B.	Historisch-statistisch-topographisches Lexicon von dem Grossherzogthum Baden, etc
002011197	1816	KOSTER, Henry.	Travels in Brazil
002011198	1817	KOSTER, Henry.	[Travels in Brazil.]
002012696	1812	KOTZEBUE, August Friedrich Ferdinand von.	How to Die for Love! A farce in two acts [and in prose], adapted from a sketch in one act, by Kotzebue, called “Blind Geladen.”
002012697	1812	KOTZEBUE, August Friedrich Ferdinand von.	[How to Die for Love! A farce in two acts [and in prose], adapted from a sketch in one act, by Kotzebue, called “Blind Geladen.”]
002013426	1814	KOVACHICH, Martin Georg.	M. G. K. Disquisitio an et quod discriminis interfuerit inter nobiles regni servientes regis et milites olim apud Hungaros
002041404	1817	L., J. J. D.	Letters on the events of the revolution in France; by a French General Officer (J. J. D. L.) Addressed to his friends in New York. [With a preface signed J. W. P.]
002042807	1815	LABAUME, Eugène.	Circumstantial Narrative of the Campaign in Russia, ... with plans of the battles of the Moskwa and Malo-Jaroslavitz ... Translated [by E. Boyce] from the French. Second edition ... improved
002042808	1815	LABAUME, Eugène.	Circumstantial Narrative of the Campaign in Russia, ... with plans of the battles of the Moskwa and Malo-Jaroslavitz ... Translated [by E. Boyce] from the French. Second edition ... improved.]
002042809	1815	LABAUME, Eugène.	Circumstantial Narrative of the Campaign in Russia, ... with plans of the battles of the Moskwa and Malo-Jaroslavitz ... Translated [by E. Boyce] from the French. Second edition ... improved.]
002043775	1809	LABORDE, Alexandre Louis Joseph de	A View of Spain; comprising a descriptive itinerary of each province, and a general statistical account of the country. ... Translated from the Prench of A. de L. (Atlas.)
002043775	1809	LABORDE, Alexandre Louis Joseph de	A View of Spain; comprising a descriptive itinerary of each province, and a general statistical account of the country. ... Translated from the Prench of A. de L. (Atlas.)
002043775	1809	LABORDE, Alexandre Louis Joseph de	A View of Spain; comprising a descriptive itinerary of each province, and a general statistical account of the country. ... Translated from the Prench of A. de L. (Atlas.)
002044973	1816	LA CARRIÈRE LA TOUR, Arsène.	Historical memoir of the war in West Florida and Louisiana in 1814-15. With an atlas ... written originally in French, and translated ... by H. P. Nugent
002048932	1818	RICHINGS, Rebecca.	Elijah: a poem. By a Lady [Miss R. Richings]
002049098	1814	CARTER, Anne.	Letters from a Lady (Miss Anne Carter.) to her Sister, during a tour to Paris, in the months of April and May, 1814
002049113	1817	LADY	Lines addressed to Prince Leopold, on the death of his Consort, the Princess Charlotte of Wales. By a Lady
002049113	1817	LADY	Lines addressed to Prince Leopold, on the death of his Consort, the Princess Charlotte of Wales. By a Lady
002049130	1816	LADY	Mary; or, Female Friendship; a poem, in twelve books. By a Lady. Book the first
002054945	1818	LAIRD, Francis C.	A Topographical and Historical Description of the County of Rutland ... With ... engravings and a map
002054946	1815	LAIRD, Francis C.	A topographical and historical description of the County of Worcester ... Illustrated with fourteen engravings and a map
002055636	1815	LAKE, John	Golden Glove; or, the Farmer's Son: a comedy in five acts [in prose]. With some poetical sketches, etc
002058281	1813	Lamb, Charles	[Specimens of English Dramatic Poets, who lived about the time of Shakspeare: with notes. By Charles Lamb.]
002058794	1809	LAMB, R.	original and authentic Journal of occurrences during the late American War, from its commencement to the year 1783
002059860	1813	LAMBERT, John	[Travels through Lower Canada and the United States of North America in the years 1806, 1807 and 1808. To which are added, biographical notices ... of some of the leading characters in the United States, etc.]
002059860	1813	LAMBERT, John	[Travels through Lower Canada and the United States of North America in the years 1806, 1807 and 1808. To which are added, biographical notices ... of some of the leading characters in the United States, etc.]
002059860	1813	LAMBERT, John	[Travels through Lower Canada and the United States of North America in the years 1806, 1807 and 1808. To which are added, biographical notices ... of some of the leading characters in the United States, etc.]
002059860	1813	LAMBERT, John	[Travels through Lower Canada and the United States of North America in the years 1806, 1807 and 1808. To which are added, biographical notices ... of some of the leading characters in the United States, etc.]
002059861	1816	LAMBERT, John	[Travels through Lower Canada and the United States of North America in the years 1806, 1807 and 1808. To which are added, biographical notices ... of some of the leading characters in the United States, etc.]
002059861	1816	LAMBERT, John	[Travels through Lower Canada and the United States of North America in the years 1806, 1807 and 1808. To which are added, biographical notices ... of some of the leading characters in the United States, etc.]
002060903	1810	LAMENTATION	[The Lamentation, a poem. In two parts. To which are added, other miscellaneous pieces, in blank verse and rhyme. Second edition, corrected.]
002061647	1810	LAMONT, John	Chronicle of Fife; being the diary of J. L. of Newton, from 1649 to 1672. [Edited by Archibald Constable.]
002062003	1813	LAMOTTE, A.	Voyage dans le Nord de l'Europe; consistant principalement de promenades en Norwège, et de quelques courses en Suède dans l'année MDCCCVII. ... Suivie d'un appendice ... Avec des planches, etc
002067235	1810	LANDT, Jørgen.	A Description of the Feroe Islands, containing an account of their situation, climate, and productions, together with the manners and customs of the inhabitants, their trade, etc. translated from the Danish
002072868	1813	LANGSDORF, Georg Heinrich von	Voyages and travels in various parts of the world, during the years 1803-1807 ... Illustrated by engravings
002072868	1813	LANGSDORF, Georg Heinrich von	Voyages and travels in various parts of the world, during the years 1803-1807 ... Illustrated by engravings
002072869	1817	LANGSDORF, Georg Heinrich von	[Voyages and travels in various parts of the world, during the years 1803-1807 ... Illustrated by engravings.]
002077305	1810	LARCOM, Henry.	Distressing narrative of the loss of the Ship Margaret of Salem
002085047	1811	LATROBE, Christian Ignatius.	A concise account of the present state of the Missions ... of the ... United Brethren, among the Heathen
002085048	1818	LATROBE, Christian Ignatius.	Journal of a Visit to South Africa, in 1815, and 1816. With some account of the Missionary Settlements of the United Brethren, near the Cape of Good Hope
002087615	1816	TRENCH, Melesina	Laura's Dream; or, the Moonlanders. [A poem, with notes. By Melesina Trench.]
002093159	1813	LAW, James Sylvius.	Irish Catholic; a patriotic poem; in five cantos, etc
002093770	1818	LAWLESS, John.	Belfast Politics, enlarged; being a compendium of the political history of Ireland for the last forty years
002099152	1814	Leach, William Elford	Zoological Miscellany; being descriptions of new or interesting animals
002099152	1814	Leach, William Elford	Zoological Miscellany; being descriptions of new or interesting animals
002099152	1814	Leach, William Elford	Zoological Miscellany; being descriptions of new or interesting animals
002101175	1817	FIELD, William	historical and descriptive account of Leamington and Warwick; to which are added, short notices of the towns, villages, etc. within the circuit of ten miles. Abridged from a larger work (An historical and descriptive account of the town and Castle of Warwick, etc. [Signed, W. F., i.e., William Field.])
002102215	1816	LEAVES	Leaves. [A collection of short pieces in verse. With notes.]
002109126	1811	LEDRU, André Pierre.	Reise nach den Inseln Teneriffa, Trinidad, St. Thomas, St. Crux und Porto Rico ... Von Sonnini mit Anmerkungen verschen. Aus dem Französischen. Mit Bemerkungen begleitet, nebst einer allgemeinen Übersicht des ganzen westindischen Archipels, vorzüglich in Rücksicht der Kolonialwaaren; von E. A. W. v. Zimmermann
002110348	1812	LEE, Henry	Memoirs of the War in the Southern Department of the United States
002110348	1812	LEE, Henry	Memoirs of the War in the Southern Department of the United States
002110355	1809	LEE, Henry	Caleb Quotem and his Wife! or, Paint, Poetry, and Putty! An opera, in three acts. To which is added a postscript, including the scene always play'd in The Review, or Wags of Windsor, but omitted in the edition lately published by G. Colman. With prefatory remarks, etc
002111058	1809	LEE, Rachel Fanny Antonina	essay on Government. By Philopatria (R. F. A. L.).]
002111911	1816	LEECH, Margaret	Poems on various subjects
002112149	1814	Grammar School (LEEDS)	Report of the Committee of the Leeds Royal Lancasterian Free School, etc
