id	year	author	title	tags	link
002069803	1849	LANGE, Christian Christoph Andreas	Diplomatarium norvegicum. Oldbreve til Kundskab om Norges indre og ydre Forhold, Sprog, Slægter, Sæder, Lovgivning og Rettergang i Middelalderen. Samlede og udgivne af Chr. C. A. Lange of Carl R. Unger. Forste (-femte) Samling. (Saml. 6-15. Af C. R. Unger og H. J. Huitfeldt.-Saml. 16. Af H. J. Huitfeldt-Kaas.-Saml. 17. Af Gustav Storm, H. J. Huitfeldt-Kaas, Alexander Bugge, Chr. Brinchmann og Oluf Kolsrud.-Saml. 18. Af H. J. Huitfeldt-Kaas, Chr. Brinchmann og Alexander Bugge.-Saml. 19. Utgit av Alexander Bugge.-Saml. 20. hft. 1. Utgit av Alexander Bugge.)
002069803	1849	LANGE, Christian Christoph Andreas	Diplomatarium norvegicum. Oldbreve til Kundskab om Norges indre og ydre Forhold, Sprog, Slægter, Sæder, Lovgivning og Rettergang i Middelalderen. Samlede og udgivne af Chr. C. A. Lange of Carl R. Unger. Forste (-femte) Samling. (Saml. 6-15. Af C. R. Unger og H. J. Huitfeldt.-Saml. 16. Af H. J. Huitfeldt-Kaas.-Saml. 17. Af Gustav Storm, H. J. Huitfeldt-Kaas, Alexander Bugge, Chr. Brinchmann og Oluf Kolsrud.-Saml. 18. Af H. J. Huitfeldt-Kaas, Chr. Brinchmann og Alexander Bugge.-Saml. 19. Utgit av Alexander Bugge.-Saml. 20. hft. 1. Utgit av Alexander Bugge.)
002069803	1849	LANGE, Christian Christoph Andreas	Diplomatarium norvegicum. Oldbreve til Kundskab om Norges indre og ydre Forhold, Sprog, Slægter, Sæder, Lovgivning og Rettergang i Middelalderen. Samlede og udgivne af Chr. C. A. Lange of Carl R. Unger. Forste (-femte) Samling. (Saml. 6-15. Af C. R. Unger og H. J. Huitfeldt.-Saml. 16. Af H. J. Huitfeldt-Kaas.-Saml. 17. Af Gustav Storm, H. J. Huitfeldt-Kaas, Alexander Bugge, Chr. Brinchmann og Oluf Kolsrud.-Saml. 18. Af H. J. Huitfeldt-Kaas, Chr. Brinchmann og Alexander Bugge.-Saml. 19. Utgit av Alexander Bugge.-Saml. 20. hft. 1. Utgit av Alexander Bugge.)
002069803	1849	LANGE, Christian Christoph Andreas	Diplomatarium norvegicum. Oldbreve til Kundskab om Norges indre og ydre Forhold, Sprog, Slægter, Sæder, Lovgivning og Rettergang i Middelalderen. Samlede og udgivne af Chr. C. A. Lange of Carl R. Unger. Forste (-femte) Samling. (Saml. 6-15. Af C. R. Unger og H. J. Huitfeldt.-Saml. 16. Af H. J. Huitfeldt-Kaas.-Saml. 17. Af Gustav Storm, H. J. Huitfeldt-Kaas, Alexander Bugge, Chr. Brinchmann og Oluf Kolsrud.-Saml. 18. Af H. J. Huitfeldt-Kaas, Chr. Brinchmann og Alexander Bugge.-Saml. 19. Utgit av Alexander Bugge.-Saml. 20. hft. 1. Utgit av Alexander Bugge.)
002069803	1849	LANGE, Christian Christoph Andreas	Diplomatarium norvegicum. Oldbreve til Kundskab om Norges indre og ydre Forhold, Sprog, Slægter, Sæder, Lovgivning og Rettergang i Middelalderen. Samlede og udgivne af Chr. C. A. Lange of Carl R. Unger. Forste (-femte) Samling. (Saml. 6-15. Af C. R. Unger og H. J. Huitfeldt.-Saml. 16. Af H. J. Huitfeldt-Kaas.-Saml. 17. Af Gustav Storm, H. J. Huitfeldt-Kaas, Alexander Bugge, Chr. Brinchmann og Oluf Kolsrud.-Saml. 18. Af H. J. Huitfeldt-Kaas, Chr. Brinchmann og Alexander Bugge.-Saml. 19. Utgit av Alexander Bugge.-Saml. 20. hft. 1. Utgit av Alexander Bugge.)
002069803	1849	LANGE, Christian Christoph Andreas	Diplomatarium norvegicum. Oldbreve til Kundskab om Norges indre og ydre Forhold, Sprog, Slægter, Sæder, Lovgivning og Rettergang i Middelalderen. Samlede og udgivne af Chr. C. A. Lange of Carl R. Unger. Forste (-femte) Samling. (Saml. 6-15. Af C. R. Unger og H. J. Huitfeldt.-Saml. 16. Af H. J. Huitfeldt-Kaas.-Saml. 17. Af Gustav Storm, H. J. Huitfeldt-Kaas, Alexander Bugge, Chr. Brinchmann og Oluf Kolsrud.-Saml. 18. Af H. J. Huitfeldt-Kaas, Chr. Brinchmann og Alexander Bugge.-Saml. 19. Utgit av Alexander Bugge.-Saml. 20. hft. 1. Utgit av Alexander Bugge.)
002069803	1849	LANGE, Christian Christoph Andreas	Diplomatarium norvegicum. Oldbreve til Kundskab om Norges indre og ydre Forhold, Sprog, Slægter, Sæder, Lovgivning og Rettergang i Middelalderen. Samlede og udgivne af Chr. C. A. Lange of Carl R. Unger. Forste (-femte) Samling. (Saml. 6-15. Af C. R. Unger og H. J. Huitfeldt.-Saml. 16. Af H. J. Huitfeldt-Kaas.-Saml. 17. Af Gustav Storm, H. J. Huitfeldt-Kaas, Alexander Bugge, Chr. Brinchmann og Oluf Kolsrud.-Saml. 18. Af H. J. Huitfeldt-Kaas, Chr. Brinchmann og Alexander Bugge.-Saml. 19. Utgit av Alexander Bugge.-Saml. 20. hft. 1. Utgit av Alexander Bugge.)
002069803	1849	LANGE, Christian Christoph Andreas	Diplomatarium norvegicum. Oldbreve til Kundskab om Norges indre og ydre Forhold, Sprog, Slægter, Sæder, Lovgivning og Rettergang i Middelalderen. Samlede og udgivne af Chr. C. A. Lange of Carl R. Unger. Forste (-femte) Samling. (Saml. 6-15. Af C. R. Unger og H. J. Huitfeldt.-Saml. 16. Af H. J. Huitfeldt-Kaas.-Saml. 17. Af Gustav Storm, H. J. Huitfeldt-Kaas, Alexander Bugge, Chr. Brinchmann og Oluf Kolsrud.-Saml. 18. Af H. J. Huitfeldt-Kaas, Chr. Brinchmann og Alexander Bugge.-Saml. 19. Utgit av Alexander Bugge.-Saml. 20. hft. 1. Utgit av Alexander Bugge.)
002069803	1849	LANGE, Christian Christoph Andreas	Diplomatarium norvegicum. Oldbreve til Kundskab om Norges indre og ydre Forhold, Sprog, Slægter, Sæder, Lovgivning og Rettergang i Middelalderen. Samlede og udgivne af Chr. C. A. Lange of Carl R. Unger. Forste (-femte) Samling. (Saml. 6-15. Af C. R. Unger og H. J. Huitfeldt.-Saml. 16. Af H. J. Huitfeldt-Kaas.-Saml. 17. Af Gustav Storm, H. J. Huitfeldt-Kaas, Alexander Bugge, Chr. Brinchmann og Oluf Kolsrud.-Saml. 18. Af H. J. Huitfeldt-Kaas, Chr. Brinchmann og Alexander Bugge.-Saml. 19. Utgit av Alexander Bugge.-Saml. 20. hft. 1. Utgit av Alexander Bugge.)
002069803	1849	LANGE, Christian Christoph Andreas	Diplomatarium norvegicum. Oldbreve til Kundskab om Norges indre og ydre Forhold, Sprog, Slægter, Sæder, Lovgivning og Rettergang i Middelalderen. Samlede og udgivne af Chr. C. A. Lange of Carl R. Unger. Forste (-femte) Samling. (Saml. 6-15. Af C. R. Unger og H. J. Huitfeldt.-Saml. 16. Af H. J. Huitfeldt-Kaas.-Saml. 17. Af Gustav Storm, H. J. Huitfeldt-Kaas, Alexander Bugge, Chr. Brinchmann og Oluf Kolsrud.-Saml. 18. Af H. J. Huitfeldt-Kaas, Chr. Brinchmann og Alexander Bugge.-Saml. 19. Utgit av Alexander Bugge.-Saml. 20. hft. 1. Utgit av Alexander Bugge.)
002069803	1849	LANGE, Christian Christoph Andreas	Diplomatarium norvegicum. Oldbreve til Kundskab om Norges indre og ydre Forhold, Sprog, Slægter, Sæder, Lovgivning og Rettergang i Middelalderen. Samlede og udgivne af Chr. C. A. Lange of Carl R. Unger. Forste (-femte) Samling. (Saml. 6-15. Af C. R. Unger og H. J. Huitfeldt.-Saml. 16. Af H. J. Huitfeldt-Kaas.-Saml. 17. Af Gustav Storm, H. J. Huitfeldt-Kaas, Alexander Bugge, Chr. Brinchmann og Oluf Kolsrud.-Saml. 18. Af H. J. Huitfeldt-Kaas, Chr. Brinchmann og Alexander Bugge.-Saml. 19. Utgit av Alexander Bugge.-Saml. 20. hft. 1. Utgit av Alexander Bugge.)
002072213	1855	LANGLEY, John Baxter.	A Literary Sandwich: being a collection of miscellaneous writings
002073796	1850	LANMAN, Charles.	Haw-ho-noo; or Records of a Tourist
002074050	1858	LA NOUE, Frédéric de.	Notice sur le combat de St. Cast (11 Septembre 1758), etc. [With plate and two plans.]
002074162	1853	LANSBERGE, Henrique van.	Venezuela pintoresca, ó vistas de las principales ciudades ... de la república de Venezuela. tom. 1. pt. 1-2
002074382	1858	LANSING, Franz.	Bilder aus der Länder- und Völkerkunde, wie auch aus der Physik der Erde. Ein geographisches Lesebuch, etc
002075106	1853	LAORTY-HADJI	La Syrie, la Palestine et la Judée et pèlerinage à Jerusalem et aux lieux saints. [With illustrations.]
002076278	1851	LAPORTE, Francis L. de	Renseignements sur l'Afrique Centrale, et sur une nation d'hommes à queue qui s'y trouverait, d'après le rapport des nègres du Soudan, esclaves à Bahia
002076554	1857	LAPPENBERG, Johann Martin.	History of England under the Norman Kings. ... To which is prefixed an epitome of the early history of Normandy. Translated from the German ... by B. Thorpe, with considerable additions and corrections by the translator
002076815	1858	LA QUÉRIÈRE, Eustache de.	Saint-Cande-le-jeune, église paroissiale de Rouen, supprimée en 1791. Avec une planche gravée sur cuivre
002077421	1851	LARDI, Francesco de'.	Indicazioni storico-archeologico-artistiche utili ad un Forestiero in Adria, città del regno Lombardo-Veneto, etc
002078501	1857	LA ROCCA, Jean de.	La Corse et son avenir
002079004	1853	LA ROCHÈRE, Eugénie D. de	Rome. Souvenirs religieux, historiques, artistiques de l'expédition française en 1849 et 1850
002079265	1853	LARPENT, Francis Seymour.	private journal of F. S. Larpent, Judge-Advocate General of the British Forces in the Peninsula attached to the head-quarters of Lord Wellington during the Peninsular War from 1812 to its close. Edited by Sir G. Larpent
002079265	1853	LARPENT, Francis Seymour.	private journal of F. S. Larpent, Judge-Advocate General of the British Forces in the Peninsula attached to the head-quarters of Lord Wellington during the Peninsular War from 1812 to its close. Edited by Sir G. Larpent
002079265	1853	LARPENT, Francis Seymour.	private journal of F. S. Larpent, Judge-Advocate General of the British Forces in the Peninsula attached to the head-quarters of Lord Wellington during the Peninsular War from 1812 to its close. Edited by Sir G. Larpent
002080918	1856	LASAULX, Peter Ernst von.	Neuer Versuch einer alten auf die Wahrheit der Thatsachen gegründeten Philosophie der Geschichte
002081397	1853	LASIUS, Otto.	Blicke in der Stadt Oldenburg Vergangenheit und Zukunft. Mit einem Plane
002082114	1850	LASSEN, Albert Peter.	Lærebog i Verdenshistorien til Brug for Latin- og Realskoler, etc
002082114	1850	LASSEN, Albert Peter.	Lærebog i Verdenshistorien til Brug for Latin- og Realskoler, etc
002083537	1850	LATHAM, Robert Gordon.	Natural History of the Varieties of Man. [With illustrations.]
002083948	1857	LATIMER, John	Local Records: or, Historical Register of remarkable events, which have occurred in Northumberland and Durham, Newcastle-upon-Tyne, and Berwick-upon-Tweed ... 1832-57. Being a continuation of the work under the same title by [J.] Sykes
002084413	1853	LATKIN, Vasily Nikolaevich	Дневникъ В. Н. Латкина, во время путешествія на Печору, въ 1840 и 1843 годахъ
002084539	1855	LA TOUCHE	Lady Willoughby: or, the Double Marriage
002085073	1855	LATROBE, John Hazlehurst Boneval.	History of Mason and Dixon's Line
002085090	1857	LATROUETTE, N. M. G.	L'Ermitage Sainte-Anne près de Domfront. (Notice lue à la séance publique de la Société des Antiquaires de Normandie, le 27 Novembre, 1856.)
002086773	1856	LAUGH	Laugh and grow wise. By the Senior Owl, of Ivy Hall. [Nursery tales, with coloured illustrations.]
002089066	1849	LAURIE, James	System of Universal Geography; founded on the works of Malte-Brun and Balbi ... A new edition, revised and corrected throughout, etc
002089067	1851	LAURIE, James	System of Universal Geography, etc
002090331	1855	LAUZIÈRES, Achille de.	Descrizione della città di Napoli e delle sue vicinanze, divisa in XXX. giornate: opera corredata di figure intagliate in legno ... a cura e spese di G. Nobile. [Giornata 1-3 written by A. de L.: giornata 4-12 by R. d'Ambra.]
002090636	1852	LAVALLÉE, Théophile.	Histoire de Paris depuis le temps des Gaulois jusqu'en 1850 ... Édition illustrée de vignettes par Champin
002091501	1856	LAVENU, L. S.	Erlesmere; or, contrasts of character
002091501	1856	LAVENU, L. S.	Erlesmere; or, contrasts of character
002091503	1858	LAVENU, L. S.	Gaston Bligh. [A novel.]
002091503	1858	LAVENU, L. S.	Gaston Bligh. [A novel.]
002092446	1851	LA VOYE, Marin J. George de.	Eugénie, the young laundress of the Bastille
002092690		LAVROVSKY, Petr Alekseevich.	Изслѣдованіе о лѣтописи Якимовской. (Отдѣльные оттиски изъ II.-ой книги Ученыхъ Записокъ издаваемыхъ Вторымъ Отдѣленіемъ Императорской Академіи Наукъ.)
002095821	1857	LAWSON, Harriot Hutchinson Wormald.	Original Poetry
002096028	1858	LAWSON, John Parker.	[Scotland delineated in a series of views by C. Stanfield ... G. Cattermole ... (Sir W. Allan) ...Drawn in lithography by J. D. Harding (Carrick, etc.). With historical, antiquarian and descriptive letterpress by J. P. L.]
002097543	1858	LÁZÁR, Miklós	Gróf Lázár család. Irta ... Gróf Lázár M. összekapcsolva Gröf Kermény J. nek a nevezett családral kéziratba hátramaradt munkájával és számos jegyzetével
002097774		LAZAREVSKY, Aleksandr Matveevich.	Указатель источниковъ для изученія Малороссійскаго края. Вып. 1
002101012	1857	LEAKE, William Martin.	On some disputed questions of Ancient Geography
002101193	1850	LEAMON, Robert.	Narrative of Proceedings regarding the erection of the Leicester Monument [to the memory of Thomas William Coke, Earl of Leicester], with a statement of account and list of subscribers
002102229	1852	LEAVES	Leaves from my Journal during the summer of 1851. By a member of the late Parliament. [Lord Robert Grosvenor, afterwards Lord Ebury.] With illustrations
002104273	1857	LE BOUCQ, Pierre.	Histoire des choses le plus remarquables advenues en Flandre, Hainaut, Artois, et pays circonvoisins depuis 1596 jusqu'à 1674 ... Publiée avec une notice sur l'auteur et sa famille par ... A. Le Boucq de Ternas
002106947	1851	LE CLERCQ DE LAPRAIRIE, Jules	Notice historique et descriptive de l'abbaye de St Leger de Soissons. Accompagnée de dessins et de gravures sur bois
002108496	1854	LEDEBUR, Leopold von	Der Rangau. Geographische Entgegnung auf die Schrift des H. Haas: “Der Rangau, seine Grafen, mit neuen Forschungen über die Abstammung der Burggrafen von Nürnberg.”
002109454	1857	LEE, Alfred Theophilus.	History of the town and parish of Tetbury, in the county of Gloucester
002109880	1851	LEE, Edwin.	Bradshaw's Companion to the Continent; a descriptive handbook, etc. [Being an enlarged edition of the work entitled: “Continental Travel,” etc.]
002109907	1854	LEE, Edwin.	Notes on Spain, with a special account of Malaga and its climate
002110423	1855	LEE, Holme	Gilbert Massenger
002110432	1856	LEE, Holme	Kathie Brande; a fire side history of a quiet life
002110432	1856	LEE, Holme	Kathie Brande; a fire side history of a quiet life
002110437	1854	LEE, Holme	Maude Talbot
002110443	1858	LEE, Holme	Sylvan Holt's Daughter
002110443	1858	LEE, Holme	Sylvan Holt's Daughter
002110443	1858	LEE, Holme	Sylvan Holt's Daughter
002110445	1855	LEE, Holme	Thorney Hall: a story of an old family
002111195	1854	LEE, Robert	last days of Alexander, and the first days of Nicholas (Emperors of Russia)
002111196	1854	LEE, Robert	[The last days of Alexander, and the first days of Nicholas (Emperors of Russia).]
002112008	1856	LEEDS	Speeches delivered at a Meeting of the Board of Guardians ... as to the desirability ... of erecting a new Workhouse, etc
002112010	1858	LEEDS	Copy of the Register of Persons entitled to vote in the election of Members ... for the Borough of Leeds, etc
002112035	1855	LEEDS	Reports of the Governor, Chaplain, and Surgeon; presented to the Justices of the Peace ... 1854
002112137	1858	Grammar School (LEEDS)	Calendar, 1858(, 62-64)
002112204	1849	Leeds Stock Exchange Buildings Company (LEEDS)	Deed of Settlement of the ... Company. (Dated 9th Jan. 1849.)
002114799	1856	LEFÈVRE, Édouard.	Département d'Eure-et-Loir. Dictionnaire géographique des communes, hameaux, fermes, moulins, châteaux, ... chapelles, ayant un nom particulier, etc
002114985	1852	LEFEVRE, Jh.	La Légion Française; première année du Siège de Montevideo. Extrait des souvenirs d'un volontaire
002118830	1851	LEHAULT, Nicolas.	Recueil concernant les désordres qui se sont passés dans le comté de Marle, pendant la guerre 1635 à 1655. [Edited by L. Papillon.]
002119470	1853	LEHMANN, Johann Georg	Urkundliche Geschichte der Bezirks-Hauptstadt Kaiserslautern und des ehemaligen Reichslandes
002125032	1855	LE JOSNE DE L'ESPIERRE, Théophile.	Recherches historiques sur la commune de Santes
002125549	1858	LELEWEL, Joachim.	Geografja: opisanie krajów Polskich ... Udzielone 1829 do atlasu panny Reginy Korzeniowskiéj
002125928	1853	LÉLUT, Louis Francisque.	Mémoire sur la déportation, suivi de considérations sur l'emprisonnement cellulaire
002128880	1852	LENA	Lena or the Silent Woman. By the author of “King's Cope,” etc. [Ellen Wallace.]
002131987	1853	LENNEP, Jacob van.	Herinneringen uit den worstelstrijd met Spanje ... Met op staal gegraveerde platen
002132066	1854	LENNEP, Jacob van	Merkwaardige Kasteelen in Nederland. Door Mr J. van L. en W. J. H. Plates
002132066	1854	LENNEP, Jacob van	Merkwaardige Kasteelen in Nederland. Door Mr J. van L. en W. J. H. Plates
002132066	1854	LENNEP, Jacob van	Merkwaardige Kasteelen in Nederland. Door Mr J. van L. en W. J. H. Plates
002132310	1851	LENNOX, William Pitt	Percy Hamilton: or, The Adventures of a Westminster Boy
002132311	1855	LENNOX, William Pitt	Philip Courtenay; or Scenes at home and abroad
002132317	1857	LENNOX, William Pitt	Story of my Life
002132317	1857	LENNOX, William Pitt	Story of my Life
002132317	1857	LENNOX, William Pitt	Story of my Life
002135880	1856	LEÔNII, Lorenzo.	Memoria storiche di Todi. (Appendice.)
002138136	1854	LÉPINOIS, Eugène de Buchère de.	Histoire de Chartres. [With plates.]
002138136	1854	LÉPINOIS, Eugène de Buchère de.	Histoire de Chartres. [With plates.]
002138801	1852	LEPSIUS, Carl Richard.	Briefe aus Ægypten, Æthiopien, und der Halbinsel des Sinai, geschrieben in den Jahren 1842-1845, etc
002138808	1852	LEPSIUS, Carl Richard.	Discoveries in Egypt, Ethiopia, and the Peninsula of Sinai, in the years 1842-45 ... Edited, with notes, by K. R. H. Mackenzie
002138828	1858	LEPSIUS, Carl Richard.	XXII. Egyptian Royal Dynasty; with some remarks on XXVI. and other dynasties of the New Kingdom. ... Translated by W. Bell ... With two lithographic plates of genealogies
002139478	1854	LERCHENFELD, Gustav von	Geschichte Bayerns unter König Maximilian Joseph I. Mit besonderer Beziehung auf die Entstehung der Verfassungs-Urkunde
002139498	1850	LERDO DE TEJADA, Miguel M.	Apuntes historicos de la heróica ciudad de Vera-Cruz, precedidos de una noticia de los descubrimientos hechos en las islas y en el continente Americano, etc
002139498	1850	LERDO DE TEJADA, Miguel M.	Apuntes historicos de la heróica ciudad de Vera-Cruz, precedidos de una noticia de los descubrimientos hechos en las islas y en el continente Americano, etc
002139498	1850	LERDO DE TEJADA, Miguel M.	Apuntes historicos de la heróica ciudad de Vera-Cruz, precedidos de una noticia de los descubrimientos hechos en las islas y en el continente Americano, etc
002141897	1851	LE SAIGE, Jacques.	Voyage de J. Le Sage de Douai à Rome, Notre Dame de Lorette, Venise, Jérusalem, et autres saint lieux. Nouvelle édition, publiée par H. R. Duthillœul
002142546		LESHKOV, Vasily Nikolaevich.	Русскій народъ и государство. Исторія Русскаго общественнаго права до XVIII. вѣка
002142861	1856	LESLEY, Peter.	Manual of Coal and its topography. Illustrated by original drawings
002145235	1853	LESTER, Charles Edwards.	My Consulship
002145489	1853	LESTIBOUDOIS, Thémistocle.	Voyage en Algérie, ou études sur la colonisation de l'Afrique Française
002148658	1853	LETTS, J. M.	California illustrated: including a description of the Panama and Nicaragua Routes
002150444	1850	LEVEL, Andrés E.	Informe sobre el estado actual de los distritos de reduccion de indéjenas Alto Orinoco, Central y Bajo Orinoco, y medidas que reclaman ... por el visitador nombrado al efecto A. E. L
002150802	1852	LEVER, Charles James.	Daltons; or, Three Roads in Life. ... With illustrations by Phiz [i.e. H. K. Browne.]
002150812	1854	LEVER, Charles James.	Dodd Family Abroad. ... With illustrations by Phiz [i.e. H. K. Browne]
002150816	1857	LEVER, Charles James.	Fortunes of Glencore
002150816	1857	LEVER, Charles James.	Fortunes of Glencore
002150816	1857	LEVER, Charles James.	Fortunes of Glencore
002150825	1857	LEVER, Charles James.	[Jack Hinton, the Guardsman ... With a portrait of the author. And numerous illustrations on wood and steel, by H. K. Browne.]
002150838	1858	LEVER, Charles James.	[The Knight of Gwynne, a tale of the time of the Union. ... With illustrations by “Phiz” [i.e. H. K. Browne].]
002150838	1858	LEVER, Charles James.	[The Knight of Gwynne, a tale of the time of the Union. ... With illustrations by “Phiz” [i.e. H. K. Browne].]
002150848	1856	LEVER, Charles James.	Martins of Cro' Martin. With illustrations by “Phiz” [i.e. Hablot-Knight Browne.]
002150873	1850	LEVER, Charles James.	Roland Cashel. With illustrations by Phiz [i.e. H. K. Browne]
002150875	1858	LEVER, Charles James.	[Roland Cashel. With illustrations by Phiz [i.e. H. K. Browne].]
002150875	1858	LEVER, Charles James.	[Roland Cashel. With illustrations by Phiz [i.e. H. K. Browne].]
002150889	1857	LEVER, Charles James.	[Tom Burke of “Ours.']
002150889	1857	LEVER, Charles James.	[Tom Burke of “Ours.']
002151113	1857	LE VERT, Octavia Walton.	Souvenirs of Travel
002151113	1857	LE VERT, Octavia Walton.	Souvenirs of Travel
002152227	1850	LEVIN, Israel Salomon.	En Brevvexling [relative to J. Levin's criticisms upon an edition of Vedels Saxo by “Samfundet for den danske Litteraturs Fremme”] meddeelt af J. Levin. Trykt som Manuskript for Studenter-Foreningens Medlemmer
002153278	1855	LEVRAULT, Louis.	Sainte-Odile et le Heidenmauer. Traditions, monuments et histoire
002154131	1857	LEW, Margaret.	Tales of the Affections
002154319	1854	LEWELL PASTURES	Lewell Pastures. By the author of “Sir Frederick Derwent,” etc. [M. R. S. Kettle.]
002154539	1850	Lewes, George Henry	Noble Heart: a tragedy, in three acts
002156139	1855	Lewis, George Cornewall	inquiry into the Credibility of the Early Roman History
002156139	1855	Lewis, George Cornewall	inquiry into the Credibility of the Early Roman History
002157987	1855	LEWIS, Titus.	Hanes Prydain Fawr, yn wladol a chrefyddol ... Wedi ei ddiwygio a'i helaethu gan John Emlyn Jones, etc
002157988	1857	LEWIS, Titus.	Hanes Prydain Fawr yn Wladol a Chrefyddol ... Wedi ei ddiwygio a'i helaethu gan John Emlyn Jones, etc. [With a portrait.]
002159587	1858	LEYDEN, John.	Poems and Ballads ... With a memoir of the Author by Sir W. Scott, Bart. And a Supplement by R. White
002159928	1854	LEYMARIE, Édouard.	Quelques mots sur un ouvrage d'un Périgourdin (L. Dessalles) ... et quelques mots sur l'histoire du Périgord
002163528	1855	LIDDELL, Henry George	History of Rome from the earliest times to the establishment of the Empire
002163528	1855	LIDDELL, Henry George	History of Rome from the earliest times to the establishment of the Empire
002163528	1855	LIDDELL, Henry George	History of Rome from the earliest times to the establishment of the Empire
002163528	1855	LIDDELL, Henry George	History of Rome from the earliest times to the establishment of the Empire
002163529	1857	LIDDELL, Henry George	History of Rome from the earliest times to the establishment of the Empire.]
002164517	1857	LIEBENAU, Hermann von.	Förderung der Eidgenossenschaft durch des Hauses Habsburg innere Verhältnisse. (Neujahrsblatt aus der Urschweiz ... 1858.)
002164518	1857	LIEBENAU, Hermann von.	Die geschichtlichen Ursachen der Entstehung einer schweizerischen Eidgenossenschaft, etc
002166336	1852	LIENAU, J. F.	Meine Erlebnisse in der Schleswig-Holsteinischen Armee
002167638	1853	LIGHT-BOB	Head-Quarters: or, Manners in the East. A drama in five acts [and in prose]. By a Light-Bob
002167945	1855	LIGHTS	Lights and shadows of English life. A novel. By the authoress of “Clara Cameron, the belle of the season”
002168088	1851	LIGNELL, Anders.	Beskrifning öfver Grefskapet Dal
002169718	1858	LILLY DALE SONGSTER	Lilly Dale Songster
002174061	1857	LINDGREN, Carl Ludvig.	Om Gustav II. Adolfs regering såsom epokgörande i afseende på representationen. Akademisk Afhandling, etc
002175141	1857	LINDSAY, Coutts	Boadicea: a tragedy [in five acts and verse]
002176288	1851	LINDSEY, W. H.	A Season at Harwich, with excursions by land and water. To which is added researches, historical, natural and miscellaneous
002176383	1854	LINDSTRÖM, Gustaf.	Bidrag till historien om Gotland såsom hörande till Drottning Christinas underhållsländer ... Afhandling ... J. H. Schröder, etc
002176778	1855	LINFORTH, James.	Route from Liverpool to Great Salt Lake Valley illustrated ... from sketches ... by Frederick Piercy, and containing a map of the overland portion of the journey. Edited by J. Linforth. [With plates, including portraits.]
002176904	1849	LINGARD, John	History of England ... Second edition.]
002176904	1849	LINGARD, John	History of England ... Second edition.]
002176904	1849	LINGARD, John	History of England ... Second edition.]
002176904	1849	LINGARD, John	History of England ... Second edition.]
002176904	1849	LINGARD, John	History of England ... Second edition.]
002176904	1849	LINGARD, John	History of England ... Second edition.]
002176904	1849	LINGARD, John	History of England ... Second edition.]
002176904	1849	LINGARD, John	History of England ... Second edition.]
002176904	1849	LINGARD, John	History of England ... Second edition.]
002176904	1849	LINGARD, John	History of England ... Second edition.]
002176915	1851	LINGARD, John	True Account of the Gunpowder Plot, extracted from Dr. Lingard's History of England, and Dodd's Church History, including the notes and documents appended to the latter by ... M. A. Tierney. With notes and prefatory remarks by Vindicator
002179205	1858	LINWOOD, Mary	House of Camelot; a tale of the olden time
002179205	1858	LINWOOD, Mary	House of Camelot; a tale of the olden time
