id	year	author	title	tags	link
002937755	1810	PLUMPTRE, Anne.	A Narrative of a three years' residence in France, principally in the Southern departments, from ... 1802 to 1805: including some ... particulars respecting the early life of the French Emperor, etc
002937755	1810	PLUMPTRE, Anne.	A Narrative of a three years' residence in France, principally in the Southern departments, from ... 1802 to 1805: including some ... particulars respecting the early life of the French Emperor, etc
002940087	1811	POCOCK, Isaac.	Anything New. A musical farce, in two acts, etc
002940089	1814	POCOCK, Isaac.	“For England, Ho!” A melo-dramatic opera in two acts
002940092	1810	POCOCK, Isaac.	Hit or Miss! A muscial farce in two acts
002940093	1810	POCOCK, Isaac.	[Hit or Miss! A muscial farce in two acts.]
002940094	1810	POCOCK, Isaac.	[Hit or Miss! A muscial farce in two acts.]
002940095	1811	POCOCK, Isaac.	[Hit or Miss! A muscial farce in two acts.]
002940099	1814	POCOCK, Isaac.	John of Paris, a comic opera in two acts
002940104	1813	POCOCK, Isaac.	Miller and his Men, a melo-drame, in two acts. Second edition
002940113	1818	POCOCK, Isaac.	Rob Roy Macgregor, or Auld Lang Syne! A musical drama, in three acts. Founded on the popular novel of “Rob Roy.”
002940114	1818	POCOCK, Isaac.	[Rob Roy Macgregor, or Auld Lang Syne! A musical drama, in three acts. Founded on the popular novel of “Rob Roy.”]
002940128	1810	POCOCK, Isaac.	Twenty Years Ago! A new melodramatic entertainment, in two acts [in prose], etc
002940131	1809	POCOCK, Isaac.	Yes or No. A musical farce, in two acts, etc
002941538	1811	POEMS	Occasional Poems. L.P
002941561	1815	HUSKINSON, Eliza.	Original Poems on a variety of subjects. By Different Hands. [Edited by E. Huskinson.]
002941630	1815	POEMS	Poems and Odes on various subjects. By a Student of the Honourable Society of the Inner Temple
002942264	1812	POETICAL SELECTIONS	Poetical selections, consisting of the most approved pieces of our best modern British poets ... A new edition
002942382	1813	POETS	Modern Poets. A dialogue in verse
002951919	1816	POLWHELE, Richard.	[The History of Cornwall; civil, military, religious, architectural, agricultural, commercial, biographical and miscellaneous.]
002955073	1813	Pontefract Auxiliary Bible Society (PONTEFRACT)	Report of the Proceedings ... at a meeting held ... on the formation of an Auxiliary Bible Society for the town of Pontefract, etc
002955074	1814	Pontefract Auxiliary Bible Society (PONTEFRACT)	Report of the Proceedings ... at the first Annual General Meeting, etc
002955231	1810	Pontey, William.	[The Forest Pruner; or, timber owner's assistant: being a treatise on the ... management of British Timber Trees, etc.]
002956100	1814	POOLE, John	Intrigue: a comic interlude, in one act [and in prose]
002956147	1815	POOLE, John	Who's Who? or, the Double Imposture. A farce in two acts
002958062	1817	POPE, R. T.	An University Prize Poem: to which is prefixed in English Metre, an Address to Ireland on the circumstances of the present time
002960437	1818	PORDEN, afterwards FRANKLIN, Eleanor Anne.	Arctic Expeditions. A poem
002962435	1813	PORTER, Hugh.	Poetical Attempts
002962817	1813	Porter, Robert Ker	Narrative of the campaign in Russia during the year 1812
002962818	1815	Porter, Robert Ker	Narrative of the campaign in Russia during the year 1812.]
002962821	1813	Porter, Robert Ker	Travelling Sketches in Russia and Sweden ... The second edition, with forty-one plates
002962821	1813	Porter, Robert Ker	Travelling Sketches in Russia and Sweden ... The second edition, with forty-one plates
002964850	1812	PORTUGAL	Narrative of the Campaigns of the Loyal Lusitanian Legion, under Brigadier General Sir Robert Wilson ... [by - Flower? or Sir John Scott Lillie?] With some account of the military operations in Spain and Portugal during the years 1809, 1810 &amp; 1811. [Edited, with an introductory chapter, by William Mayne.]
002968610	1814	POTION, Paul	A Poetical Picture of Worthing, and its vicinity. With an introductory description of the route from the metropolis. By Paul Potion, S.A.A
002970529	1810	POTTS, Thomas	Gazetteer of England and Wales, etc
002972260	1813	POUQUEVILLE, François Charles Hugues Laurent.	Travels in the Morea, Albania and other parts of the Ottoman Empire, comprehending a general description of those countries ... and an historical and geographical description of the ancient Epirus. ... Translated from the French by A. Plumptre, etc
002974387	1815	Power, George.	History of the Empire of the Musulmans in Spain and Portugal, etc
002975310	1818	POYET, Bernard.	Poyet, Architecte, etc. (À Messieurs de l'Académie Royale des Beaux Arts.) [An appeal for support in carrying out the author's plan for building an iron bridge opposite the Hôtel des Invalides.]
002978663	1810	PRAIZER, L. W.	Remarks on slander and envy, inscribed to ... the friends of J. Hanson, Esq. To which are added, Mr. Hanson's Address to his friends and country, etc
002984606	1818	TAYLOR, John	A Brief Description of the Burrough and Town of Preston, and its government and guild. Originally composed between ... 1682 and 1686. With occasional notes by John Taylor
002985164	1809	PRESTON, William	Posthumous Poems of W. Preston
003002586	1809	PRUSSIA, West	Ueber die durch den Tilsiter Frieden vom 9. Julius 1807 veranlasste Theilung von Westpreussen, deren Flächen-Inhalt und die jetzige neue Gränze von der Drage bis zur Weichsel, etc
003009522	1817	PURDY, John.	Columbian Navigator: containing ... New Sailing Directions for the Coasts and Harbours of North America, ... the West Indies, etc
003009530	1812	PURDY, John.	Memoir ... to accompany the New Chart of the Atlantic Ocean, and comprising instructions ... for the navigation of that sea, etc
003009542	1816	PURDY, John.	Tables of the Positions, or of the Latitudes and Longitudes of Places, composed to accompany the Oriental Navigator; or sailing directions for the East Indies, China, Australia, &amp;c. With notes, explanatory and descriptive
003010076	1810	GOULBURN, Edward.	Pursuits of Fashion. A satirical poem. [By E. Goulburn] ... Third edition
003013351	1818	PYRENEES	Recluse of the Pyrenees. A poem
003013351	1818	PYRENEES	Recluse of the Pyrenees. A poem
003013705	1817	BAYLY, Nathaniel Thomas Haynes.	Epistles from Bath; or, Q.'s letters to his Yorkshire relations; and miscellaneous poems. By Q. in the Corner [i.e. Thomas Haynes Bayly]
003013768	1813	Q., Q.	Leaves of Laurel; or, New Probationary Odes, for the vacant Laureatship. [A series of parodies.] Collected and edited by Q. Q. and W. W
003016577	1817	QUÉLEN DE STUER DE CAUSSADE DE LA VAUGUYON, Paul Maximilien Casimir de	Truth respecting England, or an impartial examination of the work of M. Pillet [entitled, “L'Angleterre vue à Londres et dans ses Provinces”]. Published ... by J. A. Viévard
003020672	1816	QUITO-GATE	Watchword, or Quito-Gate; a melodrama in two acts [in prose] ... The second edition
003028590	1811	RAEPSAET, Jean Joseph.	Mémoire sur l'origine des Belges, etc
003034898	1817	RAMFTLER, C. F.	National Calamity improved. A sermon [on Ezek. vii. 27] preached in reference to the interment of the Princess Charlotte Augusta of Wales, etc
003035466	1813	RAMOND DE CARBONNIÈRES, Louis François Élisabeth	Travels in the Pyrenees ... Translated from the French ... by F. Gold
003036337	1809	RAMSAY, David	History of South-Carolina, from its first settlement in 1670 to ... 1808
003036337	1809	RAMSAY, David	History of South-Carolina, from its first settlement in 1670 to ... 1808
003036346	1818	RAMSAY, David	History of the Untied States, from their first settlement as English Colonies ... to ... 1808 ... Continued to the Treaty of Ghent by S. S. Smith, D.D. ... and other ... gentlemen ... Second edition, revised, etc
003036346	1818	RAMSAY, David	History of the Untied States, from their first settlement as English Colonies ... to ... 1808 ... Continued to the Treaty of Ghent by S. S. Smith, D.D. ... and other ... gentlemen ... Second edition, revised, etc
003036346	1818	RAMSAY, David	History of the Untied States, from their first settlement as English Colonies ... to ... 1808 ... Continued to the Treaty of Ghent by S. S. Smith, D.D. ... and other ... gentlemen ... Second edition, revised, etc
003049766	1818	RAYMOND, Richard John.	Castle of Paluzzi; or, the Extorted Oath; a serious drama, in two acts [and in prose]
003049785	1818	RAYMOND, Richard John.	State Prisoner; or, the Fortress of Guntzbourg; a drama, in three acts [and in prose]
003051707	1818	READ, William	Hill of Caves, with other poems
003055104	1817	RECOLLECTIONS	Recollections of a Ramble during the summer of 1816. In a letter to a Friend
003059608	1815	REES, Thomas	A Topographical and Historical Description of South Wales ... Illustrated, etc
003060471	1816	REEVES, John	Two Tracts shewing, that Americans, born before the Independence, are, by the law of England, not aliens. First, a Discussion, &amp;c. Second, a Reply (to the Re-Statement of Mr. Chalmers's opinion on the legal effects resulting from the acknowledged independence of the United States) ... Second edition
003060663	1813	REFLECTIONS	Autumnal Reflections, a poem, ... with a few other pieces
003061124	1815	REFORMATION	Reformation. A comic interlude in one act [in prose], etc
003061654	1814	WHITE, John	Some Account of the Proposed Improvements of the Western part of London, by the formation of the Regent's Park, the New Street ... Illustrated by plans [by J. White and others] and accompanied by critical observations
003069834	1811	REITHOFER, Franz Dionys.	Kleine Chronik der Königlich-Baierischen Haupt- und Universitäts-Stadt-Landshut, etc
003074524	1816	Rennell, James	Illustrations, chiefly geographical, of the history of the Expedition of Cyrus from Sardis to Babylonia; and the Retreat of the Ten Thousand Greeks, from thence to Trebisonde and Lydia. With an appendix, containing an enquiry into the best method of improving the geography of the Anabasis, &amp;c. Explained by three maps
003074541	1814	Rennell, James	Observations on the topography of the Plain of Troy, and on the principal objects within and around it described or alluded to in the Iliad. Shewing that the system of M. de Chevalier [Le Chevalier] ... is founded on a most erroneous topography, etc
003075160	1818	RENOU, Sarah.	Temple of Truth. A poem in five cantos
003076690	1813	RERESBY, John	Travels and Memoirs of Sir John Reresby, Bart. The former (now first published) exhibiting a view of the Governments and Society in the principal States, and Courts of Europe during the time of Cromwell's usurpation: the latter containing anecdotes and secret history of the Courts of Charles II. and James II
003083271	1810	REYNOLDS, Frederic.	Free Knights; or, the Edict of Charlemagne; a drama, in three acts [in prose], interspersed with music, etc
003083319	1812	REYNOLDS, Frederic.	Renegade, a grand historical drama, in three acts [and in prose]. Founded on Dryden's Don Sebastian
003083326	1812	REYNOLDS, Frederic.	Virgin of the Sun, an operatic drama [in three acts and in prose]
003083329	1815	REYNOLDS, Frederic.	What's a Man of Fashion? A farce, in two acts [in prose], etc
003083334	1815	REYNOLDS, Frederic.	[The Will ... Third edition.]
003083756	1809	REYNOLDS, Joshua	[The works of Sir Joshua Reynolds ... To which is prefixed An account of the life and writings of the author, by Edmond Malone ... Third edition, corrected.]
003083756	1809	REYNOLDS, Joshua	[The works of Sir Joshua Reynolds ... To which is prefixed An account of the life and writings of the author, by Edmond Malone ... Third edition, corrected.]
003084006	1818	REYNOLDS, Richard	An Elegy on the Death of Richard Reynolds with other poems
003085240	1813	RHIND, William	Tributary Lay ... to the memory of George Heriot, the founder of Heriot's Hospital
003085260	1818	DODD, Charles Edward.	An Autumn near the Rhine; or, sketches of courts, society, scenery, &amp;c. in some of the German States bordering on the Rhine. [By C. E. Dodd.]
003085260	1818	DODD, Charles Edward.	An Autumn near the Rhine; or, sketches of courts, society, scenery, &amp;c. in some of the German States bordering on the Rhine. [By C. E. Dodd.]
003085979	1814	RHODES, Henrietta.	Poems and Miscellaneous Essays
003086187	1809	RHODES, Thomas	Marriage no Jest. A comedy in five acts [and in prose]
003089378	1809	HATCHER, Henry.	Description of Britain, translated [by H. Hatcher] from Richard of Cirencester; with the original treatise De Situ Britanniæ; and a commentary on the Itinerary [by T. Leman]. Lat. and Eng
003089586	1817	RICCATI, Charles.	Tableau historique et raisonné des événemens qui ont précédé et suivi le rétablissement des Bourbons en France ... depuis Mars 1815, jusqu'au 8 Juillet 1816
003089586	1817	RICCATI, Charles.	Tableau historique et raisonné des événemens qui ont précédé et suivi le rétablissement des Bourbons en France ... depuis Mars 1815, jusqu'au 8 Juillet 1816
003089586	1817	RICCATI, Charles.	Tableau historique et raisonné des événemens qui ont précédé et suivi le rétablissement des Bourbons en France ... depuis Mars 1815, jusqu'au 8 Juillet 1816
003093460	1818	RICHARDSON, Charlotte Caroline.	Harvest; a poem: with other poetical pieces
003094953	1809	RICHARDSON, Sarah	Ethelred; a legendary tragic drama [in five acts and in verse]
003094955	1810	RICHARDSON, Sarah	Gertrude; a tragic drama, in five acts [and in prose and verse]
003103913	1812	RIGHT	Right and Wrong. A comedy, in five acts [and in prose]
003103914	1812	RIGHT	[Right and Wrong. A comedy, in five acts [and in prose].]
003104893	1817	RILEY, James	An Authentic Narrative of the loss of the American Brig Commerce, wrecked on the Western Coast of Africa, in the month of August 1815. With an account of the sufferings of her surviving officers and crew, ... and observations historical, geographical, etc
003104894	1817	RILEY, James	[An Authentic Narrative of the loss of the American Brig Commerce, wrecked on the Western Coast of Africa, in the month of August 1815. With an account of the sufferings of her surviving officers and crew, ... and observations historical, geographical, etc.]
003108198		RIPLEY, J. J.	Adhelm and Ethelfled. A metrical story. (Notes.)
003112791	1809	RIVETTA, Giorgio.	Fatto storico della città di Casale Monferrato
003114267		ROBB, William	Poems illustrative of the Genius and Influence of Christianity: to which are subjoined some fugitive pieces, etc
003117594	1809	ROBERTS, James	Introductory lessons with familiar examples in Landscape for the use of those who are desirous of gaining some knowledge of the ... art of painting in water-colours. To which are added ... Instructions for executing transparencies, etc
003118366	1815	ROBERTS, Peter	Cambrian Popular Antiquities, or an account of some traditions, customs and supersitions of Wales, with observations as to their origin, etc
003121081	1812	ROBERTSON, William	History of America ... In which is included the posthumous volume, etc.]
003121081	1812	ROBERTSON, William	History of America ... In which is included the posthumous volume, etc.]
003121081	1812	ROBERTSON, William	History of America ... In which is included the posthumous volume, etc.]
003121081	1812	ROBERTSON, William	History of America ... In which is included the posthumous volume, etc.]
003121083	1817	ROBERTSON, William	History of America ... A new edition; to which is added, a continuation, comprising the history of the colonies from 1652 to the present time ... By David McIntosh, LL.D. [With maps and engraved plates, including a portrait.]]
003121083	1817	ROBERTSON, William	History of America ... A new edition; to which is added, a continuation, comprising the history of the colonies from 1652 to the present time ... By David McIntosh, LL.D. [With maps and engraved plates, including a portrait.]]
003121083	1817	ROBERTSON, William	History of America ... A new edition; to which is added, a continuation, comprising the history of the colonies from 1652 to the present time ... By David McIntosh, LL.D. [With maps and engraved plates, including a portrait.]]
003121083	1817	ROBERTSON, William	History of America ... A new edition; to which is added, a continuation, comprising the history of the colonies from 1652 to the present time ... By David McIntosh, LL.D. [With maps and engraved plates, including a portrait.]]
003121113	1812	ROBERTSON, William	history of Scotland ... The thirteenth edition, with alterations and additions.]
003121113	1812	ROBERTSON, William	history of Scotland ... The thirteenth edition, with alterations and additions.]
003121113	1812	ROBERTSON, William	history of Scotland ... The thirteenth edition, with alterations and additions.]
003121138	1809	ROBERTSON, William	History of the Reign of the Emperor Charles V ... The eleventh edition
003121138	1809	ROBERTSON, William	History of the Reign of the Emperor Charles V ... The eleventh edition
003121138	1809	ROBERTSON, William	History of the Reign of the Emperor Charles V ... The eleventh edition
003121138	1809	ROBERTSON, William	History of the Reign of the Emperor Charles V ... The eleventh edition
003123552	1816	ROBINSON, Ellen	Power, Wisdom and Goodness of God displayed in the works of Creation and Redemption: a poem
003126952	1815	ROBY, John.	Sir Bertram; a poem in six cantos
003127162	1815	ROCCA, Albert Jean Michel de.	Memoirs of the War of the French in Spain, ... translated from the French [by Maria Graham]
003128297	1818		[The Poll of the City of Rochester, for Members of Parliament, March 16, 1768.]
003129268	1812	ROCQUES DE MONTGAILLARD, Jean Gabriel Maurice	Seconde Guerre de Pologne; ou, considérations sur la paix publique du continent et sur l'indépendance maritime de l'Europe
003133426	1811	ROEDLICH, Hieronymus Franciscus.	Skizzen des physisch-moralischen Zustandes Dalmatiens und der Buchten von Cattaro, etc
003136552	1816	ROGERS, John Benjamin.	Days of Harold. A metrical tale
003136980		ROGERS, Samuel	[The pleasures of memory, and other poems. By Samuel Rogers, Esq. And The pains of memory, by Robert Merry.]
003138978	1818	ROISTER DOISTER, Ralph.	Ralph Royster Doyster, a comedy [in five acts, in verse, by N. Udall]
003141440	1817	ROLLS, Mary.	Home of Love, a poem
003141443	1816	ROLLS, Mary.	Moscow. A poem
003141445	1815	ROLLS, Mary.	Sacred Sketches from Scripture History. [In verse.]
003142560	1818	ROMAN, Abraham.	Berättelse om Norrboten och dess Lappmarker ... utgifven af A. Roman
003142692	1811	WILSON, Thomas	Romance; a poetical capriccio. [By T. Wilson?]
003142855	1815	ROMANELLI, Domenico.	Antica topografia istorica del Regno di Napoli
003142855	1815	ROMANELLI, Domenico.	Antica topografia istorica del Regno di Napoli
003142855	1815	ROMANELLI, Domenico.	Antica topografia istorica del Regno di Napoli
003147549	1817	Rome (Italy)	Rome, Naples et Florence en 1817, ou esquisses sur l'état actuel de la société, des mœurs, des arts, de la littérature, etc. de ces villes célèbres. [By M. H. Beyle.]
003153906	1817	RONDEAU, James.	Leopold's Loss: or England's Tears o'er the urn of her beloved Princess Charlotte Augusta. A monody
003153906	1817	RONDEAU, James.	Leopold's Loss: or England's Tears o'er the urn of her beloved Princess Charlotte Augusta. A monody
003157310	1812	ROSARY	Rosary, or Beads of Love with the poem of Sula: in three cantos
003158423	1809	ROSE, George	Observations on the Historical Work of the late Right Hon. C. J. Fox ... with a narrative of the events which occurred in the enterprize of the Earl of Argyle in 1685, by Sir Patrick Hume
003159061	1814	ROSE, William	Gratitude; a poem
003162157	1810	ROSINI, Giovanni.	Lettere pittoriche sul Campo Santo di Pisa
003163165	1812	ROSS, Alexander	[Helenore; or the fortunate shepherdess, etc.]
003168230	1812	ROTH, Carl Johann Friedrich von.	Ueber Thucydides und Tacitus vergleichende Betrachtungen
003169548	1815	GISBORNE, Thomas	Rothley Temple; a poem. [By T. Gisborne.]
003176604	1810	ROWE, Henry	Fables in verse
003181794	1812	RUBICHON, Maurice.	Of England. [Translated from the first edition of “De l'Angleterre.”]
003183557	1815	RUDGE, Thomas.	History and Antiquities of Gloucester, etc
003193735	1815	RUSSELL, J.	History of the War between the United States and Great Britain, which commenced in June, 1812, and closed in Feb. 1815 ... Compiled chiefly from the public documents, with an appendix, containing the correspondence which passed ... in treating for peace. To which is added the Treaty of Peace, and a list of vessels taken from Great Britain during the war
003211867	1815	S., A.	Court of Apollo; with other pieces of original poetry; also some specimens of translation from the minor Greek Poets. A. S. [i.e. Abraham Shackleton] ἐποιει
003212474	1814	SMITH, Elizabeth	[Fragments in Prose and Verse: by a young lady lately deceased (Elizabeth S- [i.e. Smith]). With some account of her life and character, by the author of “Sermons on the Doctrine and Duties of Christianity” [Miss Henrietta Maria Bowdler].]
003212474	1814	SMITH, Elizabeth	[Fragments in Prose and Verse: by a young lady lately deceased (Elizabeth S- [i.e. Smith]). With some account of her life and character, by the author of “Sermons on the Doctrine and Duties of Christianity” [Miss Henrietta Maria Bowdler].]
003212475	1818	SMITH, Elizabeth	[Fragments in Prose and Verse: by a young lady lately deceased (Elizabeth S- [i.e. Smith]). With some account of her life and character, by the author of “Sermons on the Doctrine and Duties of Christianity” [Miss Henrietta Maria Bowdler].]
003212475	1818	SMITH, Elizabeth	[Fragments in Prose and Verse: by a young lady lately deceased (Elizabeth S- [i.e. Smith]). With some account of her life and character, by the author of “Sermons on the Doctrine and Duties of Christianity” [Miss Henrietta Maria Bowdler].]
003212484	1809	SMITH, Elizabeth	[Fragments in Prose and Verse: by a young lady lately deceased (Elizabeth S- [i.e. Smith]). With some account of her life and character, by the author of “Sermons on the Doctrine and Duties of Christianity” [Miss Henrietta Maria Bowdler].]
003212484	1809	SMITH, Elizabeth	[Fragments in Prose and Verse: by a young lady lately deceased (Elizabeth S- [i.e. Smith]). With some account of her life and character, by the author of “Sermons on the Doctrine and Duties of Christianity” [Miss Henrietta Maria Bowdler].]
003212926	1813	S********, I. A. M.	An historical account and description of the City of Moscow ... By I. A. M. S******** [Sulkowski]
003213331	1810	S., J. L. O.	Haunted Fire of Uller, an Iernian Legend. By J. L. O. S
003214592	1818	SAABYE, Hans Egede.	Greenland: being extracts from a journal kept in that country in ... 1770 to 1778. ... to which is prefixed, an introduction containing some accounts of the manners of the Greenlanders, and of the mission in Greenland ... by G. Fries. Translated from the German [by H. E. Lloyd]
003217932	1810	SACK, Albert von	A Narrative of a Voyage to Surinam; of a residence there during 1805, 1806 and 1807, and of the author's return to Europe by the way of North America
003219275	1809	SADLER, Ralph	State papers and Letters of Sir Ralph Sadler. Edited by Arthur Clifford. To which is added, a memoir of the life of Sir Ralph Sadler; with historical notes by Walter Scott
003219275	1809	SADLER, Ralph	State papers and Letters of Sir Ralph Sadler. Edited by Arthur Clifford. To which is added, a memoir of the life of Sir Ralph Sadler; with historical notes by Walter Scott
003220680	1810	SAGE, J.	Original Poems
003222883	1818	SAINT GILES, Camberwell, Parish of	An Account of the Estates, Trust, and other property, belonging to the Parish of St. Giles, Camberwell
003222968	1809	SALT, Henry.	Twenty four Views in St. Helena, the Cape, India, Ceylon, the Red Sea, Abyssinia and Egypt, from drawings by H. Salt [with descriptions to illustrate the voyages and travels of George Annesley, Earl of Mountmorris]
003224382	1812	SAINT CLAIR, Arthur.	Narrative of the manner in which the campaign against the Indians in the year one thousand seven hundred and ninety one was conducted under the command of Major-General St. Clair, together with his observations on the statements of the Secretary of War, and the Quarter Master General ... and the Reports of the Committees, etc
003224428	1818	SAINT CLAIR, Henry	Miscellaneous Poems, by H. Saint Clair ... translated by himself from his own original French poems
003232064	1813	SALLIER, Guy Marie.	Annales françaises, depuis le commencement du règne de Louis XVI., jusqu'aux États-Généraux, 1774 à 1789 ... Seconde édition
003232369	1813	SALLUSTIUS CRISPUS, Caius.	History of Catiline's Conspiracy, and the Jugurthine War ... With a new translation of Cicero's four Orations against Catiline. To which is prefixed, the Life of Sallust. [By William Rose.]]
003232475	1809	SALLUSTIUS CRISPUS, Caius.	Bellum Catilinarium of Sallust travestied. Inscribed to the Right Hon. G. Canning
003233078	1817	SALMON, Joseph Whittingham.	Beauties of Hawkstone Park ... A poem ..., with moral reflections in verse ... Third edition, ... improved
003238700	1816	SAMUEL, E.	Historical Account of the British Army, and of the Law Military, as declared by the ancient and modern Statutes and Articles of War for its Government: with a free commentary on the Mutiny Act, etc
003242628	1817	SANDERS, Charles	trial and conviction of C. Sanders at Warwick Lent Assizes, 1817, for the wilful murder of G. Rogers, etc
003243086	1816	SANDERS, Prince.	By Authority. Haytian Papers. A Collection of ... Proclamations, and other official documents; together with some account of the rise, progress, and present state of the Kingdom of Hayti. With a preface by P. Sanders
003246890	1814	SANSOM, James.	Carmen Triumphale; for the year 1814
003246894	1817	SANSOM, Joseph.	Sketches of Lower Canada, historical and descriptive, etc
003252054	1817	SARGANT, Jane Alice.	Sonnets and other poems
