Book	Smell_Word	Smell_Source	Quality	Full_Sentence
abc63	duh	žveplovega dvokisa|aldehidom|hidovo žveplovo sokislino|žveplov dvokis|vinsko cvetico	prijeten	Zmerne množine žveplovega dvokisa se že v nekaj urah , večje množine pa gotovo v 8 do 10 dneh spoje z ocetnim aldehidom v alde - hidovo žveplovo sokislino , ki je ne samo zdravju veliko manj neprikladna , ampak ima tudi veliko bolj prijeten duh kakor žveplov dvokis in se z vinsko cvetico ( buketom ) prav ^ dobro vjema .
abc63	duha	azbest	smodečega	Ponatisi iz » Kmetovalca « so dovoljeni le tedaj , če se navede vir boljši , ker azbest ne gori in torej pri žveplanju ne razvija smodečega duha , kakor pri gorenju popirja , ali pa še bolj pri platnu .
abc63	duha	azbest	smodečega	Ponatisi iz » Kmetovalca « so dovoljeni le tedaj , če se navede vir boljši , ker azbest ne gori in torej pri žveplanju ne razvija smodečega duha , kakor pri gorenju popirja , ali pa še bolj pri platnu .
abc63	smrdljiv	žveplo|žveplovodik		Če žveplo kaplja v sod , se tam zopet strdi , in če se tak sod potem rabi za kipenje mošta , se pri kipenju spreminja žveplo v smrdljiv žveplovodik .
abc63	dišavami|smrdi	rožami|roža	najboljša	Od trakov , ki je na njih žveplo potrošeno z raznimi rožami ( dišavami ) , odločno odsvetujem , ker najboljša roža smrdi , kadar se zažge .
abc63	dišavami|smrdi	rožami|roža	najboljša	Od trakov , ki je na njih žveplo potrošeno z raznimi rožami ( dišavami ) , odločno odsvetujem , ker najboljša roža smrdi , kadar se zažge .
abc63	duh		neprijeten|tuj	Stem se lehko v vino spravi neprijeten ali tuj duh .
abc63	dišeča	sol	bela|močno	To je bela , močno po žveplovem dvokisu dišeča sol .
abc63	dišeča	sol	bela|močno	To je bela , močno po žveplovem dvokisu dišeča sol .
abc63	duh	po žveplovem dvokisu		Preden se žveplan sod zopet za vino rabi , ga je treba dobro pomiti , da se duh po žveplovem dvokisu , oz .
abc63	okus	žveplove kisline	neprijeten|sirov	V takih sodih se lehko nahaja precej znatna množina žveplove kisline , ki lehko da vinu neprijeten , sirov okus .
abc63	okus	žveplove kisline	neprijeten|sirov	V takih sodih se lehko nahaja precej znatna množina žveplove kisline , ki lehko da vinu neprijeten , sirov okus .
abc63	duh	po dotičnem žganju .		Les takih sodov , ki znotraj niso namazani , je torej za vino zadosti izlužen , vendar pa mu je treba vzeti duh po dotičnem žganju .
abc63	duh	trava|erba sedrera|trava	močan	Ali Vam je znana neka trava z imenom erba sedrera , ki neki rase v Braziliji in morda tudi pri nas ? Ta trava ima namreč močan duh , ki ga čebele tako ljubijo , da gredo ob rojenju same v panj in ne pobegnejo , če se takrat panj s to travo namaže .
abc63	duh	trava|erba sedrera|trava	močan	Ali Vam je znana neka trava z imenom erba sedrera , ki neki rase v Braziliji in morda tudi pri nas ? Ta trava ima namreč močan duh , ki ga čebele tako ljubijo , da gredo ob rojenju same v panj in ne pobegnejo , če se takrat panj s to travo namaže .
abc63	vonj	Šetraj	jako močan	Šetraj ima resnično jako močan vonj , ki je morda čebelam res priljubljen , če pa ima v čebelarstvu tak pomen , kakor mu ga Vi pripisujete , nam ni znano .
abc63	vonj	Šetraj	jako močan	Šetraj ima resnično jako močan vonj , ki je morda čebelam res priljubljen , če pa ima v čebelarstvu tak pomen , kakor mu ga Vi pripisujete , nam ni znano .
abc64	dišeča	vina	sladka peneča	Pač pa veljajo določila tega zakona za sladka peneča in dišeča vina , čeprav so za njih pripravo dovoljene nekatere izjeme .
abc64	dišeča	vina	sladka peneča	Pač pa veljajo določila tega zakona za sladka peneča in dišeča vina , čeprav so za njih pripravo dovoljene nekatere izjeme .
abc64	dišečih|esenc	glicerina|snovi|boraksa|salicilne kisline|formaldehida		, glicerina , škrobnega sladkorja , nečistega špirita , tamarind in izdelkov vsake vrste iz tamarind , sadnega vina ali sadnega mošta , gume in snovi , ki povečajo ekstrakt , dišečih snovi , esenc , ostankov od izdelovanja konjaka , barvil , kislin , kislih snovi , raztopnega galuna , soli , barijevih , stron - cijevih in magnezijevih spojin , mavca , borove kisline , boraksa , salicilne kisline , formaldehida , raztopnih spojin fluorja in sploh zmesi , ki vsebujejo katero teh snovi .
abc64	dišečih	vin	sladkih|penečih	Dasi ima to za naše kraje manj pomena , hočem omeniti še to , kaj določa postava glede sladkih , penečih in dišečih vin .
abc64	dišečih	vin	sladkih|penečih	Dasi ima to za naše kraje manj pomena , hočem omeniti še to , kaj določa postava glede sladkih , penečih in dišečih vin .
abc64	Dišeča|dišečih	vina|rož	zdravilnih	Dišeča vina so pa taka , katerim se dodene kakih dišečih ali zdravilnih rož .
abc64	Dišeča|dišečih	vina|rož	zdravilnih	Dišeča vina so pa taka , katerim se dodene kakih dišečih ali zdravilnih rož .
abc64	Dišečim	vinom		Dišečim vinom se poleg tega lahko dodene onih primesij , ki jih je treba , da se doseže nameravani okus .
abc64	dišava		kisloba	Penečim vinom se lahko dodenejo tudi one primesi , ki jih je treba , da se doseže primerna kisloba in dišava , čeprav so te snovi za navadna vina po tej postavi prepovedane .
abc64	dišeče	vino	začinjeno	Ravnotako se ne sme prodajati dišeče ali začinjeno vino pod kakim imenom , ki ga ne da kot takega spoznati .
abc64	dišeče	vino	začinjeno	Ravnotako se ne sme prodajati dišeče ali začinjeno vino pod kakim imenom , ki ga ne da kot takega spoznati .
abc64	dišeča	vina	sladka|peneča	Kdor pa hoče sladka , peneča ali dišeča vina za prodajo izdelovati , mora to naznaniti politični oblasti prve stopnje ( okrajnemu glavarstvu oz .
abc64	dišeča	vina	sladka|peneča	Kdor pa hoče sladka , peneča ali dišeča vina za prodajo izdelovati , mora to naznaniti politični oblasti prve stopnje ( okrajnemu glavarstvu oz .
abc65	dišale	po kadilu		Večer je bil pred Veliko nočjo , nebo , vse blesteče v veselju in svetlobi , je objelo zemljo v najtesnejšem in najopojnejšem objemu , vse ulice so dišale po kadilu , ljudje toliko da se niso polju - bovali — samo dobri angeli vedo , kje so tačas otroške misli .
abc65	duh	po mrliču|svečah	težak	Pogledal sem mrliča in zazdelo se mi je , da sta obe ustnici črnordeči ; bil sem slaboten otrok in v sobi je bil težak duh po mrliču in svečah .
abc65	duh	po mrliču|svečah	težak	Pogledal sem mrliča in zazdelo se mi je , da sta obe ustnici črnordeči ; bil sem slaboten otrok in v sobi je bil težak duh po mrliču in svečah .
abc65	vonj	šmarnic|nageljnov		In takrat v tistem velikonočnem jutru , po prečuti noči , polni strahu in nemira , se je rodilo v otroški duši težko vprašanje — danes se ga zavedam — vprašanje ne - izraženo z besedami , a globoko občuteno v srcu : Življenje — ali nam je brat aH očim ? In smrt — ali nam je mačeha ali sestra ? — — — — — Nocoj pa , ko slonim samoten ob oknu in gledam v mirno jesensko noč , morda zadnjo lepo jesensko noč , ko odpada listje s trudnih dreves , ko šumi pred menoj narasla kalna reka in nebo cvete s pomladno močjo , cvete v milijonih cvetov , da čutim skoro vonj šmarnic in nageljnov , nocoj mi je tako lahko in mirno pri srcu .
abc65	vonjem		neizrazno opojnim	Jutri pade morda že s hribov gosta megla , hladna in strupena , da bomo vsi trudni in smrti blizu kot jesenska drevesa , ampak nad meglo vendar cvete nebo z neizrazno opojnim vonjem .
abc66	duh		neprijeten	Vzrok temu pa je , če je v panju neprijeten duh ali prevelika vročina .
abc66	smrdi|smrad		občutljiv	Gnilobo spoznaš 1 ) iz žrela smrdi , 2 ) čebele žalostno letajo , 3 ) panj vedno bolj slabi , 4 ) nered pri zalegi , 5 ) znotraj je občutljiv smrad .
abc67	duhti	rožmarin		V vasici skriti sred planin duhti na oknu rožmarin .
abc67	duhti	Cvetove|nagelj	opojno	Cvetove nosi nagelj tri , žari , opojno v noč duhti .
abc67	duhti	Cvetove|nagelj	opojno	Cvetove nosi nagelj tri , žari , opojno v noč duhti .
abc67	duhti	rožmarin		A rožmarin duhti zastonj , nihče , nihče ne pride ponj .
abc67	vonjivega	dima .		Na stolovo naslonilo je oprl desnico , s katero je držal rokopis , v levici pa je sukal svalčico in zdajpazdaj jo pritaknil k ustom ter izpustil nekaj kolobarjev vonjivega dima .
abc67	duh		mrtvaški	V sobi je še vladal mrtvaški duh .
abc67	diši	mlado cvetje	Opojno	Kaj bi potem Mrak počel ! """" - - ______ - - - - - - Opojno diši na vrtu mlado cvetje .
abc67	diši	mlado cvetje	Opojno	Kaj bi potem Mrak počel ! """" - - ______ - - - - - - Opojno diši na vrtu mlado cvetje .
abc67	vzduh		Težak|mamljiv	Težak , mamljiv vzduh napolnjuje celo sobo .
abc67	dišeče	cvetove		Lahek večerni vetrič ziblje dišeče cvetove .
abc67	dišečih|duhom	rož	močno|opojnim	Žalostna povest o zapuščenem , prevaranem dekletu , ki v svojem obupu nanosi močno dišečih rož na svojo postelj , da jo zaduše s svojim opojnim duhom .
abc67	dišečih|duhom	rož	močno|opojnim	Žalostna povest o zapuščenem , prevaranem dekletu , ki v svojem obupu nanosi močno dišečih rož na svojo postelj , da jo zaduše s svojim opojnim duhom .
abc67	vonjava	mladega cvetja		Z vrta sem prihaja vonjava mladega cvetja .
abc67	vonj	hijacint	strupem	Vsa postelja je polna hijacint in kako strupem je njihov vonj .
abc67	vonj	hijacint	strupem	Vsa postelja je polna hijacint in kako strupem je njihov vonj .
abc67	zakajene		neokusne	In kaj je celo z našimi deklicami ! Poglejte v te kmečke bajte , poglejte zanemarjeva stanovanja , zakajene , neokusne kuhinje .
abc67	diši	Vaša kremška gorčica	Posebno|znamenito	Posebno Vaša kremška gorčica mi znamenito diši uživamo jo pri vsaki priložnosti .
abc67	diši	Vaša kremška gorčica	Posebno|znamenito	Posebno Vaša kremška gorčica mi znamenito diši uživamo jo pri vsaki priložnosti .
abc67	duh		prijeten|pikanten okus|imeniten	Sploh daje vsaki jedi in prikuhi posebno prijeten in pikanten okus in imeniten duh .
abc67	okus	vsake jedi	Prijeten	Prijeten okus vsake jedi je predpogoj dobrega teka , dober tek pa je temelj zdravja .
abc67	okus	vsake jedi	Prijeten	Prijeten okus vsake jedi je predpogoj dobrega teka , dober tek pa je temelj zdravja .
abc67	ne diši	Agnola|brez Vydrove kave zajutrek		Agnola , zaloga stekle in porcelana v Ljubljani : Blagovolite naročeno poslati obratno , ker brez Vydrove kave zajutrek ne diši .
abc68	smrad		neiznosen	Dravbergu ; bolj ko se mi je bližal , bolj sem občutil neki neiznosen smrad .
abc68	smrdi	Cukr|kofe|žajfo|žafran		« Prijatelj , 44 ga vprašam , « kaj pa imaš v « puklsoku44 , da tako strašansko smrdi ? 44 « Cukr , kofe , žajfo , žafran itd .
abc68	ne smrdijo			« Takšne reči pa ja ne smrdijo , kje pa si kupil44 , vprašam zopet .
abc68	smrdljivega|zavohal			44 Vesel nad tem , da imam tako dober nos , ker sem smrdljivega « Štajerca44 že od daleč zavohal , sem si naredil o Lorbeku , pravilno Konrad Lorber , takoj svojo sodbo .
abc69	vzduhom		strupenim	, govori : » Delavec , ki kanale čisti , in tako ljudi pred strupenim vzduhom varuje , človeški družbi več koristi , kakor duhovnik , ki s svojimi nadnaravnimi nauki ljudem glave meša « .
abc69	smrdeti	po gnojnici		Sedaj , delavci , pa sodite , kdo ima smrdeti po gnojnici ? Tisti , ki odločno varuje denar , ki je skupna last delavcev , ali tisti , ki ga hoče razbrskati tako , da bi koristil le nekaterim , največ pa kapitalistu .
abc71	dišeče	belo vino		Tako se dobi zelo dobro , malo temno , a dišeče belo vino , ki se lažje proda ko rdeče .
abc71	smrdi	žveplo		Za žveplanje pa se mora rabiti popolnoma čisto žveplo , ki ne kaplja in ne smrdi .
abc71	vonj|okus	rži|žitna kava	močan	^ Franckova : špecijaliteta rži : Perl - rž ^ gg * kot najbolja žitna kava , močan vonj , kavi podobni okus , snažno izdelovanje in slastni zavoji .
abc71	vonj|okus	rži|žitna kava	močan	^ Franckova : špecijaliteta rži : Perl - rž ^ gg * kot najbolja žitna kava , močan vonj , kavi podobni okus , snažno izdelovanje in slastni zavoji .
abc72	aroma	oljk , citron|pomaranč|oleandrov .		Nič manj otožen nisem nego tam doli , v oni dragi celici , v katero so prodirali šepetajoči morski valčki , v katero je pronicala aroma oljk , citron , pomaranč in oleandrov .
abc73	duh	čebule		Muhe duh od čebule ne preneso in ti puste tudi meso pri miru .
abc73	duhom	Lilija|beloto	opojnim	Lilija je kras vsakemu vrtu s svojo deviško beloto in opojnim duhom .
abc73	duhom	Lilija|beloto	opojnim	Lilija je kras vsakemu vrtu s svojo deviško beloto in opojnim duhom .
abc73	okus|duh	Jabolka	prijeten	Jabolka za jabolkov morajo biti popolnoma zrela in vil ž a n a ; naravnost z dreves niso nora na , ker takrat v njih še niso dovc razvite razne snovi , ki jim pozneje d do prijeten okus in duh .
abc73	okus|duh	Jabolka	prijeten	Jabolka za jabolkov morajo biti popolnoma zrela in vil ž a n a ; naravnost z dreves niso nora na , ker takrat v njih še niso dovc razvite razne snovi , ki jim pozneje d do prijeten okus in duh .
abc73	okus	Mlečni sladkor	lahno sladak|prijeten	Mlečni sladkor daje mleku lahno sladak in prijeten okus .
abc73	okus	Mlečni sladkor	lahno sladak|prijeten	Mlečni sladkor daje mleku lahno sladak in prijeten okus .
abc73	vonj	kava|kavo	prijeten	Če kavi pridenemo Kolinske kavne primesi v korist obmejnim Slovencem , dobi kava tudi prijeten vonj , ki kavo takoj vsakemu priljubi .
abc73	vonj	kava|kavo	prijeten	Če kavi pridenemo Kolinske kavne primesi v korist obmejnim Slovencem , dobi kava tudi prijeten vonj , ki kavo takoj vsakemu priljubi .
abc73	okusa|vonja	kava|kava	dobrega|prijetnega	In slednjič dobi kava od Kolinske kavne primesi lepo barvo , ki je dobra kava ravno 11 » tako malo sme pogrešati , kakor dobrega okusa in prijetnega vonja .
abc73	okusa|vonja	kava|kava	dobrega|prijetnega	In slednjič dobi kava od Kolinske kavne primesi lepo barvo , ki je dobra kava ravno 11 » tako malo sme pogrešati , kakor dobrega okusa in prijetnega vonja .
abc74	duh	mleko	neprijeten	V zaduhlih kleteh shranjeno mleko ima neprijeten duh in postane tudi lahko škodljivo .
abc74	duh	mleko	neprijeten	V zaduhlih kleteh shranjeno mleko ima neprijeten duh in postane tudi lahko škodljivo .
abc74	duh|zaduhel		mastna|sladak	Dobra pšenična moka je bela , v roki se čuti volna in mastna , duh ji mora biti nekako sladak ne zaduhel .
abc74	duh|okus		neprijeten	Ako postane vlažna , ali ako je dolgo v zaprtem prostoru , dobi takoj neprijeten duh in okus .
abc74	dišati	kvas|po sadju	kislo	Dober kvas mora dišati po sadju ne kislo , tudi se ne sme drobiti .
abc74	dišati	kvas|po sadju	kislo	Dober kvas mora dišati po sadju ne kislo , tudi se ne sme drobiti .
abc74	začimb	popra|paprike|klinčkov		Preslana jed , ali jed , v kateri je veliko začimb , kakor popra , paprike , klinčkov in drugih , ne koristi nikomur , škoduje pa otrokom .
abc74	vonj	vpinjenega masla	lep	Ko odpre pinjo , ji pride nasproti lep vonj in živa barva vpinjenega masla , kar jo razveseli na prvi pogled v pinjo .
abc74	vonj	vpinjenega masla	lep	Ko odpre pinjo , ji pride nasproti lep vonj in živa barva vpinjenega masla , kar jo razveseli na prvi pogled v pinjo .
abc74	diše	roža|stim cvetjem	prijetno	Prvi so tisti drobni z roža - stim cvetjem , takozvani » Binkoštni « , cveto koncem maja in prav prijetno diše .
abc74	diše	roža|stim cvetjem	prijetno	Prvi so tisti drobni z roža - stim cvetjem , takozvani » Binkoštni « , cveto koncem maja in prav prijetno diše .
abc74	diše		prijetno	Aprila že cveto in silno prijetno diše .
abc74	dišeč		lepo	Da bo pa res tak in še lepo dišeč , treba poskrbeti in pripraviti sedaj .
abc74	duh	Glivice	neprijeten	Glivice , ki nastanejo , povzročijo gnilobo zob in neprijeten duh .
abc74	duh	Glivice	neprijeten	Glivice , ki nastanejo , povzročijo gnilobo zob in neprijeten duh .
abc74	dišalo	čaja|kave		— Ali pa malo mesa ? — Tudi ne ! — ДН pa malo mleka ? — Tudi ne ! — Pa čaja ? — Tudi ne ! Ampak veste mati , kaj mi napravite , da mi bo dišalo ? Malo kave , pa seveda s KolInsllD feaoSnsi prliiSSSlO — drugačne ne maram ! — to bi pa rada pila .
abc74	dišeče	kave	prijetno	— Tako sem dejala materi in kmalu sem imela pred seboj skodelico prijetno dišeče kave .
abc74	dišeče	kave	prijetno	— Tako sem dejala materi in kmalu sem imela pred seboj skodelico prijetno dišeče kave .
abc74	ne diši	jed|kava		S „ Koiinsko kavino primesjo """" gre kava vedno vsakemu v slast , kajti , če nimaš teka in ti nobena jed ne diši , je ta kava najboljše sredstvo proti temu .
abc75	okus	zdravo mleko|mleko	okusno|redilno|škodljivo|strupeno|zoprn	Kakor je zdravo mleko okusno in redilno , tako je pokvarjeno mleko škodljivo , celo lahko tudi strupeno in ima zoprn okus .
abc75	okus	zdravo mleko|mleko	okusno|redilno|škodljivo|strupeno|zoprn	Kakor je zdravo mleko okusno in redilno , tako je pokvarjeno mleko škodljivo , celo lahko tudi strupeno in ima zoprn okus .
abc75	gnjijejo|dišijo		močno kislo	Predvsem pa mora paziti , da ne daje v to shrambo stvari , ki gnjijejo ali močno kislo dišijo .
abc75	duhlo diši	Mleko		Mleko v zaprti kangli za - duhlo diši .
abc76	smrad	gnojnica	škodljiva	Gnojna jama se pred hišni prag ne sme napravljati , ampak za hlev v kak senčni kraj ; gnojnica je zdravju , škodljiva in kjer je smrad , ne gre rad pošten človek blizu .
abc76	smrad	gnojnica	škodljiva	Gnojna jama se pred hišni prag ne sme napravljati , ampak za hlev v kak senčni kraj ; gnojnica je zdravju , škodljiva in kjer je smrad , ne gre rad pošten človek blizu .
abc76	smrde		kislo	Kako je sploli mogoče imeti prašičem tek do hrane , ko korita tako kislo smrde , ako se jim od daleč približamo .
abc76	duh	vanilje		Vmešaj 10 dkg suro - j vega mesla , 10 dkg sladkorja , 2 rume - i njaka ; ko si že četrt ure mešala , pridaj j zrezane limonine lupine in vanilje za j duh , počasi pridevaj osminko litra in še dve žlici mleka , prideni iz 2 beljakov ' sneg , četrt kiloerama moke in nazad - j nje 1 dkg pecilnega praška .
abc76	okus	kis		Posebno dober je ta kis za obare , jim daje prijeten okus .
abc76	vonj	kava|kavo	prijeten	Ce kavi pridenemo Kolinske kavne primesi v korist obmejnim Slovencem , dobi kava tudi prijeten vonj , ki kavo takoj vsakemu priljubi .
abc76	vonj	kava|kavo	prijeten	Ce kavi pridenemo Kolinske kavne primesi v korist obmejnim Slovencem , dobi kava tudi prijeten vonj , ki kavo takoj vsakemu priljubi .
abc76	vonja	kava	dobrega okusa|prijetnega	In slednjič dobi kava od Kolinske kavne primesi lepo barvo , ki je dobra kava ravno 112 tako malo sme pogrešati , kakor dobrega okusa in prijetnega vonja .
abc76	vonja	kava	dobrega okusa|prijetnega	In slednjič dobi kava od Kolinske kavne primesi lepo barvo , ki je dobra kava ravno 112 tako malo sme pogrešati , kakor dobrega okusa in prijetnega vonja .
abc77	duh|okus		neprijeten	Duh po plesuobi izvira iz tvarin , ki imajo neprijeten duh in okus ; vsakrat , kadar se poloti plesuoba lesu v .
abc78	duh	sape	značilen	Od tod značilen duh , ki prihaja od sape pijanega človeka .
abc78	duh	sape	značilen	Od tod značilen duh , ki prihaja od sape pijanega človeka .
abc78	duh	po alkoholu	značilen	Radi tega ima celo postelja , v kateri je ležal pijanec , nek značilen duh po alkoholu .
abc78	duh	po alkoholu	značilen	Radi tega ima celo postelja , v kateri je ležal pijanec , nek značilen duh po alkoholu .
abc79	uduši	tobakov dim		Profesor VVenck le dokaza ! , da tobakov dim uduši najkasneje v petih minutah vse kolerične mikrobe , ki se zbirajo v ustih .
abc79	dišala		prijetno	Ženska hoče na vsak način , da bi prijetno dišala — torej ima parfumiranje fiziologičen temelj , že v starem veku priznan .
abc79	dišavo	vina		Horac je namreč zahteval za stekleničico , napolnjeno z levandulo - vo dišavo sodček najimenitnejšega vina iz pro - slulih kleti bratov Sulpicijev .
abc79	vonj	levandule		Takrat se je vonj levandule plačal sa - mo z zlatim denarjem .
abc79	dišave|dišeče	kadilo|kadilom|kadilo		Trije kralji so prinesli Jezusu v dar dišave daljnega Vzhoda : kadilo in miro ; kajenje v cerkvah s kadilom je ostanek davnih časov , ko je bilo dišeče kadilo nekaj svetega .
abc79	dišeče	olje		Pri gostijah starih Grkov in Rimljanov se je zažigalo dišeče olje , o čemur pričajo raznovrstne svetiljke in priprave za sežiganje olja .
abc79	dišečim	oljem|palmovim oljem|majarona		Grki so si mazali ro - samezne dele telesa z raznim dišečim oljem : obraz s palmovim oljem , roke z balzamom mcn - te , lase z » esenco « majarona , brado in vrat s timijanom .
abc79	dišečih	kadil		Neron je dal na dan smrti svoje svoje žene Popeje zažgati toliko dišečih kadil , kolikor so jih tisto leto prinesli iz cele Arabije .
abc79	vohal|vonj		prijeten	Šele francoski kralji so povrnili nosu njegovo pravico , da bi vohal prijeten vonj .
abc79	dišečih	parfumov		je moral biti neprestano v atmosferi dišečih parfumov .
abc79	dišavo	sovo		Riclielien je rad rabil mošu - sovo dišavo .
abc79	duh	po mošusu .		Ko je odšel , je morala vojvodinja nekaj tednov zračiti sobo , v kateri je stanoval , predno je izginil iz nje duh po mošusu .
abc79	parfumirane|dišavami		najdražjimi	Flaubert je dajal svoji Salambo parfumirane na - ušnice in Judita se je namazala z najdražjimi dišavami , predno je šla k Holofernu .
abc81	vonjava|vonjava|vonjava|vonjava|vonjava|vonjava|vonjava|vonjava	žveplo|Saturnova|aloa|Jupitrova ; stiraks|Martova ; lovor|solnca ; muškat|Venere ; brinje ,|Merkurjeva ; bezeg ,|lune|kadilo		„ To je žveplo , vonjava Saturnova ; to je aloa , vonjava Jupitrova ; stiraks , vonjava Martova ; lovor , vonjava solnca ; muškat , vonjava Venere ; brinje , vonjava Merkurjeva ; bezeg , vonjava lune , in naposled kadilo , ki je sintetična vonjava .
abc83	smrdečo	vrelko ( kubin ali birso )		Tako vino """" močno šumi in v najkrajšem času se izprerneni žlahtna vinska kapljica v bolj gnojnici kakor vinu podobno smrdečo tekočino — za - vrelko ( kubin ali birso ) .
abc84	diši	skleda tople juhe		) Še eno ! Okoli mize , na kateri diši skleda tople juhe , čaka sedem lačnih otrok z očetom vred .
abc84	diši	jed	bolje	» Takoj veš , katera jed bolje diši .
abc84	diši	jed	bolje	» Takoj veš , katera jed bolje diši .
abc84	dišale|vohala	dezertke	imenitno	Drobna Milica , kateri so dezertke vselej tako imenitno dišale , je molče opazovala svojo mamico , tudi to je opazila , da je mati pozabila omarico zakleniti , in ko je mati po kosilu umivala v kuhinji posodje , se je Milica kakor mišika izmuznila iz sobe , tihoma odprla omarico , stopila na prste , z noskom vohala ter se vzpenjala navzgor , da je vsa zardela .
abc84	dišale|vohala	dezertke	imenitno	Drobna Milica , kateri so dezertke vselej tako imenitno dišale , je molče opazovala svojo mamico , tudi to je opazila , da je mati pozabila omarico zakleniti , in ko je mati po kosilu umivala v kuhinji posodje , se je Milica kakor mišika izmuznila iz sobe , tihoma odprla omarico , stopila na prste , z noskom vohala ter se vzpenjala navzgor , da je vsa zardela .
abc84	dišečimi	dim od smodke	Fini	Fini dim od smodke ga je zagrnil z dišečimi meglami , ki so v naju obudile nebroj spominov .
abc84	dišečimi	dim od smodke	Fini	Fini dim od smodke ga je zagrnil z dišečimi meglami , ki so v naju obudile nebroj spominov .
abc84	dišejo		svobodno	Blagor jim ! Njim naznani ura konec dela in sedaj dišejo svobodno , A mi ? Nam določa delo čas počitka ; in da se vedno po istem ravnamo , tedaj bi sploh ne bilo za nas miru .
abc84	vzduh|vzduh		Čuden	Ženske , same ženske ! Zbogom prostost in večerni izprehod ! Čuden vzduh me obda ; vzduh , ki se vedno vsak dan širi po mestnih ulicah , čim odbije ura šest .
abc84	vonj	tobakovi	močni	Takrat namreč privre iz tobačne tovarne močan tok delavstva — izvečine žensk — in valovi križem po mestu , razširjajoč s svojimi oblačili silno močni tobakovi vonj po ozračju .
abc84	vonj	tobakovi	močni	Takrat namreč privre iz tobačne tovarne močan tok delavstva — izvečine žensk — in valovi križem po mestu , razširjajoč s svojimi oblačili silno močni tobakovi vonj po ozračju .
abc84	vonj	tobakovi		In — skoro me posili smeh — v rezki tobakovi vonj se meša odnekod parfum .
abc84	duhli	sapi siromaštva		Zadušila se je v tesnobi , v za - duhli sapi siromaštva .
abc84	duh		Aromatičen	Aromatičen duh se širi po kuhinji ter oživlja nekoliko njene težke živce .
abc84	dišečo	vročo kavo		Iz omare vzame šalice ter nalije dišečo , vročo kavo .
abc84	diše|dišavi	svile	prijetno po dragoceni	Posteljnina pa je fina , same čipke , odeja iz svile , blazine diše prijetno po dragoceni dišavi .
abc84	diše|dišavi	svile	prijetno po dragoceni	Posteljnina pa je fina , same čipke , odeja iz svile , blazine diše prijetno po dragoceni dišavi .
abc84	diši	Vaša otroška moka	imenitno	13 : Vaša otroška moka imenitno diši naši Libuški , kmalu jo bo zopet pojedla , zavoljo tega jo znovič naročujem .
abc84	diši	Vaša otroška moka	imenitno	13 : Vaša otroška moka imenitno diši naši Libuški , kmalu jo bo zopet pojedla , zavoljo tega jo znovič naročujem .
abc84	diši	moka	neizmerno	13 : Našemu otroku Vaša moka neizmerno diši , zato nam je pošljite zopet 3 kg .
abc84	diši	moka	neizmerno	13 : Našemu otroku Vaša moka neizmerno diši , zato nam je pošljite zopet 3 kg .
abc85	duh		Nov	— Nov duh v novomeški žandarmeriji .
abc85	smrdi		nesramno	— Spoznal sem takrat na obrazu vrhovnega sodruga , da v socialno demokratični državi bodočnosti nesramno smrdi .
abc86	okus	sveže zelenjave	sveže	Ako se potem vzame zelenjavo iz lonca , se lahko prepričamo , da izgleda popolnoma sveže in če se skuha , ima tudi popoten okus sveže zelenjave .
