Book	Smell_Word	Smell_Source	Quality	Full_Sentence
abc18	dišeči	cveti	rudeči	Konec vej stojijo na kratkih receljčkih v kobulu dišeči , rudeči cveti .
abc18	Dišeči	volčin		Dišeči volčin cvete od velikega travna do malega srpana in raste po vapnenem svetu naših gor in planin .
abc18	dišečih	zrnic ( hmelj eva moka )	rumenih|močno	Ti storži imajo razun malih plodov g ) in h ) , ki so se razvili iz okrogle plodnice f ) , ob dnu tudi mnogo rumenih , močno dišečih zrnic ( hmelj eva moka ) grenkega okusa .
abc18	dišečih	zrnic ( hmelj eva moka )	rumenih|močno	Ti storži imajo razun malih plodov g ) in h ) , ki so se razvili iz okrogle plodnice f ) , ob dnu tudi mnogo rumenih , močno dišečih zrnic ( hmelj eva moka ) grenkega okusa .
abc18	Zelišče	koprive		Zelišče od male koprive služi ljudem za neškodljivo domače zdravilo , ali vendar je treba previdnosti , kakor nas pouči sledeči dogodek .
abc18	zelišča	koprive		Po nasvetu neke ma - začke si je skuhala zelišča od male koprive , izpila dve skledici in se vlegla v postelj .
abc18	vohaš	zelišče	presno	Ako vohaš presno zelišče , jame te boleti glava , in sicer tako silno , da omotica napada nektere ljudi , ki pipljejo konoplje .
abc18	vohaš	zelišče	presno	Ako vohaš presno zelišče , jame te boleti glava , in sicer tako silno , da omotica napada nektere ljudi , ki pipljejo konoplje .
abc18	zelišče	drnóselj|močvirsko		Žgoči drčsen , dr d rés ali drnóselj je jednoletno močvirsko zelišče , čegar okroglo steblo je pritrjeno na dolgi , členkoviti korenini , ki je prav za prav le nekoliko izpremenjeno steblo .
abc18	zelišče diši		Presno|zoperno|neprijetnega|ostrega okusa	Presno zelišče diši zoperno in je neprijetnega , ostrega okusa .
abc18	zelišče	Navadni mleček		Navadni mleček je izmed tega rodü morda najbolj razprostrto zelišče .
abc18	zelišče	Žitni mleček		Žitni mleček cvete malega in velikega srpana in je po pokrajinah okoli Sredozemskega morja prav navadno zelišče na obdelani in neobdelani zemlji .
abc18	zelišče	Nasprotnolistni mleček	sivkasto	Nasprotnolistni mleček je jednoletno , golo zelišče sivkasto - zelene ali rudečkaste barve , ki raste na peščenih morskih bregovih okoli Sredozemskega morja .
abc18	zelišče	Nasprotnolistni mleček	sivkasto	Nasprotnolistni mleček je jednoletno , golo zelišče sivkasto - zelene ali rudečkaste barve , ki raste na peščenih morskih bregovih okoli Sredozemskega morja .
abc18	diši	Korenika	zoperno|grenkega|ostrega okusa	Korenika diši zoperno in je grenkega , ostrega okusa .
abc18	diši	Korenika	zoperno|grenkega|ostrega okusa	Korenika diši zoperno in je grenkega , ostrega okusa .
abc18	dišijo	cveti|po vanilji	dobro	Veliki , krasni cveti stojijo posamič v listnih pazušicah in so vredni malega truda , ker prav dobro dišijo po vanilji in ugajajo tudi očem .
abc18	dišijo	cveti|po vanilji	dobro	Veliki , krasni cveti stojijo posamič v listnih pazušicah in so vredni malega truda , ker prav dobro dišijo po vanilji in ugajajo tudi očem .
abc18	smrdljivega		belega|ostrega	Vsi deli te rastline , zlasti listi imajo v sebi mnogo belega , zelò ostrega , smrdljivega soka , ki hitro počrni na zraku .
abc18	dišijo	Presni listi ( igle )	neprijetno|neprijetnega|ostrega|grenkega okusa	Presni listi ( igle ) dišijo neprijetno in so neprijetnega , nekoliko ostrega in grenkega okusa .
abc18	dišijo	Presni listi ( igle )	neprijetno|neprijetnega|ostrega|grenkega okusa	Presni listi ( igle ) dišijo neprijetno in so neprijetnega , nekoliko ostrega in grenkega okusa .
abc18	smrdljiva	brina		Posebno pa deluje smrdljiva brina na krvni obtok .
abc18	smrdi		preveč	Živali se ne dotaknejo te rastline , in najbrž utegnemo pravo zadeti , ako trdimo , da zavoljo tega ne , ker jim preveč smrdi .
abc18	diši	Presna korenika modre perunike	zopernega|ostrega|žgočega okusa|neprijetno	Presna korenika modre perunike je zopernega , ostrega in žgočega okusa ter neprijetno diši .
abc18	diši	Presna korenika modre perunike	zopernega|ostrega|žgočega okusa|neprijetno	Presna korenika modre perunike je zopernega , ostrega in žgočega okusa ter neprijetno diši .
abc18	diši	Presna korenika	zoperno|ostrega okusa	Presna korenika zoperno diši in je ostrega okusa .
abc18	diši	Presna korenika	zoperno|ostrega okusa	Presna korenika zoperno diši in je ostrega okusa .
abc18	duh		prijeten	Posebno veselje pa nam delajo take , ki niso le lepe in nežne , ampak ki razširjajo okoli sebe tudi prijeten duh .
abc18	dišeče	cvetke		Vendar se lahko tolažimo , ker tiči škodljivi del precej globoko v zemlji in ostane v njej , kedar trgamo dišeče cvetke .
abc18	nežua|dišeča	cvetka		Pozneje se razcepi , da more nežua in dišeča cvetka na beli dan .
abc18	dišeč	cvet	kimast	V vrhu nosi kimast , dišeč cvet a ) .
abc18	dišeč	cvet	kimast	V vrhu nosi kimast , dišeč cvet a ) .
abc18	diši	Rastlina	neprijetno	Rastlina diši neprijetno , in ako imaš mnogo opraviti okoli nje , bolela te bo rada glava .
abc18	diši	Rastlina	neprijetno	Rastlina diši neprijetno , in ako imaš mnogo opraviti okoli nje , bolela te bo rada glava .
abc18	diši	cvetje	prijetno	Badi ga imajo ljudje tudi po vrtih , ker njegovo cvetje prijetno diši .
abc18	diši	cvetje	prijetno	Badi ga imajo ljudje tudi po vrtih , ker njegovo cvetje prijetno diši .
abc18	dišečega	cvetja	lepega|prijetno|modro|belo	Nam se je prikupila zavoljo lepega , prijetno dišečega cvetja , ki je ali modro , belo , rudečkasto ali pa rumenkasto .
abc18	dišečega	cvetja	lepega|prijetno|modro|belo	Nam se je prikupila zavoljo lepega , prijetno dišečega cvetja , ki je ali modro , belo , rudečkasto ali pa rumenkasto .
abc18	dišeče	šmarnice		Ne boj se , tvoje ljubljenke , dišeče šmarnice ne bomo tukaj opisali ; ona je popolnoma nedolžna .
abc18	diši	Presna korenika	zoperno|grenkega|ostrega|žgočega okusa	Presna korenika diši zoperno in je grenkega , ostrega in žgočega okusa .
abc18	diši	Presna korenika	zoperno|grenkega|ostrega|žgočega okusa	Presna korenika diši zoperno in je grenkega , ostrega in žgočega okusa .
abc18	zelišče	svinjam	škodljivo	Tudi svinjam je zelišče škodljivo .
abc18	zelišče	svinjam	škodljivo	Tudi svinjam je zelišče škodljivo .
abc18	zelišču	volčje jagode		Tudi visijo črnice na grmičju , volčje jagode pa na zelišču .
abc18	smrad		čuden	Neki zdravnik , kte - rega so poklicali k dvema zakonskima , piše o tem takó le : Mož je bil že davno mrlič , in čuden smrad se je razširjal od njega po sobi .
abc18	dišijo		grenkega|ogadnega|jedkega|žgočega|ostrega okusa	Gomolji so sredi poletja debeli kakor golobja jajca , dišijo presni malo po kozlu in so grenkega , ogadnega in jedkega , pozneje žgočega in ostrega okusa .
abc18	ne dišijo|ovoha	Cveti	neprijetno|grenko|ostrega	Cveti ne dišijo neprijetno , toda le dober nos jih ovoha , okusa so grenko - ostrega .
abc18	ne dišijo|ovoha	Cveti	neprijetno|grenko|ostrega	Cveti ne dišijo neprijetno , toda le dober nos jih ovoha , okusa so grenko - ostrega .
abc18	ne diši	Seme	zoperno|grenkega	Seme je , kakor vse kaže , najstrupenejši podleskov del ; ono ne diši in je zoperno - grenkega , praskajočega okusa .
abc18	ne diši	Seme	zoperno|grenkega	Seme je , kakor vse kaže , najstrupenejši podleskov del ; ono ne diši in je zoperno - grenkega , praskajočega okusa .
abc18	duh		mamljiv	Moka , med ktero je omotna ljulika , peni se silno pri ognju , in kedar testo kipi , razvija se mamljiv duh , in testo se ne sprijemlje v lepe hlebe .
abc18	zelišče	zajedalk	koristno|potrebno	Res je , da razne uime zadevajo naše žitne rastline posebno v vlažnih letih , toda vlaga samo pospešuje raz - vitek raznovrstnih zajedalk , ki unièujejo kmetovalcu zdaj to , zdaj ono koristno in potrebno zelišče .
abc18	zelišče	zajedalk	koristno|potrebno	Res je , da razne uime zadevajo naše žitne rastline posebno v vlažnih letih , toda vlaga samo pospešuje raz - vitek raznovrstnih zajedalk , ki unièujejo kmetovalcu zdaj to , zdaj ono koristno in potrebno zelišče .
abc18	diši	po plesni		diši po plesni .
abc18	dišijo	Glive	zoperno|strupene|sumljive	Glive , ki zoperno dišijo , so strupene ali sumljive .
abc18	dišijo	Glive	zoperno|strupene|sumljive	Glive , ki zoperno dišijo , so strupene ali sumljive .
abc18	duh		neprijetni	Sicer priporočajo celo vrsto takozvanih „ zanesljivih razkužil “ , toda mnogo jih odpravlja samo neprijetni duh , ki se razširja ondi , kjer so si postavile bakterije svojo delavnico , njihovemu življenju pa niso pogubonosna .
abc18	smrad		neznosen	Kedar jih bolnik izbljuje , razprostirajo prav neznosen smrad .
abc18	ne diši	jed		Vrat in obraz otečeta , vročina raste , jed mu ne diši več , o spanju niti govora ni , a pri vseh teh mukah je otrok navadno pri popolni zavesti .
abc18	smrdljiv	bezgalki|dih		bezgalki , strdijo se večkrat ali gnojijo ; dih je smrdljiv , otrok ima naduho ter mora v spanju imeti usta odprta .
abc18	smrdi		grozno	Goltanec je strašno vnet in jezik kar „ kuhan “ ; iz ust bolnik grozno smrdi .
abc18	smrdljiva	Bolnikova voda	kalna	Bolnikova voda je kalna in smrdljiva , kašelj pa hud .
abc18	smrdljiva	Bolnikova voda	kalna	Bolnikova voda je kalna in smrdljiva , kašelj pa hud .
abc18	ne diši	jed		Proti večeru začne zmedeno govoriti , in to tem bolj , čim hujše ga kuha vročica ; jed mu ne diši nobena , muči ga žeja , jezik in usta so suha , in kolikor toliko postane tudi nagluh .
abc18	smrdljivo|gnilo	vodo	plesnivo	Večjidel napada črmnica živino , ktera stoji v zaduhlih , nizkih in prenapolnjenih hlevih , ktera dobiva smrdljivo , gnilo vodo , in ktero krmimo s pokvarjeno in plesnivo klajo .
abc18	smrdljivo|gnilo	vodo	plesnivo	Večjidel napada črmnica živino , ktera stoji v zaduhlih , nizkih in prenapolnjenih hlevih , ktera dobiva smrdljivo , gnilo vodo , in ktero krmimo s pokvarjeno in plesnivo klajo .
abc18	ne diši	Živali|krma		Živali ne diši nobena krma , izpreletava jo mraz in vročina , pogosto se stresa , hitro sope in se zvrne po tleh .
abc18	smrdljivo		temno|gosto	Crknjena žival ima temno , gosto in smrdljivo kri ; vranica ali slezena je čisto predrugačena in zelò napeta , in mrho - ' vina se jako hitro razseda in usmradi .
abc18	smrdljivo		trdo|mehko	Dva ali tri dni po prvih znamenjih bolezni žival ne žre in ne prežvekuje več , in njeno blato , ki je bilo v začetku trdo , postane mehko , potem vodeno , s krvjo pomešano in smrdljivo ter gre le s hudo silo od nje .
abc18	ne diši			Sluznica v gobcu porudeči in izloča obilne sline tako , da se živali penijo ; jesti jim ne diši , tudi prežvekujejo le včasi in bolj po malem ; molzne krave dajejo manj mleka , in še to je nekako rumenkasto , grenko , oskutno in se lahko sesede .
abc18	smrdijo	Take živali		Take živali že od daleč smrdijo .
abc18	smrdljivo		mastno	Koža na oteklini je pokrita z mastno , smrdljivo tekočino .
abc18	ne diši	kašelj		Polagoma postaja dihanje hitreje iu se kaže v Mkot - nicah in s tem , da žival odpira nosnici , kolikor more ; kašelj se tudi večkrat ponavlja , jesti ji ne diši , mleka je zmirom manj , prežvekovanje nepravilno , žeja pa velika .
abc18	smrdljiva	sapa		Ako se konča s smrtjo , tedaj je dihanje zmirom težavneje , kašelj silnejši , sapa pa včasi smrdljiva .
abc18	ne diši	jed		Ako tega pri njem ni opaziti , in ako mu tudi jed ne diši , tedaj je gotovo bolan .
abc18	duh	po žveplu	neprijetni	Zdaj bomo pa vrata in okna odprli , da se razkadi neprijetni duh po žveplu , oskrbeli živalice z živežem in jim izpremenili ležišče .
abc18	duh	po žveplu	neprijetni	Zdaj bomo pa vrata in okna odprli , da se razkadi neprijetni duh po žveplu , oskrbeli živalice z živežem in jim izpremenili ležišče .
abc18	duha	po smoli		Sadje se ne navzame prav nič duha po smoli in se drži leta in leta .
abc18	gniti		krhek|trhel	Ona prebiva v mrtvem lesu in je tu zelò kvarljiva , ker postane tak les krhek in trhel ter začne gniti .
abc18	duh	po plesni .	neprijetni	Ob jednem razširja tudi neprijetni duh po plesni .
abc18	duh	po plesni .	neprijetni	Ob jednem razširja tudi neprijetni duh po plesni .
abc18	okus		zopern	Ako nalijemo vino v plesnive sode , kterih nismo poprej prav dobro osnažili , dobi vino zopern okus po plesni .
abc18	duha	po plesni		Vendar mu odvzamemo nekoliko duha po plesni , ako ga pomešamo z dobrim laškim oljem , ali ako ga precedimo skoz živalsko oglje .
abc18	duha	po plesni		le malo duha po plesni , postane zopet dobro , ako ga pretočimo v dobro žvepljan sod .
abc18	zelišče	vrholika|vrholično		Ako bi rastla vrholika ali vrholično zelišče samo po tratah in travnikih , ne rekli bi ji nič hudega , ali kaj rada prehaja na njive in na obdelano zemljo sploh ter je ondi nadležna .
abc18	zelišče	pokalica ( Siléne annuläta )		____________ Po laniščih in marsikje tudi med žitom raste pogosto prevezana pokalica ( Siléne annuläta ) , ki je kakor prejšnja jednoletno , toda skoro popolnoma golo zelišče .
abc18	zelišče	cvetje	močno	Ponočna pókalica je močno , navadno ravno zelišče , ki stoji na jednoletni korenini , in čegar cvetje se odpira po noči .
abc18	zelišče	cvetje	močno	Ponočna pókalica je močno , navadno ravno zelišče , ki stoji na jednoletni korenini , in čegar cvetje se odpira po noči .
abc18	zelišče	Rogovilasti peskovec		Rogovilasti peskovec je majhno , kakih 8 — 26 centimetrov ( 3 — 10 palcev ) visoko zelišče brez pravega stebla , zakaj njegova tanka , vlaknata korenina se razveji takoj nad zemljo na več jednakih , šibkih vej , ktere se razhajajo na rogovile .
abc18	zelišče	Drobnolistni babji zob|rožnika|srpana	jednoletno	Drobnolistni babji zob je jednoletno zelišče , ki cvete od rožnika do velikega srpana .
abc18	zelišče	Drobnolistni babji zob|rožnika|srpana	jednoletno	Drobnolistni babji zob je jednoletno zelišče , ki cvete od rožnika do velikega srpana .
abc18	diši	rastlina	neprijetno	Vsa rastlina neprijetno diši in se rada izpreminja .
abc18	diši	rastlina	neprijetno	Vsa rastlina neprijetno diši in se rada izpreminja .
abc18	zelišče		škodljivo	Bodisi tako ali tako , na vsak način je zelišče škodljivo , ker potrebuje mnogo živeža in izsesava zemljo , in ker s svojo obširno rušo , zlasti s pritlehnimi listi , duši sosedno rast in ovira v razvitku .
abc18	zelišče	Navadna kreša		Navadna kreša je po vlažnih in mokrotnih prostorih prav navadno večletno zelišče , ki pa prav rado prehaja na vlažne njive , kjer je seveda plevel , in zato smo ga postavili semkaj med njegove vrstnike .
abc18	zelišče	Navadni riček ali navadna lódrase	oljnato	Navadni riček ali navadna lódrase marsikje seje kot oljnato zelišče , drugje pa je nadležen plevel , kteremu najbolj ugaja ilovnata in vap - nena zemlja .
abc18	zelišče	Navadni riček ali navadna lódrase	oljnato	Navadni riček ali navadna lódrase marsikje seje kot oljnato zelišče , drugje pa je nadležen plevel , kteremu najbolj ugaja ilovnata in vap - nena zemlja .
abc18	zelišče	Plešee		Plešee je navadno jednoletno zelišče , ki pa vztraja po ne - kterih krajih tudi po dve leti .
abc18	zelišče	Navadna kamilica	navadno	Navadna kamilica je po suhih , pustih prostorih , marsikje pa tudi na obdelani zemlji prav navadno zelišče .
abc18	zelišče	Navadna kamilica	navadno	Navadna kamilica je po suhih , pustih prostorih , marsikje pa tudi na obdelani zemlji prav navadno zelišče .
abc18	zelišče		sivkasto	Zavoljo kratkih , pritisnjenih dlačic je videti zelišče sivkasto .
abc18	zelišče	Beli drobni cveti		Beli drobni cveti so postavljeni v precej dolg grozd ; jednaki se nahajajo tudi konec vej , ako je zelišče sploh vejnato .
abc18	zelišče	Poljski hrenček	golo	Poljski hrenček je majhno , sivozeleno , golo zelišče vejnatega stebla , ki nareja med razcvetanjem malo , rahlo rušo , in ki se polagoma podaljša , plezajoč po tleh , do kakih 15 centimetrov ( ‘ / 2 čevlja ) v dolgost .
abc18	zelišče	Poljski hrenček	golo	Poljski hrenček je majhno , sivozeleno , golo zelišče vejnatega stebla , ki nareja med razcvetanjem malo , rahlo rušo , in ki se polagoma podaljša , plezajoč po tleh , do kakih 15 centimetrov ( ‘ / 2 čevlja ) v dolgost .
abc18	zelišče	Njivski óslez		Njivski óslez je jednoletno zelišče , ktero se odlikuje najbolj po tem , da ostanejo njegovi precej veliki cveti le nekoliko ur na dan odprti .
abc18	dišečo	resedico		Rumene bojke ali resede ne smeš zame niti z dišečo resedico , ki jo odgojiš na vrtni gredici .
abc18	Dišeči	pesji vijolici		Dišeči in pesji vijolici smo očitali , da škodujeta človeškemu zdravju , in ravno zavoljo tega smo seznanili prijaznega čitatelja z njima .
abc18	zelišče	Mačeha		Mačeha je jedno - ali dveletno zelišče , pritrjeno na kože - ljasti , belkasti korenini i > ) .
abc18	zelò|zelišče			Iz korenine pride robato , 60 — 100 centimetrov ( 2 — 3 čevlje ) dolgo , zelò vernato steblo , porasteno z dlakami kakor ostalo zelišče .
abc18	zelišče		slabo	List se okončuje v razvejeno vitico ali ročico , ki se oprijemlje drugega rastja in drži inače slabo zelišče na viš .
abc18	zelišče	njivski plevel		Tako smo krstili rastlino , ki je po Slovenskem precej razširjen njivski plevel , a resnice vendar nismo zvedeli popolnoma , zakaj brez vsakoršnih listnih delov ni naše zelišče .
abc18	zelišče	Beli čistnik|cvetnih recljev	golo|vejnato	Beli čistnik je jedno - ali dveletno , golo in vejnato zelišče perotkastega stebla in ravno takih cvetnih recljev .
abc18	zelišče	Beli čistnik|cvetnih recljev	golo|vejnato	Beli čistnik je jedno - ali dveletno , golo in vejnato zelišče perotkastega stebla in ravno takih cvetnih recljev .
abc18	zelišče	nemško deteljo|lucerno		To zelišče je v sorodu z meteljko , nemško deteljo ali lucerno in je tudi prav dobra živinska klaja .
abc18	zelišče		golo	Naša rastlinica je jedno - letno , golo zelišče , čegar korenina požene več kvišku stoječih , večjidel brezvejnatih stebel , ki so komaj 15 — 30 centimetrov ( 7s — 1 čevelj ) visoka .
abc18	zelišče|zamodrelo			Yse zelišče je nekako zamodrelo .
abc18	zelišče	Jednoletno		Jednoletno zelišče stoji na drobni , koželjasti korenini , in njegovo brazdasto steblo je 15 do 30 centimetrov ( 6 — 12 palcev ) visoko in se odlikuje po mnogih vejah .
abc18	zelišče		pritlikavo	To pritlikavo zelišče , ki se nahaja sem ter tja po vlažnih njivah , ima tanko , vlaknato korenino in ležeče , kakih 8 — 20 centimetrov ( 3 — 8 palcev ) dolgo , popolnoma golo , rogovilasto razvejeno steblo , tu pa tam pribito s kako koreninico .
abc18	zelišča		močna	Dokler se poslužujejo neškodljivih pomočkov , ne zameril bi jim človek že toliko — seveda jih tudi ne z besedico pohvalil — ali kaj radi svetujejo bolniku ali sploh človeku , ki ima z njimi opraviti , močna zelišča , ktera ga potem spravijo na oni svet .
abc18	diši	Zdravilni pesji jezik|rožnika|srpana		Zdravilni pesji jezik cvete od rožnika do velikega srpana in diši zo - perno .
abc18	zelišče	Mali mlečee		Mali mlečee ali sovražnica je dveletno , popolnoma golo zelišče z rujav - kasto , koželjasto korenino , na kteri stoji 30 — 45 centimetrov ( 1 — 14 / g čevlja ) visoko , okroglo , bledozeleno steblo .
abc18	zelišče		Obče nadležno|škodljivo	Obče nadležno in naši poljščini škodljivo zelišče odpraviš z najboljšim uspehom s pridno roko , dokler se ni razširilo letošnje seme po zemljišču .
abc18	zelišče	mladi koprivi ali konoplji		To zelišče je po svoji postavi podobno kaki mladi koprivi ali konoplji , toda cveti ga izdajajo za ustnatico .
abc18	zelišče	Jednoletni čišljak ( Stàchys annua )		Jednoletni čišljak ( Stàchys annua ) je majhno , kakih 30 centimetrov ( 1 čevelj ) visoko zelišče , ktero nas gledé na vnanjo postavo spominja bele pivke .
abc18	dišijo		prijetno	Vse dišijo prijetno , in ako ti je prišla kdaj ktera pod nos , spoznal jo boš po letih zopet .
abc18	zelišče	rastlina		ali p o vó j ček je bila kakor marsiktera druga rastlina v prejšnjih časih precej imenitno zelišče , zakaj rabili so jo v zdravilstvu in raznovrstnih vražah , ki so se nanašale večjidel na čarovnice .
abc18	Zelišče|diši		dobro	Zelišče prav dobro diši .
abc18	zelišče	njivski plevel		To zelišče ni samo njivski plevel , ampak njegove dolge , nerazvejene korenine se zavrtajo v korenine raznega žita in pijejo iz njih živilni sok .
abc18	zelišče	Posušeno		Posušeno zelišče je črno .
abc18	zelišče		Nemško predirno	) Nemško predirno zelišče .
abc18	zelišče	Nemško predivno		Nemško predivno zelišče je jednoletna zel s kratko , ko - željasto in močno razvejeno korenino , na kteri stoji 15 — 30 centimetrov ( * / * — 1 čevelj ) visoko , brezvejnato , ali pa ob tleh na več posameznih , steblom jednakih vej razdeljeno steblo .
abc18	zelišče	cvete malega|velikega srpana	Nemško predivno	Nemško predivno zelišče cvete malega in velikega srpana .
abc18	zelišče	cvete malega|velikega srpana	Nemško predivno	Nemško predivno zelišče cvete malega in velikega srpana .
abc18	zelišče	Njivsko predivno		Njivsko predivno zelišče je po naših krajih na - vadnejše od prejšnjega in se odlikuje tudi po tem od njega , Slika 254 .
abc18	zelišče		predivno	Nemško predivno zelišče .
abc18	zelišče	Njivsko|cvete malega|srpana	predivno	Njivsko predivno zelišče cvete malega in velikega srpana .
abc18	zelišče	Njivsko|cvete malega|srpana	predivno	Njivsko predivno zelišče cvete malega in velikega srpana .
abc18	zelišče	Njivsko	predivno	Njivsko predivno zelišče .
abc18	zelišče	Njivsko	predivno	Njivsko predivno zelišče .
abc18	dišeča	ltman		ltman , j er mane c , škrotovec , škoreca , skorócel ali ruja je povsod znana , dišeča košarica .
abc18	dišeči	cveti		Plodišče , kjer so vsajeni mnogobrojni , dišeči cveti , je votlo in se pozneje precej podaljša .
abc18	zelišče|duha	) Nedišeča kamilica		) Nedišeča kamilica je prejšnji zelò podobna , toda nos jo takoj loči od nje ; zelišče namreč nima nobenega duha .
abc18	dišeče|vonjavo zelišče		prijetno	S kratkimi besedami moremo to , če tudi ne prijetno dišeče , pa vendar vonjavo zelišče opisati takó - le .
abc18	zelišče smrdi	po	zoperno	Prvo ime ti pove , da je nos tu poglavitna stvar , zakaj to zelišče smrdi po pesji scalnici , in sicer tako zoperno , da se ga ogibljejo skoro vse živali .
abc18	zelišče smrdi	po	zoperno	Prvo ime ti pove , da je nos tu poglavitna stvar , zakaj to zelišče smrdi po pesji scalnici , in sicer tako zoperno , da se ga ogibljejo skoro vse živali .
abc18	zelišče	Smrdelika		Smrdelika je jednoletno zelišče z močno koželjasto korenino in mnogimi tanšimi vlakni .
abc18	Zelišče smrdi			Zelišče smrdi .
abc18	zelišče	Navadni kolenček	nežno|jednoletno	Navadni kolenček je precej nežno , jednoletno zelišče .
abc18	zelišče	Navadni kolenček	nežno|jednoletno	Navadni kolenček je precej nežno , jednoletno zelišče .
abc18	zelišče		srhko	To srhko zelišče , ki je porasteno s kljukastimi ščetinami , ni po naših krajih kaka redka prikazen , zakaj dosti ga raste marsikje za plotovi , kraj potov in po drugih pustih prostorih .
abc18	zelišče	Jednoletno		Jednoletno zelišče stoji na slabi koželjasti korenini in je kakih 30 centimetrov ( 1 čevelj ) visoko .
abc18	zelišče	) Plahütica , plahüta ali m olj ava|vijoličnim cvetjem .		) Plahütica , plahüta ali m olj ava je jeđnoletno zelišče z mičnim vijoličnim cvetjem .
abc18	zelišče	Dlakavi kilovnlk		Dlakavi kilovnlk je neznatno , dveletno zelišče , ktero se nahaja mestoma na peščeni obdelani zemlji ; tudi vapnena in ilovnata tla mu ugajajo .
abc18	zelišče	Mnogosemna metla ali mnogosemni kozji rep		____________ Mnogosemna metla ali mnogosemni kozji rep je jednoletno zelišče , ki prav navadno raste na obdelani in mestoma tudi na pusti zemlji .
abc18	zelišče		nadležen	Na obdelani zemlji je prav nadležen plevel , kterega odpraviš samo s tem , da izpiplješ in ugonobiš vsako zelišče , kakor hitro ga je mogoče ugledati .
abc18	smrdljivi|zeli	kozji rep	trpežni|nadležni	Kakor metle sploh , ne nahajata se tudi trpežni in smrdljivi kozji rep povsod , a mestoma sta nadležni zeli .
abc18	smrdljivi|zeli	kozji rep	trpežni|nadležni	Kakor metle sploh , ne nahajata se tudi trpežni in smrdljivi kozji rep povsod , a mestoma sta nadležni zeli .
abc18	smrdljiva|zelišče diši	metla ( Ohenopódium Bótrys )	neprijetno	Zadnja tega rodu bodi še omenjena smrdljiva metla ( Ohenopódium Bótrys ) , ktero nos najprej zasledi ; zakaj zelišče diši prav neprijetno .
abc18	smrdljiva|zelišče diši	metla ( Ohenopódium Bótrys )	neprijetno	Zadnja tega rodu bodi še omenjena smrdljiva metla ( Ohenopódium Bótrys ) , ktero nos najprej zasledi ; zakaj zelišče diši prav neprijetno .
abc18	dišijo		zoperno	Ti dišijo zoperno .
abc18	zelišče	Vrtna loboda	močno|jednoletno	Vrtna loboda je močno , kaki metli podobno , jednoletno zelišče , čegar kvišku moleče , sivozeleno ali rudečkasto steblo je 120 — 150 centimetrov ( 4 — 5 čevljev ) visoko in na koželjasti korenini pritrjeno .
abc18	zelišče	Vrtna loboda	močno|jednoletno	Vrtna loboda je močno , kaki metli podobno , jednoletno zelišče , čegar kvišku moleče , sivozeleno ali rudečkasto steblo je 120 — 150 centimetrov ( 4 — 5 čevljev ) visoko in na koželjasti korenini pritrjeno .
abc18	zelišče		Krepko	) Krepko zelišče namreč se prerije skoz navaljeno prst in požene kmalu tako globoke korenine , da moraš pozneje rastline drugo za drugo pipati .
abc18	zelišča	Cvetoča		Cvetoča zelišča naglo dozorijo , in paziti je treba , da jih ne pustiš izpipanih ležati na njivi .
