Book	Smell_Word	Smell_Source	Quality	Full_Sentence
abc59	puhti		hladan	Hladan čez plan skrivnosten veter , kramljaje tiho , popihuje ; iz loga hip ter hip glasi samotnega se slavčka pesem , metulji nočni letajo po mesečini semtertja , hladan puhti iz zemlje dih , a vseokoli po planjavi uspavajoč pokoj se vlega .
abc59	dišav		mamljivih|močnih	Speče duše zibljejo se v sanjah , budnim pa odpira svet se časov , svet prečuden , poln krasote nenavadne , svet odsev in barv neznanih , svetlost senc in temnih luči in dišav mamljivih , močnih , ki iz njih puhti opojnost sladka , mehka , vspavajoča .
abc59	duh		hudi	Tedaj — dejali so ljudje — se vozi po gozdu s spremstvom hudi duh v razbeljenih vozovih , ki s krvjo so s rdečo poškropljeni vsepočez .
abc59	smrdeči		umazani	Kako se rešiti zdaj iz zadrege ? Kako naprej ? Kako — kako do cilja ? Tako že blizu , pa naj vse izgine ? Namesto slave , sreče — grda smrt , pogin v umazani , smrdeči brozgi ? „ Na pragu ! Nemogoče — oj , svoboda ! """" Izvije se mu klic iz duše dna , in tisti hip zagleda sredi barja nedaleč majhen otok suhe zemlje .
abc59	smrad		neznosen	In vije gaz naravnost se med drevje , sledeč jo že dospe jahač do roba — tu skoči iz grmovja gostega pritlikavec ostuden prav pred konja , pa skače , pleše in se premetava ; zavist zija iz gadovih oči in smrad neznosen širi se okrog .
abc59	smrad duši	zrak		Pritlikavec se zoprno nakremži , iz zemlje švigne ogenj proti nebu , z zveplenim plinom se napolni zrak ; konjič se vzpenja , ker ga smrad duši , pa sili z vso močjo nazaj , na dan in komaj nadvladuje ga gospod .
abc59	diši	dim|kadilo|voščene sveče	Le redek	Le redek dim se dviga še v višave , diši kadilo in voščene sveče , a vitez s konjem zopet je pred gozdom .
abc59	diši	dim|kadilo|voščene sveče	Le redek	Le redek dim se dviga še v višave , diši kadilo in voščene sveče , a vitez s konjem zopet je pred gozdom .
abc60	okus		osvežujoč	Celo deževnica ni čista voda , ampak ima v sebi zrak in ogljikovo kislino , ki ji dajeta osvežujoč okus .
abc60	duh|okus	vinu|po likerju		Ali se da na kak način vinu vzeti duh in okus po likerju ? ( F .
abc60	duh|okus|dišečimi	žganje|snovmi	poseben	) Odgovor : Likčr je oslajeno žganje , ki se mu da poseben duh in okus z raznimi dišečimi snovmi .
abc60	duh|okus|dišečimi	žganje|snovmi	poseben	) Odgovor : Likčr je oslajeno žganje , ki se mu da poseben duh in okus z raznimi dišečimi snovmi .
abc60	dišeče	snovi		Te dišeče snovi se večinoma le v alkoholu raztope , in vinski alkohol jih je izlužil iz posode ter se jih je tako navzel .
abc60	Dišeče	snovi		Dišeče snovi iz vinskega alkohola izločiti pač ne gre , ne da bi pri tem vino trpelo .
abc60	dišečih|duha|okusa	snovi|po likerju .	znatnega	skoz kako cedilce ; morda pri takem ravnanju toliko dišečih snovi izhlapi , da vino ne bo več imelo znatnega duha in okusa po likerju .
abc60	dišečih|duha|okusa	snovi|po likerju .	znatnega	skoz kako cedilce ; morda pri takem ravnanju toliko dišečih snovi izhlapi , da vino ne bo več imelo znatnega duha in okusa po likerju .
abc60	diši	žganja		Imam hektoliter žganja , ki nekoliko diši po plesnivih tropinah .
abc60	okus|duh		neprijetni	Kako bi se dal iz Žganja odpraviti neprijetni okus in duh ? ( J .
abc60	okus|duh	žganje		Bržkone ste pa hranili žganje v plesnivi posodi in je v njej dobilo okus in duh po pltsnobi .
abc60	duh|okus	Olje		Olje potegne nase duh in okus po pltsnobi , se zbere skupaj in pride slednjič na vrh , odkoder se lehko posname .
abc61	dehteče	vijolice	skromne|prijetno	In gotovo so vam najljubše skromne in prijetno dehteče vijolice .
abc61	dehteče	vijolice	skromne|prijetno	In gotovo so vam najljubše skromne in prijetno dehteče vijolice .
abc61	dehtečo	vijolico	prijetno	— Ljubosumno je gledal Jezus malo , prijetno dehtečo vijolico .
abc61	dehtečo	vijolico	prijetno	— Ljubosumno je gledal Jezus malo , prijetno dehtečo vijolico .
abc61	dehti	polje|log|trata		O POMLAD VESELA O pomlad vesela , vse zbudila si ; polje , log in trata vse cvete , dehti .
abc61	dehti	cvet		Le cvetite trate , le naj cvet dehti , naj le ptica prosta brez skrbi žgoli ! Bogumil G or en ' ko .
abc62	vonj		Prijeten	Prijeten vonj je prihajal iz loga in je vabil v sladko spanje .
abc62	Dehtelo|vonju		neizraznem	Dehtelo je vse v nekem neizraznem vonju , in vse je šepetalo tiho in pritajeno .
abc62	vonj		Prijetni	Prijetni vonj jo je omamil .
abc62	dehtele|vonjem	rože	z mehkim|Čudovito	Lahke sence so se premikale na potu in kroginkrog so kimale velike , pisane rože in so dehtele z mehkim vonjem Čudovito se je zdelo Bisernici vse to .
abc62	dehtele|vonjem	rože	z mehkim|Čudovito	Lahke sence so se premikale na potu in kroginkrog so kimale velike , pisane rože in so dehtele z mehkim vonjem Čudovito se je zdelo Bisernici vse to .
abc62	dehtečih	rož		Drhtelo je tam tisoč srebrnih žarkov , in tisoč kresnic se je lesketalo med čašami dehtečih rož .
abc62	dehteče	glavice	lahno|mehko	Prijeten vctrec se je zibal nad loko in je sklanjal lahno in mehko dehteče glavice .
abc62	dehteče	glavice	lahno|mehko	Prijeten vctrec se je zibal nad loko in je sklanjal lahno in mehko dehteče glavice .
abc62	dehtečih	rožah		Žvrgoleli so veseli ptiči , in CS2 178 & & srebrna rosa se je lesketala po velikih , dehtečih rožah .
abc63	okus		neprijeten	znano kvasilo ( ferment ) oksidaza , ki zelo pohlepno jemlje kisik iz zraka in z njegovo pomočjo razkraja različne snovi v vinu ter jih izpreminja v sprsteninske snovi , ki vino kalijo in mu dajejo neprijeten okus .
abc63	okus		neprijeten	Vino se ne samo nerado čisti , ampak , kakorhitro pride z zrakom v dotiko , zlasti pa če stoji dlje časa v odprtem kozarcu , nategne , to se pravi , da izpremeni barvo , se močno skali , zgosti , tako da je bolj godlji kakor vinu podobno in poleg tega dobi še čuden , neprijeten okus .
abc63	duh	dim|dim	močan	Če v zraku zažgemo žveplo , se razvija dim , ki ima močan duh in nas sili h kašlju ? Ta dim je žveplena sokislina , ki glivice in kvasila in druge organizme uničuje .
abc63	duh	dim|dim	močan	Če v zraku zažgemo žveplo , se razvija dim , ki ima močan duh in nas sili h kašlju ? Ta dim je žveplena sokislina , ki glivice in kvasila in druge organizme uničuje .
abc63	dišečega	žvepleni sokislini|prahu	močno	To sredstvo se dobiva v podobi belega , močno po žvepleni sokislini dišečega prahu pri drogistih ( ali v kemični tvornici Viktorja Al de rja , Dunaj X .
abc63	dišečega	žvepleni sokislini|prahu	močno	To sredstvo se dobiva v podobi belega , močno po žvepleni sokislini dišečega prahu pri drogistih ( ali v kemični tvornici Viktorja Al de rja , Dunaj X .
abc63	okus		neprijeten	Čiščenje ali precejanje ima namen , s pasteriziranjem ali žveplanjem umorjene glivice ter kaliž iz vina odstraniti , kakor tudi odvzeti mu previsoko ( preveč temno ) barvo in neprijeten okus .
abc63	brez duha|okusa	belega prahu		Kemijsko čista sir n in a se dobiva v trgovini v obliki čistega , lehkega belega prahu brez duha in okusa .
abc63	smrdeč	gob|žlem		Z odstranjevanjem takih gob ste bržkone telčnik znotraj ranili in se sedaj gnoji , zato se izceja iz krave smrdeč žlem .
abc64	dihe	gorskih sap	prijetne	Šumelo je in se sipalo v gorah , v dolini je pa priklilo čez noč cvetje in zelenje , in gozdovi so začutili prijetne dihe gorskih sap .
abc64	dihe	gorskih sap	prijetne	Šumelo je in se sipalo v gorah , v dolini je pa priklilo čez noč cvetje in zelenje , in gozdovi so začutili prijetne dihe gorskih sap .
abc64	Diši|diši			Diši mu , diši .
abc64	dehtelo	Zelenje|cvetje		Zelenje in cvetje je dehtelo iz ograj , mesec je lil svoje drobne praške nad loge ; od dreves so padale dolge sence po travnikih .
abc64	dehtelo	cvetje|zelenje		Pod široko bukvijo je stalo veliko razpelo in okrog je dehtelo po travniku samo cvetje in zelenje .
abc64	zadišalo	po cvrtju|pečeni potici		Ostaniva rajši doma ! """" „ Šalo proč , oče , pojdiva ! """" Pri Zamiku jima je zadišalo po cvrtju in pečeni potici , ko sta stopila v vežo .
abc64	vonj		prijetnejši	Vsak dan se lepše razcvita in daje prijetnejši vonj .
abc64	dehteč	šopek cvetic .		Par solnčnih žarkov se je kradoma doteknilo njenih deviških grudi , v katerih je bil zataknjen dehteč šopek cvetic .
abc65	duh		zrelejši|najsprejemljivejši	— ko je že zrelejši duh najsprejemljivejši v vsi šolski dobi .
abc65	duhom		čilim	Z današnjim dnem izgubi sicer naša armada svojega generala , a je tako prepojena z njegovim čilim duhom , da se bo znala tudi sama voditi in odbijati vse mogoče napade .
abc65	duh|duh			Žirovnik vidno ginjen ter med drugim dostavil prav primerno opazko , da vidi , da se je njegov duh že toliko razširil , da nimajo „ klanfarji """" toliko pleha , da bi ta duh pokrili .
abc65	duhtečem	cvetju		Na mesto teh pesmi so se vrinile druge , ki govore o lastovkah , o duhtečem cvetju , o črnem kruhu , o jagnetih itd .
abc66	dišal	po slaniku		Ne mogla bi z veseljem pogledati podobo Matere božje , če bi vedela , da je umetnik po slaniku dišal , ko jo je slikal .
abc66	dišal	po slaniku		Ljudje te sorte 11 namreč ne razlagajo , kakšen da je umotvor , v kakšni in kateri zvezi da je umetnikovo delo s kulturo naroda in časa , temveč le ugibajo ter izprašujejo , če je umetnik po slaniku dišal ali ne .
abc66	dišal	po slaniku		Kadar doženejo , da je res dišal po slaniku , ugibajo še nadalje , kje da si je tisti slanik kupil ter kako da mu je teknil ; navsezadnje zabelijo svojo slaniško modrost še z naukom , kje da naj si umetnik vprihodnje kupuje svoje slanike in kedaj da naj jih uživa .
abc66	smrdi	gniloba		Ni pa oprostljiva tista pokvarjenost , 13 tista notranja gniloba , ki smrdi iz papirne učenosti in je poglavitno znamenje zaničevanja do umetnosti in umetnikov .
abc66	diši|vzduh	po žganju|tobaku	težak|poln plesnobe	Izba tesna in nizka in kljub svetilkam čudno mračna ; po žganju diši in po slabem tobaku , vzduh je težak , poln plesnobe .
abc66	diši|vzduh	po žganju|tobaku	težak|poln plesnobe	Izba tesna in nizka in kljub svetilkam čudno mračna ; po žganju diši in po slabem tobaku , vzduh je težak , poln plesnobe .
abc66	smrdel	rezanico nabasanega krokodila|živega leva		Menažerija je bila skromna ; par opic je imel , ki so bile zmirom lačne , z rezanico nabasanega krokodila , ki je smrdel , in živega leva .
abc66	dišave		sladke	V nobeni drugi laži , recenzentje moji , niste razodeli toliko slepote , nevednosti in gole zlohotnosti ! Oko , ozri se nazaj , prav do mraka otroških let ! Kam je letelo vse hrepenenje , komu je bila darovana najboljša moč srca in razuma , odkod je vrela , kam se je vračala vsa radost in bolest ? — Resnično , domovina , nisem te ljubil kakor cmerav otrok , ki se drži matere za krilo ; tudi te nisem ljubil kakor solznomeškobni vzdihovalec , ki ti kadi v lice sladke dišave , da te skele uboge oči ; ljubil sem te s spoznanjem ; videl sem te vso , v nadlogah in v grehih , v sra - 57 moti in v zmotah , v ponižanju in v bridkosti ; zato sem z žalostjo in srdom v srcu ljubil tvojo oskrunjeno lepoto , ljubil jo stokrat globlje in stokrat višje od vseh tvojih trubadurjev ! Moje delo je knjiga ljubezni — odpri jo , domovina , da boš videla , kdo ti je pravičen sin ! Dal sem ti , kar sem imel ; če je bilo veliko ali malo — Bog je delil , Bog razsodi ! Dal sem ti svoje srce in svoj razum , svojo fantazijo in svojo besedo , dal sem ti svoje življenje — kaj bi ti še dal ? Lani , ko sem bil zelo potrt in bolan , sem pisal : * * Ob tisti mračni , tihi uri je bilo , ko je Človeku tako milo pri srcu , kakor ob spominu na smrt .
abc66	dišeče	rdeče rože	rosne	„ Že sem videl rdeče rože , rosne , dišeče .
abc66	dišeče	rdeče rože	rosne	„ Že sem videl rdeče rože , rosne , dišeče .
abc66	dišeči	cvetice		Bele , rumene , rdeče rože so pozdravljale in vabile ; cvetice , ki jim človek ne ve imena , so blagodarno sipale svoj dišeči blagoslov .
abc66	dišale	rože	opojno	„ Kod hodi vrtnar , da mi ne prinese kruha ? Lačen sem ! """" Vrtnarja ni bilo ; rože so dišale opojno , solnce je stalo visoko na nebu in se ni genilo .
abc66	dišale	rože	opojno	„ Kod hodi vrtnar , da mi ne prinese kruha ? Lačen sem ! """" Vrtnarja ni bilo ; rože so dišale opojno , solnce je stalo visoko na nebu in se ni genilo .
abc66	dišale	Rože	opojno	„ Vzemite paradiž , ne maram paradiža ! Kruha mi dajte in vode ! """" Rože so opojno dišale , solnce se ni genilo .
abc66	dišale	Rože	opojno	„ Vzemite paradiž , ne maram paradiža ! Kruha mi dajte in vode ! """" Rože so opojno dišale , solnce se ni genilo .
abc67	duh		zopern	Ne ie ropot , ampak že sam čebelam zopern duh teh živali vznemirja in drami ždečo čebelno družino .
abc67	smrdeče	blato		, gloda drva in od nje gre smrdeče blato .
abc67	duh|duh	žveplo|vino|po gnilih jajcih .		Vrhu tega dobi s takimi trakci požveplan sod in vino * duh po goreči cunji , a ker žveplo med gorenjem razhlapi in se vleže na sodove stene , kjer se sprime , dobi vino , ki se dene v tak sod , duh po gnilih jajcih .
abc67	dišečinami|duh	žveplenih trakcev|vino	postranski	Nikdar pa ne rabi za žveplanje takih žveplenih trakcev , ki so posuti z dišečinami , kajti po teh dobi vino postranski duh , a obenem prideš z uporabo teh trakcev v navskrižje z novim vinskim zakonom .
abc67	dišečinami|duh	žveplenih trakcev|vino	postranski	Nikdar pa ne rabi za žveplanje takih žveplenih trakcev , ki so posuti z dišečinami , kajti po teh dobi vino postranski duh , a obenem prideš z uporabo teh trakcev v navskrižje z novim vinskim zakonom .
abc67	smrde	plesnive sode	Močno	Močno plesnive sode in take ki smrde po gnilobi , porabi rajši v kako drugo svrho , nikakor pa ne za vino .
abc67	smrde	plesnive sode	Močno	Močno plesnive sode in take ki smrde po gnilobi , porabi rajši v kako drugo svrho , nikakor pa ne za vino .
abc67	duh	vino|po žveplu .	zaužitno	Vedi , da pred kratkim požveplano vino ni za - užitno , sčasoma pa postane zaužitno , čim zgubi duh po žveplu .
abc67	duh	vino|po žveplu .	zaužitno	Vedi , da pred kratkim požveplano vino ni za - užitno , sčasoma pa postane zaužitno , čim zgubi duh po žveplu .
abc67	duh	po žveplu|Žvepleni dim		Da pa duh po žveplu hitrejše iz vftia odpraviš , pretakaj ga skozi škropilnik vrtnega zalivalnika ali pa na kako rešeto , da se vino dobro razprši in prezrači ter ga nalij v nezažveplan sod ! Pozor ! Žvepleni dim umori vse glivice , ki so vzrok vinskih bolezni , zato je najboljše sredstvo , da ostane vino zdravo .
abc68	smrdljivo	Cela stvar	jako	Cela stvar je jako smrdljivo poglavje iz knjige modernega vzgojeslovja na slovenskih srednjih šolah , katerega ne bomo rešetali na tem mestu .
abc68	smrdljivo	Cela stvar	jako	Cela stvar je jako smrdljivo poglavje iz knjige modernega vzgojeslovja na slovenskih srednjih šolah , katerega ne bomo rešetali na tem mestu .
abc68	duhtečih	malin|rož|pritlikovega grmovja		Tudi ' če traja poletna vročlha pre - dolgo časa ' nepretrgoma , """" je """" na posebno prisojnih solncu izpostavljenih krajih , posebno če ni v obližju bogatih jagodišč , malin , duhtečih rož , pritlikovega grmovja itd .
abc69	dišečih	vin	finih|buketnih	Meh za pretakanje finih , zlasti buketnih ( dišečih ) vin .
abc69	dišečih	vin	finih|buketnih	Meh za pretakanje finih , zlasti buketnih ( dišečih ) vin .
abc69	okus|duh	vino	neprijeten	Tako vino navadno postane bolj motno , dobi neprijeten , na gnilobo spominjajoč okus in duh , ali pa celo zavre in postane tako popolnoma neporabno .
abc69	okus|duh	vino	neprijeten	Tako vino navadno postane bolj motno , dobi neprijeten , na gnilobo spominjajoč okus in duh , ali pa celo zavre in postane tako popolnoma neporabno .
abc69	dišeči	Žveplov dvokis ali žveplova sokislina|plin	ostro	Žveplov dvokis ali žveplova sokislina , to je oni ostro dišeči plin , ki se razvija , če zažgemo nekaj žvepla v sodu , kamor mislimo vino pretočiti , učinkuje predvsem na glivice , ki jih uniči in prepreči njih škodljivo delovanje .
abc69	dišeči	Žveplov dvokis ali žveplova sokislina|plin	ostro	Žveplov dvokis ali žveplova sokislina , to je oni ostro dišeči plin , ki se razvija , če zažgemo nekaj žvepla v sodu , kamor mislimo vino pretočiti , učinkuje predvsem na glivice , ki jih uniči in prepreči njih škodljivo delovanje .
abc69	diši|ne diši	vino		Varovati se je pa predvsem prevelike , nezmiselne rabe žvepla , to je hudega žveplanja , tako da vino po žveplu kar diši , ali pa , čeprav ne diši , da povzroča vinopivcu glavobol in ga stem napelje na misel , da I je pil pokvarjeno ali pa ponarejeno vino .
abc69	dišečega	vina		Škropilnik za zračenje mladega ali po žveplu dišečega vina pri pretakanju .
abc69	duha		finega	Pri starih vinih pa ni tega , zato pretakamo stara vina bolj poredko in vedno tako , da pridejo čim manj mogoče z zrakom v dotiko , torej jih pretakamo zlasti s pomočjo sesalke ( pumpe ) in zaprtih cevi ali celo — kakor je pri finih mozeljskih vinih ( da ne izgube rez - kosti in finega duha ) v navadi — s pomočjo posebnih mehov ( glej podobo 64 .
abc69	gnilo	grozdje		To je posebno v mokrih letih , kadar je grozdje gnilo , zlasti pa če takrat nismo že mošta žveplali .
abc69	diši	mlado vino|po žveplenem vodiku (|jajcih	močno	Pozno pretakanje je tudi neumestno , če opazimo , da mlado vino močno diši po žveplenem vodiku ( gnilih jajcih * ) .
abc69	diši	mlado vino|po žveplenem vodiku (|jajcih	močno	Pozno pretakanje je tudi neumestno , če opazimo , da mlado vino močno diši po žveplenem vodiku ( gnilih jajcih * ) .
abc69	dišalo	vino	bolj	V takem slučaju bo vino tem bolj dišalo po gnilih jajcih , čim dlje bo ležalo na drožah .
abc69	dišalo	vino	bolj	V takem slučaju bo vino tem bolj dišalo po gnilih jajcih , čim dlje bo ležalo na drožah .
abc69	okus		čistejši|milejši	Vino se predvsem bolj učisti in dobi čistejši in milejši okus kakor pred pretakanjem .
abc69	okus		neprijeten	Tretji slučaj je pa ta , da se vino v kozarcu na zraku ne učisti , ampak ravno narobe , bolj zgosti in postane bolj rjavo ter dobi neprijeten okus .
abc69	diši	vino|po žveplovodiku	hudo	Končno naj omenim , kako pretakamo , če vino hudo diši po žveplovodiku ( gnilih jajcih ) vsled tega , ker je bilo grozdje prepozno žveplano , ali pa ker je na kak drug način prišlo žveplo ali žvepleni prah v kipeč mošt , kjer se je izpremenilo v žveplo - vodik .
abc69	diši	vino|po žveplovodiku	hudo	Končno naj omenim , kako pretakamo , če vino hudo diši po žveplovodiku ( gnilih jajcih ) vsled tega , ker je bilo grozdje prepozno žveplano , ali pa ker je na kak drug način prišlo žveplo ali žvepleni prah v kipeč mošt , kjer se je izpremenilo v žveplo - vodik .
abc69	duh	vino|po plesnobi		Imam nekaj plesnivih sodov in vino v njih ima duh po plesnobi .
abc70	duh	po vinu		V grlu je začutil hladno močo in v nosu je imel duh po vinu .
abc70	dišalo	Vrbanu		Kako je dišalo Vrbanu , kako je zvenelo in žvenkljalo ! „ Tudi jaz si ga potem lahko privoščim bokal ali dva .
abc70	zadišalo	po vinu		Groza je bilo Vrbana , a zaslišal je zopet žvenkljanje cekinov , zlat plašč se je zasvetil , zadišalo je po vinu .
abc70	dehteč		prosojen	Ko pa so pretekla leta in dnevi , je prišlo odpuščenje in milost ubogemu čebelarju : Nad njim so se zgrnile čebele v prosojen in dehteč živ paj - čolan ter zarajale okoli njegove glave .
abc72	okus	vino	neprijeten	Istotako je treba zopet ločiti učiščeno vino od gošče , ker če ostane sesedlo se čistilo in vsa gošča dlje časa v sodu , vino lehko dobi neprijeten okus po tej gošči , oziroma se gošča pri najmanjšem stresljaju , ali če nastopi vročina v kleti , zopet dvigne , vsled česar dotično vino postane še bolj kalno , kakor je bilo pred čiščenjem .
abc72	okus	vino	neprijeten	Istotako je treba zopet ločiti učiščeno vino od gošče , ker če ostane sesedlo se čistilo in vsa gošča dlje časa v sodu , vino lehko dobi neprijeten okus po tej gošči , oziroma se gošča pri najmanjšem stresljaju , ali če nastopi vročina v kleti , zopet dvigne , vsled česar dotično vino postane še bolj kalno , kakor je bilo pred čiščenjem .
abc72	duh		slab	Snaga je prvi pogoj umnega kletarstva ! Če se vino vsled delovanja glivic kvari , govorimo o bolezni vina , če je pa dobilo vino slab okus , duh ali slabo barvo iz drugih vzrokov , zlasti vsled slabega ravnanja z vinom ali z vinsko posodo , govorimo ona - pak i vina .
abc72	duh		Tuj|tuj	Tuj duh in tuj okus v vinu .
abc72	duh		tuj	Jako pogosto se pri nas dogaja , da dobi vino kak tuj okus ali tuj duh .
abc72	duh|okus		tuji	Ta tuji duh in okus je lehko različen , vendar pa je najbolj razširjena zatohlost ( dušek ; in p lesni vos t .
abc72	duh|duha	soda	čistega vinskega	Ta duh dobi vino od slabega soda , to je od soda , ki ni imel čistega vinskega duha .
abc72	duh|duha	soda	čistega vinskega	Ta duh dobi vino od slabega soda , to je od soda , ki ni imel čistega vinskega duha .
abc72	dišečih|duh|okus	snovi	napačen	Če potem v tak sod brez jako skrbnega pripravljanja in snaženja denemo drugo vino , potem dobi to vino od dišečih snovi , ki so jih glivice razvile v lesu ali na lesu , napačen duh in okus .
abc72	dišečih|duh|okus	snovi	napačen	Če potem v tak sod brez jako skrbnega pripravljanja in snaženja denemo drugo vino , potem dobi to vino od dišečih snovi , ki so jih glivice razvile v lesu ali na lesu , napačen duh in okus .
abc72	duh|dišeče	Vino|vina|tvarine ( zelje , krompir|trhel les	slab okus|gnijoče	Vino pa dobi tudi slab okus ali duh vsled nepravilnega ravnanja , zlasti pa , če je hranjeno v nesnažni , zatohli kleti , kjer se poleg vina spravljajo tudi dišeče ali gnijoče tvarine ( zelje , krompir , trhel les ) .
abc72	duh|dišeče	Vino|vina|tvarine ( zelje , krompir|trhel les	slab okus|gnijoče	Vino pa dobi tudi slab okus ali duh vsled nepravilnega ravnanja , zlasti pa , če je hranjeno v nesnažni , zatohli kleti , kjer se poleg vina spravljajo tudi dišeče ali gnijoče tvarine ( zelje , krompir , trhel les ) .
abc72	duh	Laško olje|vino		Laško olje se v luknjicah hrastovega lesa razkroji ( postane žaltavo ) in vino potegne ta duh nase .
abc72	duh|okus|duh		tuj	Če dobi vino kak tuj duh ali okus , potem imamo več pripomočkov , da ta duh lehko odpravimo .
abc72	izpuhti|duh	vina	slab	Že prezračenje pri pretakanju in žveplanju povzroči , da vsaj deloma iz vina izpuhti slab duh .
abc72	izpuhti|duh	vina	slab	Že prezračenje pri pretakanju in žveplanju povzroči , da vsaj deloma iz vina izpuhti slab duh .
abc72	duh|okus		tuj	Zlasti večkratno , bolj močno čiščenje z želatino , ali pa pri bolj slabih vinih s sirnino ali z mlekom , vzame vinu tak tuj duh ali okus , če ni še preveč razvit ^ Čiščenje bo navadno zadostovalo , če ima vino le t .
abc72	duh	po plesnobi	Bolj močan	Bolj močan duh , zlasti po plesnobi , se pa z navadnim čiščenjem ne bo dal izlahka odpraviti .
abc72	duh	po plesnobi	Bolj močan	Bolj močan duh , zlasti po plesnobi , se pa z navadnim čiščenjem ne bo dal izlahka odpraviti .
abc72	duh		tuji|fini vinski	Če torej vinu primešamo takega oglja , mu vzame ves tuji in seveda deloma tudi fini vinski duh , ki se pa sčasoma vsled ležanja vinu zopet povrne .
abc72	duha		slabega	Naročeno oglje moramo spraviti na suhem kraju , najbolje v dobro zaprtem kozarcu , da ne potegne kakega slabega duha nase .
abc72	dišeče|duh	vino|vino	slabo|slabi	Če naredimo , da slabo dišeče vino še enkrat kipi , potem mu odtegnejo drobne kipelne glivice slabi duh , in vino se popravi .
abc72	dišeče|duh	vino|vino	slabo|slabi	Če naredimo , da slabo dišeče vino še enkrat kipi , potem mu odtegnejo drobne kipelne glivice slabi duh , in vino se popravi .
abc72	duha|okusa	vina|laško olj e		Končno je omeniti neko starejše sredstvo za odpravljanje tujega duha in okusa iz vina , to je laško olj e .
abc72	duh	Olje	slabi	Olje se na ta način raztepe v drobčkene kapljice , ki odtegnejo kapljam vina slabi duh .
abc72	duh	Olje	slabi	Olje se na ta način raztepe v drobčkene kapljice , ki odtegnejo kapljam vina slabi duh .
abc72	duha		fino	Če olje ni res fino , brez vsakega tujega duha , se vino lehko še bolj pokvari kakor je bilo prej , ker dobi od slabega olja žaltav okus .
abc72	duha|duh|okus	v vinu|vino|po žveplu .	slabega	Poleg že navedenaga slabega duha v vinu se pogostoma dogaja , da ima vino duh in okus po žveplu .
abc72	duha|duh|okus	v vinu|vino|po žveplu .	slabega	Poleg že navedenaga slabega duha v vinu se pogostoma dogaja , da ima vino duh in okus po žveplu .
abc72	Duh|okus	žveplu		Duh in okus po žveplu dobi vino vsled prehudega žveplanja vina ali pa daljšega žveplanja posode , kamor se je potem dejalo vino , ne da bi se zadostno pomila .
abc72	duh|okus|okus	vino|po žveplovem dvokisu|po žvepleni kislini	oster	V prvem slučaju ima vino oster duh in okus po žveplovem dvokisu , v drugem praskajoč okus po žvepleni kislini .
abc72	duh|okus|okus	vino|po žveplovem dvokisu|po žvepleni kislini	oster	V prvem slučaju ima vino oster duh in okus po žveplovem dvokisu , v drugem praskajoč okus po žvepleni kislini .
abc72	duh|okus	vino		Če pa vino dobi tak duh in okus , potem se še najhitreje odpravi z večkratnim pretakanjem in zračenjem .
abc72	duh	vodikom|žveplov vodik	slabi	Žveplo se je namreč med kipenjem spojilo z vodikom v žveplov vodik , ki povzroča omenjeni slabi duh .
abc72	duh	vodikom|žveplov vodik	slabi	Žveplo se je namreč med kipenjem spojilo z vodikom v žveplov vodik , ki povzroča omenjeni slabi duh .
abc72	diši	vino		Zakaj diši vino po žveplu """" v 15 .
