id	title	year	sameAs	author	license	publisher	type	archive	link
bpt6k6565450w.txt	La Deffense du poëme heroïque , avec quelques remarques sur les oeuvres satyriques du sieur D*** Dialogues en vers & en prose	1674	https://data.bnf.fr/ark:/12148/bpt6k6565450w	Testu, Jacques (1626?-1706)	Public domain	J. Le Gras, N. Le Gras, A. Besoigne et C. Audinet (Paris)	monographie imprimée	Bibliothèque nationale de France	https://gallica.bnf.fr/ark:/12148/bpt6k6565450w
bpt6k64694215.txt	Usages et règlements locaux ayant force de loi dans le département d'Ille et Vilaine... publiés par C.-J.-B. Quernest,...	1859	https://data.bnf.fr/ark:/12148/bpt6k64694215		Public domain	Cosse et Marchal (Paris)	monographie imprimée	Bibliothèque nationale de France	https://gallica.bnf.fr/ark:/12148/bpt6k64694215
bpt6k5579576s.txt	Signes diagnostic et terminaison du cancer du pylore / par Édouard Roger,...	1878	https://data.bnf.fr/ark:/12148/bpt6k5579576s	Roger, Édouard (1849-19..)	Public domain	L. Larose (Paris)	monographie imprimée	Bibliothèque nationale de France	https://gallica.bnf.fr/ark:/12148/bpt6k5579576s
bpt6k6502486x.txt	Le voyage de Monsieur Perrichon : comédie en 4 actes / par MM. Eugène Labiche et Édouard Martin	1860	https://data.bnf.fr/ark:/12148/bpt6k6502486x	Labiche, Eugène (1815-1888)	Public domain	A. Bourdilliat et Cie (Paris)	monographie imprimée	Bibliothèque nationale de France	https://gallica.bnf.fr/ark:/12148/bpt6k6502486x
bpt6k6368008c.txt	Couplets connus chantés en ronde par les commissaires de police de Lyon et de ses faubourgs dans leur réunion à l'occasion de la Fête du Roi en 1824	1824	https://data.bnf.fr/ark:/12148/bpt6k6368008c		Public domain	imp. de J. Roger (Lyon)	monographie imprimée	Bibliothèque nationale de France	https://gallica.bnf.fr/ark:/12148/bpt6k6368008c
bpt6k61287605.txt	La Constitution d'un bien de famille insaisissable, étude pratique de la loi du 12 juillet 1909, par E. Delaporte,...	1914	https://data.bnf.fr/ark:/12148/bpt6k61287605	Delaporte, E.	Public domain		monographie imprimée	Bibliothèque nationale de France	https://gallica.bnf.fr/ark:/12148/bpt6k61287605
bpt6k61503107.txt	L'Ordonnance du 26 mars 1556 et les changements de nom de famille / par M. Prinet,...	1918	https://data.bnf.fr/ark:/12148/bpt6k61503107	Prinet, Max (1867-1937)	Public domain	(Paris ; Nogent-le-Rotrou)	monographie imprimée	Bibliothèque nationale de France	https://gallica.bnf.fr/ark:/12148/bpt6k61503107
bpt6k57117547.txt	Le 20 Décembre, satire, par M. Amédée Boudin,...	1848	https://data.bnf.fr/ark:/12148/bpt6k57117547	Boudin, Amédée (1814-1886)	Public domain	8, rue de Choiseul (Paris)	monographie imprimée	Bibliothèque nationale de France	https://gallica.bnf.fr/ark:/12148/bpt6k57117547
bpt6k96792814.txt	Discours prononcé aux obsèques du R. P. Barbelin, directeur de l'Ecole apostolique de Littlehampton à Monthières-lès-Amiens, le 2 novembre 1889 / par M. C. Paillart,...	1889	https://data.bnf.fr/ark:/12148/bpt6k96792814	Paillart, Charles	Public domain	impr. de C. Paillart (Abbeville)	monographie imprimée	Bibliothèque nationale de France	https://gallica.bnf.fr/ark:/12148/bpt6k96792814
bpt6k64715160.txt	Notice sur la sainte vie et l'admirable mort du R. P. Dom Jean Sallier, religieux à la Grande-Chartreuse / (Signé : Paule Double, Vve Sémerie)	1878	https://data.bnf.fr/ark:/12148/bpt6k64715160	Sémérie, Paule Double Mme	Public domain	Impr. de Jouve (Marseille)	monographie imprimée	Bibliothèque nationale de France	https://gallica.bnf.fr/ark:/12148/bpt6k64715160
bpt6k96877195.txt	Notre époque et le théâtre : conférence faite le 16 mars 1906, à la Société des conférences / Alfred Capus	1906	https://data.bnf.fr/ark:/12148/bpt6k96877195	Capus, Alfred (1858-1922)	Public domain	E. Fasquelle (Paris)	monographie imprimée	Bibliothèque nationale de France	https://gallica.bnf.fr/ark:/12148/bpt6k96877195
bpt6k96098974.txt	Instruction pour les employés à la perception des droits de controlle des actes des notaires & sous signatures privées...	1738	https://data.bnf.fr/ark:/12148/bpt6k96098974	Ferme générale (France)	Public domain	impr. de P. Antoine (Nancy)	monographie imprimée	Bibliothèque nationale de France	https://gallica.bnf.fr/ark:/12148/bpt6k96098974
bpt6k5525458w.txt	Rapports et comptes rendus des séances / second Congrès international du travail à domicile. Zurich, 8-9 septembre 1912	1913	https://data.bnf.fr/ark:/12148/bpt6k5525458w	Congrès international du travail à domicile (02 ; 1912 ; Zurich, Suisse)	Public domain	Misch & Théron (Bruxelles)	monographie imprimée	Bibliothèque nationale de France	https://gallica.bnf.fr/ark:/12148/bpt6k5525458w
bpt6k96693171.txt	Le monde sous-marin / par Zurcher et Margollé	1868	https://data.bnf.fr/ark:/12148/bpt6k96693171	Margollé, Élie Philippe (1816-1884)	Public domain	J. Hetzel (Paris)	monographie imprimée	Bibliothèque nationale de France	https://gallica.bnf.fr/ark:/12148/bpt6k96693171
bpt6k58022556.txt	France éprouvée, France triomphante ! : quatre conférences sur la guerre données à la cathédrale de Digne en 1915 / Abbé Gabriel Blanc,...	1915	https://data.bnf.fr/ark:/12148/bpt6k58022556	Blanc, Gabriel (Chanoine)	Public domain	E. Vitte (Lyon)	monographie imprimée	Bibliothèque nationale de France	https://gallica.bnf.fr/ark:/12148/bpt6k58022556
bpt6k6377285t.txt	Paris insurgé : histoire illustrée des événements accomplis du 18 mars au 28 mai 1871 : pièces et documents recueillis au jour le jour / classés, coordonnés et annotés par A. de Balathier-Bragelonne	1872	https://data.bnf.fr/ark:/12148/bpt6k6377285t		Public domain	(Paris)	monographie imprimée	Bibliothèque nationale de France	https://gallica.bnf.fr/ark:/12148/bpt6k6377285t
bpt6k9771627g.txt	Tableaux de l'ordre des avocats au Conseil d'état et à la Cour de Cassation, deuxième partie depuis le 10 septembre 1867,... Publié par le conseil de l'ordre / Gabriel Pérouse, Antoine Mimerel	1924	https://data.bnf.fr/ark:/12148/bpt6k9771627g		Public domain	Imprimerie Peyriller, Rouchon et Gamon (Le Puy-en-Velay)	monographie imprimée	Bibliothèque nationale de France	https://gallica.bnf.fr/ark:/12148/bpt6k9771627g
bpt6k96087413.txt	Lettre [1re-4e] de M. Janin de Combe Blanche à M. Cadet,...	1773	https://data.bnf.fr/ark:/12148/bpt6k96087413	Janin de Combe Blanche, Jean (1731-1811)	Public domain	impr. de Vve Vedeilhié (Vienne)	monographie imprimée	Bibliothèque nationale de France	https://gallica.bnf.fr/ark:/12148/bpt6k96087413
bpt6k1268939r.txt	L'Hyenne combattue, ou Le triomphe de l'amitié et de l'amour maternel , en deux poëmes héroïques	1765	https://data.bnf.fr/ark:/12148/bpt6k1268939r		Public domain	Dufour (Amsterdam et Paris)	monographie imprimée	Bibliothèque nationale de France	https://gallica.bnf.fr/ark:/12148/bpt6k1268939r
bpt6k5788347t.txt	Catherine, ou La vierge du Canada	1853	https://data.bnf.fr/ark:/12148/bpt6k5788347t		Public domain	Barbou fr. (Limoges)	monographie imprimée	Bibliothèque nationale de France	https://gallica.bnf.fr/ark:/12148/bpt6k5788347t
bpt6k6471680h.txt	Eloge funèbre de M. Jules-François-Joseph Du Pré de Saint-Maur, président de la Société de secours mutuels d'Oran... prononcé à Arbal, le 22 octobre 1877 ; par le P. Pollari,...	1878	https://data.bnf.fr/ark:/12148/bpt6k6471680h	Pollari, Le P. (S. J.)	Public domain	Impr. de Roussel (Paris-Auteuil)	monographie imprimée	Bibliothèque nationale de France	https://gallica.bnf.fr/ark:/12148/bpt6k6471680h
bpt6k6350903n.txt	Notice sur Rene Doreau, élève de l'école libre de Saint Joseph de Poitiers	1866	https://data.bnf.fr/ark:/12148/bpt6k6350903n		Public domain	Impr. de Oudin (Poitiers)	monographie imprimée	Bibliothèque nationale de France	https://gallica.bnf.fr/ark:/12148/bpt6k6350903n
bpt6k64701362.txt	Chanson nouvelle en patois de Lille... [J'ai bien deux mots à dire. Signé : Édouard Prévot.]	1863	https://data.bnf.fr/ark:/12148/bpt6k64701362	Prévost, Édouard	Public domain	impr. de Horemans (Lille)	monographie imprimée	Bibliothèque nationale de France	https://gallica.bnf.fr/ark:/12148/bpt6k64701362
bpt6k5837336k.txt	L'Enquête agricole, par le Cte de Falloux,...	1866	https://data.bnf.fr/ark:/12148/bpt6k5837336k	Falloux, Alfred de (1811-1886)	Public domain	C. Douniol (Paris)	monographie imprimée	Bibliothèque nationale de France	https://gallica.bnf.fr/ark:/12148/bpt6k5837336k
bpt6k98004464.txt	Histoire de Tarare , suivie de quelques réflexions sur l'Opéra du même nom	1787	https://data.bnf.fr/ark:/12148/bpt6k98004464	Carré de Belleville	Public domain	chez Lefèvre (A Ormuz ; et se trouve à Paris)	monographie imprimée	Bibliothèque nationale de France	https://gallica.bnf.fr/ark:/12148/bpt6k98004464
bpt6k6549379q.txt	Histoire de la ville d'Autun et de la foire de S.-Ladre	1857	https://data.bnf.fr/ark:/12148/bpt6k6549379q		Public domain	impr. de Romand (Mâcon)	monographie imprimée	Bibliothèque nationale de France	https://gallica.bnf.fr/ark:/12148/bpt6k6549379q
bpt6k6458426n.txt	Un lieutenant du grand Condé / par Bellarmin	1875	https://data.bnf.fr/ark:/12148/bpt6k6458426n	Bellarmin, H.	Public domain	Barbou frères (Limoges)	monographie imprimée	Bibliothèque nationale de France	https://gallica.bnf.fr/ark:/12148/bpt6k6458426n
bpt6k6101179g.txt	(Tableaux de lecture)	1863	https://data.bnf.fr/ark:/12148/bpt6k6101179g		Public domain	J. Delalain (Paris)	monographie imprimée	Bibliothèque nationale de France	https://gallica.bnf.fr/ark:/12148/bpt6k6101179g
bpt6k65113268.txt	Comédie enfantine...	19..	https://data.bnf.fr/ark:/12148/bpt6k65113268	Ratisbonne, Louis (1827-1900)	Public domain	J. Hetzel (Paris)	monographie imprimée	Bibliothèque nationale de France	https://gallica.bnf.fr/ark:/12148/bpt6k65113268
bpt6k57855235.txt	Réponses du citoyen d'Esparbès, a l'arrêté des commissaires nationaux civils envoyés aux Isles-sous-le-Vent, adressées à la Convention nationale	1792-1793	https://data.bnf.fr/ark:/12148/bpt6k57855235	Esparbès, Jean-Jacques d' (1720-1810)	Public domain	impr. de Testu (Paris)	monographie imprimée	Bibliothèque nationale de France	https://gallica.bnf.fr/ark:/12148/bpt6k57855235
bpt6k9799111x.txt	Asie et Insulinde, Afrique, rédigé conformément aux programmes du 31 mai 1902, à l'usage de l'enseignement secondaire : classe de cinquième (divisions A et B) / F. Schrader et L. Gallouédec	1904	https://data.bnf.fr/ark:/12148/bpt6k9799111x	Gallouédec, Louis (1864-1937)	Public domain	Hachette (Paris)	monographie imprimée	Bibliothèque nationale de France	https://gallica.bnf.fr/ark:/12148/bpt6k9799111x
bpt6k5475892f.txt	Chez le Roi de France à Goritz, février 1883. (Signé J. Bonnet.)	1883	https://data.bnf.fr/ark:/12148/bpt6k5475892f	Bonnet, J. (01)	Public domain	impr. de P. Jacquin (Besançon)	monographie imprimée	Bibliothèque nationale de France	https://gallica.bnf.fr/ark:/12148/bpt6k5475892f
bpt6k6473246q.txt	Les principales étymologies de la langue française : précédées d'un petit traité de la dérivation et de la composition des mots / par B. Jullien,...	1862	https://data.bnf.fr/ark:/12148/bpt6k6473246q	Jullien, Bernard (1798-1881)	Public domain	L. Hachette (Paris)	monographie imprimée	Bibliothèque nationale de France	https://gallica.bnf.fr/ark:/12148/bpt6k6473246q
bpt6k6208255t.txt	Péking et ses habitants : moeurs, coutumes, religion et arts des chinois d'après des documents authentiques recueillis pendant l'expédition de Chine / mis en ordre par Alexandre M... [Michaux]	1861	https://data.bnf.fr/ark:/12148/bpt6k6208255t	Michaux, Alexandre (1834-18..?)	Public domain	Ledoyen (Paris)	monographie imprimée	Bibliothèque nationale de France	https://gallica.bnf.fr/ark:/12148/bpt6k6208255t
bpt6k5493416m.txt	Lettres de vieillards, études contemporaines, par le Cte A. de Saint-Aulaire. (Novembre 1896.)	1897	https://data.bnf.fr/ark:/12148/bpt6k5493416m	Saint-Aulaire, Anatole Beaupoil de (1842-19..)	Public domain	C. Lévy (Paris)	monographie imprimée	Bibliothèque nationale de France	https://gallica.bnf.fr/ark:/12148/bpt6k5493416m
bpt6k96827453.txt	L'éleveur de bêtes à cornes (2e édition) / par Félix Villeroy,...	1857	https://data.bnf.fr/ark:/12148/bpt6k96827453	Villeroy, Félix (18..?-1881)	Public domain	Librairie agricole de la Maison rustique (Paris)	monographie imprimée	Bibliothèque nationale de France	https://gallica.bnf.fr/ark:/12148/bpt6k96827453
bpt6k5839844g.txt	Les Alcôves maudites, par Henry de Kock (Paul de Kock fils)	1874	https://data.bnf.fr/ark:/12148/bpt6k5839844g	Kock, Henry de (1819-1892)	Public domain		monographie imprimée	Bibliothèque nationale de France	https://gallica.bnf.fr/ark:/12148/bpt6k5839844g
bpt6k6580277v.txt	Traité de zoologie élémentaire : à l'usage des établissements d'instruction / par le Dr Th. Olivier	1865	https://data.bnf.fr/ark:/12148/bpt6k6580277v	Olivier, Théodore Edmond (1817?-1867)	Public domain	H. Casterman (Tournai)	monographie imprimée	Bibliothèque nationale de France	https://gallica.bnf.fr/ark:/12148/bpt6k6580277v
bpt6k5607486h.txt	L'âne des Korrigans ; suivi de : Les bateaux noirs de Belle-Isle (légendes du Morbihan) / Quesnay de Beaurepaire ; ouvrage illustré de 30 compositions par l'auteur, gravées par Ch.-G. Petit	1894	https://data.bnf.fr/ark:/12148/bpt6k5607486h	Quesnay de Beaurepaire, Alfred (1830-1898)	Public domain	(Paris)	monographie imprimée	Bibliothèque nationale de France	https://gallica.bnf.fr/ark:/12148/bpt6k5607486h
bpt6k58492364.txt	La Lucrèce créole, poème historique / Eugène Carlos	1870	https://data.bnf.fr/ark:/12148/bpt6k58492364	Carlos, Eugène	Public domain	Lacroix (Paris)	monographie imprimée	Bibliothèque nationale de France	https://gallica.bnf.fr/ark:/12148/bpt6k58492364
bpt6k54624063.txt	De la pseudo-paralysie générale d'origine syphilitique / par le Dr A. Fournier,... ; leçon recueillie par E. Brissaud,...	1878	https://data.bnf.fr/ark:/12148/bpt6k54624063	Fournier, Alfred (1832-1914)	Public domain	aux bureaux du Progrès médical (Paris)	monographie imprimée	Bibliothèque nationale de France	https://gallica.bnf.fr/ark:/12148/bpt6k54624063
bpt6k6153053w.txt	La Muse du soldat, chansons patriotiques, par E.-Aimé Gonnet,...	1831	https://data.bnf.fr/ark:/12148/bpt6k6153053w	Gonnet, E.-Aimé	Public domain	impr. de A. Henry (Paris)	monographie imprimée	Bibliothèque nationale de France	https://gallica.bnf.fr/ark:/12148/bpt6k6153053w
bpt6k6529053w.txt	Voyages dans les deux océans Atlantique et Pacifique, 1844 à 1847... par M. Eugène Delessert	1848	https://data.bnf.fr/ark:/12148/bpt6k6529053w	Delessert, Eugène (1819-1877)	Public domain	A. Franck (Paris)	monographie imprimée	Bibliothèque nationale de France	https://gallica.bnf.fr/ark:/12148/bpt6k6529053w
bpt6k9760137j.txt	Législation : 1e année : 1896-1897. Année 1 / Ecole spéciale militaire	1896-1897	https://data.bnf.fr/ark:/12148/bpt6k9760137j	École spéciale militaire de Saint-Cyr	Public domain	[s.n.][s.n.]	monographie imprimée	Bibliothèque nationale de France	https://gallica.bnf.fr/ark:/12148/bpt6k9760137j
bpt6k96149672.txt	Oeuvres de Alphonse Daudet	1930	https://data.bnf.fr/ark:/12148/bpt6k96149672	Daudet, Alphonse (1840-1897)	Public domain	Librairie Alphonse Lemerre (Paris)	monographie imprimée	Bibliothèque nationale de France	https://gallica.bnf.fr/ark:/12148/bpt6k96149672
bpt6k5849602q.txt	Catalogue d'une collection de tableaux... et quelques objets de curiosité dont la vente se fera pour cause du décès de M. Prousteau de Montlouis... 5 mai 1851... / [expert] Defer	1851	https://data.bnf.fr/ark:/12148/bpt6k5849602q		Public domain	impr. et lithogr. de Maulde et Renou (Paris)	monographie imprimée	Bibliothèque nationale de France	https://gallica.bnf.fr/ark:/12148/bpt6k5849602q
bpt6k57941957.txt	Marseille, Nîmes et ses environs en 1815, par Charles Durand,... 2e édition...	1818	https://data.bnf.fr/ark:/12148/bpt6k57941957	Durand, Charles (ancien procureur du roi)	Public domain	Plancher (Paris)	monographie imprimée	Bibliothèque nationale de France	https://gallica.bnf.fr/ark:/12148/bpt6k57941957
bpt6k57059203.txt	"De verborum significatione : recueil alphabétique des définitions du titre XVI, livre L, du ""Digeste"" et de celles qui sont dispersées dans le ""Corps de droit"" et dans les ""Institutes"" de Gaius, avec l'indication des livres, titres, lois et paragraphes et le nom des jurisconsultes / par C. Quernest,..."	1851	https://data.bnf.fr/ark:/12148/bpt6k57059203	Quernest, Charles (1818-1894)	Public domain	Verdier (Rennes)	monographie imprimée	Bibliothèque nationale de France	https://gallica.bnf.fr/ark:/12148/bpt6k57059203
bpt6k5723994b.txt	Le Château de la folie, par Paul Perret	1867	https://data.bnf.fr/ark:/12148/bpt6k5723994b	Perret, Paul (1830-1904)	Public domain	Michel-Lévy (Paris)	monographie imprimée	Bibliothèque nationale de France	https://gallica.bnf.fr/ark:/12148/bpt6k5723994b
bpt6k9812096j.txt	Catalogue des livres en feuilles qui se trouvent chez Delaplace, libraire et commissionnaire, à Paris, rue de Sorbonne, n° 376, payables comptant en numéraire, ou en mandats au cours du jour de leur réception.	1796-1797	https://data.bnf.fr/ark:/12148/bpt6k9812096j		Public domain	[Paris, Delaplace, 1796-1797]	monographie imprimée	Bibliothèque nationale de France	https://gallica.bnf.fr/ark:/12148/bpt6k9812096j
bpt6k61161495.txt	Les fleurs de Mai, hymnes à Marie, par un de ses enfants	1857	https://data.bnf.fr/ark:/12148/bpt6k61161495		Public domain	imp. de Dupont (Périgueux)	monographie imprimée	Bibliothèque nationale de France	https://gallica.bnf.fr/ark:/12148/bpt6k61161495
bpt6k6276277q.txt	Moyen de rétablir les finances et de les maintenir en bon état	1801	https://data.bnf.fr/ark:/12148/bpt6k6276277q		Public domain	impr. de Demonville (Paris)	monographie imprimée	Bibliothèque nationale de France	https://gallica.bnf.fr/ark:/12148/bpt6k6276277q
bpt6k1265784z.txt	Catalogue général officiel. Beaux-Arts. Exposition centennale de l'art français (1789-1889)	1889	https://data.bnf.fr/ark:/12148/bpt6k1265784z		Public domain	imp. de L. Danel (Lille)	monographie imprimée	Bibliothèque nationale de France	https://gallica.bnf.fr/ark:/12148/bpt6k1265784z
bpt6k9691697f.txt	Six nouvelles nouvelles / traduites pour la première fois du chinois par le marquis d'Hervey-Saint-Denys,...	1892	https://data.bnf.fr/ark:/12148/bpt6k9691697f		Public domain	Maisonneuve et Larose (Paris)	monographie imprimée	Bibliothèque nationale de France	https://gallica.bnf.fr/ark:/12148/bpt6k9691697f
bpt6k56296819.txt	Consultation délibérée par M. Dufourmantelle,... sur le droit appartenant aux avoués de calculer l'émolument de copie des rôles des expéditions délivrées par les greffiers, avec une augmentation proportionnelle à l'augmentation du nombre des syllabes prescrites dans ces expéditions par la loi du 26 janvier 1892	1896	https://data.bnf.fr/ark:/12148/bpt6k56296819	Dufourmantelle, Paul	Public domain	impr. de Cerf (Versailles)	monographie imprimée	Bibliothèque nationale de France	https://gallica.bnf.fr/ark:/12148/bpt6k56296819
bpt6k5821216b.txt	Claude et Marianne, par Henry Murger	1851	https://data.bnf.fr/ark:/12148/bpt6k5821216b	Murger, Henry (1822-1861)	Public domain	Méline, Cans et Cie (Bruxelles)	monographie imprimée	Bibliothèque nationale de France	https://gallica.bnf.fr/ark:/12148/bpt6k5821216b
bpt6k57878425.txt	Madame de Sévigné	1812	https://data.bnf.fr/ark:/12148/bpt6k57878425	Sévigné, Marie de Rabutin-Chantal (1626-1696 ; marquise de)	Public domain	Le Fuel (Paris)	monographie imprimée	Bibliothèque nationale de France	https://gallica.bnf.fr/ark:/12148/bpt6k57878425
bpt6k5699009f.txt	Ma petite soeur, par Auguste Ricard. Volume 1	1839	https://data.bnf.fr/ark:/12148/bpt6k5699009f	Ricard, Auguste (1799-1841)	Public domain	C. Lachapelle (Paris)	monographie imprimée	Bibliothèque nationale de France	https://gallica.bnf.fr/ark:/12148/bpt6k5699009f
bpt6k6464082x.txt	Mort et funérailles de M. l'abbé Choiselat, curé de la Cathédrale de Saint Dié / [signé : A. S.]	1875	https://data.bnf.fr/ark:/12148/bpt6k6464082x	A. S.	Public domain	Impr. de Humbert (Saint-Dié)	monographie imprimée	Bibliothèque nationale de France	https://gallica.bnf.fr/ark:/12148/bpt6k6464082x
bpt6k61002323.txt	"Moyens de payer les dettes arriérées de l'État, ou réponse à la brochure de M. le duc de Gaëte, intitulée : ""Opinion préliminaire sur les finances"" ; par un ancien négociant"	1815	https://data.bnf.fr/ark:/12148/bpt6k61002323		Public domain	Mme Goulet ((Paris,))	monographie imprimée	Bibliothèque nationale de France	https://gallica.bnf.fr/ark:/12148/bpt6k61002323
bpt6k55237374.txt	Mémorandum historique pour servir à l'explication du tableau donné ci-après, opuscule destiné au Congrès scientifique réuni à la Rochelle en 1856. [Signé : Ponts-Asnières-La-Châtaigneraye.]	1856	https://data.bnf.fr/ark:/12148/bpt6k55237374	La Châtaigneraye, Jean-Baptiste-François-Auguste (1785-18..)	Public domain	impr. de Firmin-Didot frères (Paris)	monographie imprimée	Bibliothèque nationale de France	https://gallica.bnf.fr/ark:/12148/bpt6k55237374
bpt6k65686382.txt	"Au coeur de l'Antarctique : expédition du ""Nimrod"" au Pôle sud / E. H. Shackleton ; traduction et... adaptation... par M. Charles Rabot..."	1910	https://data.bnf.fr/ark:/12148/bpt6k65686382	Shackleton, Ernest Henry (1874-1922)	Public domain	Hachette (Paris)	monographie imprimée	Bibliothèque nationale de France	https://gallica.bnf.fr/ark:/12148/bpt6k65686382
bpt6k1242218r.txt	Catalogue de terres cuites, groupes, statuettes, bustes, 12 tableaux et 30 dessins, oeuvres de A. Carrier-Belleuse... / [expert] F. Jacob	1883	https://data.bnf.fr/ark:/12148/bpt6k1242218r		Public domain	[s.n.]	monographie imprimée	Bibliothèque nationale de France	https://gallica.bnf.fr/ark:/12148/bpt6k1242218r
bpt6k96169060.txt	La Botanique de J.-J. Rousseau, contenant tout ce qu'il a écrit sur cette science, l'exposition de la méthode botanique de M. de Jussieu ; la manière de former les herbiers, par M. Haüv	1802	https://data.bnf.fr/ark:/12148/bpt6k96169060	Haüy, René-Just (1743-1822)	Public domain	F. Louis (Paris)	monographie imprimée	Bibliothèque nationale de France	https://gallica.bnf.fr/ark:/12148/bpt6k96169060
bpt6k97661271.txt	Étude sur les végétations adénoïdes du pharynx nasal : thèse présentée à la Faculté de médecine... / par J. Collet	1880	https://data.bnf.fr/ark:/12148/bpt6k97661271	Collet, J (Dr)	Public domain	Imprimerie nouvelle (Lyon)	monographie imprimée	Bibliothèque nationale de France	https://gallica.bnf.fr/ark:/12148/bpt6k97661271
bpt6k6459386w.txt	Quelques mots sur Diane de Poitiers (Anet, le 25 Juin 1875) / [signé H. Dubreuil]	1876	https://data.bnf.fr/ark:/12148/bpt6k6459386w	Dubreuil, Henry (1848-1893)	Public domain	impr. de Durand frères (Chartres)	monographie imprimée	Bibliothèque nationale de France	https://gallica.bnf.fr/ark:/12148/bpt6k6459386w
bpt6k6119519b.txt	Chansons sérieuses, par Ferdinand Victor	1860	https://data.bnf.fr/ark:/12148/bpt6k6119519b	Lacadorais, Ferdinand-Victor (pseud. Ferdinand Victor)	Public domain	impr. de De Soye et Bouchet (Paris)	monographie imprimée	Bibliothèque nationale de France	https://gallica.bnf.fr/ark:/12148/bpt6k6119519b
bpt6k6121151z.txt	Fables offertes à l'enfance, par Mlle Cl. Filleul de Pétigny	1850	https://data.bnf.fr/ark:/12148/bpt6k6121151z	Filleul de Pétigny, Clara (1822-1878)	Public domain	A. Maugars (Paris)	monographie imprimée	Bibliothèque nationale de France	https://gallica.bnf.fr/ark:/12148/bpt6k6121151z
bpt6k6148002v.txt	Les Alchimistes du XIXe siècle... La Comédie en vers... Par J.-A. d'Escodeca de Boisse. [Lu... à la Société philotechnique.]	1860	https://data.bnf.fr/ark:/12148/bpt6k6148002v	Escodeca de Boisse, Jean-Arnaud d' (1802-1865)	Public domain	Ledoyen (Paris)	monographie imprimée	Bibliothèque nationale de France	https://gallica.bnf.fr/ark:/12148/bpt6k6148002v
bpt6k57756163.txt	Histoire de la Restauration. Edition 2,Tome 6 / par M. F.-P. Lubis,...	1848	https://data.bnf.fr/ark:/12148/bpt6k57756163	Lubis, F.-P.	Public domain	(Paris)	monographie imprimée	Bibliothèque nationale de France	https://gallica.bnf.fr/ark:/12148/bpt6k57756163
bpt6k64802692.txt	Esquisse de l'histoire de la médecine, depuis son origine jusqu'à l'année 1812 , servant d'introduction au Dictionnaire des sciences médicales ; par L.-J. Renauldin,...	1812	https://data.bnf.fr/ark:/12148/bpt6k64802692	Renauldin, Léopold Joseph (1775-1859)	Public domain	impr. de Le Normant (Paris)	monographie imprimée	Bibliothèque nationale de France	https://gallica.bnf.fr/ark:/12148/bpt6k64802692
bpt6k5425270d.txt	Prépondérance de la France depuis l'avènement de l'empereur Napoléon III, par M. F.-M.-L. Rousson du Galteyrès,...	1857	https://data.bnf.fr/ark:/12148/bpt6k5425270d	Rousson Du Galteyrès, Louis-Ferdinand	Public domain	impr. de Soustelle (Nîmes)	monographie imprimée	Bibliothèque nationale de France	https://gallica.bnf.fr/ark:/12148/bpt6k5425270d
bpt6k9615938n.txt	Recherche des leucomaïnes dans la rate / par le Dr Émile-François-Joseph Morelle	1886	https://data.bnf.fr/ark:/12148/bpt6k9615938n	Morelle, Émile François Joseph (Dr)	Public domain	impr. de L. Danel (Lille)	monographie imprimée	Bibliothèque nationale de France	https://gallica.bnf.fr/ark:/12148/bpt6k9615938n
bpt6k5525128q.txt	La province de Québec et l'émigration européenne (Deuxième édition) / publié par ordre du gouvernement de la province de Québec	1873	https://data.bnf.fr/ark:/12148/bpt6k5525128q		Public domain	[s.n.] (Québec)	monographie imprimée	Bibliothèque nationale de France	https://gallica.bnf.fr/ark:/12148/bpt6k5525128q
bpt6k5435905h.txt	Le Congrès de 1860 ; par un Italien. (Signé : L. P.)	1860	https://data.bnf.fr/ark:/12148/bpt6k5435905h		Public domain	Impr. de Pfeffer et Puky (Genève)	monographie imprimée	Bibliothèque nationale de France	https://gallica.bnf.fr/ark:/12148/bpt6k5435905h
