id	title	year	sameAs	author	license	publisher	type	archive	link
bpt6k54377983.txt	Souvenir et adieu, antiquités religieuses et profanes, moyen âge, scènes historiques et légendaires, par J.-B. Buzy,...	1892	https://data.bnf.fr/ark:/12148/bpt6k54377983	Buzy, J.-B.	Public domain	impr. Saint-Martin (Ligugé)	monographie imprimée	Bibliothèque nationale de France	https://gallica.bnf.fr/ark:/12148/bpt6k54377983
bpt6k5612297b.txt	La perle des triolets ou l'Antiquité renouvellée avec les noms et surnoms des plus généreux frondeurs de la ville et Faux-bourgs de Paris	1650	https://data.bnf.fr/ark:/12148/bpt6k5612297b		Public domain	F. Noël (Paris)	monographie imprimée	Bibliothèque nationale de France	https://gallica.bnf.fr/ark:/12148/bpt6k5612297b
bpt6k96130934.txt	Cas de fécondité chez une mule : accompagné de considérations sur les hybrides du genre equus / traduction de M. Molinier,...	1875	https://data.bnf.fr/ark:/12148/bpt6k96130934		Public domain	(Langres)	monographie imprimée	Bibliothèque nationale de France	https://gallica.bnf.fr/ark:/12148/bpt6k96130934
bpt6k6267464t.txt	Napoléon, l'impératrice Joséphine et le grenadier de Saint-Cloud , anecdote peu connue de la vie de Napoléon Bonaparte, racontée par un témoin oculaire. 1808	1833	https://data.bnf.fr/ark:/12148/bpt6k6267464t		Public domain	Impr. de J.-M. Boursy (Lyon)	monographie imprimée	Bibliothèque nationale de France	https://gallica.bnf.fr/ark:/12148/bpt6k6267464t
bpt6k6524150f.txt	Les Musées d'Athènes par P. Cavvadias...	1894	https://data.bnf.fr/ark:/12148/bpt6k6524150f	Cavvadias, P.	Public domain		monographie imprimée	Bibliothèque nationale de France	https://gallica.bnf.fr/ark:/12148/bpt6k6524150f
bpt6k5475272m.txt	Nouveaux samedis : 13e série / par A. de Pontmartin,...	1876	https://data.bnf.fr/ark:/12148/bpt6k5475272m	Pontmartin, Armand de (1811-1890)	Public domain	(Paris)	monographie imprimée	Bibliothèque nationale de France	https://gallica.bnf.fr/ark:/12148/bpt6k5475272m
bpt6k63175945.txt	Avis au lecteur. Concernant une lettre adressée à Messieurs de l'Académie franc̜aise , où on cherche à prouver que M. le Maréchal de Vauban ne mérite pas l'eloge que cette respectable compagnie a proposé pour le prix d'eloquence de 1787	1786-1787	https://data.bnf.fr/ark:/12148/bpt6k63175945		Public domain	[s.n.]	monographie imprimée	Bibliothèque nationale de France	https://gallica.bnf.fr/ark:/12148/bpt6k63175945
bpt6k58341181.txt	Applications au Code civil des Institutes de Justinien et des cinquante livres du Digeste. Tome 1 / , avec la traduction en regard ; par M. Biret,...	1824	https://data.bnf.fr/ark:/12148/bpt6k58341181	Biret, Aimé Charles Louis Modeste (1767-1839)	Public domain	l'auteur (Paris)	monographie imprimée	Bibliothèque nationale de France	https://gallica.bnf.fr/ark:/12148/bpt6k58341181
bpt6k56597839.txt	L'Aveugle, au docteur Coursserant, stances par Raoul Bonnery...	1873	https://data.bnf.fr/ark:/12148/bpt6k56597839	Bonnery, Raoul (1851-1894)	Public domain	impr. de Beauvais (Le Mans)	monographie imprimée	Bibliothèque nationale de France	https://gallica.bnf.fr/ark:/12148/bpt6k56597839
bpt6k5453942q.txt	Thiers et Salvador, drame hypothétique et international. Partie 1 / par Erick Raudi	1872	https://data.bnf.fr/ark:/12148/bpt6k5453942q	Raudi, Erick	Public domain	Dentu (Paris)	monographie imprimée	Bibliothèque nationale de France	https://gallica.bnf.fr/ark:/12148/bpt6k5453942q
bpt6k61077001.txt	La Lyre angélique, recueil de cantiques nouveaux,... par M. l'abbé Justin Etcheverry,...	1870	https://data.bnf.fr/ark:/12148/bpt6k61077001	Etcheverry, Justin (1815-1890)	Public domain	Périsse frères (Paris)	monographie imprimée	Bibliothèque nationale de France	https://gallica.bnf.fr/ark:/12148/bpt6k61077001
bpt6k6152901z.txt	Une actrice au paradis / par S.-Champion Lajarry aîné...	1836	https://data.bnf.fr/ark:/12148/bpt6k6152901z		Public domain	impr. de A. Belin (Paris)	monographie imprimée	Bibliothèque nationale de France	https://gallica.bnf.fr/ark:/12148/bpt6k6152901z
bpt6k6548665d.txt	Géographie-atlas du cours moyen : textes, cartes et devoirs / par les Frères des écoles chrétiennes	1900	https://data.bnf.fr/ark:/12148/bpt6k6548665d	Frères des écoles chrétiennes	Public domain	C. Poussielgue (Paris)	monographie imprimée	Bibliothèque nationale de France	https://gallica.bnf.fr/ark:/12148/bpt6k6548665d
bpt6k5817551d.txt	Une ambassade au Maroc / par Gabriel Charmes	1887	https://data.bnf.fr/ark:/12148/bpt6k5817551d	Charmes, Gabriel (1850-1886)	Public domain	C. Lévy (Paris)	monographie imprimée	Bibliothèque nationale de France	https://gallica.bnf.fr/ark:/12148/bpt6k5817551d
bpt6k56234469.txt	Acte d'accusation contre Libri-Carrucci	1850	https://data.bnf.fr/ark:/12148/bpt6k56234469		Public domain	Panckoucke (Paris)	monographie imprimée	Bibliothèque nationale de France	https://gallica.bnf.fr/ark:/12148/bpt6k56234469
bpt6k65561853.txt	Avenir de la cavalerie en campagne	1869	https://data.bnf.fr/ark:/12148/bpt6k65561853		Public domain	J. Dumaine (Paris)	monographie imprimée	Bibliothèque nationale de France	https://gallica.bnf.fr/ark:/12148/bpt6k65561853
bpt6k5785501k.txt	Correspondance secrète des députés de Saint-Domingue avec les comités de cette île. (12 août 1789-9 avril 1790.)	1789-1790	https://data.bnf.fr/ark:/12148/bpt6k5785501k		Public domain		monographie imprimée	Bibliothèque nationale de France	https://gallica.bnf.fr/ark:/12148/bpt6k5785501k
bpt6k5742358n.txt	Discours prononcé par le citoyen Rivière, professeur à l'école centrale du département du Lot, à la cérémonie funèbre du général Hoche	1795	https://data.bnf.fr/ark:/12148/bpt6k5742358n	Rivière, Le Citoyen	Public domain	Richard père et fils (Cahors)	monographie imprimée	Bibliothèque nationale de France	https://gallica.bnf.fr/ark:/12148/bpt6k5742358n
bpt6k96248158.txt	Inauguration du buste du Cte de Serre à Pagny-sur-Moselle, le... 24 octobre 1886 . Discours de M. Salmon,...	1887	https://data.bnf.fr/ark:/12148/bpt6k96248158	Salmon	Public domain	impr. de Berger-Levrault (Nancy)	monographie imprimée	Bibliothèque nationale de France	https://gallica.bnf.fr/ark:/12148/bpt6k96248158
bpt6k6315076w.txt	Étude critique sur quelques points de la physiologie du sommeil, par J.-B. Langlet	1872	https://data.bnf.fr/ark:/12148/bpt6k6315076w	Langlet, Jean-Baptiste (1841-1927)	Public domain	L. Leclerc (Paris)	monographie imprimée	Bibliothèque nationale de France	https://gallica.bnf.fr/ark:/12148/bpt6k6315076w
bpt6k64380096.txt	Procès-verbal de la fête célébrée à Namur, le 30 frimaire an III... à l'occasion de l'installation de l'administration d'arrondissement du pays et ci-devant comté de Namur...	1794	https://data.bnf.fr/ark:/12148/bpt6k64380096		Public domain		monographie imprimée	Bibliothèque nationale de France	https://gallica.bnf.fr/ark:/12148/bpt6k64380096
bpt6k9673403r.txt	Rapport à M. le préfet de l'Allier, sur la situation agricole du canton d'Ébreuil / par M. Boirot (Victor),...	1842	https://data.bnf.fr/ark:/12148/bpt6k9673403r	Boirot, Victor	Public domain	impr. de L. Jourdain (Cusset)	monographie imprimée	Bibliothèque nationale de France	https://gallica.bnf.fr/ark:/12148/bpt6k9673403r
bpt6k6218616c.txt	Observation relative à la loi contre les émigrés	1792	https://data.bnf.fr/ark:/12148/bpt6k6218616c		Public domain	[s.n.][s.n.]	monographie imprimée	Bibliothèque nationale de France	https://gallica.bnf.fr/ark:/12148/bpt6k6218616c
bpt6k5536604m.txt	L'intérêt général : conte	1844	https://data.bnf.fr/ark:/12148/bpt6k5536604m		Public domain	imp. de Beanfort et Lecauf (Cherbourg)	monographie imprimée	Bibliothèque nationale de France	https://gallica.bnf.fr/ark:/12148/bpt6k5536604m
bpt6k96627177.txt	Biographies d'hommes illustres des temps anciens et modernes / Edgar Zévort	1887	https://data.bnf.fr/ark:/12148/bpt6k96627177	Zevort, Edgar (1842-1908)	Public domain	Picard-Bernheim (Paris)	monographie imprimée	Bibliothèque nationale de France	https://gallica.bnf.fr/ark:/12148/bpt6k96627177
bpt6k5478213p.txt	L'Amour et la Bouteille ou le véritable chansonnier des campagnes. Recueil de couplets badins, grivois, bachiques, de pastorales, romances, amourettes et chants patriotiques	1849	https://data.bnf.fr/ark:/12148/bpt6k5478213p		Public domain	librairie populaire des villes et des campagnes (Paris)	monographie imprimée	Bibliothèque nationale de France	https://gallica.bnf.fr/ark:/12148/bpt6k5478213p
bpt6k5530031k.txt	Prise de la citadelle d'Anvers... / A. Bisson-Paesschiers	1833	https://data.bnf.fr/ark:/12148/bpt6k5530031k	Paesschiers-Bisson, Adolphe (Eugène-Adolphe)	Public domain	impr. de Goetschy fils (Paris)	monographie imprimée	Bibliothèque nationale de France	https://gallica.bnf.fr/ark:/12148/bpt6k5530031k
bpt6k6541819p.txt	A coté du bonheur	1880	https://data.bnf.fr/ark:/12148/bpt6k6541819p		Public domain	Calmann-Lévy (Paris)	monographie imprimée	Bibliothèque nationale de France	https://gallica.bnf.fr/ark:/12148/bpt6k6541819p
bpt6k5718281k.txt	Les sourds-muets et les anthropologistes : mémoire en réponse au Dr Mygind, présenté au congrès de Genève (1896) / par M. Eugène Née,... ; préface de M. Henri Gaillard	1898	https://data.bnf.fr/ark:/12148/bpt6k5718281k	Née, Eugène	Public domain	Impr. d'ouvriers sourds-muets (Paris)	monographie imprimée	Bibliothèque nationale de France	https://gallica.bnf.fr/ark:/12148/bpt6k5718281k
bpt6k5754509r.txt	Fête en réjouissance de la paix, de la délivrance de l'Espagne et du glorieux retour de S. A. R. monseigneur le duc d'Angoulême	1823	https://data.bnf.fr/ark:/12148/bpt6k5754509r		Public domain	Impr. de Mellinet-Malassis (Nantes)	monographie imprimée	Bibliothèque nationale de France	https://gallica.bnf.fr/ark:/12148/bpt6k5754509r
bpt6k5740361h.txt	L'art d'elever un prince , dedié à monseigneur le duc de Bourgogne	1688	https://data.bnf.fr/ark:/12148/bpt6k5740361h	Foix, Marc-Antoine de (1627-1687)	Public domain	A Paris, chez la veuve de Claude Thiboust; et Pierre Esclassan. M.DC.LXXXVIII	monographie imprimée	Bibliothèque nationale de France	https://gallica.bnf.fr/ark:/12148/bpt6k5740361h
bpt6k5487487n.txt	De la Phthisie pulmonaire, au point de vue de l'anatomie, de la physiologie pathologique et du diagnostic, par M. Felz,...	1865	https://data.bnf.fr/ark:/12148/bpt6k5487487n	Feltz, Victor-Timothée (1835-1893)	Public domain	impr. de Silbermann (Strasbourg)	monographie imprimée	Bibliothèque nationale de France	https://gallica.bnf.fr/ark:/12148/bpt6k5487487n
bpt6k5809648m.txt	Vie du bienheureux saint Roch,...	1855	https://data.bnf.fr/ark:/12148/bpt6k5809648m		Public domain	Impr. de Laurent (Verdun)	monographie imprimée	Bibliothèque nationale de France	https://gallica.bnf.fr/ark:/12148/bpt6k5809648m
bpt6k6379124d.txt	Notice sur la vie de Révérende Mère Abbesse Marie de Saint-Paul du St-Sacrement, supérieure du Monastère de Sainte-Claire, à Lyon	1871	https://data.bnf.fr/ark:/12148/bpt6k6379124d		Public domain	Impr. de Vve Rougier et fils (Lyon)	monographie imprimée	Bibliothèque nationale de France	https://gallica.bnf.fr/ark:/12148/bpt6k6379124d
bpt6k64584257.txt	L'héritage de Déjazet	1875	https://data.bnf.fr/ark:/12148/bpt6k64584257		Public domain	Impr. de Vves Renou, Maulde et Cock (Paris)	monographie imprimée	Bibliothèque nationale de France	https://gallica.bnf.fr/ark:/12148/bpt6k64584257
bpt6k6124582t.txt	La vallée de Sainte-Hélène, ou veillées au tombeau d'un homme célèbre. Mémoires particuliers sur la vie et la mort de Napoléon Bonaparte, rapportés de Sainte-Hélène et publiés par un officier de l'un des régiments en station dans cette île pendant la captivité de l'ex-empereur	1821	https://data.bnf.fr/ark:/12148/bpt6k6124582t		Public domain	Ledentu (Paris)	monographie imprimée	Bibliothèque nationale de France	https://gallica.bnf.fr/ark:/12148/bpt6k6124582t
bpt6k9765896c.txt	Variabilité et différentes modalités du souffle révélateur de l'insuffisance aortique : thèse présentée à la Faculté de médecine... / par Frédéric-Joseph Marqueyrol	1890	https://data.bnf.fr/ark:/12148/bpt6k9765896c	Marqueyrol, Frédéric-Joseph	Public domain	Association typographique (Lyon)	monographie imprimée	Bibliothèque nationale de France	https://gallica.bnf.fr/ark:/12148/bpt6k9765896c
bpt6k9674383r.txt	Panégyrique de saint Étienne d'Obazine / par M. l'abbé Germain Breton,...	1889	https://data.bnf.fr/ark:/12148/bpt6k9674383r	Breton, Germain (1852-1931)	Public domain	impr. de J. Mazeyrie (Tulle)	monographie imprimée	Bibliothèque nationale de France	https://gallica.bnf.fr/ark:/12148/bpt6k9674383r
bpt6k6459570q.txt	Le massage et la gymnastique médicale suédoise / par Jeanne Schenström,...	1908	https://data.bnf.fr/ark:/12148/bpt6k6459570q	Schenström, Jeanne	Public domain	Institut R. Schenström (Paris)	monographie imprimée	Bibliothèque nationale de France	https://gallica.bnf.fr/ark:/12148/bpt6k6459570q
bpt6k5813257m.txt	Le Notariat en Norwège, par le Dr Vladimir Pappafava,...	1895	https://data.bnf.fr/ark:/12148/bpt6k5813257m	Pappafava, Vladimir (1850-1928)	Public domain	impr. de Baratier (Grenoble)	monographie imprimée	Bibliothèque nationale de France	https://gallica.bnf.fr/ark:/12148/bpt6k5813257m
bpt6k5772708z.txt	L'amphithéâtre du grand collège de Reims . Solyman 2, quatorziesme empereur des Turcs... par George Thilloys,...	1617	https://data.bnf.fr/ark:/12148/bpt6k5772708z	Thilloys, George	Public domain	S. de Foigny (Reims)	monographie imprimée	Bibliothèque nationale de France	https://gallica.bnf.fr/ark:/12148/bpt6k5772708z
bpt6k1265718z.txt	"Elévation et distribution d'eau. Service des eaux de Versailles, Marly, Meudon et Saint-Cloud... extrait du 26e volume de la ""Publication industrielle des machines outils et appareils"". Biographie de M. Xavier Dufrayer,... [Signée : Armengaud aîné], extrait du ""Bulletin de la Société des anciens élèves des écoles nationales d'arts et métiers"""	1880	https://data.bnf.fr/ark:/12148/bpt6k1265718z	Armengaud, Eugène (1810-1891)	Public domain	Armengaud aîné (Paris)	monographie imprimée	Bibliothèque nationale de France	https://gallica.bnf.fr/ark:/12148/bpt6k1265718z
bpt6k5502232g.txt	Deuxième ballet dansé par le roy dans son château des Tuileries, le lundi 30e jour du mois de décembre 1720	1720	https://data.bnf.fr/ark:/12148/bpt6k5502232g	Coypel, Charles-Antoine (1694-1752)	Public domain	impr. de J.-B.-C. Ballard (Paris)	monographie imprimée	Bibliothèque nationale de France	https://gallica.bnf.fr/ark:/12148/bpt6k5502232g
bpt6k5613321v.txt	La Voix de Jérusalem	1863	https://data.bnf.fr/ark:/12148/bpt6k5613321v		Public domain	Grasart (Paris)	monographie imprimée	Bibliothèque nationale de France	https://gallica.bnf.fr/ark:/12148/bpt6k5613321v
bpt6k61132826.txt	Réfutation du Compte rendu de M. Sainneville, sur les événements de Lyon en juin 1817	1818	https://data.bnf.fr/ark:/12148/bpt6k61132826		Public domain	chez les marchands de nouveautés (Lyon)	monographie imprimée	Bibliothèque nationale de France	https://gallica.bnf.fr/ark:/12148/bpt6k61132826
bpt6k5626332v.txt	Livret-Devaux. Guide indispensable aux débitants de boissons et à tous les négociants soumis à l'exercice de la régie, ainsi qu'aux consommateurs, par M. A. Devaux,...	1876	https://data.bnf.fr/ark:/12148/bpt6k5626332v	Devaux, A. (employé de la recette buraliste de Pierrefitte)	Public domain	Roret (Paris)	monographie imprimée	Bibliothèque nationale de France	https://gallica.bnf.fr/ark:/12148/bpt6k5626332v
bpt6k5512492q.txt	Adresse de l'industrie et du commerce à M. Thiers,... Paris, le 18 novembre 1872	1872	https://data.bnf.fr/ark:/12148/bpt6k5512492q		Public domain		monographie imprimée	Bibliothèque nationale de France	https://gallica.bnf.fr/ark:/12148/bpt6k5512492q
bpt6k9760359t.txt	Le rôle de l'aéronautique maritime française dans la protection des communications : 1914-1918 / travail de M. le L. V. d'Hespel	1928-1929	https://data.bnf.fr/ark:/12148/bpt6k9760359t	École supérieure de guerre navale (Paris)	Public domain	[s.n.]	monographie imprimée	Bibliothèque nationale de France	https://gallica.bnf.fr/ark:/12148/bpt6k9760359t
bpt6k6576737n.txt	D'Aix-les-Bains à Rumilly et Annecy. Itinéraire historique et descriptif ; par Fr. D., avocat à la cour... de Chambéry	1867	https://data.bnf.fr/ark:/12148/bpt6k6576737n		Public domain	Impr. de Pouchet (Chambéry)	monographie imprimée	Bibliothèque nationale de France	https://gallica.bnf.fr/ark:/12148/bpt6k6576737n
bpt6k96010685.txt	Catalogue raisonné des livres et des manuscrits japonais enregistrés à la bibliothèque de l'Université de Leyde / par le Dr L. Serrurier,...	1896	https://data.bnf.fr/ark:/12148/bpt6k96010685	Serrurier, Lindor (1846-1901)	Public domain	E. J. Brill (Leyde)	monographie imprimée	Bibliothèque nationale de France	https://gallica.bnf.fr/ark:/12148/bpt6k96010685
bpt6k63110720.txt	Procès-verbal de la conduite tenue par l'armée révolutionnaire pendant son séjour à Grenade, chef-lieu de district, au département de Haute-Garonne, dressé par la municipalité et conseil général de la commune, le troisième nivôse de l'an second de la république...	1794	https://data.bnf.fr/ark:/12148/bpt6k63110720		Public domain	Ve Desclassan (Toulouse)	monographie imprimée	Bibliothèque nationale de France	https://gallica.bnf.fr/ark:/12148/bpt6k63110720
bpt6k3752267.txt	Commune de Romainville. Bibliothèque municipale populaire. Catalogue méthodique. 1882	1883	https://data.bnf.fr/ark:/12148/bpt6k3752267		Public domain		monographie imprimée	Bibliothèque nationale de France	https://gallica.bnf.fr/ark:/12148/bpt6k3752267
bpt6k9765411w.txt	De la luxation trapézo-métacarpienne incomplète en arrière : thèse présentée à la Faculté de médecine... / par Paul Waton	1888	https://data.bnf.fr/ark:/12148/bpt6k9765411w	Waton, Paul	Public domain	Impr. de M. Guichard et L. Dreyfus (Lyon)	monographie imprimée	Bibliothèque nationale de France	https://gallica.bnf.fr/ark:/12148/bpt6k9765411w
bpt6k55650435.txt	Le mariage de S. A. R. monseigneur le duc d'Orléans avec la princesse Hélène de Mecklembourg-Schwerin . Par M.....	1837	https://data.bnf.fr/ark:/12148/bpt6k55650435		Public domain	Delaunay (Paris)	monographie imprimée	Bibliothèque nationale de France	https://gallica.bnf.fr/ark:/12148/bpt6k55650435
bpt6k55351050.txt	Le scélérat royal : grand roman national historique / par A. Halnare	1876	https://data.bnf.fr/ark:/12148/bpt6k55351050	Halnare, A. (pseud. d'Ernest L.)	Public domain	(Paris)	monographie imprimée	Bibliothèque nationale de France	https://gallica.bnf.fr/ark:/12148/bpt6k55351050
bpt6k5530848m.txt	Charles X que l'on veut mettre en prison, ou ses créanciers qui le poursuivent par corps. Détails intéressants sur la cour d'Holyrood	1830	https://data.bnf.fr/ark:/12148/bpt6k5530848m		Public domain	Impr. de Sétier (Paris)	monographie imprimée	Bibliothèque nationale de France	https://gallica.bnf.fr/ark:/12148/bpt6k5530848m
bpt6k6121457g.txt	Catalogue de tableaux... Vente 11 févr. 1846...	1846	https://data.bnf.fr/ark:/12148/bpt6k6121457g		Public domain	Gérard (Paris)	monographie imprimée	Bibliothèque nationale de France	https://gallica.bnf.fr/ark:/12148/bpt6k6121457g
bpt6k6471355d.txt	Monseigneur Joseph-Armand Gignoux, Evêque de Beauvais... Sa vie-ses adieux... -Son éloge funèbre, prononcé par Mgr Mermillod...	1878	https://data.bnf.fr/ark:/12148/bpt6k6471355d	Eglise catholique. Diocèse (Genève, Suisse ; 03..-1801)	Public domain	Impr. de D. Pere (Beauvais)	monographie imprimée	Bibliothèque nationale de France	https://gallica.bnf.fr/ark:/12148/bpt6k6471355d
bpt6k5499157c.txt	Patrie et liberté !... : instruction civique et droit usuel, à l'usage des jeunes Français / par Louis Crénais	1887	https://data.bnf.fr/ark:/12148/bpt6k5499157c	Crénais, Louis	Public domain	l'auteur (Marolles)	monographie imprimée	Bibliothèque nationale de France	https://gallica.bnf.fr/ark:/12148/bpt6k5499157c
bpt6k9614436s.txt	Poètes et artistes de l'Italie / Émile Montégut	1881	https://data.bnf.fr/ark:/12148/bpt6k9614436s	Montégut, Émile (1825-1895)	Public domain	Hachette et Cie (Paris)	monographie imprimée	Bibliothèque nationale de France	https://gallica.bnf.fr/ark:/12148/bpt6k9614436s
bpt6k5706050f.txt	Préfecture du département de la Seine. Administration générale de l'assistance publique à Paris. Instruction générale sur le service extérieur des enfants assistés	1877	https://data.bnf.fr/ark:/12148/bpt6k5706050f		Public domain	impr. de Dupont (Paris)	monographie imprimée	Bibliothèque nationale de France	https://gallica.bnf.fr/ark:/12148/bpt6k5706050f
bpt6k62331654.txt	Catalogue du Musée Rath	1906	https://data.bnf.fr/ark:/12148/bpt6k62331654		Public domain	impr. de W. Kündig et fils (Genève)	monographie imprimée	Bibliothèque nationale de France	https://gallica.bnf.fr/ark:/12148/bpt6k62331654
bpt6k9621275j.txt	Coutumes générales du bailliage du Bassigny, rédigées par les trois états d'icelui, convoqués à cet effet... et homologuées... au mois de novembre 1580. Avec le stile contenu au cayer suivant	1761	https://data.bnf.fr/ark:/12148/bpt6k9621275j		Public domain	H. Thomas père et fils (Nancy)	monographie imprimée	Bibliothèque nationale de France	https://gallica.bnf.fr/ark:/12148/bpt6k9621275j
bpt6k9610076p.txt	Du gouvernement et des loix de la Pologne	1781	https://data.bnf.fr/ark:/12148/bpt6k9610076p		Public domain	[s.n.] (Londres)	monographie imprimée	Bibliothèque nationale de France	https://gallica.bnf.fr/ark:/12148/bpt6k9610076p
bpt6k9611484x.txt	Cours d'organisation et législation / Ministère de la guerre. Ecoles militaires	1921	https://data.bnf.fr/ark:/12148/bpt6k9611484x	France. Ministère de la guerre (1791-1936)	Public domain	Impr. nationale (Paris)	monographie imprimée	Bibliothèque nationale de France	https://gallica.bnf.fr/ark:/12148/bpt6k9611484x
bpt6k58550797.txt	Histoire scandaleuse et anecdotique de Charles X,...	1830	https://data.bnf.fr/ark:/12148/bpt6k58550797		Public domain	chez les marchands de nouveautés (Paris)	monographie imprimée	Bibliothèque nationale de France	https://gallica.bnf.fr/ark:/12148/bpt6k58550797
bpt6k65247864.txt	Notice sur Auguste Geffroy, membre de l'Institut, professeur d'histoire à la Sorbonne, directeur de l'école française de Rome, lue le 12 janvier 1896 à la réunion générale annuelle de l'Association des anciens élèves de l'Ecole normale supérieure / par Léon Ollé-Laprune,...	1896	https://data.bnf.fr/ark:/12148/bpt6k65247864	Ollé-Laprune, Léon (1839-1898)	Public domain	impr. de D. Dumoulin (Paris)	monographie imprimée	Bibliothèque nationale de France	https://gallica.bnf.fr/ark:/12148/bpt6k65247864
bpt6k5832709h.txt	Promenade au salon 1844 et aux galeries des beaux-arts / précédé d'une lettre à Théodore Rousseau par T. Thoré ; avec une eau forte de Jeanron...	1844	https://data.bnf.fr/ark:/12148/bpt6k5832709h	Thoré, Théophile (1807-1869)	Public domain	Alliance des arts (Paris)	monographie imprimée	Bibliothèque nationale de France	https://gallica.bnf.fr/ark:/12148/bpt6k5832709h
bpt6k6119409m.txt	"Mercuriale à M. le comte de Saint-Aulaire, sur son pamphlet apologétique de M. le duc Decazes, intitulé : ""Réponse au Mémoire de Me Berryer fils, pour le général Donnadieu"" , par M****"	1820	https://data.bnf.fr/ark:/12148/bpt6k6119409m		Public domain	Le Normant (Paris)	monographie imprimée	Bibliothèque nationale de France	https://gallica.bnf.fr/ark:/12148/bpt6k6119409m
bpt6k5652713g.txt	Le mal et le remède, aphorismes sociaux : profession de foi / de Ramon de La Sagra,...	1859	https://data.bnf.fr/ark:/12148/bpt6k5652713g	Sagra, Ramón de la (1798-1871)	Public domain	l'auteur (Paris)	monographie imprimée	Bibliothèque nationale de France	https://gallica.bnf.fr/ark:/12148/bpt6k5652713g
bpt6k5499148d.txt	Étude comparée sur la propagation des souffles organiques du coeur dans l'âge adulte et l'enfance, par le Dr S. Perret,...	1891	https://data.bnf.fr/ark:/12148/bpt6k5499148d	Perret, Simon (1847-19..)	Public domain	impr. de L. Delaroche (Lyon)	monographie imprimée	Bibliothèque nationale de France	https://gallica.bnf.fr/ark:/12148/bpt6k5499148d
bpt6k5469466j.txt	Essai sur la pathogénie du crétinisme / par Verdan,...	1883	https://data.bnf.fr/ark:/12148/bpt6k5469466j	Verdan, Théodore (Dr)	Public domain	impr. de A. Davy (Paris)	monographie imprimée	Bibliothèque nationale de France	https://gallica.bnf.fr/ark:/12148/bpt6k5469466j
bpt6k5608543d.txt	Le bon combat en Côte d'Ivoire / [signé Blocher]	19..	https://data.bnf.fr/ark:/12148/bpt6k5608543d	Blocher-Saillens, Madeleine (1881-1971)	Public domain	impr. de A. Coueslant (Cahors)	monographie imprimée	Bibliothèque nationale de France	https://gallica.bnf.fr/ark:/12148/bpt6k5608543d
bpt6k6130013w.txt	Règlement sur la tenue de la comptabilité des économes dans les établissements publics d'assistance, du 9 septembre 1899	1909	https://data.bnf.fr/ark:/12148/bpt6k6130013w		Public domain	Berger-Levrault (Paris)	monographie imprimée	Bibliothèque nationale de France	https://gallica.bnf.fr/ark:/12148/bpt6k6130013w
bpt6k5821950s.txt	Les Mystères de la claque. Par V. D.	1850	https://data.bnf.fr/ark:/12148/bpt6k5821950s		Public domain	chez les principaux libraires (Paris)	monographie imprimée	Bibliothèque nationale de France	https://gallica.bnf.fr/ark:/12148/bpt6k5821950s
bpt6k57855005.txt	Chambre de commerce de Lyon. Séance du 23 octobre 1902. Responsabilité des compagnies de chemins de fer (modification de l'article 103 du Code de commerce). Rapport de M. G. Lyonnet	1902	https://data.bnf.fr/ark:/12148/bpt6k57855005	Lyonnet, Gabriel	Public domain	"impr. du ""Salut public"" (Lyon)"	monographie imprimée	Bibliothèque nationale de France	https://gallica.bnf.fr/ark:/12148/bpt6k57855005
