id	title	year	sameAs	author	license	publisher	type	archive	link
bpt6k6547096k.txt	Pèlerinage de S.-Ived, à Braine : le lundi de la Pentecôte...	1850	https://data.bnf.fr/ark:/12148/bpt6k6547096k		Public domain	impr. E. Fossé-Darcosse (Soissons)	monographie imprimée	Bibliothèque nationale de France	https://gallica.bnf.fr/ark:/12148/bpt6k6547096k
bpt6k54474100.txt	Séjour à Lyon de S. A. R. Madame, duchesse de Berry, pendant les journées des 20, 21, 22 et 23 octobre 1829	1829	https://data.bnf.fr/ark:/12148/bpt6k54474100		Public domain	Pitrat (Lyon)	monographie imprimée	Bibliothèque nationale de France	https://gallica.bnf.fr/ark:/12148/bpt6k54474100
bpt6k57841489.txt	Droit romain : le Concept du vol dans le droit romain. Droit français : Étude théorique et pratique sur les condamnations conditionnelles (loi Bérenger). Thèse pour le doctorat... par Lucien Treppoz,...	1894	https://data.bnf.fr/ark:/12148/bpt6k57841489	Treppoz, Lucien	Public domain	Chevalier-Marescq (Paris)	monographie imprimée	Bibliothèque nationale de France	https://gallica.bnf.fr/ark:/12148/bpt6k57841489
bpt6k63020810.txt	Méthode à employer pour procéder à la visite des hommes appelés au service militaire / par A.-Ch. Dogny,...	1841	https://data.bnf.fr/ark:/12148/bpt6k63020810	Dogny, A.-Ch.	Public domain	impr. de E. Fleury et L. Huriez (Laon)	monographie imprimée	Bibliothèque nationale de France	https://gallica.bnf.fr/ark:/12148/bpt6k63020810
bpt6k9676737h.txt	Correspondance de l'armée franc̜aise en Égypte , interceptée par l'escadre de Nelson ; publiée a Londres ; avec une introduction et des notes de la chancellerie anglaise, traduites en franc̜ais ; suivies d'observations par E.T. Simon. Avec une carte de la Basse-Egypte...	1798-1799	https://data.bnf.fr/ark:/12148/bpt6k9676737h		Public domain	A Paris, chez Garnery. An VII [1798 ou 1799]	monographie imprimée	Bibliothèque nationale de France	https://gallica.bnf.fr/ark:/12148/bpt6k9676737h
bpt6k54078108.txt	La Napoliade, par Auguste Norga	1895	https://data.bnf.fr/ark:/12148/bpt6k54078108	Norga, Auguste	Public domain	impr. de Lahure (Paris)	monographie imprimée	Bibliothèque nationale de France	https://gallica.bnf.fr/ark:/12148/bpt6k54078108
bpt6k1243564b.txt	Tableaux, dessins, aquarelles modernes... [des collections d'Isidore Pils, M. M***, et anonyme] / [expert] Durand-Ruel	1866	https://data.bnf.fr/ark:/12148/bpt6k1243564b		Public domain	[s.n.]	monographie imprimée	Bibliothèque nationale de France	https://gallica.bnf.fr/ark:/12148/bpt6k1243564b
bpt6k6128658r.txt	Que doit-on penser des événements de Lyon et du département du Rhône en 1817 ? A-t-on raison d'attaquer en calomnie M. le colonel Fabvier ? Par F.-J.-N. D., ancien magistrat	1818	https://data.bnf.fr/ark:/12148/bpt6k6128658r		Public domain	Guyot (Lyon)	monographie imprimée	Bibliothèque nationale de France	https://gallica.bnf.fr/ark:/12148/bpt6k6128658r
bpt6k5468473c.txt	Arrestation+ du Roi . Ode	1791	https://data.bnf.fr/ark:/12148/bpt6k5468473c		Public domain	A Vienne, de l'Imprimerie des royalistes fugitifs. 1791	monographie imprimée	Bibliothèque nationale de France	https://gallica.bnf.fr/ark:/12148/bpt6k5468473c
bpt6k9619704d.txt	Galerie des fondateurs de la liberté politique chez les modernes, ou Portraits des rois, généraux, hommes d'état, publicistes...	1824	https://data.bnf.fr/ark:/12148/bpt6k9619704d		Public domain	Mme Brossier [etc.] (Paris)	monographie imprimée	Bibliothèque nationale de France	https://gallica.bnf.fr/ark:/12148/bpt6k9619704d
bpt6k5829896x.txt	Un dernier mot sur le théâtre de Champlieu (Oise) / par Peigné-Delacourt,...	1860	https://data.bnf.fr/ark:/12148/bpt6k5829896x	Peigné-Delacourt, Achille (1797-1881)	Public domain	D. Andrieux-Duru (Noyon)	monographie imprimée	Bibliothèque nationale de France	https://gallica.bnf.fr/ark:/12148/bpt6k5829896x
bpt6k58461022.txt	Les Amours d'un serpent, vaudeville en 2 actes, par MM. de Lustières et Feuquerolles... [Paris, Variétés, 27 janvier 1855.]	1855	https://data.bnf.fr/ark:/12148/bpt6k58461022	Feuquerolles (18..-18.. ; auteur dramatique)	Public domain	Michel Lévy frères (Paris)	monographie imprimée	Bibliothèque nationale de France	https://gallica.bnf.fr/ark:/12148/bpt6k58461022
bpt6k5860607j.txt	Le Bois de Boulogne, poème suivi de notes historiques et critiques, par Dusausoir,...	1801	https://data.bnf.fr/ark:/12148/bpt6k5860607j	Dusausoir, François-Jean (1737-1822)	Public domain	Roullet (Paris)	monographie imprimée	Bibliothèque nationale de France	https://gallica.bnf.fr/ark:/12148/bpt6k5860607j
bpt6k5510611b.txt	Prophéties de Napoléon à l'île Sainte-Hélène, recueillies et publiées par W. Kilian	1830	https://data.bnf.fr/ark:/12148/bpt6k5510611b	Kilian, W.	Public domain	N. Delangle ((Paris,))	monographie imprimée	Bibliothèque nationale de France	https://gallica.bnf.fr/ark:/12148/bpt6k5510611b
bpt6k6459711j.txt	Conseils pour le concours en thème latin, par J.-R.-T. Cabaret-Dupaty,...	1836	https://data.bnf.fr/ark:/12148/bpt6k6459711j	Cabaret-Dupaty, J.-R.-T.	Public domain	Pourchet (Paris)	monographie imprimée	Bibliothèque nationale de France	https://gallica.bnf.fr/ark:/12148/bpt6k6459711j
bpt6k65159507.txt	Britannia, ou Recherche de l'antiquité d'Abbeville , par N. Sanson,...	1636	https://data.bnf.fr/ark:/12148/bpt6k65159507	Sanson, Nicolas (1600-1667)	Public domain	impr. de R. Mansion, pour l'autheur (Paris)	monographie imprimée	Bibliothèque nationale de France	https://gallica.bnf.fr/ark:/12148/bpt6k65159507
bpt6k6257465z.txt	Notions des Anglais sur la grande question : si le pouvoir législatif peut exercer le pouvoir judiciaire ; et sur la cause de Louis XVI.	1792	https://data.bnf.fr/ark:/12148/bpt6k6257465z		Public domain	[S. l., 1792]	monographie imprimée	Bibliothèque nationale de France	https://gallica.bnf.fr/ark:/12148/bpt6k6257465z
bpt6k6303655w.txt	De quoi s'agit-il ? . Par un membre de collége électoral de département,...	1815	https://data.bnf.fr/ark:/12148/bpt6k6303655w		Public domain	Favre (Paris)	monographie imprimée	Bibliothèque nationale de France	https://gallica.bnf.fr/ark:/12148/bpt6k6303655w
bpt6k6293117q.txt	Procès-verbal du cérémonial et des discours prononcés par différents membres des corps administratifs réunis... d'Épernay, à l'occasion du don qui leur a été fait d'une pierre de la Bastille, le 22 septembre 1792...	1792	https://data.bnf.fr/ark:/12148/bpt6k6293117q		Public domain		monographie imprimée	Bibliothèque nationale de France	https://gallica.bnf.fr/ark:/12148/bpt6k6293117q
bpt6k55401561.txt	Tactique des cannibales, ou Des jacobins , comédie en un acte et en prose : précédée & suivie de quelques morceaux ayant trait à la Révolution. Seconde édition, imprimée sur le manuscrit non tronqué, daté du 2 pluviose, an IIIe de la république, ou le 21 janvier 1795...	1795	https://data.bnf.fr/ark:/12148/bpt6k55401561		Public domain	chez les marchands de nouveautés (Paris)	monographie imprimée	Bibliothèque nationale de France	https://gallica.bnf.fr/ark:/12148/bpt6k55401561
bpt6k65775148.txt	Le Cadet de famille, ou l'Intrigue impromptu, comédie-vaudeville en 1 acte, par M. Édouard Lemaître... [Paris, Gymnase dramatique, 30 décembre 1843.]	1844	https://data.bnf.fr/ark:/12148/bpt6k65775148	Lemaître, Édouard (18..-18.. ; auteur dramatique)	Public domain	Marchant (Paris)	monographie imprimée	Bibliothèque nationale de France	https://gallica.bnf.fr/ark:/12148/bpt6k65775148
bpt6k9622752k.txt	Éloge de M. Boubée, chanoine de la métropole, directeur au Petit-séminaire : prononcé par M. l'abbé Campistron au service funèbre célébré le... 19 janvier dans la chapelle du Petit-séminaire	1888	https://data.bnf.fr/ark:/12148/bpt6k9622752k	Campistron, Pierre-Lucien (1840-1921)	Public domain	impr. de A. Thibault (Auch)	monographie imprimée	Bibliothèque nationale de France	https://gallica.bnf.fr/ark:/12148/bpt6k9622752k
bpt6k55766039.txt	L'Alliance anglaise, par Alexandre Walewski	1838	https://data.bnf.fr/ark:/12148/bpt6k55766039	Walewski, Alexandre (1810-1868)	Public domain	impr. de F. Locquin (Paris)	monographie imprimée	Bibliothèque nationale de France	https://gallica.bnf.fr/ark:/12148/bpt6k55766039
bpt6k9765890w.txt	Des résultats éloignés de la prothèse immédiate dans les résections du maxillaire inférieur : thèse présentée à la Faculté de médecine... / par Claude Martin,...	1893	https://data.bnf.fr/ark:/12148/bpt6k9765890w	Martin, Claude (1843-1911)	Public domain	impr. de A. Storck (Lyon)	monographie imprimée	Bibliothèque nationale de France	https://gallica.bnf.fr/ark:/12148/bpt6k9765890w
bpt6k6569043m.txt	Lettre des vénérables freres anti-politiques et de l'abbé Rive, présentée à MM. les commissaires du Roi, dans le département des Bouches-du-Rhône, le 13 janvier 1791, avec une autre lettre du même abbé Rive, aux mêmes commissaires.	1791	https://data.bnf.fr/ark:/12148/bpt6k6569043m	Rive, Jean-Joseph (1730-1791)	Public domain	A Nosopolis [i. e. Aix-en-Provence], chez les Freres de la Miséricorde [1791].	monographie imprimée	Bibliothèque nationale de France	https://gallica.bnf.fr/ark:/12148/bpt6k6569043m
bpt6k62651059.txt	La sainte Trinité des braves, ou La violette sous trois espèces	1815	https://data.bnf.fr/ark:/12148/bpt6k62651059	N.-V. R.	Public domain	Impr. de Renaudière (Paris)	monographie imprimée	Bibliothèque nationale de France	https://gallica.bnf.fr/ark:/12148/bpt6k62651059
bpt6k5619178t.txt	César Falempin, par Louis Reybaud	1861	https://data.bnf.fr/ark:/12148/bpt6k5619178t	Reybaud, Louis (1799-1879)	Public domain	Michel-Lévy frères (Paris)	monographie imprimée	Bibliothèque nationale de France	https://gallica.bnf.fr/ark:/12148/bpt6k5619178t
bpt6k97583131.txt	La Paysanne pervertie, ou Les moeurs des grandes villes. Partie 1 / : mémoires de Jeannette R*** mis au jour par Nougaret	1777	https://data.bnf.fr/ark:/12148/bpt6k97583131	Nougaret, Pierre-Jean-Baptiste (1742-1823)	Public domain	J.-F. Bastien (Paris)	monographie imprimée	Bibliothèque nationale de France	https://gallica.bnf.fr/ark:/12148/bpt6k97583131
bpt6k9759314r.txt	Un roman d'amour : études balzaciennes / Vicomte de Spoelberch de Lovenjoul	1896	https://data.bnf.fr/ark:/12148/bpt6k9759314r	Spoelberch de Lovenjoul, Charles de (1836-1907)	Public domain	C. Lévy (Paris)	monographie imprimée	Bibliothèque nationale de France	https://gallica.bnf.fr/ark:/12148/bpt6k9759314r
bpt6k5607201q.txt	Morale populaire, ou Traité des droits et des devoirs de l'homme, par S. Theubet,...	1848	https://data.bnf.fr/ark:/12148/bpt6k5607201q	Theubet, S.	Public domain	l'auteur (Paris)	monographie imprimée	Bibliothèque nationale de France	https://gallica.bnf.fr/ark:/12148/bpt6k5607201q
bpt6k6449933j.txt	Commentaire sur l'ordonnance des conflits (1er juin 1828) ; par A.-H. Taillandier,... Ouvrage contenant les travaux de la Commission... le rapport de M. de Cormenin, la législation étrangère sur les conflits, etc.	1829	https://data.bnf.fr/ark:/12148/bpt6k6449933j	Taillandier, Alphonse-Honoré (1797-1867)	Public domain	J.L. J. Brière (Paris)	monographie imprimée	Bibliothèque nationale de France	https://gallica.bnf.fr/ark:/12148/bpt6k6449933j
bpt6k5611483p.txt	Saint-Yore / par l'abbé B.-J. Thobois,...	1904	https://data.bnf.fr/ark:/12148/bpt6k5611483p	Thobois, Benoît Joseph	Public domain	(Boulogne-sur-Mer)	monographie imprimée	Bibliothèque nationale de France	https://gallica.bnf.fr/ark:/12148/bpt6k5611483p
bpt6k5661209t.txt	Défense de M. le comte de Peyronnet... devant la Cour des Pairs, le 19 décembre 1830, par M. Hennequin,...	1830	https://data.bnf.fr/ark:/12148/bpt6k5661209t	Hennequin, Antoine Louis Marie (1786-1840)	Public domain	impr. de J. Pinard (Paris)	monographie imprimée	Bibliothèque nationale de France	https://gallica.bnf.fr/ark:/12148/bpt6k5661209t
bpt6k6565427n.txt	Jean Jean Gros-Pataud : histoire allemande accomodée pour les petits français de trois à six ans / par Trim	1867	https://data.bnf.fr/ark:/12148/bpt6k6565427n	Ratisbonne, Louis (1827-1900)	Public domain	Hachette (Paris)	monographie imprimée	Bibliothèque nationale de France	https://gallica.bnf.fr/ark:/12148/bpt6k6565427n
bpt6k56119145.txt	"""La Renommée""... Note sur M. Lacoudrais, maître des requêtes au conseil d'État..."	1842	https://data.bnf.fr/ark:/12148/bpt6k56119145		Public domain	bureaux de La Renommée (Paris)	monographie imprimée	Bibliothèque nationale de France	https://gallica.bnf.fr/ark:/12148/bpt6k56119145
bpt6k6564197z.txt	Établissement à Paris d'étuves publiques pour la désinfection des objets de literie et des linges qui ont été en contact avec des personnes atteintes de maladies infectieuses ou contagieuses : 1°Rapport de MM. Pasteur et Léon Colin au Conseil d'hygiène... 2°Extrait du procès-verbal de la séance du Conseil d'hygiène du 11 juin 18	1880	https://data.bnf.fr/ark:/12148/bpt6k6564197z	Colin, Léon (1830-1906)	Public domain	impr. de C. de Mourgues (Paris)	monographie imprimée	Bibliothèque nationale de France	https://gallica.bnf.fr/ark:/12148/bpt6k6564197z
bpt6k54607142.txt	Instruction publique. Faculté de droit de Strasbourg. Acte public sur les obligations solidaires qui sera soutenu... pour obtenir le grade de licencié en droit, par Mengin-Charles Charon	1819	https://data.bnf.fr/ark:/12148/bpt6k54607142	Charon, Mengin-Charles (1798-1876)	Public domain	impr. de Levrault (Strasbourg)	monographie imprimée	Bibliothèque nationale de France	https://gallica.bnf.fr/ark:/12148/bpt6k54607142
bpt6k5613133c.txt	Notice sur la vie du bienheureux Jean, berger...	1848	https://data.bnf.fr/ark:/12148/bpt6k5613133c		Public domain	A. Brissy (Arras)	monographie imprimée	Bibliothèque nationale de France	https://gallica.bnf.fr/ark:/12148/bpt6k5613133c
bpt6k6583710b.txt	L'Espagne pittoresque, artistique et monumentale : moeurs, usages et costumes / par MM. Manuel de Cuendias et V. de Féréal ; illustrations par Célestin Nanteuil	1848	https://data.bnf.fr/ark:/12148/bpt6k6583710b	Cuendias, Manuel de (1800-1881)	Public domain	Librairie ethnographique (Paris)	monographie imprimée	Bibliothèque nationale de France	https://gallica.bnf.fr/ark:/12148/bpt6k6583710b
bpt6k5611665f.txt	Ateliers nationaux. Ordre du jour... / [signé : Émile Thomas]	1848	https://data.bnf.fr/ark:/12148/bpt6k5611665f	Thomas, Émile (1822-1880)	Public domain	impr. de A. Appert (Paris)	monographie imprimée	Bibliothèque nationale de France	https://gallica.bnf.fr/ark:/12148/bpt6k5611665f
bpt6k61028514.txt	Guide pratique pour la constitution d'un bien de famille insaisissable, commentaire de la loi du 12 juillet 1909 et formules, par J. Bonnafoux,... et P. Cozette,...	1912	https://data.bnf.fr/ark:/12148/bpt6k61028514	Cozette, Paul (1869-1927)	Public domain		monographie imprimée	Bibliothèque nationale de France	https://gallica.bnf.fr/ark:/12148/bpt6k61028514
bpt6k96022455.txt	Le prince Lucien Bonaparte et sa famille	1889	https://data.bnf.fr/ark:/12148/bpt6k96022455		Public domain	E. Plon, Nourrit et Cie (Paris)	monographie imprimée	Bibliothèque nationale de France	https://gallica.bnf.fr/ark:/12148/bpt6k96022455
bpt6k5695184h.txt	La république et la religion	1848	https://data.bnf.fr/ark:/12148/bpt6k5695184h		Public domain	J. Lecoffre (Paris)	monographie imprimée	Bibliothèque nationale de France	https://gallica.bnf.fr/ark:/12148/bpt6k5695184h
bpt6k55299279.txt	Les grandes idées morales et les grands moralistes. Nicole / pages choisies, par J. Vaudouer,... L. Lantoine,...	1898	https://data.bnf.fr/ark:/12148/bpt6k55299279	Nicole, Pierre (1625-1695)	Public domain	A. Picard et Kaan (Paris)	monographie imprimée	Bibliothèque nationale de France	https://gallica.bnf.fr/ark:/12148/bpt6k55299279
bpt6k9601206r.txt	Notice sur le général de division baron de Chabaud-La-Tour / par M. Saint-Marc Girardin	1885	https://data.bnf.fr/ark:/12148/bpt6k9601206r	Saint-Marc Girardin, Barthélémy (1847-1891)	Public domain	Société anonyme de publications périodiques (Paris)	monographie imprimée	Bibliothèque nationale de France	https://gallica.bnf.fr/ark:/12148/bpt6k9601206r
bpt6k6462337h.txt	L'ami des ouvriers, ou Guide théorique des architectes, des maîtres en tous états, métiers ou professions... / par L. Perrin,...	1844	https://data.bnf.fr/ark:/12148/bpt6k6462337h	Perrin, L. (jurisconsulte)	Public domain	P. Faye (Bordeaux)	monographie imprimée	Bibliothèque nationale de France	https://gallica.bnf.fr/ark:/12148/bpt6k6462337h
bpt6k57936806.txt	Un bon Français au peuple français	1815	https://data.bnf.fr/ark:/12148/bpt6k57936806		Public domain	chez les marchands de nouveautés (Paris)	monographie imprimée	Bibliothèque nationale de France	https://gallica.bnf.fr/ark:/12148/bpt6k57936806
bpt6k56122320.txt	Souvenirs, par Fernand Pérès	1855	https://data.bnf.fr/ark:/12148/bpt6k56122320	Pérès, Fernand	Public domain	impr. de Vve Veirun (Alais)	monographie imprimée	Bibliothèque nationale de France	https://gallica.bnf.fr/ark:/12148/bpt6k56122320
bpt6k5793753n.txt	Aux armées françaises , par M. D......	1815	https://data.bnf.fr/ark:/12148/bpt6k5793753n		Public domain	J.-G. Dentu (Paris)	monographie imprimée	Bibliothèque nationale de France	https://gallica.bnf.fr/ark:/12148/bpt6k5793753n
bpt6k97456697.txt	Manuel de l'école mutuelle de la ville du Mans / par F. Dulac, directeur...	1848	https://data.bnf.fr/ark:/12148/bpt6k97456697	Dulac, François (1804-1....)	Public domain	Monnoyer (Le Mans)	monographie imprimée	Bibliothèque nationale de France	https://gallica.bnf.fr/ark:/12148/bpt6k97456697
bpt6k6568542m.txt	Récits de terroir... / Mis G. de Cherville	1893	https://data.bnf.fr/ark:/12148/bpt6k6568542m	Cherville, Gaspard de (1821-1898)	Public domain	(Paris)	monographie imprimée	Bibliothèque nationale de France	https://gallica.bnf.fr/ark:/12148/bpt6k6568542m
bpt6k5576828t.txt	À propos du végétarisme / [signé Élisée Reclus]	1901	https://data.bnf.fr/ark:/12148/bpt6k5576828t	Reclus, Élisée (1830-1905)	Public domain	[s.n.][s.n.]	monographie imprimée	Bibliothèque nationale de France	https://gallica.bnf.fr/ark:/12148/bpt6k5576828t
bpt6k6577992v.txt	La comédie enfantine (2e édition) / Louis Ratisbonne ; vignettes par Gobert et Froment	1861	https://data.bnf.fr/ark:/12148/bpt6k6577992v	Ratisbonne, Louis (1827-1900)	Public domain	Michel Lévy frères (Paris)	monographie imprimée	Bibliothèque nationale de France	https://gallica.bnf.fr/ark:/12148/bpt6k6577992v
bpt6k5652099k.txt	Considérations étiologiques sur le syndrome de Little / Dr Lucien Bacaresse,...	1902	https://data.bnf.fr/ark:/12148/bpt6k5652099k	Bacaresse, Lucien	Public domain	J. Rousset (Paris)	monographie imprimée	Bibliothèque nationale de France	https://gallica.bnf.fr/ark:/12148/bpt6k5652099k
bpt6k63781510.txt	Notice sur M. Bénigne Joly, Dr en Sorbonne, chanoine de l'église abbatiale et collégiale de St Etienne de Dijon, instituteur des religieuses hospitalières, et surnommé à Dijon le père des pauvres . (Signé : Bouzerand.)	1869	https://data.bnf.fr/ark:/12148/bpt6k63781510		Public domain	Impr. de Marchand (Dijon)	monographie imprimée	Bibliothèque nationale de France	https://gallica.bnf.fr/ark:/12148/bpt6k63781510
bpt6k5468383d.txt	À MM. les membres de l'Assemblée nationale. Capacité électorale, considérations et projets applicables à la ville de Paris / par Édouard Petit	1871	https://data.bnf.fr/ark:/12148/bpt6k5468383d	Petit, Édouard (administrateur du bureau de bienfaisance du IIIe arrondissement)	Public domain	(Paris)	monographie imprimée	Bibliothèque nationale de France	https://gallica.bnf.fr/ark:/12148/bpt6k5468383d
bpt6k5701705g.txt	Le petit duc / [Charlotte Mary Yonge] ; [traduit de l'anglais par Marue Bersier]	1866	https://data.bnf.fr/ark:/12148/bpt6k5701705g	Yonge, Charlotte Mary (1823-1901)	Public domain	impr. de Rives et Faget (Toulouse)	monographie imprimée	Bibliothèque nationale de France	https://gallica.bnf.fr/ark:/12148/bpt6k5701705g
bpt6k65415862.txt	Études critiques sur la vie de Colomb avant ses découvertes : les origines de sa famille, les deux Colombo, ses prétendus parents, la vraie date de sa naissance, les études et les premières campagnes qu'il aurait faites, son arrivée en Portugal et le combat naval de 1476, son voyage au Nord, son établissement en Portugal, son mariage, sa famille portugaise / par Henry Vignaud,...	1905	https://data.bnf.fr/ark:/12148/bpt6k65415862	Vignaud, Henry (1830-1922)	Public domain	H. Welter (Paris)	monographie imprimée	Bibliothèque nationale de France	https://gallica.bnf.fr/ark:/12148/bpt6k65415862
bpt6k1025175b.txt	La misere des garçons boulangers de la ville et fauxbourgs de Paris.	1739-1754	https://data.bnf.fr/ark:/12148/bpt6k1025175b		Public domain	A Troyes, chez la veuve Garnier, imprimeur-libraire, rue du Temple. Avec permission.	monographie imprimée	Bibliothèque nationale de France	https://gallica.bnf.fr/ark:/12148/bpt6k1025175b
bpt6k5431855t.txt	La Revendication, brochure politique, par Adolphe Royannez. [Avant-propos de Armand Duportal.]	1869	https://data.bnf.fr/ark:/12148/bpt6k5431855t	Royannez, Adolphe (1829-1880)	Public domain	impr. de P. Savy (Toulouse)	monographie imprimée	Bibliothèque nationale de France	https://gallica.bnf.fr/ark:/12148/bpt6k5431855t
bpt6k6548088b.txt	À tout seigneur, tout honneur, folie-vaudeville en 1 acte, mêlée de chants, par M. Léon Vazeille... [Paris, théâtre Saint-Pierre.]	1871	https://data.bnf.fr/ark:/12148/bpt6k6548088b	Vazeille, Léon	Public domain	Bornet-Lejeune (Paris)	monographie imprimée	Bibliothèque nationale de France	https://gallica.bnf.fr/ark:/12148/bpt6k6548088b
bpt6k6461153m.txt	Les Signes et prodiges, apparus sur la ville de Paris, Sainct-Denys & autres lieux. Le soir du dimanche douziesme septembre 1621 . Ensemble des livers jugemens decertez [sic] sur ce mesme suject.	1621	https://data.bnf.fr/ark:/12148/bpt6k6461153m		Public domain	A Paris, par Abraham Saugrain. 1621.	monographie imprimée	Bibliothèque nationale de France	https://gallica.bnf.fr/ark:/12148/bpt6k6461153m
bpt6k6374100f.txt	Atlas de dissections zoologiques : manuel de travaux pratiques à l'usage des candidats au certificat de sciences physiques, chimiques et naturelles (P.C.N. et S.P.C.N.), à la licence ès sciences naturelles, des élèves des écoles normales, des candidats au brevet supérieur, etc. (2e édition revue et augmentée) / par Henri Coupin,...	1925	https://data.bnf.fr/ark:/12148/bpt6k6374100f	Coupin, Henri (1868-1937)	Public domain	Vigot frères (Paris)	monographie imprimée	Bibliothèque nationale de France	https://gallica.bnf.fr/ark:/12148/bpt6k6374100f
bpt6k97887953.txt	Exposition de la gravure sur bois à l'Ecole nationale des beaux-arts, [Paris], mai 1902 / catalogue... par MM. Henri Bouchot, G. Claudin, J. Masson, Henri Beraldi... [et al.]	1902	https://data.bnf.fr/ark:/12148/bpt6k97887953		Public domain	Librairie de l'art ancien et moderne (Paris)	monographie imprimée	Bibliothèque nationale de France	https://gallica.bnf.fr/ark:/12148/bpt6k97887953
bpt6k1265564h.txt	Les Amours d'été. Divertissement en un acte et en vaudevilles par MM. de Piis et Barré, représenté pour la 1e fois à la Muette... le... 20 septembre 1781... Nouvelle édition...	1784	https://data.bnf.fr/ark:/12148/bpt6k1265564h	Barré, Pierre-Yves (1749-1832)	Public domain	Cailleau (Paris)	monographie imprimée	Bibliothèque nationale de France	https://gallica.bnf.fr/ark:/12148/bpt6k1265564h
bpt6k5801324p.txt	Les affinités françaises de l'Alsace avant Louis XIV et l'iniquité de sa séparation de la France / par Jacques Flach,...	1915	https://data.bnf.fr/ark:/12148/bpt6k5801324p	Flach, Jacques (1846-1919)	Public domain	L. Tenin (Paris)	monographie imprimée	Bibliothèque nationale de France	https://gallica.bnf.fr/ark:/12148/bpt6k5801324p
bpt6k58216760.txt	La Nouvelle imprévue , drame en un acte et en prose, dédié aux dames, par M. de Ste C...	1774	https://data.bnf.fr/ark:/12148/bpt6k58216760	Sainte Colombe, Monsieur de (1725-17..?)	Public domain	Hardouin (Paris)	monographie imprimée	Bibliothèque nationale de France	https://gallica.bnf.fr/ark:/12148/bpt6k58216760
bpt6k56160722.txt	A mes concitoyens. Un ami de l'ordre, de la justice et de la vérité... veut faire connaître... les principes d'un fonctionnaire qui a violé les lois du sang... pour satisfaire une injuste vengeance... [Signé : Juéri.]	1831	https://data.bnf.fr/ark:/12148/bpt6k56160722	Juéri	Public domain	impr. de I. Tournel (Montpellier)	monographie imprimée	Bibliothèque nationale de France	https://gallica.bnf.fr/ark:/12148/bpt6k56160722
bpt6k96949552.txt	Diverses pièces curieuses. 24, L'espouvantable et prodigieuse vision des fantosmes au nombre de douze mille, advenus au pays d'Angoulmois et veuz par les habitans de là en grande admiration	1875	https://data.bnf.fr/ark:/12148/bpt6k96949552		Public domain	impr. L. Perrin (Lyon)	monographie imprimée	Bibliothèque nationale de France	https://gallica.bnf.fr/ark:/12148/bpt6k96949552
bpt6k6200061c.txt	Couplets chantés les 7 février 1849 et 6 février 1850 au banquet annuel des anciens élèves du Collège Stanislas / [signé : Alfred Caumont]	1850	https://data.bnf.fr/ark:/12148/bpt6k6200061c	Caumont, Alfred	Public domain	impr. de N. Chaix et Cie (Paris)	monographie imprimée	Bibliothèque nationale de France	https://gallica.bnf.fr/ark:/12148/bpt6k6200061c
bpt6k5723070t.txt	Les noix dorées de l'arbre de Noël / Mlle Marie Sandras	1872	https://data.bnf.fr/ark:/12148/bpt6k5723070t	Sandras, Marie	Public domain	Grassart (Paris)	monographie imprimée	Bibliothèque nationale de France	https://gallica.bnf.fr/ark:/12148/bpt6k5723070t
bpt6k6338702g.txt	Société charitable de Saint-François-Régis.... Nancy, le 13 janvier 1862 / [signé : Vagner]	1862	https://data.bnf.fr/ark:/12148/bpt6k6338702g	Vagner, Nicolas (1811-1886)	Public domain	impr. de Vagner (Nancy)	monographie imprimée	Bibliothèque nationale de France	https://gallica.bnf.fr/ark:/12148/bpt6k6338702g
