id	title	year	sameAs	author	license	publisher	type	archive	link
bpt6k9740448t.txt	Arrêt du conseil d'état qui déboute le fermier de sa demande à fin d'établissement des droits de petit scel dans les amirautés	1754	https://data.bnf.fr/ark:/12148/bpt6k9740448t	France. Conseil d'Etat (13..-1791)	Public domain	impr. de A. Boude (Paris)	monographie imprimée	Bibliothèque nationale de France	https://gallica.bnf.fr/ark:/12148/bpt6k9740448t
bpt6k5468872b.txt	[Lettre de M. G. Macé, commissaire de police, chef du Service de Sûreté, à M. Engelhard, avocat à la Cour, au sujet de l'extradition d'Hartmann]	1880	https://data.bnf.fr/ark:/12148/bpt6k5468872b	Macé, Gustave (1835-1904)	Public domain	[s.n.][s.n.]	monographie imprimée	Bibliothèque nationale de France	https://gallica.bnf.fr/ark:/12148/bpt6k5468872b
bpt6k6515209n.txt	Beautés des victoires et conquêtes des Français, depuis 1792 jusqu'en 1815 : récit des campagnes de la Révolution et de l'Empire, beaux faits d'armes et de dévouement des soldats français. Tome 2 / par E. de La Bédollière	1847	https://data.bnf.fr/ark:/12148/bpt6k6515209n	La Bédollière, Émile de (1812-1883)	Public domain	M. Ardant (Paris)	monographie imprimée	Bibliothèque nationale de France	https://gallica.bnf.fr/ark:/12148/bpt6k6515209n
bpt6k6113305r.txt	"Observations sur le ""Mémoire"" de M. le général Donnadieu / par M. A. Choppin d'Arnouville,..."	1820	https://data.bnf.fr/ark:/12148/bpt6k6113305r	Choppin d'Arnouville, Augustin (1776-1857)	Public domain	Delaunay (Paris)	monographie imprimée	Bibliothèque nationale de France	https://gallica.bnf.fr/ark:/12148/bpt6k6113305r
bpt6k12439172.txt	Catalogue d'une collection de vitraux anciens, armes des XVIe et XVIIe siècles, objets de vitrine... / [expert] Charles Mannheim	1883	https://data.bnf.fr/ark:/12148/bpt6k12439172		Public domain	[s.n.]	monographie imprimée	Bibliothèque nationale de France	https://gallica.bnf.fr/ark:/12148/bpt6k12439172
bpt6k58187070.txt	Les espagnols au Maroc / Germond de Lavigne	1889	https://data.bnf.fr/ark:/12148/bpt6k58187070	Germond de Lavigne, Alfred (1812-1891)	Public domain	C. Bayle (Paris)	monographie imprimée	Bibliothèque nationale de France	https://gallica.bnf.fr/ark:/12148/bpt6k58187070
bpt6k5614884d.txt	Société des progrès agricoles. Nécrologie. Le duc de Doudeauville . (Signé : D. de La Chauvinière.)	1841	https://data.bnf.fr/ark:/12148/bpt6k5614884d	La Chauvinière, D. de	Public domain	impr. de J.-B. Gros ((Paris,))	monographie imprimée	Bibliothèque nationale de France	https://gallica.bnf.fr/ark:/12148/bpt6k5614884d
bpt6k5499247b.txt	Foi et patrie, ou La France chrétienne se révélant au sein de ses désastres dans les actes sublimes de son clergé... Par Fr. de Valserres	1873	https://data.bnf.fr/ark:/12148/bpt6k5499247b		Public domain	Barbou frères (Limoges)	monographie imprimée	Bibliothèque nationale de France	https://gallica.bnf.fr/ark:/12148/bpt6k5499247b
bpt6k5821569h.txt	L'avant-dernier jour d'un condamné : comédie-vaudeville en un acte / P.-E. Goguillot	1890	https://data.bnf.fr/ark:/12148/bpt6k5821569h	Goguillot, Paul-Émile (1862-1929)	Public domain	impr. de Douladoure-Privat (Toulouse)	monographie imprimée	Bibliothèque nationale de France	https://gallica.bnf.fr/ark:/12148/bpt6k5821569h
bpt6k6127165v.txt	Pensée des braves sur les hauts faits de Napoléon . (Signé : LM. LC.)	1821	https://data.bnf.fr/ark:/12148/bpt6k6127165v		Public domain	chez les marchands de nouveautés (Paris)	monographie imprimée	Bibliothèque nationale de France	https://gallica.bnf.fr/ark:/12148/bpt6k6127165v
bpt6k61246113.txt	La procédure dans les arbitrages internationaux / par Albert Acremant,...	1905	https://data.bnf.fr/ark:/12148/bpt6k61246113	Acremant, Albert (1882-1942)	Public domain	impr. de Sueur-Charruey (Arras)	monographie imprimée	Bibliothèque nationale de France	https://gallica.bnf.fr/ark:/12148/bpt6k61246113
bpt6k6265655x.txt	Fête funèbre, pour honorer la mémoire du général Joubert . Programme	1799	https://data.bnf.fr/ark:/12148/bpt6k6265655x	France. Ministère de l'intérieur (1791-1830)	Public domain	Impr. de la république (Paris)	monographie imprimée	Bibliothèque nationale de France	https://gallica.bnf.fr/ark:/12148/bpt6k6265655x
bpt6k6518942m.txt	Gratuité du passage sur la Garonne à Bordeaux. [Signé : E. Théron, fils aîné.]	1858	https://data.bnf.fr/ark:/12148/bpt6k6518942m	Théron, E.	Public domain	Ragot (Bordeaux)	monographie imprimée	Bibliothèque nationale de France	https://gallica.bnf.fr/ark:/12148/bpt6k6518942m
bpt6k5682374m.txt	Petit-Pierre, ou le Bon cultivateur, par Ch. Calemard de La Fayette	1859	https://data.bnf.fr/ark:/12148/bpt6k5682374m	Calemard de La Fayette, Charles (1815-1901)	Public domain	Hachette (Paris)	monographie imprimée	Bibliothèque nationale de France	https://gallica.bnf.fr/ark:/12148/bpt6k5682374m
bpt6k5711727b.txt	Luxation ilio-pubienne irréductible, observée par M. le professeur E. Simonin	1872	https://data.bnf.fr/ark:/12148/bpt6k5711727b	Simonin, Edmond (1812-1884)	Public domain		monographie imprimée	Bibliothèque nationale de France	https://gallica.bnf.fr/ark:/12148/bpt6k5711727b
bpt6k9735144d.txt	La Révolution lyonnaise du 4 septembre 1870 au 8 février 1871 : rapport fait au nom de la commission d'enquête sur les actes du gouvernement de la Défense nationale (sous-commission du Sud-Est) / par M. de Sugny,...	1873	https://data.bnf.fr/ark:/12148/bpt6k9735144d	Ramey, Francisque-Marie-Joseph (1825-1908 ; comte de Sugny)	Public domain	E. Lachaud (Paris)	monographie imprimée	Bibliothèque nationale de France	https://gallica.bnf.fr/ark:/12148/bpt6k9735144d
bpt6k6492688p.txt	"WL. Gagneur / [signé : ""Edouard Pernot""]"	1885	https://data.bnf.fr/ark:/12148/bpt6k6492688p	Pernot, Édouard	Public domain	chez tous les libraires (Paris)	monographie imprimée	Bibliothèque nationale de France	https://gallica.bnf.fr/ark:/12148/bpt6k6492688p
bpt6k9611059g.txt	Règlement du 12 juin 1875 sur les manoeuvres de l'infanterie. Titre cinquième, Ecole de brigade / Ministère de la guerre	1877	https://data.bnf.fr/ark:/12148/bpt6k9611059g	France. Ministère de la guerre (1791-1936)	Public domain	Impr. nationale (Paris)	monographie imprimée	Bibliothèque nationale de France	https://gallica.bnf.fr/ark:/12148/bpt6k9611059g
bpt6k6532631g.txt	Essai sur le paysage, dans lequel on traite des diverses méthodes pour se conduire dans l'étude du paysage , suivi de courtes notices sur les plus habiles peintres en ce genre... par C.-J.-F. Lecarpentier,...	1817	https://data.bnf.fr/ark:/12148/bpt6k6532631g	Le Carpentier, Charles-Louis-François (1744-1822)	Public domain	Treuttel et Wurtz (Paris)	monographie imprimée	Bibliothèque nationale de France	https://gallica.bnf.fr/ark:/12148/bpt6k6532631g
bpt6k5601402z.txt	Présentation du tarif des taxes locales à percevoir en 1888 : rapport au conseil général / Nouvelle-Calédonie et dépendances	1887	https://data.bnf.fr/ark:/12148/bpt6k5601402z	Nouvelle-Calédonie	Public domain	Impr. nouméenne (Nouméa)	monographie imprimée	Bibliothèque nationale de France	https://gallica.bnf.fr/ark:/12148/bpt6k5601402z
bpt6k5474949g.txt	Essai sur le vrai sens du mot liberté, appliqué aux relations des hommes entre eux	1798	https://data.bnf.fr/ark:/12148/bpt6k5474949g		Public domain	chez les principaux libraires (Paris)	monographie imprimée	Bibliothèque nationale de France	https://gallica.bnf.fr/ark:/12148/bpt6k5474949g
bpt6k96014281.txt	Monographie des Silene de l'Algérie / par MM. Soyer-Willemet,... et D.-A. Godron,...	1851	https://data.bnf.fr/ark:/12148/bpt6k96014281	Godron, Dominique-Alexandre (1807-1880)	Public domain	Grimblot et Veuve Raybois (Nancy)	monographie imprimée	Bibliothèque nationale de France	https://gallica.bnf.fr/ark:/12148/bpt6k96014281
bpt6k5740396q.txt	Campagne pittoresque du Luxor / par M. Léon de Joannis,...	1835	https://data.bnf.fr/ark:/12148/bpt6k5740396q	Joannis, Léon de	Public domain	Mme Huzard (Paris)	monographie imprimée	Bibliothèque nationale de France	https://gallica.bnf.fr/ark:/12148/bpt6k5740396q
bpt6k202416s.txt	Un idéaliste, Émile Trolliet (1856-1903) : oeuvres choisies / avec une biographie d'É. Trolliet, par Olivier Billaz...	1905	https://data.bnf.fr/ark:/12148/bpt6k202416s	Trolliet, Émile (1856-1903)	Public domain	A. Gratier & J. Rey (Grennoble)	monographie imprimée	Bibliothèque nationale de France	https://gallica.bnf.fr/ark:/12148/bpt6k202416s
bpt6k5667636z.txt	Jousselin. Poitou, Vendée, Limousin	1884	https://data.bnf.fr/ark:/12148/bpt6k5667636z		Public domain	Impr. de Chaix (Paris)	monographie imprimée	Bibliothèque nationale de France	https://gallica.bnf.fr/ark:/12148/bpt6k5667636z
bpt6k5790587t.txt	"Lettre et réponse au ""Journal des débats"", par M. Jollivet,..."	1842	https://data.bnf.fr/ark:/12148/bpt6k5790587t	Jollivet, Adolphe (1799-1848)	Public domain	impr. de E.-B. Delanchy (Paris)	monographie imprimée	Bibliothèque nationale de France	https://gallica.bnf.fr/ark:/12148/bpt6k5790587t
bpt6k6215547n.txt	Examen de la brochure intitulée : Un mort sur la crise du Portugal	1827	https://data.bnf.fr/ark:/12148/bpt6k6215547n		Public domain	A. Pihan Delaforest (Paris)	monographie imprimée	Bibliothèque nationale de France	https://gallica.bnf.fr/ark:/12148/bpt6k6215547n
bpt6k5771931k.txt	Le dirigeable Lebaudy pendant les années 1902 et 1903	1904	https://data.bnf.fr/ark:/12148/bpt6k5771931k		Public domain	impr. de L. Desmolins (Mantes)	monographie imprimée	Bibliothèque nationale de France	https://gallica.bnf.fr/ark:/12148/bpt6k5771931k
bpt6k5467952m.txt	Une éducation de nos jours-observations sur les principes d'éducation préconisés par M. Legouvé,... par le R. P. J. Noury,...	1882	https://data.bnf.fr/ark:/12148/bpt6k5467952m	Noury, Jean (18..-19.. ; jésuite)	Public domain	A. Josse (Paris)	monographie imprimée	Bibliothèque nationale de France	https://gallica.bnf.fr/ark:/12148/bpt6k5467952m
bpt6k57873693.txt	J.-J. Rousseau justifié envers sa patrie , ouvrage dans lequel on a inséré plusieurs lettres de cet homme célèbre qui n'ont point encore paru	1775	https://data.bnf.fr/ark:/12148/bpt6k57873693	Rousseau, Jean-Jacques (1712-1778)	Public domain		monographie imprimée	Bibliothèque nationale de France	https://gallica.bnf.fr/ark:/12148/bpt6k57873693
bpt6k54069658.txt	"Consultation et poursuites au sujet du n ° XI de la ""Correspondance politique et administrative"" , par M. Joseph Fiévée. [Paris, 22 juin 1818]"	1818	https://data.bnf.fr/ark:/12148/bpt6k54069658		Public domain	impr. de Le Normant (Paris)	monographie imprimée	Bibliothèque nationale de France	https://gallica.bnf.fr/ark:/12148/bpt6k54069658
bpt6k5507400r.txt	Toast à la musique de la ville de Cette et à la Société philarmonique, réunies dans un banquet à l'occasion de la fête de sainte Cécile, le 28 novembre 1858 / [par A. Bartro]	1859	https://data.bnf.fr/ark:/12148/bpt6k5507400r	Bartro, Antoine (1801-1896)	Public domain	impr. de Izar fils (Cette)	monographie imprimée	Bibliothèque nationale de France	https://gallica.bnf.fr/ark:/12148/bpt6k5507400r
bpt6k6349219m.txt	Vie de Saint Léon	1867	https://data.bnf.fr/ark:/12148/bpt6k6349219m		Public domain	Impr. de Barbou frères (Limoges)	monographie imprimée	Bibliothèque nationale de France	https://gallica.bnf.fr/ark:/12148/bpt6k6349219m
bpt6k65189468.txt	Description du parc de Brunehaut.	1827	https://data.bnf.fr/ark:/12148/bpt6k65189468	Viart, Amédée de (1809-1868)	Public domain	Paris. Le Normant fils, imprimeur du Roi, rue de Seine, n° 8, F. S. G. 1827.	monographie imprimée	Bibliothèque nationale de France	https://gallica.bnf.fr/ark:/12148/bpt6k65189468
bpt6k56298951.txt	La décadence romaine : scènes historiques / par M. Armand Pommier et M***	1861	https://data.bnf.fr/ark:/12148/bpt6k56298951	Pommier, Armand (1829-....)	Public domain	E. Dentu (Paris)	monographie imprimée	Bibliothèque nationale de France	https://gallica.bnf.fr/ark:/12148/bpt6k56298951
bpt6k97741053.txt	Observations chirurgico-légales, sur un point important de la jurisprudence criminelle . Lues à la séance publique de l'Académie des sciences de Dijon, le 20 décembre 1789. Par M. le professeur Chaussier	1790	https://data.bnf.fr/ark:/12148/bpt6k97741053	Chaussier, François (1746-1828)	Public domain	Barrois le jeune (Paris)	monographie imprimée	Bibliothèque nationale de France	https://gallica.bnf.fr/ark:/12148/bpt6k97741053
bpt6k62030330.txt	"Almanach musical pour ... : éphémérides musicales, biographies des célébrités de la musique / [par Moléri [""puis"" Molé] et Oscar Comettant]"	1864	https://data.bnf.fr/ark:/12148/bpt6k62030330		Public domain	Collignon (Paris)	publication en série imprimée	Bibliothèque nationale de France	https://gallica.bnf.fr/ark:/12148/bpt6k62030330
bpt6k6442314z.txt	Comité départemental de secours aux blessés et aux familles privées de leur section pendant la guerre : procès-verbal de la séance du 10 septembre 1871	1871	https://data.bnf.fr/ark:/12148/bpt6k6442314z		Public domain	Impr. de H. Gentel (Aurillac)	monographie imprimée	Bibliothèque nationale de France	https://gallica.bnf.fr/ark:/12148/bpt6k6442314z
bpt6k6551730n.txt	"Examen de l'écrit intitulé ""La Chirobaliste d'Héron d'Alexandrie traduite du grec"", etc., etc. / [signé A.-J.-H. Vincent]"	1862	https://data.bnf.fr/ark:/12148/bpt6k6551730n	Vincent, Alexandre (1797-1868)	Public domain	Mallet-Bachelier (Paris)	monographie imprimée	Bibliothèque nationale de France	https://gallica.bnf.fr/ark:/12148/bpt6k6551730n
bpt6k9687782x.txt	Le jeu des vertus : roman d'un auteur dramatique / Vte Henri de Bornier	1886	https://data.bnf.fr/ark:/12148/bpt6k9687782x	Bornier, Henri de (1825-1901)	Public domain	E. Dentu (Paris)	monographie imprimée	Bibliothèque nationale de France	https://gallica.bnf.fr/ark:/12148/bpt6k9687782x
bpt6k62278480.txt	Notice de livres élémentaires à l'usage de l'enseignement dans les salles d'asile, de l'enseignement primaire, de l'enseignement spécial	1875	https://data.bnf.fr/ark:/12148/bpt6k62278480		Public domain	Hachette et Cie (Paris)	monographie imprimée	Bibliothèque nationale de France	https://gallica.bnf.fr/ark:/12148/bpt6k62278480
bpt6k96341725.txt	Traités des tutelles et curatelles, de la division des choses et des moyens par lesquels on en acquiert la propriété . Par noble Louis Astruc,...	1758	https://data.bnf.fr/ark:/12148/bpt6k96341725	Astruc, Louis (16..-17.. ; juriste)	Public domain	J.-F. Forest (Toulouse)	monographie imprimée	Bibliothèque nationale de France	https://gallica.bnf.fr/ark:/12148/bpt6k96341725
bpt6k5561968v.txt	"Recherches et doutes sur la naissance du duc de Bordeaux établis d'après la partie officielle du ""Moniteur"" et d'après les journaux de l'époque. [Par P.-J. Guilmot.]"	1834	https://data.bnf.fr/ark:/12148/bpt6k5561968v	Guilmot, Pierre-Joseph (bibliothécaire à Douai)	Public domain	Mme Vve Charles-Béchet (Paris)	monographie imprimée	Bibliothèque nationale de France	https://gallica.bnf.fr/ark:/12148/bpt6k5561968v
bpt6k9785999h.txt	Anciens poèmes chinois d'auteurs inconnus / traduits par Tsen Tsonming,...	1923	https://data.bnf.fr/ark:/12148/bpt6k9785999h		Public domain	J. Desvigne (Lyon)	monographie imprimée	Bibliothèque nationale de France	https://gallica.bnf.fr/ark:/12148/bpt6k9785999h
bpt6k9602869n.txt	Manuel cristallographe, ou Abrégé de la cristallographie de M. Romé de l'Isle , avec une méthode facile pour connoître les différentes cristallisations des mixtes qui composent un cabinet de minéralogie, aidé par une collection de polièdres dont cet ouvrage est aussi une explication. Par M. Swebach Des Fontaines,...	1792	https://data.bnf.fr/ark:/12148/bpt6k9602869n	Swebach Des Fontaines	Public domain	Bossange et Cie (Paris)	monographie imprimée	Bibliothèque nationale de France	https://gallica.bnf.fr/ark:/12148/bpt6k9602869n
bpt6k55484309.txt	Fas, son université et l'enseignement supérieur musulman / par G. Delphin,...	1889	https://data.bnf.fr/ark:/12148/bpt6k55484309	Delphin, Gaëtan (1857-1919)	Public domain	P. Perrier (Oran)	monographie imprimée	Bibliothèque nationale de France	https://gallica.bnf.fr/ark:/12148/bpt6k55484309
bpt6k5468773d.txt	Du nouvel impôt sur les égouts : questions locales	1864	https://data.bnf.fr/ark:/12148/bpt6k5468773d		Public domain	Impr. de Olive (Marseille)	monographie imprimée	Bibliothèque nationale de France	https://gallica.bnf.fr/ark:/12148/bpt6k5468773d
bpt6k5712263s.txt	Symptômes spasmodiques et contractures permanentes dans la paralysie générale / par le Dr Marc Trénel,...	1894	https://data.bnf.fr/ark:/12148/bpt6k5712263s	Trénel, Marc (Dr)	Public domain	G. Steinheil (Paris)	monographie imprimée	Bibliothèque nationale de France	https://gallica.bnf.fr/ark:/12148/bpt6k5712263s
bpt6k6550775x.txt	Exposition d'archives et documents de guerre du service de santé de la 18e région et d'oeuvres d'artistes mobilisés au centre d'oto-rhino-laryngologie et de chirurgie maxillo-faciale, du 12 avril au 1er juin 1919, terrasse du Jardin-Public, Bordeaux : catalogue illustré	1919	https://data.bnf.fr/ark:/12148/bpt6k6550775x		Public domain	impr. Gounouilhou (Bordeaux)	monographie imprimée	Bibliothèque nationale de France	https://gallica.bnf.fr/ark:/12148/bpt6k6550775x
bpt6k9766133r.txt	Restauration fonctionnelle du pouce : thèse présentée à la Faculté de médecine... / Gabriel Hanotte,...	1888	https://data.bnf.fr/ark:/12148/bpt6k9766133r	Hanotte, Gabriel	Public domain	impr. L. Dane (Lyonl)	monographie imprimée	Bibliothèque nationale de France	https://gallica.bnf.fr/ark:/12148/bpt6k9766133r
bpt6k6366078d.txt	Notice biographique sur M. le comte Henri de Brimont	1869	https://data.bnf.fr/ark:/12148/bpt6k6366078d		Public domain	(Paris)	monographie imprimée	Bibliothèque nationale de France	https://gallica.bnf.fr/ark:/12148/bpt6k6366078d
bpt6k5577741n.txt	A quoi tiennent les crises ministérielles et l'instabilité du gouvernement ? par M. A. Duchatellier	1840	https://data.bnf.fr/ark:/12148/bpt6k5577741n	Du Chatellier, Armand (1797-1885)	Public domain	impr. de C. Mellinet (Nantes)	monographie imprimée	Bibliothèque nationale de France	https://gallica.bnf.fr/ark:/12148/bpt6k5577741n
bpt6k6207977h.txt	Contrôle chimique de la fabrication du sucre : instructions de laboratoire / par MM. P. Champion et H. Pellet,...	1874	https://data.bnf.fr/ark:/12148/bpt6k6207977h	Pellet, Henri (1848-19..?)	Public domain	impr. de J. Claye (Paris)	monographie imprimée	Bibliothèque nationale de France	https://gallica.bnf.fr/ark:/12148/bpt6k6207977h
bpt6k54682491.txt	A la mémoire de monseigneur Dominique-Augustin Dufêtre évêque de Nevers. Novembre 1860 / (signé : M. de C.)	1861	https://data.bnf.fr/ark:/12148/bpt6k54682491	Puissant, Vital (1835-1878)	Public domain	(Nevers)	monographie imprimée	Bibliothèque nationale de France	https://gallica.bnf.fr/ark:/12148/bpt6k54682491
bpt6k55458953.txt	Du relâchement du pylore : son influence sur la digestion de l'estomac en un certain nombre de maladies chroniques / par M. le Dr G. Louis de Seré,...	1865	https://data.bnf.fr/ark:/12148/bpt6k55458953	Seré, Louis de (Dr)	Public domain	A. Delahaye (Paris)	monographie imprimée	Bibliothèque nationale de France	https://gallica.bnf.fr/ark:/12148/bpt6k55458953
bpt6k9680625c.txt	Service funèbre de M. Eugène Bersier, pasteur de l'église réformée de France, célébré le vendredi 22 novembre 1889 à l'église évangélique de l'Etoile	1889	https://data.bnf.fr/ark:/12148/bpt6k9680625c		Public domain	église évangélique de l'Etoile (Paris)	monographie imprimée	Bibliothèque nationale de France	https://gallica.bnf.fr/ark:/12148/bpt6k9680625c
bpt6k6181359m.txt	L'ouvrier : drame en 5 actes / par Frédéric Soulié	1858	https://data.bnf.fr/ark:/12148/bpt6k6181359m	Soulié, Frédéric (1800-1847)	Public domain	Michel-Lévy frères (Paris)	monographie imprimée	Bibliothèque nationale de France	https://gallica.bnf.fr/ark:/12148/bpt6k6181359m
bpt6k65504784.txt	Le Transsaharien : dernière oeuvre de guerre, première oeuvre de paix, avec note annexe sur les affluents ou deltas méditerranéens... / par V. Schwich,...	1916	https://data.bnf.fr/ark:/12148/bpt6k65504784	Schwich, V.	Public domain	impr. de A. Fouquet (Tunis)	monographie imprimée	Bibliothèque nationale de France	https://gallica.bnf.fr/ark:/12148/bpt6k65504784
bpt6k5510419z.txt	Observations présentées à monsieur le vicomte Du Hamel, maire de la ville de Bordeaux , par le directeur des théâtres de la même ville	1829	https://data.bnf.fr/ark:/12148/bpt6k5510419z	Baignol (02)	Public domain	impr. de Lavigne jeune (Bordeaux)	monographie imprimée	Bibliothèque nationale de France	https://gallica.bnf.fr/ark:/12148/bpt6k5510419z
bpt6k55467047.txt	Couplets patriotes, faits à l'occasion de la fête civique des deux martyrs de la Liberté, Lepelletier & Marat, célébrée le 30 brumaire, l'an 2e de la République française	179.	https://data.bnf.fr/ark:/12148/bpt6k55467047	Lemaire, Antoine-François (1758-18..)	Public domain	[s.n.][s.n.]	monographie imprimée	Bibliothèque nationale de France	https://gallica.bnf.fr/ark:/12148/bpt6k55467047
bpt6k5662071s.txt	Foyers et coulisses. 4, Palais-Royal / par Henry Buguet	1874	https://data.bnf.fr/ark:/12148/bpt6k5662071s	Buguet, Henry (1845-1920)	Public domain	Tresse (Paris)	monographie imprimée	Bibliothèque nationale de France	https://gallica.bnf.fr/ark:/12148/bpt6k5662071s
bpt6k64673854.txt	Miscellanées : poésies / par O. J. R.	1867	https://data.bnf.fr/ark:/12148/bpt6k64673854	Richard, Olivier-Jules (1836-1896)	Public domain	impr. de C. Thèze (Rochefort)	monographie imprimée	Bibliothèque nationale de France	https://gallica.bnf.fr/ark:/12148/bpt6k64673854
bpt6k6317598t.txt	Les prodiges du hasard : comédie-vaudeville en deux actes	1850	https://data.bnf.fr/ark:/12148/bpt6k6317598t		Public domain	maison des orphelins (Bordeaux)	monographie imprimée	Bibliothèque nationale de France	https://gallica.bnf.fr/ark:/12148/bpt6k6317598t
bpt6k58086259.txt	"Ministère de la Guerre. Décision présidentielle du 29 juin 1878, modifiant les tarifs de solde par suite du vote de la loi sur les pensions de retraite des officiers. Extrait du ""Journal militaire officiel"", partie réglementaire, 1er semestre 1878, n° 31"	1878	https://data.bnf.fr/ark:/12148/bpt6k58086259		Public domain	J. Dumaine (Paris)	monographie imprimée	Bibliothèque nationale de France	https://gallica.bnf.fr/ark:/12148/bpt6k58086259
bpt6k9674559s.txt	Explication des principes élémentaires de musique , par Jean Bisch, professeur. Nouvelle édition augmentée de solfèges faciles, et de 24 airs de chant par gradation...	1804-1815	https://data.bnf.fr/ark:/12148/bpt6k9674559s	Bisch, Jean (1733-1824)	Public domain	Louis (Paris)	monographie imprimée	Bibliothèque nationale de France	https://gallica.bnf.fr/ark:/12148/bpt6k9674559s
bpt6k96743860.txt	Voyage de Robert Macaire aux enfers : almanach nouveau...	1836	https://data.bnf.fr/ark:/12148/bpt6k96743860	Neveux	Public domain	impr. de Chassaignon (Paris)	monographie imprimée	Bibliothèque nationale de France	https://gallica.bnf.fr/ark:/12148/bpt6k96743860
bpt6k54682424.txt	A la mémoire de Monsieur le curé de Bressuire. A ses amies	1867	https://data.bnf.fr/ark:/12148/bpt6k54682424		Public domain	imp. de H. Oudin (Poitiers)	monographie imprimée	Bibliothèque nationale de France	https://gallica.bnf.fr/ark:/12148/bpt6k54682424
bpt6k9674428w.txt	Edmond-Jean-Marie Durnerin et Marie-Eulalie Julie Tansard : 12 mai 1888	1889	https://data.bnf.fr/ark:/12148/bpt6k9674428w	Pinat, H. (Abbé)	Public domain	impr. de F. Levé (Paris)	monographie imprimée	Bibliothèque nationale de France	https://gallica.bnf.fr/ark:/12148/bpt6k9674428w
bpt6k6460142h.txt	Album poétique des jeunes personnes, ou Choix de poésies extrait des meilleurs auteurs français... précédé de réflexions sur les règles de l'art poétique, par Mme A. Tastu...	1854	https://data.bnf.fr/ark:/12148/bpt6k6460142h	Tastu, Amable (1798-1885)	Public domain	Didier (Paris)	monographie imprimée	Bibliothèque nationale de France	https://gallica.bnf.fr/ark:/12148/bpt6k6460142h
bpt6k5403512t.txt	Chanson sur la naissance de monseigneur le duc de Bourgogne	1751	https://data.bnf.fr/ark:/12148/bpt6k5403512t	A. (17..-17.. ; jésuite)	Public domain	([Paris.] De l'imprimerie de Thiboust, imprimeur du Roi, place de Cambray. [1751])	monographie imprimée	Bibliothèque nationale de France	https://gallica.bnf.fr/ark:/12148/bpt6k5403512t
bpt6k6469051x.txt	Notice biographique. L'abbé Marie-Louis Lorton, ancien vicaire de La Clayette, décédé à Cannes, le 8 décembre 1876	1877	https://data.bnf.fr/ark:/12148/bpt6k6469051x		Public domain	(Autun)	monographie imprimée	Bibliothèque nationale de France	https://gallica.bnf.fr/ark:/12148/bpt6k6469051x
bpt6k97667258.txt	Pour bien connaître la Tunisie. Compagnie fermière des chemins de fer tunisiens	1930	https://data.bnf.fr/ark:/12148/bpt6k97667258		Public domain	imp. de Maréchal (Paris)	monographie imprimée	Bibliothèque nationale de France	https://gallica.bnf.fr/ark:/12148/bpt6k97667258
bpt6k67832q.txt	Histoire d'une jeune fille sauvage, trouvée dans les bois à l'âge de dix ans . Publiée par madame H....t	1755	https://data.bnf.fr/ark:/12148/bpt6k67832q	Hecquet, Marie-Catherine (1686-1764)	Public domain	A Paris. M. DCC. LV	monographie imprimée	Bibliothèque nationale de France	https://gallica.bnf.fr/ark:/12148/bpt6k67832q
bpt6k5818311h.txt	"Remerciement à M. B** auteur des lettres sur la peinture, vulgairement appelées ""La Critique du Salon"", et imprimées, à Genève en 1750 . Par M. Z**. Peintre de l'Académie de Saint-Luc"	1751	https://data.bnf.fr/ark:/12148/bpt6k5818311h		Public domain	[s.n.]	monographie imprimée	Bibliothèque nationale de France	https://gallica.bnf.fr/ark:/12148/bpt6k5818311h
