Book	Smell_Word	Smell_Source	Quality	Full_Sentence
abc80	vonja|okusa	kisu	prijetnega	Kdo ne pozna pehtranove potvice in I štrukljev ? Prideva se tudi kisu radi prijetnega vonja in okusa .
abc80	vonja|okusa	kisu	prijetnega	Kdo ne pozna pehtranove potvice in I štrukljev ? Prideva se tudi kisu radi prijetnega vonja in okusa .
abc80	dišave	Zdravilna kadulja ( žavbelj )	zdravilne	Kot zdravilne dišave so posebno priporočljive : Zdravilna kadulja ( žavbelj ) .
abc80	dišave	Zdravilna kadulja ( žavbelj )	zdravilne	Kot zdravilne dišave so posebno priporočljive : Zdravilna kadulja ( žavbelj ) .
abc80	dišava	sivka ( lavendel )		Še ena dišava , ki se pa ne rabi v I kuhinji , in tudi ne kot zdravilnica , je sivka ( lavendel ) .
abc80	dišave	zelene		Ker po zimi ne ostanejo dišave zelene , zato treba , da jih porežemo o pravem času in spravimo za zimo .
abc80	dišave|duh			Pravi čas porezovati dišave je ravno pred cvetom ali pa v prvem cvetu , ker takrat so dosegle najmočnejši duh in najmočnejšo rast .
abc80	okus|vonj	kava	prijeten	Samo tista kava , kateri je pridejana Kolinska kavna primes v korist obmejnim Slovencem , ima res izvrsten okus , prijeten vonj in lepo barvo .
abc80	okus|vonj	kava	prijeten	Samo tista kava , kateri je pridejana Kolinska kavna primes v korist obmejnim Slovencem , ima res izvrsten okus , prijeten vonj in lepo barvo .
abc81	smrdečo	snov	kislo	Ako vzamemo kak žebljiček ali pa leseno špičico in pobez - gamo z njo v celico s prevertanim pokroveem , privlečemo iz nje neko zelenkasto rujavo , vlečljivo , kislo smrdečo snov , t .
abc81	smrdečo	snov	kislo	Ako vzamemo kak žebljiček ali pa leseno špičico in pobez - gamo z njo v celico s prevertanim pokroveem , privlečemo iz nje neko zelenkasto rujavo , vlečljivo , kislo smrdečo snov , t .
abc82	vonjem		prijetnim	jejo človeka s svojim prijetnim vonjem .
abc82	vonj|dišefiega	trave|grma		Tuj vonj 30 je objel , nikjer ni našla trave ali dišefiega grma ; skoro tesno ji je postalo .
abc82	dišeč		Lep	Lep in dišeč je bil ta vrt in ovCka je mislila , da je postavljen za njo .
abc83	ne diši	cvetica	prijetno	Vsaka cvetica ne diši prijetno .
abc83	ne diši	cvetica	prijetno	Vsaka cvetica ne diši prijetno .
abc83	Ne diši	po kadilu		Ne diši povsod po kadilu .
abc83	diši		prijetno|preveč	) Ni prijetno , kar preveč diši .
abc83	diši|smrdi			) Kar enemu diši , to drugemu smrdi .
abc83	diši	po svetilki|po olju )		) Ta spis diši po svetilki ( po olju ) .
abc84	duhtele	cvetke		Drevje je bilo golo in cvetke še niso duhtele .
abc84	dišale	rože|oslovski gnoj	opojnejše	Da bi rože boljše rastle in opojnejše dišale , ko napoči pravi čas zanje , je ležal po gredicah oslovski gnoj .
abc84	dišale	rože|oslovski gnoj	opojnejše	Da bi rože boljše rastle in opojnejše dišale , ko napoči pravi čas zanje , je ležal po gredicah oslovski gnoj .
abc84	vonj	cvetk	opojnih	Tisti sunek v trebuh pa tudi ni bil malenkost ! Nekega dne je bilo okno odprto in pohleven vetrič je prinašal v sobo vonj opojnih cvetk .
abc84	vonj	cvetk	opojnih	Tisti sunek v trebuh pa tudi ni bil malenkost ! Nekega dne je bilo okno odprto in pohleven vetrič je prinašal v sobo vonj opojnih cvetk .
abc85	dišave	planinskih lilij		' » Prisopihal sem z gora , z najvišjih vrhuncev in prinašam s seboj dišave planinskih lilij z vrta gorskih vil , ki ga še ni videlo človeškooko .
abc85	vonjem	šopek lilij		» Oh , če bi imela šopek lilij z vrta gorskih vil ! Kako bi se naslajala z njihovirn vonjem ! Kako lepo bi okrasila z njimi svojo kočico ! « Ubožica , kako je hrepenela po tej sreči ! Kako bi jih dobila ? Ne - mogoče ! Kako jo je to težilo ! Začela je jokati .
abc85	dišečih	cvetic	rdečih|belih	Ali ti ne nudi pisana loka dovolj cvetic , rdečih , belih , dišečih .
abc85	dišečih	cvetic	rdečih|belih	Ali ti ne nudi pisana loka dovolj cvetic , rdečih , belih , dišečih .
abc85	vonja		sladkega	Ne zavrni me , mati ! Daj , da se naužijem sladkega vonja iz žametastih čaš rajskih cvetk ! Če ji obljubiš , bo tvoja hčerka še srečnejša , kakor je bila prej .
abc85	dišečih	lilij		Naši ranjeni vojaki njih zdravniki in strežniki - ^ « 230 > + - Druge so frfotale kakor beli metulji po pisanih gredah okrog dišečih lilij .
abc86	smrdeča	po žganju|po jetiki|po otrocih		Postelja za dva gospoda ! Kakšna je tista postelja in kdo , odkod sta tista dva gospoda , ki bi bila zadovoljna z eno samo posteljo ? Tam kje na dvorišču je izba , smrdeča po žganju , po jetiki in po otrocih .
abc86	dišečega	čaja	močno	Gospodinja je stopila v izbo ter mu je prinesla močno dišečega čaja .
abc86	dišečega	čaja	močno	Gospodinja je stopila v izbo ter mu je prinesla močno dišečega čaja .
abc87	aromatičnega	jelkovim medom|gozdnega medu .		Znamenit hotel v Vogezih , ki mu je lastnik sam čebelar , je že izza mnogo let svoje goste tako razvadil z jelkovim medom , da jim mora leto za letom priskrbovati tega aromatičnega gozdnega medu .
abc87	smrdeča	gniloba	Gnila	Gnila zalega ali smrdeča gniloba .
abc87	smrdeča	gniloba	Gnila	Gnila zalega ali smrdeča gniloba .
abc87	izpuhteva|duh		kisel	Njih vsebina sestoji iz vodenozrnate kaše , ki izpuhteva več ali manj kisel duh .
abc87	duh		poseben	V vsakem slučaju pa gre od njih neki prav poseben duh , ki ga je težko opisati .
abc87	smrdeča	snov		Ta smrdeča snov se sčasoma posuši v temnorjave , blesteče luske ali hraste , ki jih imenujmo škorljup .
abc87	smrdeče	gnilobe		Skorljup smrdeče gnilobe spoznamo vedno na tem , da je njegova površina gladka in enakomerna .
abc88	dišave	beli cvet		Ponosno lahko gledaš dol z višave , visoka lipa , na poletni svet , najslajše polna si dišave , ko krono tvojo krasi beli cvet .
abc89	dišečih	Breskev	tistih žlahtnih|rumeno nadahnjenih|okusnih	Prav lepo sem si bila izdelala na tihem načrt : Breskev kupirn Amandi , tistih žlahtnih , rumeno nadahnjenih , tako okusnih in dišečih , da bi jih jedli še airgelci , če bi imeli zobe .
abc89	dišečih	Breskev	tistih žlahtnih|rumeno nadahnjenih|okusnih	Prav lepo sem si bila izdelala na tihem načrt : Breskev kupirn Amandi , tistih žlahtnih , rumeno nadahnjenih , tako okusnih in dišečih , da bi jih jedli še airgelci , če bi imeli zobe .
abc89	diše		opojno|prijetno	Za trdno je bila prepričana , da je na sadnem trgu vse polno zabojev s samimi bre - skvami , ki diše tako opojno in prijetno .
abc89	dišalo	breskvah		Medtem , ko je kril debel sneg strehe in ulice , ji je skozi okna v posteljo dišalo le po breskvah .
abc89	dišeče	bilke		Skozi ši - roko lino je zapihai v svisli leden veter , ki je rahljal in razmetaval že tako zrahljano suho seno okroK mojega ležišča name , da so me prijetno ščegetale dolge dišeče bilke po vratu in po ra - zgaljenih prsih .
abc90	vonj	šmarnic in vijolic	sladki	Pozna , deževna jesen je bila zunaj , zato ni objemal velike , v pozlačenem okvirju milostno zroče slike Matere božje z Jezusčkom v naročju sladki vonj šmarnic in vijolic , kakor spomladi .
abc90	vonj	šmarnic in vijolic	sladki	Pozna , deževna jesen je bila zunaj , zato ni objemal velike , v pozlačenem okvirju milostno zroče slike Matere božje z Jezusčkom v naročju sladki vonj šmarnic in vijolic , kakor spomladi .
abc90	dišečimi	cvetkami	najlepše	Mala Malči in nekoliko starejša Tonka sta okrasili Marijin oltarček * v sobi z najlepše dišečimi cvetkami , kar sta jih mogli natrgati na cvetočih 75 travnikih .
abc90	dišečimi	cvetkami	najlepše	Mala Malči in nekoliko starejša Tonka sta okrasili Marijin oltarček * v sobi z najlepše dišečimi cvetkami , kar sta jih mogli natrgati na cvetočih 75 travnikih .
abc90	vonj|dišala	šmarnic|zvončkov|vijolic|po cveticah .	sladak	Visoke , pisajie vaze okrog Marijine slike so bile polne belih šmarnic , zvončkov , vijolic in ljubko smehljajočih se spominčic ; sladak vonj je kipel navzgor — vsa soba je dišala po cveticah .
abc90	vonj|dišala	šmarnic|zvončkov|vijolic|po cveticah .	sladak	Visoke , pisajie vaze okrog Marijine slike so bile polne belih šmarnic , zvončkov , vijolic in ljubko smehljajočih se spominčic ; sladak vonj je kipel navzgor — vsa soba je dišala po cveticah .
abc90	dehteči	travi murni .		Bil je lep , topel večer ; okno v hiši je bilo odprto na stežaj , Zunaj so cvrčali v dehteči travi murni .
abc91	duh		svež|krepak	Iz nove postavodaje proti oderuhom veje svež , krepak duh tistih naukov , ki nas jih je naučil tisti dr .
abc92	dišečimi	rožami		Zato , ker je bilo tisto malo življenje že samo na sebi tako prijetno , da se ni poljubilo mojitn poskočnim , svežim in nepokvarjenim mislim prav nikamor iz majhnega , z dišečimi rožami nastlanega vrtca , pa četudi bi bil nahajal za visoko ograjo še kak drug lepši svet .
abc92	dišečem	oblaku		Toda meni je bilo , kakor da mi zmankuje tal pod nogami ; kakor da se dvigam na dišečem oblaku vedno više in više , sam Bog vedi kam : nič več nisem slišal nove , poskočne pesmi , slišal scm samo ječeče zvoke drhtečih strun na učiteljevih goslih .
abc93	dišečega	kadila		58 kazal mašnik , zavit v oblake dišečega kadila , ki se je valilo nad mrgolečimi glavami vzdolž po svetišču in se dvigalo visoko do širokih , svetlih oken .
abc93	smrdeč	oblak dima		Tedaj je za - donel nedaleč od cerkve , vrhu hriba , prvi strel , da se je stresla zemlja ; za njim drugi , tretji , četrti ; venomer so nabijali fantje raožnarje , zapore - doma so se začeli oglašati streli ; kadar je švignil plamen iz možnarja in , se je dvignil plahutaje , kakor izrastel iz tal , ogromen smrdeč oblak dima ( proti nebu , je zagrmel pok bobneče med sivim hribovjem in odmevalo je ostro od skal .
abc93	duh	belo|rožnonadahnjeno cvetje .	sladek|opojen	Od zelenečih njiv pod potjo in od cvetočih črešenj ter jablan na travnikih in ob potu se je širil sladek , opojen duh , na travo in na pot je rosilo belo in rožnonadahnjeno cvetje .
abc93	duh	belo|rožnonadahnjeno cvetje .	sladek|opojen	Od zelenečih njiv pod potjo in od cvetočih črešenj ter jablan na travnikih in ob potu se je širil sladek , opojen duh , na travo in na pot je rosilo belo in rožnonadahnjeno cvetje .
abc93	dišeče	kadilo		V mehkih tokih so se razlili križem svetišča srebrni glasovi pevk in božali srca vernikov ; izpred oltarja pa sc je valilo dišeče kadilo in se jc spenjalo kvišku .
abc93	dehtečimi|dišalo|duh|duhom	cvetoče breskve|breskvinega cvetja|cvetočih jablan	sladko	Na stežaj so bila odprta ozka okna , temnozelena polkna so se prijazno lesketala ; zunaj v vinogradu , pod hišo , so se v rahlem vetriču pozibavale cvetoče breskve , vse kakor z rožnatimi , dehtečimi oblaki obdane ; sladko je dišalo v sobo , duh breskvinega cvetja se je mešal z duhom cvetočih jablan zadaj za hišo , kier so žgoleli gizdavi liščki in naščeperjeni straadi .
abc93	dehtečimi|dišalo|duh|duhom	cvetoče breskve|breskvinega cvetja|cvetočih jablan	sladko	Na stežaj so bila odprta ozka okna , temnozelena polkna so se prijazno lesketala ; zunaj v vinogradu , pod hišo , so se v rahlem vetriču pozibavale cvetoče breskve , vse kakor z rožnatimi , dehtečimi oblaki obdane ; sladko je dišalo v sobo , duh breskvinega cvetja se je mešal z duhom cvetočih jablan zadaj za hišo , kier so žgoleli gizdavi liščki in naščeperjeni straadi .
abc94	okusa	Vino	vodeno|kislo|brez finega	Vino iz nezrelega grozdja je lehko šibko , vodeno in kislo , brez finega okusa .
abc94	okusa	Vino	vodeno|kislo|brez finega	Vino iz nezrelega grozdja je lehko šibko , vodeno in kislo , brez finega okusa .
abc94	gnijoče|smrdeče	tvarine		Preden torej pričnete s trgatvijo , osnažite najprej klet ( zidanico ) znotraj , počedite iz nje vso pajčevino , ometite stene , izmečite iz nje vse gnijoče in smrdeče tvarine in jo — če le mogoče — pobelite .
abc94	duh|okus	vinu	neprijeten	Prva da vinu neprijeten duh in okus , druga pa povzroča , da vino počrni .
abc94	duh|okus	vinu	neprijeten	Prva da vinu neprijeten duh in okus , druga pa povzroča , da vino počrni .
abc94	duh|okus	sode		Če je pa sod pol leta ali še več prazen ležal in je bil večkrat žveplan , je dobro vodi pridejati 1 % """" sode , da se duh in okus po žveplu hitreje odpravi .
abc94	duh|okus	po žveplu .		Le , če sod ni bil rabljen več kakor eno leto in pri tem vedno zažveplan , ga je treba zakuhati z 2 % sodovim lugom ali pa vsaj dlje časa namakati z mrzlo vodo , da popolnoma izgubi duh in okus po žveplu .
abc94	okus|duh	vina		Prvič to , po vinski postavi sploh ni dopustno , drugič tako zakuhavanje nima drugega učinka kakor vrela voda sama , in tretjič se s takimi sredstvi kvečjemu pokvari okus ali duh vina .
abc94	gniti	grozdje		V mokrih letih se pa tudi prav lehko zgodi , posebno če začne že prav zrelo grozdje gniti , da je vino iz gnilega grozdja boljše kakor iz zdravega .
abc94	okus	Čreslovina|vinu	trd|zagaten|trpek	Čreslovina daje vinu trd , zagaten , trpek okus .
abc94	okus	Čreslovina|vinu	trd|zagaten|trpek	Čreslovina daje vinu trd , zagaten , trpek okus .
abc94	gnije	grozdje		Predvsem bodi tukaj omenjeno , da v mokrotnih letih , ali kadar gnije grozdje vsled kislega črvička , tudi če smo skrbno odbirali gnilo grozdje , taka vina , ki so kot mošt kipela dlje časa na tropu , rada nategujejo , to se pravi , da , kadar se pretakajo ali kadar sploh pridejo z zrakom v dotiko , rjave in se zgoste .
abc94	okus		čist	Vsled tega žveplanja mošta dosežemo , da mošt kipi bolj čisto kakor nežveplan , da se vino iz žveplanega mošta rajši čisti in da ima bolj čist okus .
abc94	duh	vina	fini	Pri visoki toplini se vrši vrenje jako burno , ogljikova kislina odhaja v velikih mehurčkih iz kipečega mošta in jemlje s seboj deloma tvoreči se alkohol , zlasti pa uhaja z njo fini duh vina .
abc94	duh	vina	fini	Pri visoki toplini se vrši vrenje jako burno , ogljikova kislina odhaja v velikih mehurčkih iz kipečega mošta in jemlje s seboj deloma tvoreči se alkohol , zlasti pa uhaja z njo fini duh vina .
abc94	gnijočih|smrdečih	drož		Nato pustimo vino pri miru , dokler se , vsaj deloma , ne učisti , in ga — navadno meseca decembra — prvič pretočimo ( presnamemo ) , da ga ločimo od lehko gnijočih in smrdečih drož .
abc94	zelišča	suho cvetje ( suhe rože )|lipovoCTetje		t L ubljenl na Martinovi ( Ahacijeri ) cesti 10 po najvišjih cenah ra / novrstnn zelišča , suho cvetje ( suhe rože ) , lipovoCTetje , korenine , lubjein semena .
abc94	duh	gnilobi|plesnivcu|grenkobi	zoprn	Eponit , s katerim se vzame vinu vsak zoprn okut ali duh , bodisi po gnilobi , plesnivcu , po sodu , grenkobi itd .
abc94	duh	gnilobi|plesnivcu|grenkobi	zoprn	Eponit , s katerim se vzame vinu vsak zoprn okut ali duh , bodisi po gnilobi , plesnivcu , po sodu , grenkobi itd .
abc95	dišalo	po pečenem ptiču|krompirju	prijetno	V kuhinji je kaj prijetno dišalo po pečenem ptiču in krompirju .
abc95	dišalo	po pečenem ptiču|krompirju	prijetno	V kuhinji je kaj prijetno dišalo po pečenem ptiču in krompirju .
abc95	dehtela	Draga mast|pečenka|ambrozija		Kuharica Meta je previdno vzela pečenko iz tajinstvenega oddelka pod kotlom in pred nami je ležal zapeljivo - dražestni puran , že lepo rumenkast in rjavkast , s krompirjem okusno garniran 1 Draga mast je rahlo šumela in pečenka je dehtela kakor ambrozija .
abc95	Dišal	puran		Dišal mu je puran ! Toda shramba je bila dobro zaprta .
abc95	diši|vohala		prijetno	„ Kako prijetno diši pri vas ! """" se je čudila gospa Rotija in vohala z dolgim nosom po zraku ko lovski pes .
abc95	diši	Po pečenki		„ Po pečenki diši .
abc95	dehtenju	gnezdeč|topolov		Mama , jaz se že ne maram moliti , raje bi se še dalje učila ! Mati : „ To je nepotrebno , kajti možje ne marajo pametnih žen ! """" Hči : „ Da , ti vedno misliš , da so vsi možje takšni ko naš papa / """" Florijan Golar : Pesem Ob jutranjih sapic dehtenju , žgolenju gnezdeč in topolov mokrih šumenju , ko mak in škrjanček se kopljeta v rosi , je grozdek vstal izpod listov zelenih , izbrisal oči si zaspane in k sveti maši je šel po slemenih .
abc95	smrdita		brezbožno	da oba brezbožno smrdita .
abc95	dehti	po|tobaku	finem	In godrnjali so : „ Oho ! Kaj pa je to ? Gospod Makarij kadijo lulo ! In po prav finem tobaku , dehti za njim .
abc95	dehti	po|tobaku	finem	In godrnjali so : „ Oho ! Kaj pa je to ? Gospod Makarij kadijo lulo ! In po prav finem tobaku , dehti za njim .
abc95	smrdi	tobak		Kje pa so gospod Makarij dobili tobak , ko ga že dva tedna ni dobiti niti mrvice nikjer ? To smrdi po skopuštvu in oderuštvu ! """" Bližnji znanci pa so Makarija ustavljali ter milo prosili : • „ Bog daj zdravje gospod Makarij ! Ampak to ste ga fino onega Spuricija ! Ves svet se čudi .
abc95	dišeč	oblaček		Kadar gre na izprehod , je kot dišeč , rožen oblaček , ki je vstal iz zarje .
abc96	dišeča		pojoča	O njih nam je povedal Andrej Vešligaj naslednjo zgodbo : Gorice so gorele v pomladnem solncu , in nebo je bilo kot velika sinja roža , polna rosne svetlobe , dišeča in pojoča , ko sem se po ozki , peščeni stezi bližal viničarski koči .
abc96	vonjem|dišal	gozda|bukovega|hrastovega listja|mlade gorice|zemlje|trsa|zrak		Duh gozda , bukovega in hrastovega listja , se je spajal z vonjem mlade gorice , zemlje in trsa , in ves zrak je dišal po pomladi .
abc96	zavohaš	vabo		Ko zavohaš mojo vabo , je ni moči na svetu , ki bi te vzdržala .
abc96	duh|dišečo		Nepopisno prijeten	Nepopisno prijeten duh te zvabi k pasti , in skominalo te bo , da zasadiš zobke v dišečo skorjo .
abc96	dišečega	trsa|maka		Na dobro zdravje ! Kar do dna in poglej skozi kozarec v nebesa ! — Tako , in zdaj , Micika , vzemi to ubogo miško , nesi jo po robu goric sredi dišečega trsa in maka , kjer se sliši žvrgolenje kosa in drozda , nesi jo v dolino , kjer teče tisti bistri studenec .
abc97	vonj|vonj|dišav		slajši od najslajših	Z nepopisno slastjo je vdihaval vonj , kipeč iz domače grude , vonj slajši od najslajših dišav .
abc97	vonj	las		"""" Kopač je začutil vonj njenih las , do njega je prihajala toplota njenega telesa .
abc97	dehtečih	cvetic	opojno	Čebele in čmrlji se opajajo ob čašah opojno dehtečih cvetic , nad vsem pa sije veliko solnce , kakor ni sijalo še nikoli .
abc97	dehtečih	cvetic	opojno	Čebele in čmrlji se opajajo ob čašah opojno dehtečih cvetic , nad vsem pa sije veliko solnce , kakor ni sijalo še nikoli .
abc98	aromo	Med	pekoč|prijetno	Med , ki je iztrčan iz takih satni ¬ kov , ima zelo pekoč okus in manj prijetno aromo .
abc98	aromo	Med	pekoč|prijetno	Med , ki je iztrčan iz takih satni ¬ kov , ima zelo pekoč okus in manj prijetno aromo .
abc98	smrad|gnile		Mrliški|ostuden	Jožefa dan ? — Mrliški , ostuden smrad mi puhne ! nasproti , čebele vse mrtve , gnile na tleh , satovje in panjeve stene vse ostudno ponesnažene , in samo v nekaterih panjih je še v kakem kotu ždela kopica blatnih čebel z matico .
abc99	dehteli	klinčki		klinčki so dehteli ob parobju gredic , a na drevju so se med zelenjem vabliivo smehljale črešnje , ki so Jih škodoželjno obletavali neugnani vrabci .
abc99	vonjala	odpadajoči cvetni listki|napol razvite cvetove		Kakor po veliki zmagi je zadovoljno občudovala velike skupine vrtnic , jih gladila z drobnimi prstki , da so odpadajoči cvetni listki frfotali na tla , vonjala napol razvite cvetove in primerjala , kako bi se najlepši podali njej za kitico na prsih .
abc99	duhom dišeča	reseda .	opojnim	Ob parobju gredic jo je vabila z opojnim duhom dišeča reseda .
abc99	duhom dišeča	reseda .	opojnim	Ob parobju gredic jo je vabila z opojnim duhom dišeča reseda .
abc99	dišeče	trobentice		Za hiacinti cveto dišeče trobentice in še druge pri nas neznane cvetice , hčerke toplega juga .
abc99	dišeči	narcise|klinčki		Tedaj cveto tam narcise in dišeči klinčki v komaj tja prispeli in še sopihajoči pomladi , ki se pa že plaho ozira na sever , odkoder se bliža trdih korakov starka zima s polnim košem snega , ledu in mraza .
abc99	vonj	jedi		Tončka je vonj jedi prijetno šČegetal v nosku , in želodček se je trdovratno oglašal .
abc100	smrdi	mlru		Ponoči — pravijo — da ne da mlru , ker venomer copota s svojimi širokimi podplati okolo in pa da smrdi .
