Book	Smell_Word	Smell_Source	Quality	Full_Sentence
bibbleue304	puanteur	La quatriesme peine	intolerable	La quatriesme peine de l ’ Enfer , est vne puanteur intolerable , qui auec grãd tourment , prend les ames dãnées au nez , l ’ Escriture sainte appelle cette puãteur , puantise de soulphre .
bibbleue304	puanteur		grands|extremes|insupportables	Or la cause pour quoy le feu , le froid , & la puanteur de l ’ Enfer sont si grands , si extremes , & insupportables , c ’ est qu ’ aucune vapeur ny exhalaison ne sort de là , la iustice diuine y retenant & resserrant tout pour vn plus grand tourment .
bibbleue304	puant|puanteur	charongne	plus	Qu ’ il sçache & qu ’ il retienne qu ’ il est plus puant qu ’ aucune charongne qui soit , que sa puanteur donne iusques dans le Ciel , & qu ’ il empuantit & empunaise tout le monde .
bibbleue304	puant|puanteur	charongne	plus	Qu ’ il sçache & qu ’ il retienne qu ’ il est plus puant qu ’ aucune charongne qui soit , que sa puanteur donne iusques dans le Ciel , & qu ’ il empuantit & empunaise tout le monde .
bibbleue304	odeur|puanteur|puante	ame	mauvaise	S ’ il se trouue en lieu où il sente quelque mauvaise odeur , & queque puanteur , salleté , qu ’ il se souuienne que son ame est encore plus vilaine & plus puante à cause des grands pechez qu ’ elle commet en soy mesme .
bibbleue304	odeur|puanteur|puante	ame	mauvaise	S ’ il se trouue en lieu où il sente quelque mauvaise odeur , & queque puanteur , salleté , qu ’ il se souuienne que son ame est encore plus vilaine & plus puante à cause des grands pechez qu ’ elle commet en soy mesme .
bibbleue304	puant		desagreable	Qu ’ il se represente aussi l ’ extréme desplaisir qu ’ il fait à son bon Ange , qui a vn & grand soin de luy , qui se tient prés de luy pour le preseruer des embusches de ses ennemis , & qu ’ encor qu ’ il luy soit puant & desagreable , à cause de ses horribles pechez , il ne l ’ abandonne , attendant qu ’ il se reconnoisse .
bibbleue317	odeur	fumier pourri	mauvaise	Et si l ' on m ' a vu avec mon carosse devant quelques Eglises , chacun sait bien que ma Maîtresse n ' y alloit jamais que pour voir ses confidentes , & pour prendre l ' heure , comme c ' est maintenant la mode : enfin il est vrai qu ' il n ' entra jamais dans mon carosse personne qui eût une seule bonne pensée : il étoit tellement reconnu de tout le monde , que quand on vouloit faire quelque mariage où l ' on eût besoin de s ' informer si une fille étoit pucelle , si une Dame étoit chaste , on ne faisoit que demander si elle n ' avoit point mis le pied dans mon carosse , parce que c ' étoit un vrai témoignage de corruption : & après cela vous me traitez si rudement , quelle cruauté ! Hi , hi , dit ce Diable , lui donnant cinq ou six rudes sanglades de fouets coup sur coup , qui faisoient des cercles de sang autour du pauvre Cocher , si bien qu ' il me fut force de me retirer autant pour la pitié que j ' avois de lui , comme pour fuir la mauvaise odeur de fumier pourri que ce Cocher sentoit .
bibbleue317	odeur	fumier pourri	mauvaise	Et si l ' on m ' a vu avec mon carosse devant quelques Eglises , chacun sait bien que ma Maîtresse n ' y alloit jamais que pour voir ses confidentes , & pour prendre l ' heure , comme c ' est maintenant la mode : enfin il est vrai qu ' il n ' entra jamais dans mon carosse personne qui eût une seule bonne pensée : il étoit tellement reconnu de tout le monde , que quand on vouloit faire quelque mariage où l ' on eût besoin de s ' informer si une fille étoit pucelle , si une Dame étoit chaste , on ne faisoit que demander si elle n ' avoit point mis le pied dans mon carosse , parce que c ' étoit un vrai témoignage de corruption : & après cela vous me traitez si rudement , quelle cruauté ! Hi , hi , dit ce Diable , lui donnant cinq ou six rudes sanglades de fouets coup sur coup , qui faisoient des cercles de sang autour du pauvre Cocher , si bien qu ' il me fut force de me retirer autant pour la pitié que j ' avois de lui , comme pour fuir la mauvaise odeur de fumier pourri que ce Cocher sentoit .
bibbleue317	exhalant	vapeurs	fort puantes	La curiosité qui me portoir d ' apprendre & de voir toujours quelque chose de nouveau me fit passer outre , & à peine eus - je fait vingt pas , que je trouvai un lac qui me sembloit beaucoup plus grand que celui de Genéve , extrèmement bourbeux & exhalant de fort puantes vapeurs , il se faisoit un bruit dedans si étrange que j ' en étois tout étourdi , je demandai ce que c ' étoit , c ' est , me dit - on , le lieu où l ' on fait endurer les femmes du monde qui étoient devenues Douegnas & par ainsi j ' appris que les Douegnas de ce monde sont les grenouilles d ' enfer , humides , boueuses & qui ne font que gromeler , & crouasser sans articuler leur voix .
bibbleue317	exhalant	vapeurs	fort puantes	La curiosité qui me portoir d ' apprendre & de voir toujours quelque chose de nouveau me fit passer outre , & à peine eus - je fait vingt pas , que je trouvai un lac qui me sembloit beaucoup plus grand que celui de Genéve , extrèmement bourbeux & exhalant de fort puantes vapeurs , il se faisoit un bruit dedans si étrange que j ' en étois tout étourdi , je demandai ce que c ' étoit , c ' est , me dit - on , le lieu où l ' on fait endurer les femmes du monde qui étoient devenues Douegnas & par ainsi j ' appris que les Douegnas de ce monde sont les grenouilles d ' enfer , humides , boueuses & qui ne font que gromeler , & crouasser sans articuler leur voix .
bibbleue317	odeurs		mauvaises	Je ne me pus tenir de rire les voyant si fort écarquillés , & se plonger dans le lac quand on aprochoit d ' elles : les mauvaises odeurs que l ' on sentoit - là ne me permirent pas d ' y resler plus long - tems .
bibbleue322	parfums	fourrures|tissus		Ici , de riches magasins présentaient au luxe opulent les diamans de Goleonde , les fourrures de la Sybérie , les tissus de l ’ Inde , les parfums de l ’ Orient .
bibbleue337	odeurs		puantes	Après la soupe notre viande , Reste des enfans & du chat , Remplit à peine un demi - plat Pour notre ordinaire prébande ; L ’ aîle d ’ un poulet étouffé , Un morceau de boeuf réchauffé , Plein de vers & de moisissure , Qui produit de puantes odeurs , Est la meilleure nourriture , Des misérables serviteurs .
bibbleue340	odeur	onguét		3 * Adonc Marie print vne liure d ’ onguent de nard approuué de grand pris , & oignit les pieds de Iesus , & les essuya de ses cheueux : & la maison fut remplie de l ’ odeur de l ’ onguét , 4 Lors Iudas Iscariot vn de ses disciples , qui le deuoit trahir , dit : 5 Pourquoy cét onguent n ’ a il esté vendu trois cens deniers , & donné aux pauures ? 6 Cela , dit - il , non point qu ’ il eust soing des pauures : mais pourtant qu ’ il estoit larron , Sous 13 .
bibbleue340	senteurs	linges	aromatiques	40 Lors prindrent le corps de Iesus , & le lierent de linges auec senteurs aromatiques , comme la coustume des Iuifs est d ’ enseuelir .
bibbleue340	senteurs	linges	aromatiques	40 Lors prindrent le corps de Iesus , & le lierent de linges auec senteurs aromatiques , comme la coustume des Iuifs est d ’ enseuelir .
bibbleue344	odeur		bonne	Les Ciriers de belles bougies , Embrasés d ' une sainte ardeur , Offrirent à l ' Auteur de la vie , Avec encens de bonne odeur .
bibbleue366	'	ame		Il est certain que comme notre ame est une substance purement   spirituelle , il ne se peut dire qu ' elle sorte par aucune partie du corps ; car de la même façons que j ' occupe ma pensé a la considération des objets que j ' ai vû autrefois , ou des personnes que je connois , & que cette même pensée s ' exhale de mon ame , sans qu ' on puisse dire qu ' elle sorte par aucunes parties de mon corps , ainsi l ' ame à la derniere période de la vie de l ' nomme , disparoît subtilement sans qu ' on puisse dire qu ' elle sort , ni par où elle sort .
bibbleue366	exhalaison	souffle|poulmon|petit vent		Supposez néanmoins que selon l ' opinion la plus commune le coeur soit le premier vivant & dernier mourant de l ' animal , & qu ' il ne posséde la vie naturelle sans l ' haleine & le respir qui lui est communiqué par le poulmon pour rafraichir l ' ardeur qui l ' enflamme , nous pouvons dire qu ' en quelque façon l ' ame sort du corps avec l ' effort de ce dernier respir , non pas qu ' elle soit ointe ou attachée à l ' exhalaison de ce souffle subtil ; mais parce que le poulmon n ' exhalant plus le petit vent par ce respir , il s ' ensuit bien de - là que son opération naturelle est ce qui maintient le corps en union avec l ' ame , qui pour être composé de parties contraires l ' une à l ' autre , cette harmonie naturelle affoiblie se corrompt & enfin se dissout & à cette corruption & dissolution des parties succéde la retraite de l ' ame & sa séparation d ' avec le corps ; ainsi que la liqueur qui seroit dans un vase fragile , s ' ébranle entierement & se perd étant mis en pieces .
bibbleue366	puanteur|odeurs	feu ensouffré|fange	horrible|douces	La cinquieme sera l ' horrible puanteur du feu ensouffré dont ils brûleront , & de la fange dont ils seront infectés , pour les douces odeurs dont ils auront mal usés dans leurs délices .
bibbleue366	puanteur|odeurs	feu ensouffré|fange	horrible|douces	La cinquieme sera l ' horrible puanteur du feu ensouffré dont ils brûleront , & de la fange dont ils seront infectés , pour les douces odeurs dont ils auront mal usés dans leurs délices .
bibbleue366	odoriférantes	fleurs très	-	Anselme , & les autres Auteurs cités par Tyrinus , sur l ' explication de la seconde Epitre de Saint Pierre ; qui croyent pieusement que tous les Innocens coupables après le Jugement universel , habitront la terre ( déserte pour lors par d ' autres habitans ) après qu ' elle aura été purifiée par le feu qui précédera ce grand jour , qui alors disent - ils , sera émaillée de quantité de fleurs très - odoriférantes , qui ne se faneront point comme à présent , qu ' un même jour les voit naître & périr , & de grand nombre de beaux Arbres portant fleurs & fruits de toutes sortes environnés de quantité de claires fontaines , qui coulant doucement arroseront ces plantes de l ' humidité de leurs eaux , & enjolivées de tous les autres ornemens de la nature , qui pourront contribuer à son lustre & à sa beauté .
bibbleue366	odoriférantes	fleurs très	-	Anselme , & les autres Auteurs cités par Tyrinus , sur l ' explication de la seconde Epitre de Saint Pierre ; qui croyent pieusement que tous les Innocens coupables après le Jugement universel , habitront la terre ( déserte pour lors par d ' autres habitans ) après qu ' elle aura été purifiée par le feu qui précédera ce grand jour , qui alors disent - ils , sera émaillée de quantité de fleurs très - odoriférantes , qui ne se faneront point comme à présent , qu ' un même jour les voit naître & périr , & de grand nombre de beaux Arbres portant fleurs & fruits de toutes sortes environnés de quantité de claires fontaines , qui coulant doucement arroseront ces plantes de l ' humidité de leurs eaux , & enjolivées de tous les autres ornemens de la nature , qui pourront contribuer à son lustre & à sa beauté .
bibbleue366	odoriférant|odorat	thym	doux	La terre est emaillée de fleurs , & d ' un thym odoriférant & si doux à l ' odorat , que l ' on peut dire avec raison que c ' est l ' ambre commun des forêts .
bibbleue366	odoriférant|odorat	thym	doux	La terre est emaillée de fleurs , & d ' un thym odoriférant & si doux à l ' odorat , que l ' on peut dire avec raison que c ' est l ' ambre commun des forêts .
bibbleue366	odeurs		prophanes	Un peu plus avant je vis une maison fort élevée , d ' où sortoient des flammes & des fumées à gros brandons , & m ' informant de que ce pouvoit être , on me dit , que c ' êtoit un bain délectable , où se baignoient les mondains qui avoient trop curieusement senti les odeurs prophanes , & ouvrant la porte avec vitesse ils me contraignirent d ' y regarder , ou je vis un Lac profond de glace & de neige , où étoient plongés jusqu ' au col un très - grand nombres d ' hommes & de femmes claquetant les dents de froid , & quantité de démons regardant aux fenêtres armés de divers instrumens de supplices cruels , comme de lances , de javelots ou fléches , dont ils frappoient ou menaçoient ceux qui osoient lever la tête ou les bras hors de cet étang , où ils languissoient impitoyablement , & sans espérance de remede .
bibbleue366	puantes	ondes		Mais beaucoup davantage entendant leurs menaces redoubler ; disant que si je ne prenois la résolution de m ' en retourner d ' où je venois , ils me précipiteroient au milieu de cette horrible campagne , pour être emporté des vents dans un fleuve profond , ou si d ' aventure je ne mourois en tombant , au moins je serois enseveli sans pitié dans ces ondes puantes sans esperance d ' en sortir jamais .
bibbleue366	exhaloit|odeurs	soufre	puantes|insupportables	Ils s ' approchérent donc de moi avec des menaces effroyables , disant pourquoi je ne leur obéissoit , reprenant la route de mon chemin pour retourner aussi - tôt ; & me prenant par le bras me frappoient outrageusement ; puis m ' empoignant parle milieu du corps m ' enlevérenten une autre campagne , autant & plus spacieuse que les autres ; or la quantité & la qualité des pe nes étoit sans nombre aussi bien que les personnes qui les enduroient ; car la terre étoit si embrasée de feux & de flammes , que de quelque côté qu ' on tournât la vue on n ' appercevoit que des feux , ainsi qu ' à l ' embouchure d ' une fournaise ardente ; mais ce qui augmentoit plus l ' horreur de ces peines , étoit l ' abondance du soufre , qui exhaloit des odeurs si puantes & insupportables , qu ' elles me faisoient souvent tomber en défaillance .
bibbleue366	exhaloit|odeurs	soufre	puantes|insupportables	Ils s ' approchérent donc de moi avec des menaces effroyables , disant pourquoi je ne leur obéissoit , reprenant la route de mon chemin pour retourner aussi - tôt ; & me prenant par le bras me frappoient outrageusement ; puis m ' empoignant parle milieu du corps m ' enlevérenten une autre campagne , autant & plus spacieuse que les autres ; or la quantité & la qualité des pe nes étoit sans nombre aussi bien que les personnes qui les enduroient ; car la terre étoit si embrasée de feux & de flammes , que de quelque côté qu ' on tournât la vue on n ' appercevoit que des feux , ainsi qu ' à l ' embouchure d ' une fournaise ardente ; mais ce qui augmentoit plus l ' horreur de ces peines , étoit l ' abondance du soufre , qui exhaloit des odeurs si puantes & insupportables , qu ' elles me faisoient souvent tomber en défaillance .
bibbleue366	puanteur	fumées ensoufrées		Les démons voyant que je m ' étonnois des angoisses & des peines que souffroient ces pauvres Ames languissantes , tant pour les brasiers ardens , que pour la puanteur des fumées ensoufrées qui en sortoient en abondance , me mirent au choix de deux choses l ' une , de m ' exposer à la rigueur de toutes ces peines , où de retourner d ' où j ' étois venu .
bibbleue366	puante	boue		A peine eut - il fini ce discours , que ces Satellites m ' empoignant par le colet , me transporterent en un fleuve si épais & profond , que la pensée humaine est trop foible pour se réprésenter la crainte que le bruit terrible des ondes écumantes de ce fleuve ensoufré me donnérent alors ; ce fleuve étoit couvert d ' un côté de feux & de flammes au lieu d ' eau , & de l ' autre c ' étoit une boue noirâtre & puante , qui auroit fait soulever le cœur aux plus robustes .
bibbleue366	clameurs		plaintives	En quatrieme lieu , il étoit battu d ' un vent si impétueux , qu ' il étoit capable de renverser un édifice cimente , à plus forte raison le petit poids d ' un pauvre homme aussi foible qu ' un roseau , & ce qui me rendoit encore plus confus étoit d ' entendre d ' un côté les clameurs plaintives & les hurlemens des condamnés , & de l ' autre les cris effroyables que faisoient les démons pour m ' épouvanter & faire perdre courage , ce qui en effet me causa une foiblesse de cœur devant que de m ' exposer sur ce pont périlleux .
bibbleue366	odorat|odeur	roses|Jasmins|roses		Voyant donc une petite pente vers la main droite , enjolivé de part & d ' autre de roses & de Jasmins , je pris ma route par cet endroit , contentant mes sens de tant de beautés , mes yeux & mon odorat de la couleur & de l ' odeur des roses , dont les feuilles tombant à terre , jonchoient & parfumoient le chemin de leur douceur & de leur beauté , & mes oreilles du doux gazouillement que faisoient les ondes argentines de quantité de petits ruisseaux qui couloient le long du sentier .
bibbleue366	odoriférantes	fleurs		De l ' autre côté je voyois quantité de vases d ' or & d ' argent émaillés de pierres précieuse d ' un prix inestimable , & tous remplis de si belles fleurs & si odoriférantes , qu ' elles embaumoient ce lieu de volupté .
bibbleue366	odeur|parfums|senteurs		suave|agréable|aromatiques	Et comme j ' en approchois , je vis qu ' on ouvroit de riche portail d ' or , duquel s ' exhaloit un air doux , & une odeur suave & si agréable qu ' il sembloit qu ' on y brûloit tous les parfums & toutes les senteurs aromatiques du monde .
bibbleue368	odeur		bonne	Mais comme cemte Voiture ne nettroit pas en bonne odeur auprès t ’ une Maîtresse , & que l ’ equipage est un avantageux début pour la Nôce ; je me fais apporter chez - vous , Monsieur , d ’ une manièére élé gante , pour tous présenter toutes les for missions que la pharmacie doit à la Médecine .
bibbleue374	parfumé		riche	Dites luy bien comme i ' estime Son riche present parfumé , Monstrez luy bien en bellé rime Qu ' il est dans mon esptit pouriamais enrollé , Et qu ' il y tient plus fort que s ' il estoit collé .
bibbleue374	parfuma|parfumé		moins	Vn coffre enfermoit ce present Qui parfuma toute machambre , Moins pesant pour estre d ' argent , Que pour estre trop chargé d ' ambre , Et dans ce riche coffre autre coffre enfermeé , Estoit plus riche encore & bien moins parfumé .
bibbleue374	senteur		riche	Item vn fort beau chappellet Garny de plus d ' vne medaille , Quiconque dira qu ' il est laid , Ne dira certes rien qui vaille , Item peaux de senteur du sieur Frangipani , Tel present est - il laid , nanni , nanni , ma foy nanni Item ferrests & boistes d ' or , Bagues , Boucars & po rcelaines , Des pendans d ' oreilles encor , Gands à cinq doigts & non mitaines , Le tout , si bon , si beau , si riche & bien sentant , Que Lope à mon aduisn ' en peut fournir autant , Item prosnez à haute voix Que cette charmante Princesse , Cette fille de tant de Rois Que mon cœur adore sans cesse , M ' est venu visiter deux fois iusqu ' à mon lict , Et brida Vendredy pour moy son appetit .
bibbleue379	exhalaison		douce	Il disoit que l ' humeur qui dans un corps domine , A voir certains objets en dormant nous incline , Le phlegme humide & froid s ' élevant au cerveau , Y vient représenter des brouillards & de l ' eau , La bile ardente & jaune aux qualités subtilites , N ' y dépeint que combat qu ' embrasement de Villes , Le sang qui tient de l ' air & répond au printems , Rend le moins fortunés en leurs songes content , Sa douce exhalaison ne forme que de roses , Des objets égayés , & d ' agréables choses , Et la mélancolie à la noire vapeur , Où se loge toujours la tristesse & la peur , Ne pouvant figurer que des images sombres , Nous fait voir des tombeaux , des spectres & des ombres , C ' est ainsi que chacun apperçoit en dormant , Les indices secrets de son tempéramment , HERODE .
bibbleue379	odeur	philtre	mauvaise	Il faut en ce rapport par une adresse extrême , Que pour le mieux tromper tu te trompe toi - même Figure - toi le fait d ' un penser ingénu , Comme si sans mensonge il étoit avenu , Puis ayant en ton ame imprimé cet image , Laisse agir là - dessus ta langue & ton visage , Je ne puis te donner de meilleure leçon , Mais dis toujours le fait d ' une même façon , Crois toi - même l ' horreur que tu veux faire croire Et prend garde en parlant de manquer de mémoire Dans ces mots à peu - près : Sire , de jour en jour La Reine m ' entretient sur un philtre d ' amour , Qu ' elle voudroit mêler parmi votre breuvage , Afin de vous porter à l ' aimer d ' avantage , Mais connoissant assez l ' excès de votre ardeur , Je trouve que ce philtre est de mauvaise odeur , Vû même que pendant elle m ' en sollicite , Elle est mal assurée & paroit interdite , Là - dessus mu de zele & de fidélité , J ' en viens donner avis à votre Majesté , De peur que par l ' emploi de quelqu ' autre Ministre , Vous soyez prévenu d ' un accident funeste .
bibbleue379	odeur	philtre	mauvaise	Il faut en ce rapport par une adresse extrême , Que pour le mieux tromper tu te trompe toi - même Figure - toi le fait d ' un penser ingénu , Comme si sans mensonge il étoit avenu , Puis ayant en ton ame imprimé cet image , Laisse agir là - dessus ta langue & ton visage , Je ne puis te donner de meilleure leçon , Mais dis toujours le fait d ' une même façon , Crois toi - même l ' horreur que tu veux faire croire Et prend garde en parlant de manquer de mémoire Dans ces mots à peu - près : Sire , de jour en jour La Reine m ' entretient sur un philtre d ' amour , Qu ' elle voudroit mêler parmi votre breuvage , Afin de vous porter à l ' aimer d ' avantage , Mais connoissant assez l ' excès de votre ardeur , Je trouve que ce philtre est de mauvaise odeur , Vû même que pendant elle m ' en sollicite , Elle est mal assurée & paroit interdite , Là - dessus mu de zele & de fidélité , J ' en viens donner avis à votre Majesté , De peur que par l ' emploi de quelqu ' autre Ministre , Vous soyez prévenu d ' un accident funeste .
bibbleue379	odeur	vertu		Que mon cœur pour le moins se rendra le dernier , Ce jour s ' en va borner la longueur de ma vie , Je vois bien que l ' envie , Travaille puissamment à creuser mon tombeau , Et que la crainte du Tyran qui m ' opprime , Ne me suppose un crime , Que pour avoir sujet d ' en commettre un nouveau Qu ' il en use à son gré , me voilà toute prête , De payer de ma tête , Afin de contenter ce cœur dénaturé : Quelque horreur qu ' en la mort on puisse reconnoître , Elle n ' a qu ' à paroître , J ' irai la revoir d ' un visage assuré : Il est tems désormais que le Ciel me sépare , D ' avec ce Barbare , Son humeur & la mienne ont trop peu de rapport : La vertu respirant parmi l ' odeur du vice , Éprouve le supplice , Du vivant bouche à bouche attaché contre un mort , Auteur de l ' Univers souveraine puissance , Qui depuis ma naissance , M ' a toujours envoyé des matieres de pleurs , Mon ame n ' a recours qu ' à tes bontés divines , Au milieu des épines , Seigneurs faites - moi bientôt marcher dessus des fleurs .
bibbleue380	odeur		merveilleuse	L ' Hôte fit preparer une chambre pour Galien , on lui mit des draps blanc sentant une odeur merveilleuse .
bibbleue383	odeurs	violettes|fleurs|leurs		C ' est - là Qu ' on voyoit les violettes , A l ' envi des autres fleurs , S ' élever sur les herbettes Pour répandre leurs odeurs .
bibbleue390	fumet		doux	Son aimable fumée Et favorable aux yeux , Quand elle est respirée , C ’ est un Baume pour eux ; Ce doux fumet qui monte en forme de nuage , Vous développéra , la la , L ’ imagination ’ don don , Pour faire un bel Ouvrage , De la Philosophie Malbranche le Héros , Avec cette Ambroisie , Ranime tous ses os ; Quand sa santé va mal , ce sublime gênie , Dans ce reméde - là , la la , Sans consulter Purgon , don don , Va rechercher la vie .
bibbleue395	odeur	Lis		L ’ éclat & l ’ odeur du Lis , Se trouvent chez ma Philis , Voilà la ressemblance ; L ’ un ne fleurit qu ’ au Printemps , L ’ autre fleurit en tout temps , Voilà la difference .
bibbleue1503	odeur	loromage		Que ses soüilons de Gauffriers , Font sentir l ’ odeur du loromage , Et que ces noirs Chaudronniers , Font un fâcheux carillon ge , Mai nous voilà quasi dedans , Bon - jour la Foire , Dieu soit ceans , Je suis un pouvre cul de jate Qui vient tout exprès de chez - nous , Non , pour acheter des bijoux , Mais pour un grand bien de ma ratte , Sur votre lot qui tant éclate , Faire quelque Vers aigres & doux .
bibbleue1554	odeur	pomme		Pour faire un petit pot plein de vin , ce qui trompe agréablement une compagnie en buvant à sa santé , autant de fois que l ' on veut , sans qu ' il se vuide , 30 Tour d ' adresse pour couper une jarrerière en deux , sans qu ' elle soit endommagée , 31 Pour faire une pomme d ' odeur qui pourra servir contre la peste , ibid .
